Keyword,Title,Scrapping Date,Article Date,Author,Link,Content
Debt Market Sentiment,Gen Z's new pro-union push,2024-09-14,2023-09-04,Kate Morgan,https://www.bbc.com/worklife/article/20230831-the-gen-zers-leading-a-new-pro-union-push,"US union membership has plummeted. But young workers are organising, pushing companies to rise to the occasion and meet their demands for better conditions on the job. Labour unions in the United States have seen a major decline since the 1980s. According to Bureau of Labour Statistics data, more than 20% of workers belonged to a union in 1983 (the first year such data was available). In 2022, that number had fallen by half. The decline, which many experts attribute to employer-friendly policy change, an increase in right-to-work laws that weaken employees' organising and collective bargaining power and a trend towards outsourcing, has left the United States with one of the lowest union densities among major economies. But even with membership on the decline, worker support for unions has risen. In August 2022, Gallup recorded the highest levels of union support since the 1960s; 71% of Americans approve of labour unions, and about one in 10 non-union workers said they were ""extremely interested"" in joining one. High-profile labour efforts have dominated headlines: in recent years, workers at Amazon, Starbucks and several universities have organised. The Writer's Guild of America and actors' union SAG-AFTRA remain on strike over demands for wage and benefit increases, along with protection from evolving AI. And among those on the frontlines are the nation's youngest workers leading the renewed push for labour unions. Gen Z is, according to the Center for American Progress, ""the most pro-union generation alive today"". ""I think there's a growing understanding that if you have a job, you need a union,"" says Jaz Brisack (pictured above). The now-26-year-old was one of the earliest leaders of union efforts at Starbucks in Buffalo, New York, in 2021. Gen Z's involvement and support for organised labour makes sense considering the context of their experiences, says Kate Bronfenbrenner, director of labour education research and a senior lecturer at Cornell University's School of Industrial and Labour Relations, US. ""First of all, they grew up being told they were going to be better off than their parents,"" she says. ""The fact is, they struggled to find jobs, and the jobs they found were not as good as their parents'. They and the generations that follow them are saddled with college debt. They're looking at a world where they wonder if they should even have children because of climate change. They're concerned about broader social issues like reproductive rights and gun control, and planning to hold governments and employers accountable on those issues."" Some company practices during the pandemic, adds Bronfenbrenner, increased Gen Z workers' enthusiasm for unions: low-income employees, service workers and workers without a higher educational degree had difficulty accessing personal protective equipment (PPE), health care and paid sick time on the job. Reports from the Economic Policy Institute show that, in 2020, just upwards of 10% workers deemed ""essential"", including those in the retail sector, were covered by a union contract. Workers who were represented by a union, meanwhile, were more likely to access internal and external mechanisms to advocate for safety and health concerns. ""Many of these workers were on the front lines,"" she says. ""When they asked for something as simple as some PPE, or time off to take care of their family members, or to not come to work when they were sick, employers said no. Workers are willing to put up with a lot but risking your life and your family's lives – that's too much, and I think that was the final straw."" Brisack, who uses they/them pronouns, says their employment at Starbucks amid a pandemic-related job shortage moved them to feel ""nothing is coming to save us"". It inspired them to try to generate their own solutions, and was key to their organising efforts, which involved many Gen Zers and supporters. Brisack now believes in the power of unions to create equality among what they see as an inequitable power structure, saying, ""I think people are looking back and seeing that what actually created improved standards of living in the past was union density, and they're more open to ideas about organising."" Gen Z vs the world Baby boomers had plenty to draw them together, says Bronfenbrenner, as the generation ""got very involved politically with civil rights, the women's movement and the anti-war movement"". But in the late 1970s, ""it shifted very dramatically, and there was much more focus on taking care of yourself and making money"". Researchers widely consider Generation X to be significantly more independent and self-reliant; and millennials, according to empirical research, are the most individualistic generation of all. Gen Z, on the other hand, appears to be the collective generation. A multi-year Stanford University research project, the findings of which are detailed in the book Gen Z, Explained: The Art of Living in a Digital Age, determined the group born between the mid-1990s and 2010 is highly collaborative. Brisack believes since Gen Z feels they've been collectively let down by society, many feel it's necessary to act as a group to improve things. Gen Z-driven unionisation efforts also tend to be marked by the generation's passion for social causes, and their demands reflect it, says Bronfenbrenner. ""There's this term, 'organising for the common good',"" she says. She points to several moments; for instance, in the spring, striking teachers in California demanded sustainability initiatives and better care for homeless students. ""The Starbucks workers demanded their employer take a stand on LGBTQ rights,"" she adds. But Gen Z organisers don't only have new demands; they're also organising new industries, including hourly wage positions that haven't traditionally been covered by union protections. ""When we first started taking on Starbucks, there were a lot of people in the union world who were like, 'this is not a good target. This is not reasonable',"" says Brisack. ""Because it's tiny workplaces and a company that's going to fight it, and really high turnover so you're reinventing the wheel every few months.""  Large corporations may also have the power to launch widescale anti-union campaigns and messaging that can be difficult for small-scale organisers to overcome. But while many Gen Z organisers like Brisack have realistic expectations about what unionising in service industry jobs can – or can't – accomplish, they still find it worthwhile. ""Obviously, we're not going to get pensions and a lot of things that unions were able to get in the past in some industries – at least not without really, really solid union density,"" they say. ""But I think we can change the standard of living from, 'these are poverty jobs' to being able to have a career and be long-term workers in these roles without sacrificing a standard of living."" Efficient organisers Beyond being enthusiastic about organising, Gen Z is also just plain good at it. Their tactics have evolved faster than companies' union-busting efforts, and Gen Z-led protests have drummed up major public attention and support. Organisers at the media outlet Business Insider, for instance, utilised a robust social media campaign; some experts say this technique catalysed executives to recognise the union after a 13-day strike.  This social innovation can offer a kind of insulation against employers' efforts to prevent unionisation, says Bronfenbrenner. ""Creativity puts the employer off guard because the workers are having fun. They're not supposed to be having fun when there's an anti-union campaign; they're supposed to be scared and intimidated. When unions do creative things like use memes, it turns that whole climate of fear and conflict on its head."" And Gen Z's mastery of social media and multi-platform communication helps create widespread public support, she adds. Data from the Pew Research Center research has shown public sentiment towards corporations is increasingly negative. And the public is more likely to support workers moving against them, she says even when it creates inconveniences like TV shows' new seasons being postponed, or UPS packages being delayed. ""There's a public who is willing to make sacrifices for workers' rights,"" says Bronfenbrenner. Finally, what makes Gen Z workers in service industries and low-wage jobs the ultimate organisers, she adds, is that they're far less affected by traditional union-busting techniques because they don't care all that much about getting fired. ""These companies already don't offer them pensions or long-term promotional tracks. They already move around from job to job, so getting fired is not the same threat,"" believes Bronfenbrenner. Change or trend? Even amid a declining rate of unionisation, most Americans believe unions are good for workers. And despite years of pro-employer legislation at the federal level, in late August, the treasury department issued a report that showed unions were good for the economy. Secretary of the Treasury Janet Yellen wrote that unionising ""could contribute to reversing the stark increase in inequality we’ve seen in recent decades, promoting economywide growth"". Whether recent organising efforts will translate into change at a systemic level, or a return to the kind of union density America saw in the last century remains to be seen. Brisack believes the unionisation of high-churn service industries creates momentum. ""People might be moving from one job to another, partly because of the industry being a high-burnout, high-exploitation industry, but people are going to take the union principles with them,"" they say. ""Once you've been through one union campaign, it's a lot harder to just accept exploitation or unfair conditions, or having no voice in future workplaces.""  Bronfenbrenner says larger developments may be brewing. There's been a changing of the guard at the National Labour Relations Board (NLRB), the independent federal agency that provides protections for private-sector employees, she points out, and those running the agency ""are responding to their job very differently, and decisions keep coming down that are making organising easier"". But those positions are appointed by the President with the consent of the Senate, adds Bronfenbrenner. ""All of this can change with a new administration and Congress. The question is, can this moment outlast that? Will these young people get motivated to make sure change is happening beyond just their workplace? Will they get discouraged when the change doesn't happen fast enough?"""
Debt Market Sentiment,"London still works for share listings, says boss",2024-09-14,2023-06-01,BBC News,https://www.bbc.com/news/business-65777308,"""London still works"" as a place to float a business on the stock exchange, according to the boss of the world's largest producer of natural soda ash. We Soda has announced plans to list its shares in the UK, in a move that could value it at up to $7.5bn (£6bn). The move is being seen as a boost for London's stock market, after concern it is losing out to overseas rivals. It would be the country's biggest flotation so far this year and could see We Soda enter the FTSE 100 index. According to consultancy EY, the amount raised through share flotations in London fell by 90% last year. Earlier this year, building materials giant CRH said it would be moving its main share listing from the UK to the US. British microchip designer Arm is to float in the US despite reports that the UK government had lobbied it to choose London. But We Soda chief executive Alasdair Warren told the BBC's Today programme it had chosen the UK as it felt the London market was one that would ""well understand our business"". The soda ash produced by We Soda can be found in washing powder detergents, and is also used by companies in the production of goods such as glass. solar panels and batteries for electric vehicles. As well as soda ash, Mr Warren said the company was also a chemicals producer, ""with lots of characteristics which are similar to a lot of the speciality chemicals companies that are listed in London"". Pension funds, or individual investors, can buy shares whether they are listed in the UK, US or one of the European exchanges. But a UK listing generates significant ancillary business for a UK financial services industry that still makes up more than 10% of the UK's entire economy and contributes more than 10% of all taxes paid here. Accountants, lawyers, financial PR firms and others feed off the fees that UK listings generate. The exodus has not gone unnoticed by the government. It has been scrambling to try to make the UK a more attractive place for companies to set out their stall. We Soda already has its headquarters in London and Europe is its biggest market.  Mr Warren added that since the company had launched its flotation plans, ""we've had almost 300 investors express interest, around half of those are from the UK, but a half of them are from also other countries around the world, including a lot from the US and Europe"". ""So I think that that's an endorsement of the fact that London still works and we're very confident we'll get a good deal done,"" he said, We Soda is owned by Ciner Group, a Turkish industrial conglomerate controlled by billionaire Turgey Ciner. The flotation is aiming to raise about $800m for the Ciner Group, with part of the proceeds being used to pay down debt. Susannah Streeter, head of money and markets at Hargreaves Lansdown, said the flotation was a ""ray of light"" for the London market. However, she added it was ""unlikely to lead to a flood of immediate listings due to the still volatile nature of market sentiment""."
Debt Market Sentiment,Why people in China stopped paying their mortgages,2024-09-14,2022-08-09,By Suranjana Tewari,https://www.bbc.com/news/world-asia-china-62402961,"""Construction stops, mortgage stops. Deliver homes and get repaid!"" That was one of the chants disgruntled apartment buyers in China used at a protest in June. But their ire over unfinished homes didn't stop at signs and chants. Hundreds of them stopped paying their mortgages - a radical step for China, where dissent is not tolerated.  A young couple who moved to Zhengzhou in central China told the BBC that after receiving the down payment last year, the developer withdrew from the project and construction stalled. ""I have imagined countless times the joy of living in a new home, but now it all feels ridiculous,"" the woman, who did not wish to be named, said. A woman in her late 20s who also bought a home in Zhengzhou told the BBC that she too is ready to stop paying her mortgage: ""After the project is fully resumed, I'll continue paying."" Many of them can pay but are choosing not to, unlike the US subprime mortgage crisis in 2007 when money was lent to high-risk borrowers who then defaulted. They have purchased homes in roughly 320 projects around the country, according to a crowd-sourced estimate on Github where homeowners have been posting about their decision. But it's unclear how many actually stopped paying.  The boycotted loans could total $145bn (£120bn), S&P Global ratings estimates. Other analysts say it could be even higher. The revolt has rattled authorities, focusing attention on a market already under pressure from a slowing economy and a serious cash crunch. More alarmingly, it has signalled a lack of confidence in one of the main pillars of the world's second largest economy.  ""Mortgage boycotts, driven by deteriorating sentiment toward property, are... a very serious threat to the financial position of the sector,"" think tank Oxford Economics said in a recent note. China's property sector makes up a third of its economic output. That includes houses, rental and brokering services; industries producing white goods that go into apartments; and construction materials. But China's economy has been slowing - in the last quarter it grew by just 0.4% compared to the previous year. Some economists don't expect any growth this year. That's largely because of Beijing's zero-Covid strategy - repeated lockdowns and continued restrictions have affected incomes and, in turn, savings and investments. The size of China's economy means that disruption in a crucial market - like property - can affect the global financial system. Experts believe contagion is the concern now - banks won't lend if they believe the sector is tanking.  ""It will all depend on policy,"" says Ding Shuang, head of Greater China economic research at Standard Chartered. ""Unlike in other parts of the world where property bubbles break because of the markets, this is government-inflicted.""  Thirty real estate companies have already missed foreign debt payments. Evergrande, which defaulted last year on its $300bn debt, is the most high-profile casualty. S&P has warned that if sales do not pick up, more companies could follow suit. Demand for homes is also not rising as China undergoes a demographic change with urbanisation and population growth slowing.  ""The fundamental issue is that we have reached a turning point in the housing market in China,"" says Julian Evans-Pritchard, a senior China economist at Capital Economics.  Real estate accounts for about 70% of personal wealth in China - and home buyers often pay upfront for unfinished projects. These ""pre-sales"" make up 70%-80% of new home sales in China, Mr Evans-Pritchard said, adding that developers need that money because they use it to fund several projects at once.  But many young and middle class Chinese are no longer investing in property, likely because of a weak economy, job losses and pay cuts - and now the fear that developers might not complete projects. ""That's part of the problem - developers were counting on new money coming in, and those new sales are not happening anymore,"" Mr Evans-Pritchard said. More than $220bn worth of loans could be tied to unfinished projects, according to banking group ANZ. And credit - a  major source of cash in the boom years - has also dried up.  In 2020, China's government introduced the ""three red lines"" - accounting measures to limit how much developers could borrow. That cut off funding, and the subsequent lack of confidence in the market has also affected banks' willingness to lend to property companies.  For one, Beijing is putting the onus on local governments - they're offering reduced deposits, tax rebates and cash subsidies to home buyers, and relief funds to developers. But this comes at a cost because local coffers will take a hit as property developers buy less land. ""I think this is the moment for the central government and regulators to step in,"" Mr Ding said. ""At some point it will step in to ring-fence the problem of some companies. The sector is too important for the economy."" The Financial Times recently reported that China issued $148bn in loans to help property developers, and Bloomberg reported that mortgage holders may be given a payment holiday without it affecting their credit score. But in a recent note, Oxford Economics said any government intervention in real estate and infrastructure may provide a short-term boost but that ""it is not ideal for China's longer-term growth as the government and the financial sector are being forced to help sustain an unproductive (and failing) real estate industry"". This is also not just a financial crisis. The boycott of mortgages risks becoming a serious social issue, Mr Ding said. And that could become a problem for President Xi Jinping ahead of a crucial party congress later this year where he is expected to seek a historic third term.  Analysts say the reported bailout - $148bn - may not be enough. Capital Economics estimates companies need $444bn just to complete halted projects. It's also not clear whether banks - especially smaller rural ones - can absorb the cost of the mortgage strike.  Even if construction restarts, many developers may not survive because house sales are unlikely to shore up sentiment. Sales in China's 100 top developers dropped by 39.7% in July compared to the same period last year, according to China Real Estate Information Corp (CRIC). This crisis is the clearest indication yet that China's economy is at a crossroads. ""The government is trying its best to find new sources of growth but that's going to be challenging because the economy has been very reliant on property, infrastructure investment and exports over the last three decades,"" Mr Evans-Pritchard said. ""The era of very rapid growth in China is probably now over... and that's most obvious in the property sector at the moment."" Additional reporting by BBC Beijing"
Debt Market Sentiment,Global markets in sell-off mode,2024-09-14,2018-10-26,BBC News,https://www.bbc.com/news/business-45995725,"Global markets remained in sell-off mode on Friday, as investor worries sent shares in Asia, Europe and the US tumbling. The benchmark S&P 500 index in the US slid more than 1.7%, closing down almost 10% from its September high. The Dow Jones fell 1.2%, while the Nasdaq slumped more than 2%. The falls extended losses earlier in the month, fuelling concerns that sentiment is shifting as investors face a widening mix of risks. As of this week, the Dow Jones and S&P 500 indexes have given up the gains they posted earlier in the year, while the Nasdaq is up only about 2%. On Friday, a US Commerce Department report showing stronger-than-expected annualised growth of 3.5% in the third quarter failed to bolster confidence, as analysts focused on weakness in exports, housing and business investment. Disappointing quarterly results from tech giants Amazon and Google-owner Alphabet also fuelled Friday's declines. On the S&P 500, Amazon - previously one of the market's star performers - was one of the biggest losers. Shares in the retail giant fell more than 7%, after the firm forecast weaker sales growth than expected for the upcoming Christmas season. October is typically a bumpy month for the markets, but the declines have made for one of the worst months in several years. Analysts expect global growth to slow next year, particularly in China. In the US, companies are facing rising costs due to labour shortages and trade tariffs. In Europe, uncertainty over Brexit and Italian debt has also fuelled worries.  On Friday, France's CAC 40 index fell 1.3%, while the Dax slipped about 1%.  In London, the FTSE 100 retreated, closing down 0.9% at 6,939.56. Earlier, Hong Kong's Hang Seng index lost 1.1%, while Japan's Nikkei 225 fell 0.4%."
