Keyword,Title,Scrapping Date,Article Date,Author,Link,Content
investors sentiments,Turkey: Could the US damage its economy?,2024-09-15,2019-01-16,By Reality Check,https://www.bbc.com/news/world-46866661,"President Trump has said the US will ""devastate Turkey economically"" if Ankara decides to attack Kurdish groups in Syria. Mr Trump was referring to his plan to pull US forces out of Syria, where they have been fighting alongside a Kurdish militia against the group calling itself Islamic State (IS). Turkey regards the Kurdish group as terrorists. The US president's comments drew a sharp response from Turkey, which said Mr Trump would not get anywhere by threatening the country economically. After Mr Trump's tweet, the Turkish lira dropped in value against the US dollar. It then recovered its value, suggesting that his remarks had limited impact. So how could the US damage Turkey economically - if it wanted to? The relationship between Washington and Ankara has historically been close - politically, economically and militarily. Turkey - a Nato member - is a vital partner for the US but there have been significant strains in the partnership. These came out into the open last August, when the US slapped sanctions on Turkey over the continued detention of American pastor Andrew Brunson. It marked a new low in relations and was a further blow to an already fragile economy. The US also doubled tariffs on Turkish steel and aluminium that month, leading to further falls in the value of the Turkish lira - some 40% since the beginning of 2018. Turkey responded in kind, raising tariffs on cars from the US to 120%, on alcoholic drinks to 140% and on leaf tobacco to 60%. In fact, only 5% of Turkish exports head to the US and Turkey imports only slightly more from there. Turkey's trading relationships with China, Russia and Germany are more important.  But even though overall trade with US is not as large, there are key vulnerable sectors: air transport, iron and steel and machinery - and this is where the US has chosen to target previous sanctions. Turkey has historically had a deficit in international trade, in that it imports more from the rest of the world than it exports. However, the trade gap did narrow considerably in 2018 on the back of the weakness of the lira, which made Turkey's exports more competitive and imports more expensive. Turkey may be vulnerable over its high levels of debt. As of the end of September 2018, its external debt amounted to over 50% of its gross domestic product (GDP) - the value of all the goods and services it produces in a year - according to official figures. ""This is Turkey's Achilles heel,"" says York University economist Gulcin Ozkan.  ""It puts the country at the mercy of international investors and makes it vulnerable to exchange rate movements."" There are two features of Turkey's foreign debt increase that are concerning. It has a relatively high level of short-term debt, which is due for repayment in the near future. That means having a greater reliance on external finance. In addition, most of its overall debt is in foreign currencies such as the US dollar and the euro. So, the debt becomes more expensive as the Turkish currency loses value and other currencies - such as the US dollar - strengthen. In fact, the lira had been struggling for most of last year, recording its worst decline since 2001. This currency weakness also aggravates Turkey's persistent inflation problem, which at one point in 2018 peaked at over 25%.   It's important to point out that the Turkish economy has been growing strongly for most of the period since 2001. But confidence in Turkey was beginning to wane last year over concerns that the economy was overheating due to huge spending and borrowing. In addition, the Turkish government has taken away some power from the central bank, leading investors to worry about the direction of fiscal policy. So any fallout with the US could further sour the financial markets' view of the health of the Turkish economy. ""This could lead to a decline in capital inflows and impact the value of the Turkish currency,"" says economist Gulcin Ozkan. But given the importance of the political and strategic relationship with Turkey, which shares borders with Syria, Iraq and Iran, the US may want to tread carefully. Turkey is the biggest recipient of US defence equipment after Israel and the UAE and the vast majority of its air force is US supplied. It also hosts US and Nato forces at its Incirlik airbase, in the south of the country. So Turkey may be economically vulnerable but politically and strategically it remains very important. Read more from Reality Check Send us your questions Follow us on Twitter"
investors sentiments,Ted Baker to 'learn lessons' of hugs probe,2024-09-15,2019-03-21,BBC News,https://www.bbc.com/news/business-47649883,"Troubled fashion chain Ted Baker has said it is ""determined to learn lessons"" from the ""forced hugs"" scandal that forced out its boss Ray Kelvin. The pledge came in its annual results statement, less than three weeks after Mr Kelvin resigned in the wake of the misconduct allegations. Pre-tax profit for the year to 26 January was down 26% to £50.9m, from £68.8m a year earlier. The figures were in line with a profit warning issued last month. The firm is continuing an investigation into the allegations against Mr Kelvin. Its shares fell more than 5% in early Thursday trading. In its results statement, Ted Baker said it wanted all employees to feel ""respected and valued"" and would ensure that ""appropriate changes"" were made. The scandal over Mr Kelvin, who founded the chain and was its chief executive, broke in December, when employees launched an online petition accusing him of inappropriate comments and behaviour. The petition, on the workplace website Organise, said that more than 200 Ted Baker staff were finally breaking their silence after at least ""50 recorded incidents of harassment"" at the fashion group.  Staff claimed that as well as engaging them in unwelcome embraces, the brand's founder had asked young female members of staff to sit on his knee, cuddle him or let him massage their ears. At the time, Mr Kelvin took a voluntary leave of absence. He stepped down on 4 March. The firm said its investigation was continuing and would now focus on Ted Baker's ""policies, procedures and handling of HR-related complaints"". Acting chief executive Lindsay Page said that ""despite difficult trading conditions"", the firm's sales performance over the year had been ""resilient"". The results showed a marked divergence between the fortunes of its online and High Street operations, reflecting current consumer trends. E-commerce sales rose 20.4% to £121.7m, but overall retail sales were just 4.2% higher at £461m. At the same time, retail sales per sq ft of High Street store space decreased by 5.5% to £786. ""Performance was impacted by competitive discounting across the retail sector, consumer uncertainty, the well-publicised challenges facing some of our UK trading partners and the unseasonable weather across our global markets at different points throughout the year,"" the retailer said. ""Despite this, growth was driven by continued investment across the retail channel in new and existing stores and our e-commerce platform."" George Salmon, equity analyst at Hargreaves Lansdown, said: ""These are turbulent times for Ted. The top line is still heading in the right direction, but only on account of the continued addition of new sales space and the strong contribution from online sales.  ""However, Ted had already braced investors to expect a drop in profits this year, and sentiment was already frayed on the back of the ongoing investigation into the former CEO's conduct.  ""We think the share price movement is more to do with Ted's notably downbeat outlook - which will be a surprise to many after the positive trading statement in January."" "
investors sentiments,Amazon warns of slower sales as economy weakens,2024-09-15,2022-10-27,BBC News,https://www.bbc.com/news/business-63421170,"Apple and Amazon sales are being hit by the weakening global economy, the tech giants have warned, adding to fears about their upcoming profits. Amazon shares tumbled more than 15% after the US stock market closed, as the firm forecast far weaker sales for the festive season than expected. Apple shares also slipped after warning of a slowing demand for gaming and advertising. Both cited the rising cost of living as a factor eroding consumer buying power. ""We're very optimistic about the holiday but we're realistic that there are various factors weighing on people's wallets"", Amazon's chief financial officer Brian Olsavsky told analysts on a call to discuss the results. Amazon founder Jeff Bezos, who remains chairman of the company, recently warned about worrying signals coming from the economy, writing on Twitter that it was time to ""batten down the hatches"". Apple, seen as one of the steadiest of the tech giants, has not been immune.  In its update on Thursday, Apple reported that sales rose by 8% to $90.1bn in the three months to September compared with the same period the year before. That was a quarterly record, albeit one dented by weaker-than-expected iPhone sales and soft growth in China. But Apple executives warned investors that they were seeing weakness in digital advertising and gaming and expecting a sharp fall in Mac computer sales. They added that a strong dollar would hit business. ""Apple's ability to sell highly priced hardware in the current environment defies all the rules,"" said Sophie Lund-Yates, lead equity analyst at Hargreaves Lansdown. ""The key festive season is a crucial barometer for consumer sentiment, and there's a possibility Apple is going to lose some steam year-on-year when it comes to Christmas sales."" Both Apple and Amazon saw business boom during the pandemic, as more activity moved online.  But sales have softened significantly over the past year, as consumers do more of their shopping in person once again, and shift their buying habits in response to rising prices. At Amazon, overall sales in the three months to September rose 15% year-on-year to $127.1bn, but its international business shrank. Growth slowed in its lucrative cloud services unit. While Amazon sales were strong in July, they weakened in August and September, especially in Europe, said Mr Olsavsky, blaming the problems on a ""tougher recessionary environment"". Costs for items such as fuel are also rising, which is likely to hit profits, he added. ""Worrying times for Amazon, in line with other big tech,"" said Paolo Pescatore, analyst at PP Foresight. ""This is set to be a winter of discontent."" Executives at major tech firms, including Microsoft, Google's parent company Alphabet, and Facebook have also discussed weakness in recent financial updates. "
investors sentiments,Klarna to cut 10% of staff as it warns of recession,2024-09-15,2022-05-24,By Michael Race,https://www.bbc.com/news/business-61562651,"Buy now pay later firm Klarna has announced plans to cut around 700 staff as it warned of a ""likely recession"". The Swedish firm blamed a combination of rising prices, a change in consumer sentiment and the war in Ukraine for the move. ""What we are seeing now in the world is not temporary or short-lived, and hence we need to act,"" said chief executive Sebastian Siemiatkowski. The cuts equate to around 10% of Klarna's 7,000-strong workforce.  ""When we set our business plans for 2022 in the autumn of last year, it was a very different world than the one we are in today,"" said Mr Siemiatkowski. ""Since then, we have seen a tragic and unnecessary war in Ukraine unfold, a shift in consumer sentiment, a steep increase in inflation, a highly volatile stock market and a likely recession."" In a blog, Mr Siemiatkowski advised staff - who the company refers to ""Klarnauts"" - to ""take care of yourselves and each other"". Klarna is one of many tech companies warning that the months ahead will be difficult and taking steps to cut jobs or freeze hiring, as consumer spending weakens and ad sales slow. Social media firm Snap shares tumbled roughly 40% on Tuesday after it cut sales and profit targets set a month ago. The owner of the Snapchat messaging app said it would slow its rate of hiring after it said ""macroeconomic environment has deteriorated further and faster than anticipated"". The update prompted a wider sell-off, with shares in Facebook-owner Meta down roughly 10%, Google-owner Alphabet falling 8% and smaller firms such as Pinterest down 26%. In the UK, the central bank has warned the economy could fall into recession - defined as the economy getting smaller for two consecutive quarters - after official figures revealed the economy shrank in March. Higher prices are beginning to bite into household budgets and people have started spending less and cutting down on car journeys due to high fuel costs. Soaring energy bills and food prices are also having an impact and inflation - the rate at which prices rise - jumped to 9% in April and is expected to reach more than 10% by the end of the year. Commenting on the cuts, Klarna said its affected employees in Europe will be offered ""to leave Klarna with an associated compensation"", but added outside of the continent, ""the process for impacted employees will look different depending on where you work"". Klarna staff were asked to work from home this week ""in consideration of the privacy of the people affected by these changes"". Mr Siemiatkowski said it had been ""a very tumultuous year"" so far. It contrasts with 2021 when, thanks to the shift in consumer spending to online during Covid restrictions, Klarna saw the value of the company soar to $46bn when it raised millions of dollars from investors. Since then, however, The Wall Street Journal has reported it is seeking a new round of investment and its valuation could sink by as much as $16bn to $30bn. Klarna dismissed the report as ""pure speculation"". Buy-now-pay-later providers should have a pretty good insight of consumer sentiment. After all, it is a product that has been used by 17 million people in the UK, including 30% of those aged in their 20s. No doubt Klarna has decided that those customers are likely to tighten their belts, spending less on fashion and the like as food and fuel take a bigger and bigger chunk out of their disposable incomes. But there are likely to be wider factors at play here too. Firstly, this kind of credit is facing greater scrutiny from regulators. Will shoppers think twice about clicking the Klarna box if they know that, in doing so, other potential lenders will be aware of how they are funding their purchases or they have to undergo affordability checks? Secondly, Klarna has expanded fast, but so have its losses, and those in charge need to chart a sustainable course for the business. Over its last financial year, Klarna's operating losses swelled to 6.58bn Swedish krona (£540m) from 1.62bn Swedish krona.  In its annual report, the company said losses were growing but that was ""entirely explained by Klarna's growth, expansion to new markets and massive inflow of new customers"". Danni Hewson, financial analyst for AJ Bell, said Klarna's job cuts ""might be the sensible option even if it takes a great big chunk out of the company's valuation"". ""Markets are adjusting, those sky-high market caps that some growth businesses have attained over the last couple of years are coming under considerable scrutiny and many investors are deciding they don't hold up,"" said Ms Hewson. ""Klarna's caught between a rock and hard place as it needs to keep up its expansion momentum if it's to grow revenue and start generating profits. ""It could delay fundraising, wait for a more favourable moment, but there's no telling how long that wait would be particularly when recession is looming over the global economy."" Buy-now-pay-later is now a popular payment method across many stores, especially for people in their 20s. However, one in 10 people using them already had debt arrears elsewhere, a review by the Financial Conduct Authority last year found. It has led to criticism the schemes encourage shoppers to buy more than they can afford. Earlier this month, Klarna announced it would start telling credit agencies who pays on time and who falls behind. From June, banks and credit card firms will be able to see people's Klarna habits when making credit checks."
investors sentiments,Stock markets hit by Ukraine invasion fears,2024-09-15,2022-02-14,By Russell Hotten,https://www.bbc.com/news/business-60374581,"Europe's stock markets closed sharply lower on Monday, but recouped some losses in afternoon trading on hopes of a deal to resolve Ukraine tensions. The FTSE 100 ended 1.7% down, and the main markets in Paris and Frankfurt 2% lower, with travel stocks hard hit. Reports from Russia that talks with the West over Ukraine should continue helped improve investor sentiment. That limited losses on Wall Street, where at lunchtime in New York the Dow Jones was down 0.5% and Nasdaq up 0.7%. According to reports, Sergei Lavrov has suggested to Russia's President Vladimir Putin that diplomatic efforts should continue because there might be a chance of doing a deal. On the FTSE 100, IAG, the owner of British Airways and Iberia, fell 5.6%. Shares in the major banks closed between 4% and 5% down. The biggest loser was London-listed Russian mining company Evraz, which tumbled 29%. The FTSE 100's fall, the worst session in three weeks, followed a fall in Asian stock markets. ""The fact that the door has not been shut to further talks... is a good thing,"" said Patrick O'Hare, at Briefing.com. ""Hence, the negativity seen earlier has dissipated some, yet there is still a major cloud of uncertainty hanging over the market."" Oil initially rose sharply with Brent crude topping $95 (£70) per barrel, stoking fresh inflationary worries, although the price has eased back slightly.  With oil demand high as global economies emerge from lockdown, there are fears a war or severe sanctions on Russia will cut supplies, sending the price above $100 a barrel, something not seen since 2014. ""Just as the storm of Covid appeared to be receding, the growing expectation of an invasion of Ukraine is the fresh threat now unnerving investors, with confidence plunging in many parts of the world,"" said Hargreaves Lansdown analyst Susannah Streeter.  She added: ""With worries that inflation is already running far too hot, the possibility Russian troops could move across the border has led to another surge in the oil price. Energy markets are clearly on edge and if supplies are threatened there is a risk oil will shoot up even higher."" Analysts at Capital Economics estimate war or sanctions could add to inflation in Europe, forcing central banks to lift interest rates faster and further. ""Over the longer term, whether Russia ends up invading or not, this geopolitical flare-up is likely to speed up the process of Russia's decoupling from the West,"" Capital Economics said in a research note. Moscow has amassed an estimated 100,000 troops along Ukraine's border but denies any intent to invade.  Despite this, more than a dozen countries have urged their citizens to leave Ukraine, with the US saying Moscow could begin an attack ""at any time"". "
investors sentiments,Will Argentine and Turkish crises spread?,2024-09-15,2018-09-06,By Ana Nicolaci da Costa ,https://www.bbc.com/news/business-45191872,"Economic crises in Turkey and Argentina have led to talk of ""contagion"" - the danger of financial problems in one country spilling over into others. Turkey has struggled with a falling currency and worsening relations with the US. A spiralling crisis in Argentina prompted the government to announce austerity measures and to ask the International Monetary Fund (IMF) for an early release of a $50bn loan. The sharp falls in the value of Turkey's lira and Argentina's peso have led to fears that currencies from South Africa to Russia will follow suit. In Asia, India's rupee and Indonesia's rupiah have already been hit. So should Asian economies be concerned? Put simply, contagion is a self-fulfilling process, whereby economic problems in one country prompt investors to sell assets in economies with similar risks. In a globalised world, a crisis in one country can also quickly spread to others through trade links or lending by banks.  That is why a downturn in Turkey or Argentina matters abroad -  beyond making holidays there cheaper. Trade is the obvious way for trouble in one country to affect another.  When an economy begins to falter, companies tend to cut production and then jobs. As a result, consumers have less money to spend on goods, including imports. This is bad news for global businesses that export a lot of goods to the country.    If a crisis also causes a country's currency to weaken, the cost of imports rise, further hurting demand. However, Joseph Gagnon at the Washington-based Peterson Institute for International Economics, says Asia has ""very low trade links"" with Argentina and Turkey, ""so that is not much of a worry"". Rajiv Biswas, Asia Pacific chief economist for IHS Markit, also says trade with Turkey is an unlikely channel of contagion for Asia, since the region relies more heavily on big economies such as China, Europe and the US for their exports. ""The more significant concern for Apac [Asia Pacific] nations would be if the Turkish economic crisis results in contagion to emerging markets currencies and equities, which could potentially trigger significant capital outflows from emerging markets,"" he said. The phrase ""emerging markets"" refers to developing countries in Africa, Latin America or Asia, while major economies such as the US, the UK and Japan tend to have higher living standards and more developed financial systems. During an economic crisis, investors tend to sell riskier assets, such as emerging market currencies or stocks, and hold on to safer ones, such as the US dollar or government bonds issued by major economies.  Julian Evans-Pritchard, a senior China economist at Capital Economics, says countries that rely on money from overseas and have foreign inflows of cash into their stock and bond markets are particularly at risk of contagion. ""The risk is that when sentiment turns more negative, foreign investors start to pull out those funds, which has an impact on the exchange rate,"" he said. ""For countries that borrowed a lot in foreign currency, usually in US dollars, this can make it difficult for them to repay their foreign currency denominated debt. That's what happened in 1997 during the Asian financial crisis, for example."" In Asia, both India and Indonesia rely heavily on foreign capital inflows, which is why their currencies have suffered in particular. India, an oil importing country, has seen its import bill rise along with higher oil prices and this has caused its current account deficit to widen, said Mr Biswas of IHS Markit. A country that runs a current account deficit may rely on inflows of foreign money to finance spending and investments. Indonesia, meanwhile, has low foreign exchange reserves and a high level of foreign ownership in the local equity and bond markets, Mr Biswas added.  This makes it particularly vulnerable to investors pulling their money out of the country. Another way contagion can spread is when banks in one country own assets in another country which is in trouble. The economic problems can cause the value of these assets to fall. When that happens, investors worry how a bank will cope with the falling value of the assets, and how this will affect its ability to lend money to consumers and other borrowers. Such concerns weighed on European bank shares recently, with investors worried about how much Turkish assets they own. The Financial Times reported that a wing of the European Central Bank was concerned about the exposure of some of the eurozone's biggest lenders to Turkey. The report said Spain's BBVA, Italy's UniCredit and France's BNP Paribas, all of which have significant operations in Turkey, were particularly exposed. Spain's banks are the most exposed to Turkey, according to IHS Markit, citing data from the Bank for International Settlements. They have about €81bn of exposure to Turkish assets, and French banks have exposure to about €35bn. But IHS Markit's Mr Biswas said Asian banks' exposure to Turkey was limited. ""In the big picture of the banking sectors of the Asian countries, this would not be a serious negative factor in their outlook,"" he said."
