Keyword,Title,Scrapping Date,Article Date,Author,Link,Content
investors sentiments,Sell-off erases Trump Media shares' 2024 gains,2024-09-15,2024-09-04,Natalie Sherman,https://www.bbc.com/news/articles/c93p2v72dpdo,"Donald Trump's media company was hit by a fresh round of selling on Wednesday, wiping out gains the share price had enjoyed this year alongside the rising political fortunes of its namesake. Shares fell more than 6% to less than $17, which is less than what they were worth at the start of 2024.  The share price, which hit a peak in April during the former president's criminal trial, has fallen more than 70% from its high.  The firm, operator of the social media platform Truth Social, still boasts a market value of more than $3.3bn - a hefty sum for a small company with shrinking revenue and growing losses.  Mr Trump's victory in the January Republican primary had helped to stoke interest in the Trump Media at the start of the year. Buyers snapped up shares of Digital World Acquisition Corp., a publicly-traded shell company, which was created to buy Trump Media and was seen on Wall Street as a proxy for the firm.  Demand jumped farther around the time the merger was formally completed in March. The price has swung wildly in the months since.  Its most recent high came in July, after Trump survived an assassination attempt and before President Joe Biden bowed out of the race, but the price has slid lower in recent weeks.  The falls come as the company approaches the date at which Trump and other early investors will be free to start selling their shares. Mr Trump's stake is currently worth about $2bn, down from more than $6bn a few months ago.  Analysts had warned investors to expect big swings in value, describing it as a ""meme stock"", propelled by sentiment rather than its financial characteristics."
investors sentiments,Allegations mount against India market regulator,2024-09-15,2024-09-09,Nikhil Inamdar & Archana Shukla,https://www.bbc.com/news/articles/cly3kvzp317o,"India’s market regulator is facing a threat to its credibility after a barrage of allegations against its chief, top fund managers have told the BBC. Multiple charges, mostly around conflict of interest, have surfaced against Madhabi Puri Buch, chairperson of the Securities and Exchange Board of India (Sebi), from at least four different corners over the past month. She has denied most of them and not publicly responded to some. This comes amid a bull run in India’s equity markets, which are among the world’s best performing this year. Foreign investors have pumped in over $6bn (£4.5bn), while millions of new mom-and-pop investors have opened electronic accounts to invest in a mutual funds and initial public offering (IPO) frenzy. Trouble for Ms Buch began in August when US-based short-seller Hindenburg Research accused her and her husband of holding investments in an offshore fund used by the Adani Group, implying it was why Sebi was dragging its feet on an investigation against Adani over allegations of accounting fraud and market manipulation. Since then a number of other accusations have come to the fore. The main opposition Congress party has accused Ms Buch of receiving rental income from a company she was investigating. It has also alleged that she held an ""office of profit"" at ICICI Bank, one of India’s largest private lenders, continuing to earn large sums of money through Employee Stock Ownership Plans (Esops) long after her stint with them was over. Subhash Chandra Goyal, the chairman emeritus of media giant Zee Entertainment Enterprises, blamed her for the collapse of a merger between his company and Sony Enterprises, stating ""I am convinced that the Sebi chairperson is corrupt"" and calling her ""vindictive"" in a press conference. He is currently facing regulatory action, charges of fund diversion and is barred from holding key posts in listed firms. But perhaps most damaging of all is growing internal dissent within Sebi, which has now spilled out into the public domain. On 5 September, furious staff members staged a rare protest outside the regulator’s headquarters demanding Ms Buch’s resignation. Around 1,000 employees had reportedly complained of a toxic work culture in a letter to the finance ministry earlier, local media reported. They complained of ""immense pressure"" and ""shouting, scolding and public humiliation” becoming a norm in meetings. Sebi has publicly rejected the claims as “misplaced”, adding that “junior officers have been misguided, perhaps by external elements”. However, protesters on Thursday called for an immediate retraction of this statement. “This is unprecedented,” says Hemindra Hazari, an independent business analyst. “Until yesterday it was allegations from the outside, now internal problems have become public. Something is seriously wrong.” Ms Buch has strongly defended herself, denying any conflict of interest claims in the Hindenburg case, while ICICI Bank has denied paying her a salary or Esops and said she only received her retirement benefits after she left the bank. The Sebi chief has so far not made a public statement on protesting employees or the criticisms levelled at her by Mr Chandra. Sebi didn't respond to the BBC's request for comment. An alumnus of India’s premier management school, Indian Institute of Management Ahmedabad, Ms Buch is a trailblazer in many ways. The youngest and first female chairperson to lead Sebi, she became the first chief to have come from a private corporate background. Despite being credited for reforming Sebi with stricter insider trading rules and auditing frameworks, allegations of a lack of transparency in her own financial affairs raise serious concerns about whether Sebi holds its top officials to the same standards it expects from public companies, experts say. “The crux of the issue is about disclosure rules governing the senior-most officials at regulatory bodies, given their access to unpublished price-sensitive information. Their orders and decisions can dramatically impact stock prices, raising the stakes for stringent disclosure and compliance norms,” writes Sucheta Dalal, a veteran financial journalist, in a column for Moneylife magazine. Standards for heads of regulators are much more stringent in developed countries where they are required to, for instance, “divest from direct holdings in entities that could post conflict of interest”, says Ms Dalal, adding that certain discrepancies in the statement put out by ICICI Bank about its Esop policy have complicated rather than clarified matters. Regulators like Sebi typically have political appointees and lateral hires from the private sector. Sebi is run by a board with members from the finance ministry, the central bank and others nominated by the federal government. The Buch episode is a “learning” not just for Sebi, but also for other Indian regulators like the insurance watchdog or the Competition Commission to apply more robust disclosure processes, says Shriram Subramanian of the proxy advisory firm InGovern Research. “It will bring more transparency,” Mr Subramanian adds. For the moment, investors seem unperturbed by the events of the past month. “Global investors already pay a regulatory risk premium when they invest in India, they will ignore this,” said a veteran trader. But things could take a turn for the worse if the controversy snowballs further, says Mr Hazari. “Institutional money can flee if internal warnings go out around compliance issues. And then retail investors will slowly start pulling out of the market,” he adds. With pressure mounting from both outside and inside Sebi, some say Ms Buch is now faced with the very real question of leaving her post. Her position was ""untenable"" a few weeks ago, but has become increasingly ""unsustainable"" now, Subhash Garg, a former finance secretary, told journalist Barkha Dutt on Mojo Story, a digital outlet. A resignation or a suspension would be seen as an admission of guilt, which neither Ms Buch nor the government would want. At least three market experts the BBC spoke with said the most likely outcome of the controversy will be that Ms Buch's appointment won’t be renewed. Her current three-year tenure as chairperson ends in February 2025. “For me what’s most astounding is that the government has been totally silent. They need to step in now. When serious allegations are made against the head of a regulator, the government or the judiciary are the only higher authorities which can authorise a credible investigation,” said Mr Hazari. Others have also called for the board of Sebi to step in and publicly address the allegations. An executive at a foreign fund house who spoke to the BBC on condition of anonymity said global investors will watch the way the government handles the matter, and how swiftly it acts.  “This will affect investor sentiment going forward,” he said."
investors sentiments,Slowest US inflation since 2021 raises rate cut hope,2024-09-15,2024-08-14,Natalie Sherman,https://www.bbc.com/news/articles/cwy3wy522dyo,"Consumer prices in the US rose at the slowest pace in more than three years last month, bolstering the case for the central bank to start cutting interest rates. Overall, prices rose 2.9% over the 12 months to July, the smallest annual increase since March 2021 and down from 3% in June, the Labor Department said.  The monthly inflation report was being closely watched after signs of weaker-than-expected jobs growth in July sparked stock market turmoil and recession fears earlier this month.  Analysts said the figures should help convince the Federal Reserve that high borrowing costs are working to return inflation back to normal, despite upticks in housing and food costs. The Federal Reserve has held its key lending rate at 5.3% - a roughly two-decade high - since July 2023, a move that has hit the public in the form of higher rates for mortgages, credit cards and other loans.  By keeping rates high, the bank is hoping to discourage borrowing and cool the demand pressures that were helping drive up prices of homes, cars and other items. But the central bank is under pressure to cut rates as inflation, which tracks the pace of price increases, has started to move closer to its 2% target rate, helped by lower oil prices and resolution of Covid-era supply chain crunches.  The three major stock indexes in the US were little changed after the report, which came in roughly as expected. Julian Howard, chief multi-asset investment strategist at GAM Investments, said a rate cut in September now looked ""all but certain"". But he said he thought the Fed would remain cautious about signalling the path ahead, pointing to last month's uptick in inflation in the UK, where the Bank of England recently cut rates. ""While the UK's higher-than-2% figure, was to an extent expected, it is still slightly jarring when inflation comes in higher than the target after a recent rate cut,"" he said.  ""Whatever the Fed does in September, it will be very keen to convey ongoing data dependency from one meeting to the next, rather than setting out a trajectory that might fail to materialise."" Inflation in the US has already receded significantly since June 2022, when it hit 9.1%. Over the past year, prices for appliances and cars have fallen, along with prices for other items such as airline tickets and furniture.  Petrol prices - a key determinant of economic sentiment in the US - have dropped 2.2%. But rising prices for household staples such as groceries have kept political pressure on the White House during a presidential election year, weighing on Democrats. Housing has accounted for more than 70% of inflation over the past year, as rents jumped more than 5%. Grocery prices also rose 1.1%, while car insurance has soared more than 18%. In a statement, President Joe Biden said the report showed ""progress fighting inflation and lowering costs for American households"", while the Trump campaign focused on the 20% rise in prices since 2021, calling the phenomenon ""Kamalanonics"", after election rival vice-president Kamala Harris. On Wall Street, the figures left investors divided about how much the Fed should cut rates in September - whether by 0.25 percentage points or more. Wells Fargo analysts said they were betting on the Fed moving more aggressively to cut rates, despite the acceleration in rents in July. ""Through the see-saw ride of recent monthly prints, the moderation in core inflation has broadened beyond goods, with services inflation—most notably housing—also cooling over the past year,"" economists led by Sarah House wrote.  ""The continued steady slowdown in inflation, when paired with the rise in the unemployment rate and deterioration in other labor market indicators, leads us to believe the [Fed] will want to move quickly."""
investors sentiments,China's rhetoric turns dangerously real for Taiwanese,2024-09-15,2024-08-15,Rupert Wingfield-Hayes,https://www.bbc.com/news/articles/ce8dy437pdno,"Calls to denounce “die hard"" Taiwanese secessionists, a tipline to report them and punishments that include the death penalty for “ringleaders” –  Beijing’s familiar rhetoric against Taiwan is turning dangerously real. The democratically-governed island has grown used to China’s claims. Even the planes and ships that test its defences have become a routine provocation. But the recent moves to criminalise support for it are unnerving Taiwanese who live and work in China, and those back home. “I am currently planning to speed up my departure,” a Taiwanese businesswoman based in China said – this was soon after the Supreme Court ushered in changes allowing life imprisonment and even the death penalty for those guilty of advocating for Taiwanese independence. “I don’t think that is making a mountain out of a molehill. The line is now very unclear,” says Prof Chen Yu-Jie, a legal scholar at Taiwan’s Academia Sinica. China’s Taiwan Affairs Office was quick to assure the 23 million Taiwanese that this is not targeted at them, but at an “extremely small number of hard-line independence activists”. The “vast majority of Taiwanese compatriots have nothing to fear,” the office said. But wary Taiwanese say they don’t want to test that claim. The BBC has spoken to several Taiwanese who live and work in China who said they were either planning to leave soon or had already left. Few were willing to be interviewed on record; none wanted to be named. “Any statement you make now could be misinterpreted and you could be reported. Even before this new law China was already encouraging people to report on others,” the businesswoman said. That was made official last week when Chinese authorities launched a website identifying Taiwanese public figures deemed “die hard” separatists. The site included an email address where people could send “clues and crimes” about those who had been named, or anyone else they suspected. Scholars believe Beijing hopes to emulate the success of Hong Kong’s national security laws, which it said were necessary for stability - but they have crushed the city’s pro-democracy movement as former lawmakers, activists and ordinary citizens critical of the government have been jailed under them. By making pro-Taiwanese sentiments a matter of national security, Beijing hopes to “cut off the movement’s ties with the outside world and to divide society in Taiwan between those who support Taiwan independence and those who do not”, Prof Chen says. She believes the guidance from the Supreme Court will almost certainly result in prosecutions of some Taiwanese living in China. “This opinion has been sent to all levels of law enforcement nationwide. So this is a way of saying to them – we want to see more cases like this being prosecuted, so go and find one.” “We must be even more cautious,” said a Taiwanese man based in Macau. He said he had always been prepared for threats, but the new legal guidance had made his friends “express concern” about his future in the Chinese city. “In recent years, patriotic education has become prevalent in Macau, with more assertive statements on Taiwan creating a more tense atmosphere compared to pre-pandemic times,” he added. Taiwan, which has powerful allies in the US, the EU and Japan, rejects Beijing’s plans for “reunification” – but fears have been growing that China’s Xi Jinping has sped up the timeline to take the island, an avowed goal of the Chinese Communist Party. For more than 30 years Taiwanese companies - iPhone-maker Foxconn, advanced chips giant TSMC and electronics behemoth Acer – have played a key role in China’s growth. The prosperity also brought Taiwanese from across the strait who were in search of jobs and brighter prospects. “I absolutely loved Shanghai when I first moved there. It felt so much bigger, more exciting, more cosmopolitan than Taipei,” says Zoe Chu*. She spent more than a decade in Shanghai managing foreign musicians who were in high demand from clubs and venues in cities across China. This was the mid-2000s when China was booming, drawing money and people from across the globe. Shanghai was at the heart of it - bigger, shinier and trendier than any other Chinese city. “My Shanghainese friends were dismissive of Beijing. They called it the big northern village,” Ms Chu recalls. “Shanghai was the place to be. It had the best restaurants, the best nightclubs, the coolest people. I felt like such a country bumpkin, but I learned fast.” By the end of that decade – in 2009 - more than 400,000 Taiwanese lived in China. By 2022, that number had plummeted to 177,000, according to official figures from Taiwan. “China had changed,” says Ms Chu, who left Shanghai in 2019. She now works for a medical company in Taipei and has no plans to return. “I am Taiwanese,” she explains. “It’s no longer safe for us there.” The Taiwanese exodus has been driven by the same things that have pushed huge numbers of foreigners to leave China – a sluggish economy, growing hostility between Beijing and Washington and, most of all, the sudden and sweeping lockdowns during the Covid pandemic. But Taiwanese in China have also been worried because the government doesn’t see them as “foreigners”, which makes them especially vulnerable to state repression. Senior Taiwanese officials have told the BBC that 15 Taiwanese nationals are currently being held in China for various alleged crimes, “including violations of the anti-secession law”. In 2019, China jailed a Taiwanese businessman for espionage after he was caught taking photos of police officers in Shenzen – a charge he denied. He was only released last year. In April 2023, China confirmed that it had arrested a Taiwan-based publisher for “endangering national security”. He still remains in custody. Amy Hsu*, who once lived and worked in China, says she is now scared to even visit because of her job. After returning to Taiwan, she began volunteering at an NGO which helped people who had fled Hong Kong to settle in Taiwan. “It is definitely more dangerous for me now,” she says.  “In 2018, they began using surveillance cameras to fine people for jaywalking and the system could identify your face and send the fine directly to your address.” She says the extent of surveillance disturbed her – and she worries it can be used to go after even visitors, especially those on a list of potential offenders. “Oh I am definitely on the list. I am a hardline pro-independence [guy] with lots of ideas,” chuckles Robert Tsao, a 77-year-old tech billionaire, who founded one of Taiwan’s largest chip-makers, United Micro-electronics Corporation (UMC). Mr Tsao was born in Beijing, but today he supports Taiwan independence and avoids not just China, but also Hong Kong, Macau, Thailand and even Singapore. Mr Tsao was not always hostile to China. He was one of the first Taiwanese investors to set up advanced chip-making factories in China. But he says the crackdown in Hong Kong changed his mind: “It was so free and vibrant and now it’s gone. And they want to do the same to us here.” “This new ruling is actually helping people like me,” he says. He believes it will backfire, increasing the resolve of Taiwanese people to resist China. “They say the new law will only affect a few hard-line independence supporters like me, but so many Taiwanese people either support independence or the status quo [keep things as they are], which is the same thing, so we have all become criminals.” * Names changed on request of contributors "
investors sentiments,Global stocks climb as US recession fears ease,2024-09-15,2024-08-09,Michael Race & João da Silva,https://www.bbc.com/news/articles/c8dpm9n2g6go,"The stock index of the UK's biggest publicly-listed companies edged higher on Friday after concerns eased over the state of the US economy.  The FTSE 100, which is made up of the country's biggest businesses including banks, airlines and housebuilders, rose in early trading. It follows stronger trading in the US where stock markets had their best day in almost two years on Thursday. Global financial markets have been spooked in the past seven days over fears that world's biggest economy could be heading for a slowdown. But on Thursday, official data revealed US unemployment claims rose by less than expected. The benchmark S&P 500 index ended the day 2.3% higher. The Dow Jones Industrial Average rose 1.8%, and the Nasdaq jumped 2.9%. In London, the FTSE 100 ticked up 0.7%. Stock markets indexes in Paris and Frankfurt followed a similar path. Stocks in Asia made modest gains, recovering some of the losses after Japanese indexes had their worst day since 1987 earlier in the week. ""The [US] latest jobless claims data, though not normally a major market event, supports the view that recent pessimism may have been overdone,"" said UBS Global Wealth Management. Official figures from the US Labor Department showed first-time claims for unemployment benefits in the US had fallen more than expected to 233,000 last week. But despite the apparent recovery in global markets, analysts warn that trading will likely remain choppy for the time being. ""The market volatility is creating trading opportunities for investors over the short term,"" said Peter McGuire from trading platform XM.com. ""It will be a bumpy ride over the election season and we all await the [US Federal Reserve] policy decision in September."" The Federal Reserve held off cutting interest rates last week - something that typically boosts growth - in contrast to other central banks such as the Bank of England. But, this week's market upheaval stoked further speculation about when - and by how much - the Fed will cut borrowing costs. ""[The] Fed is now likely to cut rates up to 50bps in September which in turn supports expanding valuation for the market,"" said Jun Bei Liu, portfolio manager at Tribeca Investment Partners."
