Keyword,Title,Scrapping Date,Article Date,Author,Link,Content
Debt Market Sentiment,Five ways to revive Zimbabwe’s economy,2024-09-14,2017-11-22,By Matthew Davies,https://www.bbc.com/news/world-africa-42079584,"Current events in Zimbabwe show that while a week may be a long time in politics, it is really a very short blink of an eye in economics. Zimbabweans on the streets of Harare and Bulawayo may be hopeful for political change, but they are much more sanguine and realistic when it comes to improving the country's economy.  Presidents can be impeached in days or weeks. It takes years to wreck economies and usually even longer to repair them. So, will Emmerson Mnangagwa be able to take Zimbabwe's economy off life support and at least start to put it on the road to recovery? Analysts are very sceptical that a quick solution is even feasible. The euphoria that has gripped the nation has certainly raised hopes that the future will be brighter, but if that improved sentiment is to deliver economic dividends, the government needs to make some drastic reforms. The first tool President Mnangagwa would need to even get a recovery kick-started is hard currency. Zimbabwe hasn't had a currency of its own since 2009, after hyperinflation killed off the old Zimbabwean dollar.  Since then, the US dollar has been the main currency for transactions, as well as the South African rand. And in recent years a cash shortage has been slowly strangling the economy, which is half the size it was at the turn of the millennium. Ten numbers that will help you understand what's actually going on But who would stump up the cash? Western donors will remain wary of a Zanu-PF government which simply sees Robert Mugabe replaced by Mr Mnangagwa.  The International Monetary Fund, which describes Zimbabwe's economy as one of the most fragile in the world, may be more willing - but only with many strings attached to any deal.  China is possibly the most likely cash benefactor in the initial stages of a Mnangagwa administration. In some circles, Mr Mnangagwa is seen as Zimbabwe's Deng Xiaoping, the Chinese leader who instigated a degree of market liberalisation.  Assuming the cash is forthcoming, what then? Mr Mnangagwa would have to dump economic policies that are unpalatable to foreign investors.  In 2009, Mr Mugabe signed the Indigenisation and Economic Empowerment Act (IEEA) into law, which aimed to place 51% of companies into the hands of Black Zimbabweans.  Even some Chinese companies have been forced to close their operations in Zimbabwe in recent years, because the IEEA made it unprofitable to do business in the country.  Once considered the breadbasket of Africa, Zimbabwe saw its agricultural production start to plunge at the turn of the century after the government-sanctioned programme of farm seizures.  Some sources claim that Mr Mnangagwa is keen to revitalise Zimbabwe's commercial farms, and may seek the help of white farmers to do it.  Corruption has been a major restraint on economic growth in Zimbabwe for years. Much of the farmland that was seized from white farmers ended up in the hands of army generals and the political elite, who knew next to nothing about agriculture.  The farms simply fell into disarray. Likewise, businesses that ended up with people with more political connections than entrepreneurial flair more often than not went to the wall.  Not that corruption is confined to Zimbabwe in the African context, but it is one of those places that it seems to trickle down from the top. Just ask any South African who has driven their car across the border and been stopped at a police roadblock.  But Mr Mnangagwa has not escaped the corruption criticism. It is alleged that he was at the top of corruption tree when the army effectively took over the Marange diamond fields in the east of the country in 2008. At the time, he was the defence minister.  That whole affair raised the eyebrows even of Mr Mugabe, who said last year that he felt at least $13bn of revenue had gone missing from the diamond bonanza. For nearly 20 years, Zimbabwe has been in default on $9bn worth of international debt. That debt needs restructuring, probably with the assistance of the IMF and the World Bank.  Perhaps a government that did not only include Zanu-PF could even get the debt (or some of it) wiped out. Mr Mnangagwa is thought to be open to a new deal with the IMF, but getting new financing and renegotiating old deals would probably be easier for a unity government which included opposition politicians, especially former Finance Minister Tendai Biti.  Formal jobs in Zimbabwe are rare. Unemployment runs at more than 90%. Creating the conditions for investment and seeing that money flows in should have a dramatic short-term effect on unemployment.  Other conditions already exist: the country has an abundance of natural resources in both agriculture and mining, and a potential labour force that's one of the most skilled in Africa.  All it needs is the political will and the right economic conditions for Zimbabwe's unemployment statistics to become rather less stratospheric.    Meanwhile, three million Zimbabweans are estimated to live outside the country, having fled the dire economic conditions that emerged over the past two decades. They too have skills which would be useful in the rebuilding of the economy.  But they will have to feel they would be landing on solid and stable ground - both financially and politically. Otherwise, why go back?  In addition, it could be argued that a Zanu-PF dominated government would not want them back this side of an election. The vast majority of the returning diaspora would be unlikely to vote for Mr Mnangagwa and his party. In the longer term, Zimbabwe needs to have its own currency.  Using the US dollar was necessary after the old Zim dollar became worth less than the paper it was printed on and met its demise.  But there is so much more to creating a viable currency than switching on a printing press. Confidence is key.  Last year, the Reserve Bank introduced ""bond notes"" which were meant to alleviate the chronic shortage of US dollars in the system.  However, many thought this was an attempt to re-introduce the Zim dollar via the back door.  In fact, the notes have done nothing to address the cash shortage and some analysts say they might have actually made the situation worse, by pushing up the demand for US dollars even further.  Few people like using the bond notes, even though the amount in circulation is relatively low and the denominations are small.  Putting money into a bank was no longer considered the soundest of options, because the cash could only be withdrawn in small amounts and there was always the fear that the Reserve Bank would come for your hard-earned dollars.  So, the stock market soared, ironically becoming one of the best performing bourses in the world. Indeed, the rise in the stock market has only been curtailed by the army intervention and the resignation of Mr Mugabe."
Debt Market Sentiment,Rebooting the case for Scottish independence,2024-09-14,2018-05-25,By Douglas Fraser,https://www.bbc.com/news/uk-scotland-scotland-business-44252435,"Four years on from That Referendum on Scotland, and what's changed? Well, quite a lot, thanks to Brexit, three national elections, a new first minister, a new prime minister, the rise of Richard Leonard and Rees-Moggery, plus an oil and gas slump. But the polling figures on independence have barely shifted. ""Why?"" I was asked this week by a semi-detached Nationalist.  ""Because the arguments haven't moved,"" he answered himself. Neither side has reflected, in public at least, on where their arguments needed sharpening up, least of all on the economic questions. Until today - 25 May 2018. Remember the date. It just might turn out to be significant. The Sustainable Growth Commission will take some digesting. It's a weighty, meaty document. From what I've been told about its recommendations, it retains much of the sunny optimism that buoyed the Yes campaign in 2014, but to that has been added a big dollop of candour. As an economic prospectus for independence, it recognises that people were not sufficiently reassured in 2014, least of all about their pensions, savings and mortgages. They heard glib assurances back then that negotiations with Westminster would go swimmingly, because that would be in Westminster's interest. Downing Street would give Scotland what was asked for, including joint control of sterling. Transition costs were so low as to lack any serious costing. And a higher economic growth rate would flow from an enlightened administration taking all the right policy and fiscal decisions, without facing economic or political headwinds or any internal contradictions on lowered tax and higher spending. I recall one Yes supporter wryly comparing the sentiment of the movement back then to the Summer of Love in 1967. Everything good was possible, and all at once. Nothing bad need happen. It was groovy, man. Andrew Wilson is no hippie, though he draws deeply on the pipe of positivity and optimism. The commission he has led has applied candour to each of the weaker points in the 2014 economic prospectus, and conceded some ground to the critics of independence, in the interests of credibility. Take the currency for instance. The new plan does not seek shared control of the Bank of England.  It takes the word of the former governor, Lord (Mervyn) King, that Scotland could certainly be independent, and it could use sterling, but at one big cost: Holyrood would have to accept whatever monetary decisions are made in the City of London, and made in the interests of a London-dominated nation that no longer included Scotland. If Scotland's economy were out of sync with the cycle in the UK, that could be painful. That's how it was in the 1990s, and Alex Salmond railed against it. But in recent years, London has been the outlier, and Scotland has been at or near the UK average. So interest rate and financial policies set for the British middle ground, even without Scotland in Britain, might have suited Holyrood just fine. A central bank would be set up, without control over interest rates, and there would be a regulator, but with a light workload, as the banks would have shifted at least their brass plates south of the Border, to be regulated from London.  Any smaller financial institutions, still based in Scotland, would have low expectations of a bail-out - though since the crash, that's now the message to all lenders. Or take fiscal policy. The Wilson Commission gulps in full the harsh message from GERS - Government Expenditure and Revenue Scotland.  A deficit, including oil and gas revenue, at nearly 10% of national output, or Gross Domestic Product, is not sustainable, it is conceded. So what to do? A lot of work has gone into the answer. It is not simply to grow the economy faster, as the name of the commission suggested it should. The days of the tiger economies, at least in Europe, have gone.  The best hope for boosting growth in the short term - productivity being a longer-term project - is seen as a boost to immigration, with a ""Come to Scotland"" campaign, and financial incentives thrown in.  That's easy for an economist to say: less so for a politician (I intend to return to the question of growth once I've had a chance to digest the recommendations). A key element of the Wilson answer to the fiscal question is discipline on spending. This looks like, politically, the most difficult factor to manage, in an excited environment where expectations can run away from reality. The constraint would not be a real terms cut, but instead a very small increase, at 1% below the cash terms increase in economic growth. For example, suppose 2% inflation and 1.5% real growth, which is not an unreasonable target, meaning 3.5% cash growth. Pare that back to a disciplined 2.5% increase in public spending, and you could guess that would make for uncomfortable discussions round the Cabinet table.  The aim, remember, is to be doing this over the years when immense pressure is expected to build on health and social care budgets. The Wilson report adds to that a cut in defence, including the nuclear deterrent budget, to 1.6% of national economic output (To be clear: Trident money would not be spent on other priorities. It would be put into deficit reduction). Then review tax collection and get it to the same level of efficiency as the best of smallish nations. There's a call for a rigorous review of all spending, to ensure that the government doesn't keep spending on the priorities of 10 or 20 years ago, just because it's aye been, and because those programmes are too difficult to cut. And oil and gas? No, that is taken out the equation, to be treated as a windfall, and put into a future generations fund for long-term projects. All this assumes a taxing and spending regime which doesn't depart much from what we have at the moment. In the early years, it does not encourage people to think that Scotland would shift either to a high-tax, high welfare Scandinavian model or low tax and low regulation. Nor does it battle through the thicket of possibilities around Brexit, and where Scotland might find itself over the next few years.  For five to 10 years of such a fiscal plan, it is reckoned that an independent Scotland would be running a deficit and building up debt. Modelling with what they say are conservative assumptions, the deficit would fall to 3% in the ninth year.  That's the level widely seen, as in euro currency rules, to be a safe and stable level of deficit. Only then could the government start to look at the five other tests being set for creating a Scottish currency - a small package of tick boxes designed to reassure voters and the markets with a canny nod to caution. So while leaving monetary policy to the Bank of England, and requiring tight discipline on spending, the rhetoric of independence or even ""taking back control"" begins to lose its shine. Critics of independence might well question if it would be worth all the effort, and £450m in estimated transition costs, only to find that a change in constitutional status hasn't moved the dials much.  But that's one of the many lessons we're in the early stages of learning from the Brexit process. ""Taking Back Control"" in an open, modern economy is something of a mirage. Even a sovereign parliament is constrained by international agreements and market orthodoxies.  And even at Whitehall's scale and depth, the capacity of government to negotiate and and to manage upheaval is itself a major constraint.  In turn, that places tight limitations on what else it can be expected to achieve in managing or reforming public services. Unpicking economic unions, whether 45 years in the making in Europe or 311 years in Britain, is much more complicated than it might look at first. Bigger and established players in negotiations tend to have most leverage.  When it's done, independence has to be combined with some dependence and a lot of inter-dependence, requiring compromise. And as the Swiss sometimes observe about their relations with Brussels, the negotiations never stop. In that sense, though in few others, the Brexit negotiations may be doing the Scottish constitutional debate a favour. Looking at London and Brussels, Scots can see and smell the rubber hitting the road.   Voters may be more likely, therefore, to seek and reward candour, rather than jumping on the bandwagon painted in the brightest red and sporting the most populist slogan. That's among the big challenges thrown down by the Wilson Commission. The report gives the independence movement something big and meaty to chew on, and to debate internally, perhaps then to move the dials in its direction on the Yes and No polling.  It throws down the gauntlet to opponents of Scottish independence to reflect at least as seriously on the campaign they ran in 2014. They got the majority. But at least some must surely be wary of complacency. Would the same campaign and arguments work again, in the wake of Brexit, and against the Andrew Wilson prospectus? And the report is also a challenge to all of us who take some part in the debate about Scotland's future.  From what we know about it so far, the report of the Sustainable Growth Commission sounds like a serious document for serious times.  It is a more mature approach than we've seen for a long time, and surely demands a mature response."
Debt Market Sentiment,UK economy 'vulnerable' to borrowing shock,2024-09-14,2020-03-11,By Szu Ping Chan,https://www.bbc.com/news/business-51836555,"A surge in public spending risks exposing the UK economy to a shock rise in borrowing costs, according to the government's spending watchdog. Abandoning long-term goals to balance the books could have consequences, the Office for Budget Responsibility said. Higher annual borrowing and overall debt would leave Britain ""vulnerable"" to changing investor sentiment. The warning came as the chancellor unveiled the biggest Budget giveaway since 1992. Rishi Sunak's first budget included an extra £7bn to support workers and businesses affected by the coronavirus and at least £5bn to help the NHS cope with the outbreak. In total he outlined £30bn of extra spending this year. But higher spending over the long-term would be likely to lead to higher borrowing, which could prompt a rise in the cost of that borrowing. A year ago, the OBR predicted the UK economy would grow by 1.4% this year. Now it says it expects it to grow at just 1.1% this year, the slowest pace since the financial crisis. That does not take into account any hit from the virus, which will slow growth further and could add an additional £6bn to the deficit over the next two years, George Buckley, chief UK economist at Nomura estimates.   The extra £12bn to battle the coronavirus was not costed in this year's Budget, he points out. Public borrowing is already forecast to climb to a six-year high by 2022 without taking into account these additional spending measures. There has been no immediate impact on the cost of government borrowing. Yields on ten year government bonds rose only marginally after the Budget as investors took the near-term planned rise in borrowing in their stride Ranko Berich, head of market analysis at Monex Europe, said: ""Markets are not only willing to accept [higher] fiscal spending but are now actively cheering it."" However, the OBR said the government's decision to move away from trying to reduce Britain's debt in relation to the size of the economy, could store up problems for the future. The last government said it aimed to bring down public sector net debt, but it now is projected to remain steady at around 75% of GDP over the next five years. Robert Chote, the chairman of the OBR, said that while he did not see the government spending splurge as a ""gamble"", a sudden increase in inflation and interest rates would make ""the arithmetic a lot more uncomfortable."" Sir Charlie Bean, a member of the OBR's budget responsibility committee, added: ""Clearly the more debt you build up, the more exposed you are if things go wrong.  ""And there's a good general principle that you want to have the debt-to-GDP ratio declining in good times, to build up the space for responding precisely to the events like the coronavirus. ""If you only have the ambition to keep debt constant as a proportion of GDP, every time you get a bad shock, you just ratchet that up again."" Boris Johnson's government has moved away from an previous Tory ambition to eliminate borrowing this decade. In the Budget the chancellor launched a review of the government's current self-imposed spending rule, which requires it to balance the books, excluding investment spending, within three years. Public borrowing is forecast to be lower this financial year at £47.4bn than predicted last March, but after that the deficit is projected to rise sharply. The government is now set to borrow £54.8bn in the coming financial year to plug the gap between the money it spends on public services and the tax revenues it collects. This is much higher than the £40.2bn that was forecast. This will rise to £66.7bn in 2021-22. The spending in this Budget is being largely paid for with a big increase in government borrowing. The government expects to borrow almost £100bn more in this Parliament (before mid-2024) than was expected the last time we had any forecasts. And that figure does not include £12bn to be spent on getting the economy through the coronavirus outbreak. The Treasury documents say that money will be accounted for in the next Budget in the autumn. Mr Sunak said a weaker global backdrop would drag down UK growth. But the OBR said it expected the economy to rebound in 2021 with the help of the big spending boost. It said growth is forecast to rise to 1.8%, before moderating to 1.5% in 2022 and 1.3% the following year. Higher growth would make it easier to reduce debt as a proportion of the overall size of the economy and make the UK less vulnerable to a shock rise in borrowing costs. However, the growth forecasts were made before the extent of the coronavirus outbreak in the UK became clear. So they do not take into account the impact of the virus, the emergency government stimulus measures, or the cut in UK interest rates announced earlier on Wednesday. Mr Sunak said the coronavirus outbreak would have a ""significant impact"" on the economy, warning that a fifth of Britain's workforce could be off work at the same time during the peak of the outbreak. But he said the extra spending and investment would provide ""security today"" and ""prosperity tomorrow"". Mr Sunak unveiled a three-point plan to tackle the coronavirus, including: Mr Sunak said the government would do ""everything we can to keep this country and our people healthy and financially secure""."
