Keyword,Title,Scrapping Date,Article Date,Author,Link,Content
Debt Market Sentiment,Why this US jobs report matters and what to watch,2024-09-14,2024-09-05,Natalie Sherman,https://www.bbc.com/news/articles/clyne60ln20o,"If you care about where the US economy is headed, you might want to keep an eye on events on Friday. At 08:30 ET (13.30 BST), the US Labor Department will release the results of its monthly jobs surveys of employers and households. The report is one of the most important gauges of the state of the world's largest economy - and it is coming at a critical time. The US presidential campaign, in which voters have identified the economy as a top concern, is under way. And after several years focused on inflation worries, attention is starting to turn to the job market. Last month, the Labor Department reported the unemployment rate had hit 4.3% in July, up from 3.5% a year earlier, as jobs growth slowed. The news helped to fuel several days of stock market turmoil. If Friday's report shows further cracks forming in the job market that would be bad news for Democrats, undermining the story they have been telling of an economy that is healthy, if slowing, and returning to sustainable growth, after a post-pandemic boom.  How much we should worry is still up for debate.  Such an increase in unemployment often signals an economic recession - but forecasters say that prediction is less certain this time, noting factors like a surge in immigration that have complicated the picture.  Other data suggest the rise in unemployment rate has been driven by more people looking for work, rather than a sharp rise in job cuts.  Friday's report will help to flesh out that puzzle, offering a key piece of evidence as voters' impressions start to cement ahead of the November vote.  Republicans have been keen to point to any bad news – a stock market stumble, lower growth figures, slowing business investment and a dip in hiring – as evidence that a change of leadership in Washington is necessary. Part of what has kept Democrats on the defensive about the economy is the unusual mix of forces at play right now.  The US central bank raised borrowing costs sharply two years ago, responding to prices that were jumping at the fastest rate since the 1980s.  The Federal Reserve said the moves - which brought its key lending rate to a roughly two decade high of 5.3% - would help get inflation under control.  But the way they do that is by discouraging business expansions and other big spending and dampening the pressures pushing up prices.  Put more simply, the Fed is deliberately slowing the economy. That often doesn't end well.  Historically, a big jump in rates typically ends in a recession - and the stock market has been jittery over any signs that the economy is headed for a ""hard landing"". Donald Trump has fanned the fears, for months predicting an economic ""crash"" - especially if his opponent is elected. Polls suggest a majority of Americans have already spent much of the last few years believing the economy is in recession - a downbeat assessment at odds with the country's 2.5% growth last year. Many analysts blame the disconnect on inflation, as households balk at prices that have jumped nearly 20% over four years.  But the urgency of that issue has abated, as wages rise and inflation subsides, dropping to 2.9% in the most recent official reading - the slowest pace since March 2021. That has set the stage for the Fed to lower interest rates for the first time in four years, which could bring further financial relief, leading to lower borrowing costs for mortgages, car loans, credit cards and other forms of debt. Friday's job report will be key to confirming the timing and size of the cut - and if it is actually likely to end up boosting sentiment and helping Democrats, as expected.  For now, most analysts expect a cut of 0.25 percentage points, which would signal an ongoing, orderly slowdown.  If the figures fuel worries about the economy, however, a bigger cut might be in order - though a cut driven by a stuttering economy and Americans losing jobs would hardly prove a benefit to Democrats.  Conversely, booming jobs numbers might make the bank rethink whether the economy is still running too hot and a cut is necessary at all.  That has left the Harris campaign in a peculiar position - hoping for a good jobs report, but not a great one.  In a closely watched speech last month, Federal Reserve chairman Jerome Powell left his options for how big a cut might be on the table.  Friday's jobs report may start closing some doors. "
Debt Market Sentiment,"High mortgage rates pricing out buyers, says Nationwide",2024-09-14,2024-07-01,Nick Edser,https://www.bbc.com/news/articles/cp081z9vre4o,"High mortgage rates mean affordability is still ""stretched"" for many home buyers, according to the Nationwide. The building society said that while earnings had been rising faster than house prices in recent years, this had not been enough to offset the impact of more expensive mortgages. Its comments came as it said house price growth had been ""broadly stable"" in June, with prices up 0.2% from the previous month. The average house price is now £266,064, the lender said. Prices were up 1.5% from a year earlier, but Nationwide said activity in the housing market had been ""broadly flat"" over the past 12 months, with transactions down by about 15% compared with 2019. The lender said the market was still being affected by the increase in mortgage rates, which started climbing after the Bank of England began to raise its key interest rate in late 2021. Robert Gardner, Nationwide's chief economist, said that mortgage rates are ""still well above the record lows prevailing in 2021 in the wake of the pandemic"". ""For example, the interest rate on a five-year fixed rate mortgage for a borrower with a 25% deposit was 1.3% in late 2021, but in recent months this has been nearer to 4.7%. ""As a result, housing affordability is still stretched."" Nationwide's figures are based on the building society's own mortgage lending, which does not include buyers who purchase homes with cash, or buy-to-let deals. Cash buyers account for about a third of housing sales. The impact of higher borrowing costs can be seen in the fact that transactions involving a mortgage are down by nearly 25% over the past year, Nationwide said. Meanwhile the number of cash transactions for properties is about 5% higher than pre-pandemic levels. Across the UK, Northern Ireland saw the biggest price increases, up 4.1% from a year earlier. Wales and Scotland both saw a 1.4% annual rise. Prices in England climbed by 0.6%, with northern regions seeing bigger increases in general than the south. Despite some major lenders cutting their mortgage rates last week, home loan costs remain far higher than pre-pandemic levels. According to financial information service Moneyfacts, the average rate on a two-year fixed mortgage deal stands at 5.95%, while for a five-year deal the average is  5.53%. The focus is now on the Bank of England's Monetary Policy Committee (MPC), which sets interest rates, to see if it decides to cut at its next meeting on 1 August. June's MPC meeting saw a change in tone from policymakers, with suggestions that the Bank could vote for a rate cut next month. ""Buyers may find their mojo again when we get a rate cut from the Bank of England,"" said Sarah Coles, head of personal finance at Hargreaves Lansdown. ""This could come as early as August, although sticky services inflation and higher wages could mean we need to wait until the autumn. ""Either way, we’re not expecting massive overnight drops in mortgage rates, so the reaction is more likely to be a muted upturn in sentiment than an overwhelming wave of optimism."" Last week, the Bank said that about three million households are set to see their mortgage payments rise in the next two years. These are homeowners who arranged mortgage deals before the Bank started to lift rates in 2021. These deals are now expiring, and the Bank said the majority will finish before the end of 2026. For the typical household looking for a new deal, monthly mortgage repayments are forecast to increase by about £180, or about 28%, the Bank said. However, for around 400,000 households, monthly payments could jump by 50% or more. Bank of England figures released on Monday showed a small fall in the number of mortgages approved in May, down to 60,000 from 60,800 in April. However, the data also showed the amount borrowed through mortgages dropped sharply to £1.2bn in May, from £2.2bn the month before, although this does not include those remortgaging with the same lender. Read more here"
Debt Market Sentiment,Stratford market traders: 'It's good to be back',2024-09-14,2024-05-17,Barry Caffrey & James W Kelly,https://www.bbc.com/news/articles/cnkekl1nj23o,"Traders at an east London market saved from closure have expressed their relief at being able to reopen. Stratford's Market Village was forced to close in January after the company that ran the site went into administration. Newham Council has now agreed to take on a 15-year lease for the site thanks to a £700,000 grant from the mayor of London's Good Growth Fund. The market, which has about 60 traders, reopened last Friday. Caribbean takeaway owner Samantha Scott said she was ""grateful and thankful"" to be able to reopen. ""It's good to be back - it feels like we were taken away from our home,"" she said. As part of the agreement, the council will be able to operate the market itself or assign the lease to another market operator. The market has been serving customers out of Stratford Centre since 1974. Abdul Qadir, who has run a phone shop in the market for 24 years, said: ""The feeling is good.  ""I'm soon going to be out of debt, I can pay my staff and my livelihood is going to be good."" He added: ""We feel like [the closure] was a bad dream."" Angela Akbas, who has run the Centre Cafe for more than 20 years, said the market acts as a community hub for many people.  ""This would have been a big loss to the community,"" she said.  ""This market brings entrepreneurship, diversity, it's multicultural and caters for everybody's needs."" ""We get people that come in with no families and nobody to talk to. They come in and have a chat with me and it makes them feel good,"" she added. The sentiment is echoed by some of Ms Akbas's customers. Maureen told BBC London she was ""very glad"" the market had reopened and gave Ms Akbas ""a cuddle"" when the cafe returned to business. ""This shopping centre is vital because these are small independent businesses,"" adds Michelle, another market customer. ""They depend on locals to support them."" Listen to the best of BBC Radio London on Sounds and follow BBC London on Facebook, X and Instagram. Send your story ideas to hello.bbclondon@bbc.co.uk"
