Keyword,Title,Scrapping Date,Article Date,Author,Link,Content
investors sentiments,WeWork's Adam Neumann quits as chief executive,2024-09-15,2019-09-24,By Natalie Sherman,https://www.bbc.com/news/business-49803064,"WeWork's Adam Neumann has agreed to step down as chief executive of the trendy office rental firm saying it's in the ""best interests"" of the company. The decision is effective immediately, the firm said. He will remain with the company as non-executive chairman.  Scrutiny of his leadership had ""become a significant distraction,"" it said.  The move comes after WeWork's plans for a stock market listing ran into trouble, with investors raising concerns about losses and governance. ""While our business has never been stronger, in recent weeks, the scrutiny directed toward me has become a significant distraction, and I have decided that it is in the best interest of the company to step down as chief executive,"" Mr Neumann said in a statement.  WeWork's board of directors said it had named WeWork's Artie Minson, formerly co-president and chief financial officer, and Sebastian Gunningham, formerly vice chairman, co-chief executives of the company. Mr Neumann built WeWork in his own image, creating a buzzy, multi-billion dollar company known for its co-working spaces, free-flowing alcohol and a stated mission to ""elevate the world's consciousness"". Since 2010, the firm has expanded from a single office in New York City to more than 500 locations in 29 countries. Japanese investment giant Softbank valued the company at $47bn (£37bn) in its most recent investment round. But Mr Neumann's brash charisma, which once attracted investors, emerged as a liability as WeWork decided to sell its shares on the public market. Reports suggest the firm's expected valuation had sunk to between $10bn and $12bn. Reports surfaced detailing erratic decision making and the ways his hard-partying habits had infused corporate culture. Perhaps most alarming to potential investors were the ways Mr Neumann had blurred the lines between his own personal finances and WeWork. For example, over the years, the company had been a tenant in some properties that he owned; and Mr Neumann, who had voting control of the company, had also secured personal loans using company stock as collateral. ""I think many investors are uncomfortable with Neumann's relationship with the company,"" Sam Reynolds, a technology analyst, told the BBC. Mr Neumann agreed to modify some of those arrangements as it became clear that he was losing support from major backers, such as Softbank.  For example, he returned the $5.9m in stock he received for selling WeWork the trademark ""We"" and agreed to give WeWork any profit from properties he owns that the company leases.  His wife Rebekah, a WeWork co-founder who had been given the power to identify a successor, also had her role reduced. Mr Neumann has reportedly also agreed to significantly reduce his voting powers. But even that move and his role change may not assuage concerns about the company, which lost nearly $2bn last year.  Market sentiment has turned, after shares in other high-profile, loss-making start-ups such as ride-hailing apps Uber and Lyft, have crashed following flotation. And critics have long complained that WeWork's financials don't make sense, pointing to the firm's losses and the much lower valuations of similar companies such as rival IWG, which used to be known as Regus. WeWork ""is a property company trying to sprinkle tech company fairy dust over itself,"" said Richard Kramer, founder of Arete Research. ""That won't work with investors.""  The company was relying on its stock market launch to unlock new loans, which means its delay could spell trouble. Mr Reynolds said he expected the company to remain privately held for the foreseeable future. ""I think the IPO will be delayed indefinitely,"" he said. ""WeWork certainly has a future, but not as a public company."" Born in Israel, Mr Neumann served in the Israeli Navy before moving to New York to ""get a great job, have tons of fun and make a lot of money"", as he put it in a 2017 TechCrunch interview.  He enrolled at Baruch College at the City University of New York in 2002, but dropped out just shy of graduation to go into business.  One of his early ventures was a baby clothing company that evolved into the luxury Egg Baby brand. Later, he and business partner Miguel McKelvey, an architect, renovated an office space and sublet the property. They sold the business but the idea grew into WeWork. Read more: A profile of Adam Neumann"
investors sentiments,Soaring shares: A good or bad sign?,2024-09-15,2017-08-02,By Natalie Sherman,https://www.bbc.com/news/business-40744544,"For weeks now, US stock markets have been hitting records, a rise claimed by President Donald Trump as proof of a healthy economy.  But Mr Trump's pride in the numbers is at odds with analysts and investors, who have expressed increasing discomfort over the market's climb. About 65% of investment managers surveyed by Northern Trust last quarter said they believed shares were over-valued, the highest ever in the firm's report.  Surveys by Bank of America Merrill Lynch have expressed alarm about the high prices, as have policymakers at the Federal Reserve. ""We are concerned about equity valuations right now,"" says Mike Morrill, chief operating officer at DF Dent, a Baltimore-based investment company. ""We've had nine years of a strong bull market and that's not going to last forever."" The sentiment is similar to statements Mr Trump himself made before his election, when he said the stock market was ""so bloated"" and warned people to ""be careful"". If investors believe prices are too high - and are buying anyway - that could be a sign of a bubble.  So is the stock market rally a reason to cheer, as Mr Trump suggests now? Or could a crash be around the corner? Stocks, which have been on a long-term upward trend, surged early in 2017, amid optimism over business-friendly policies endorsed by the Trump administration, such as tax reform.  Analysts say that without clear signs of progress on reform in Washington that effect has faded.  Now, it's strong corporate revenue and profit growth that are boosting share prices, with gains going to larger, multinational companies. The three major measures - the S&P 500, the Dow Jones Industrial Average and the Nasdaq - have climbed between roughly 10% and 17% so far this year, compared with about 6% to 7% during the same period last year. The Nasdaq has hit a new high more than 40 times this year. Since 2012, the value of the S&P 500 index has almost doubled. ""The stock market hit the highest level it's ever been,"" Mr Trump boasted on Wednesday as the Dow Jones Industrial Average exceeded 22,000 points on Wednesday morning.  ""Our country is doing very well,"" he said. But that hasn't stopped the muttering that the stock market, at least, is due for a correction.  Robert Shiller, a Nobel Prize-winning economist at Yale University, says share gains reflect optimism about where the economy is heading, but it's an unreliable forecasting tool, and shifts quickly. ""The stock market is mostly psychology,"" he says. ""The fluctuations in it mean that we're in an optimistic mood but we could change and we could change suddenly."" Investors are trying to anticipate what might trigger a change - whether it be rising interest rates, weak consumer spending, developments overseas or something else entirely.  Mr Shiller says he thinks Mr Trump himself poses one of the biggest risks.   The firestorm in Washington in May after Mr Trump fired former FBI director James Comey prompted some of the biggest one-day share sell-offs this year.  ""Usually, presidents are not able to transform the economy unless he does something disastrous, which transforms it down,"" says Mr Shiller. ""I'm thinking that it's more likely he will create some kind of uncertainty, disruption and that might be a trigger for decline."" Many of the biggest gains come from a single sector - technology stocks - the same industry that some investors say is overvalued. The S&P 500 information technology index, which averages 68 companies, including heavyweights such as Apple, Microsoft and Facebook, last month passed the record set in March 2000.  The index rose about 22% in the first seven months of 2017, while the broader S&P 500 climbed about 10%.  Some say the gains in tech make sense, as investors target a part of the economy seeing rapid growth.  However, others worry that in some cases the rise in shares has little to do with the companies' actual prospects.  And in more recent weeks, tech stocks have come under pressure. If the sell-off spreads to other sectors, it could be a warning of bigger problems.  Jill Hall, a US equity strategist at Bank of America Merrill Lynch, doesn't expect stock markets in general to rise much more this year, but she's not predicting a big sell-off either.  She thinks investors will shift their money from the high-growth tech industry into sectors such as energy, health care and finance. ""What we're expecting is more of a rotation out of growth and into value,"" she says. Some say they're worried Federal Reserve and central bankers elsewhere will move too aggressively to increase interest rates, causing havoc in bond and stock markets. About 27% of investors surveyed by Bank of America Merrill Lynch last month identified a mistake by central bankers in the US and Europe as the biggest risk to their outlooks. Another 28% were worried about bonds. Mr Trump himself raised alarms on these lines at a presidential debate last year.  ""We are in a big, fat, ugly bubble,"" he said. ""The only thing that looks good is the stock market. But if you raise interest rates even a little bit, that's going to come crashing down."" That's something that is not lost on the central bankers responsible for monetary policy. Last month Federal Reserve chair Janet Yellen told a US congressional committee: ""We want to make sure that we manage this in a way that is not disruptive to financial markets.""  And that's a sentiment financial markets would no doubt endorse. "
investors sentiments,Shares hit by US-North Korea tensions,2024-09-15,2017-08-11,BBC News,https://www.bbc.com/news/business-40902805,"The UK's stock market ended the week down 1.1% as worries over the situation between the US and North Korea continue to rattle investors. On Friday, Donald Trump said the US military was ""locked and loaded"" to deal with North Korea, By the close of trading, the FTSE 100 was down 84.46 points, or 1.1%, to 7,305.48, having dropped 1.4% on Thursday. US markets held steady in trade on Friday, with the Dow Jones up 0.2%. On the London stock market, mining shares saw the biggest falls as many metal prices were hit by the geopolitical concerns. Shares in Glencore, Rio Tinto and Anglo American were all down by between 2.8% and 3.1%.  Housebuilders Persimmon and Barratt Developments were among the biggest gainers of the day, up 1.58% and 1.02% respectively. ""The FTSE has carried on where it left off on Thursday, with yet another day of risk-off sentiment seeing investors shift out of equities,"" said Joshua Mahony, market analyst at IG. ""The UK headline index has crashed to the lowest level since late June, in a week which has turned from mundane to insane. ""For a week that has been largely devoid of major economic releases, Donald Trump's confrontational stance with North Korea has raised volatility across the board."" Gold - generally regarded as a safer asset in times of uncertainty - hit its highest price for more than two months on Friday, touching $1,288.97 an ounce at one point. On the currency markets, the pound was up 0.03% against the dollar at $1.2981 but down 0.23% against the euro at 1.0999 euros."
investors sentiments,Shares hit by US-North Korea tensions,2024-09-15,2017-08-11,BBC News,https://www.bbc.com/news/business-40897398,"The UK's stock market has fallen 1% as worries over the situation between the US and North Korea continue to rattle investors. On Friday, Donald Trump said the US military was ""locked and loaded"" to deal with North Korea, By mid afternoon, the FTSE 100 was down 71.50 points, or 1%, to 7,318.44, having dropped 1.4% on Thursday. Other markets in Europe also fell, with Germany's Dax index down 0.1% and France's Cac 40 dropping 1.1%. US markets held steady in early trade on Friday, with the Dow Jones edging up 0.1%. On the London stock market, mining shares saw the biggest falls as many metal prices were hit by the geopolitical concerns. Shares in Glencore, Rio Tinto and Anglo American were all down by more than 3%.  ""The FTSE has carried on where it left off on Thursday, with yet another day of risk-off sentiment seeing investors shift out of equities,"" said Joshua Mahony, market analyst at IG. ""The UK headline index has crashed to the lowest level since late June, in a week which has turned from mundane to insane. ""For a week that has been largely devoid of major economic releases, Donald Trump's confrontational stance with North Korea has raised volatility across the board."" Gold - generally regarded as a safer asset in times of uncertainty - hit its highest price for more than two months on Friday, touching $1,288.97 an ounce at one point. On the currency markets, the pound was unchanged against the dollar at $1.2972 and down 0.3% against the euro at 1.0992 euros."
investors sentiments,"Bitcoin back above $50,000 as recovery continues",2024-09-15,2021-08-23,BBC News,https://www.bbc.com/news/business-58309024,"The price of Bitcoin has risen above $50,000 (£36,480) for the first time in three months as the cryptocurrency continues to recover from a deep slump.  The coin fell sharply in May after a crackdown in China and a decision by Elon Musk's Tesla not to accept it as payment any more.  But investor sentiment is improving as more mainstream financial companies begin using the digital currency. Bitcoin is now up 81% since January, when it was trading at just $27,700. On Monday, it climbed almost 3% to $50,266.90 while Ether, another popular digital coin, was up more than 4% at $3,367.51.  It came as PayPal said it would allow customers in the UK to buy, sell and hold Bitcoin and other digital currencies as it expands its crypto services outside of the US for the first time. With over 403 million active accounts globally, the US firm is one of the largest mainstream financial companies to offer users access to cryptocurrencies.  ""This appears to be yet another example of a global company legitimising the use of crypto as it becomes more mainstream,"" said Michael Hewson at CMC Markets.   Continued support from the US Federal Reserve for the US economy has also bolstered Bitcoin recently, analysts say. It is holding interest rates at record lows and making riskier assets more attractive to investors.  Neil Wison of Markets.com said Bitcoin's rebound ""shows no signs of cooling"", although he said he expected to see some ""pullback"" in the short term.  But Dan Ives from Wedbush Securities said Bitcoin remained ""a highly volatile digital currency"", despite growing investor optimism. "
investors sentiments,Tesla profit surge driven by record car deliveries,2024-09-15,2021-07-26,BBC News,https://www.bbc.com/news/business-57935264,"Tesla has reported surging profits, despite shortages of semiconductor chips and congestion at ports hampering production. Sales rose to $12bn (£8.6bn) in the three months to the end of June, up from $6bn a year ago, when its US factory was shut down. The electric carmaker said it delivered a record 200,000 cars to customers in the same period. It added that public support for greener cars was greater than ever. The company, led by billionaire entrepreneur Elon Musk, reported on Monday that profits soared off the back of strong sales. Profits for the second three months of the year were $1.1bn, up from $104m last year, bolstered by sales of its cheaper Model 3 sedan and Model Y. In an update to investors on Monday, Tesla said: ""Public sentiment and support for electric vehicles seems to be at a never-before-seen inflection point.  ""We continue to work hard to drive down costs and increase our rate of production to make electric vehicles accessible to as many people as possible."" Tesla added that how quickly it could produce cars throughout the rest of the year would depend on the supply of key parts of its vehicles, with demand at ""record levels"". On a call with financial analysts on Monday, Mr Musk said: ""At this point, I think everyone can agree, electric vehicles are the only way forward."" Mr Musk said during the call that the global chip shortage ""remains quite serious"" and manufacturing would hinge on this ""slowest part of the supply chain"". He also described late-night calls with suppliers in an attempt to resolve shortages. As a result, there were growing waiting times for Tesla cars, especially across Europe, the company said in its results. It will look to start production at its new Berlin ""gigafactory"" as soon as possible. It has been plagued by delays, although the company bills it as ""the most advanced high-volume electric vehicle production plant in the world"". It will ramp up the manufacturing of its cars at its California hub in the meantime. Mr Musk was also reportedly seen visiting Luton earlier this year, sparking rumours he may be considering a Tesla factory in the UK. Other car giants such as Ford and General Motors have been forced to suspend production temporarily in some US factories, having been hit by the global shortage of semiconductors. Profits at Tesla in the second quarter were also dented, however, by other items such as investments in the cryptocurrency Bitcoin. It invested heavily in the digital currency previously. But it stopped taking Bitcoin as a form of payment earlier this year because of Mr Musk's concerns about the environmental impact of Bitcoin mining, which uses huge amounts of electricity. The company reported a $23m loss on its Bitcoin investments on Monday, although its chief executive recently signalled it might accept it again in future. Wedbush analyst Dan Ives said that this figure was, however, ""much lower than many had feared"". He added that overall, the set of results marked a ""step in the right direction"" for the company, with ""healthy"" growth also seen in China, where Tesla began manufacturing last year. Mr Ives did point out, however, that a big question for investors would be when the company would be able to hit profitability excluding the income it gets from reselling to other carmakers the credits that it earns for exceeding emissions and fuel standards. Between April and the end of June, it saw $354m in revenues generated through the sale of such credits, down from $428m the same period a year before."
investors sentiments,Bitcoin slump sees trades suspended,2024-09-15,2017-12-22,BBC News,https://www.bbc.com/news/business-42457983,"Bitcoin plunged on Friday, extending a fall that saw the crypto-currency lose almost a third of its value from a record of nearly $20,000 (£15,000). The crypto-currency's price dipped below $11,000 on Friday, according to the Coindesk exchange website, before recovering to above $13,000. Amid the swings, three Bitcoin-related exchanges suspended certain trades. Bitcoin has had a blistering trip over the past 12 months. Its price at the start of the year was about $1,000.  It has skyrocketed since - more than doubling in value since November -  drawing interest from major firms as well as private investors. But since Sunday Bitcoin has been on a losing streak, falling back to where it was at the start of December. Analysts said investors should be prepared for such rapid changes, which have characterised the asset from its start.  ""This is exactly how this asset trades and has done since the beginning,"" said Nick Colas, co-founder of New York-based DataTrek Research. ""It has a lot of volatility and it will for the foreseeable future."" This week's plunge led to a flood of trades that swamped one of Bitcoin's major exchanges, Coinbase, on Friday. A technical slowdown prompted the firm to halt buying and selling twice. The CME and CBOE exchanges in the US also temporarily suspended trading of certain Bitcoin futures contracts, which allow investors to bet on where they expect the price of Bitcoin to be at certain points in the future.  The exchanges have automatic brakes that apply once a commodity or asset has moved by a certain amount - as happened in this case. The market remains driven by sentiment, according to Charles Hayter, founder and chief executive of industry website Cryptocompare. ""A manic upward swing led by the herd will be followed by a downturn as the emotional sentiment changes,"" he said. Some traders would have been cashing in on the spectacular gains made over the year, he added. Concerns about the infrastructure behind crypto-assets may also be spooking investors, said Nick Colas, himself a Bitcoin trader. In recent weeks, markets have been rattled by hacks and allegations of insider trading. He attributes some of this week's slump to the launch of a new crypto-asset that came earlier than planned. The surprise temporary shutdown of Coinbase on Friday was the kind of thing that could erode investor confidence, he argued. ""It is not OK to just take trading offline randomly through the day,"" he said. ""The robustness of that system is just as important to their confidence... as the price of crypto-currencies themselves."" A spokesman for Coinbase said the firm was working around the clock to ensure smooth trading. Friday's suspensions lasted for about two hours in total. ""We're doing everything within our power,"" the spokesman said.  A digital asset, Bitcoin is not backed by any governments. It is created through a complex process known as ""mining"", and then monitored by a network of computers across the world. There is a steady stream of about 3,600 new Bitcoins a day, with more than 16.5 million now in circulation. Supply is expected to peak at about 21 million.  Every single transaction is recorded in a public list called the blockchain. This makes it possible to trace the history of Bitcoins to stop people from spending coins they do not own, making copies or undoing transactions. Regulators around the world have stepped up their warnings about its provenance as an investment.  One of this week's most striking comments came from Denmark's central bank governor, who called it a ""deadly"" gamble. Earlier this month, the head of one of the UK's leading financial regulators warned people to be ready to ""lose all their money"" if they invested in Bitcoin. Andrew Bailey, head of the Financial Conduct Authority, told the BBC that neither central banks nor the government stood behind the ""currency"" and therefore it was not a secure investment. Despite the risk to individuals, US authorities have said they do not think it is a big enough part of financial markets to be a threat to broader economic stability."
