Keyword,Title,Scrapping Date,Article Date,Author,Link,Content
Government Securities Yield,Can Fed chief dig himself out of a (Jackson) Hole?,2024-09-14,2019-08-22,By Russell Hotten,https://www.bbc.com/news/business-49415776,"Jerome Powell may be ""clueless"" according to US President Donald Trump. But when the Federal Reserve head takes centre stage at a gathering of the banking elite this weekend there'll be plenty of people watching for his clues on restoring global economic balance. It's the annual symposium of central bankers from around the world, held in the picturesque Wyoming mountain village of Jackson Hole. Mr Powell's keynote speech is the much-anticipated highlight. According to Sarah House, senior economist at Wells Fargo Securities: ""The whole point [of Jackson Hole] is to get away, take a step back from what we are currently seeing in the economy, and talk about some of the longer term issues."" But will Mr Powell have that luxury? Such is the anxiety gripping financial markets, there's an expectation he needs to address immediate issues: interest rate direction, conflicting signals on Wall Street, the China trade row, stimulus, perhaps even Mr Trump's constant sniping. Mr Powell faces a balancing act: Calm jittery financial markets without antagonising further a hostile president who only this week called him a ""golfer who can't putt"". Many think it's a no-win situation. For Ms House, it's not even as if the US economy is in particularly bad shape. She told the BBC that Mr Trump perhaps has a point when he insists in his Twitter outpourings that the economy is in rude health.  She said: ""The consumer sector is very strong right now. The labour market is hot - we've got close to the lowest unemployment rate in about 50 years… Savings rates are quite high."" Should the economy turn sour, ""there's a lot of cushion to fall back on"". It's in China and Europe, specifically Germany, where many of the big economic problems lay, she said. And yet, there are fears the US economy, which has expanded each year for more than a decade, is at risk of stalling - perhaps even tipping into recession. Such is Wall Street's unease that share markets plunged 3% one day last week, only to recover almost as quickly. But it is in the bond markets - basically, the area that deals with loans to governments and companies - where recession signals have been flashing brightest.  This month it became more expensive for the US government to borrow money over two years than 10. Usually, investors want a higher rate of return for locking up money for 10 years - compensation for unforeseeable risks. When the reverse is the case - a so-called bond yield inversion - it suggests investors think the short-term economic picture is gloomy. What's more, an inversion has proved a reliable (though by no means conclusive) indicator that recession is on its way. The president has dismissed recession warnings. Yet on Tuesday, he touted tax cuts to boost the economy - only to dismiss the idea on Wednesday. Many asked, if Mr Trump thinks the economy is in good health, why contemplate a tax stimulus? There is, then, a mass of conflicting signals that analysts would like Mr Powell to cut through and clear up.  As Russ Mould, investment director at AJ Bell points out, when the jobs and consumer markets are healthy, you would normally expect pressure for interest rate rises, not cuts. It's ""just a little odd"", he told the BBC.  Minutes released this week from the last Fed meeting, in July, underlined the confusion. Rates were cut 25 basis points, but the minutes show some policymakers wanted to go further, while others were against a cut. At the very least, the Jackson Hole elite should ""send a signal to markets that they are attuned to the risks and at least doing what they can"", Mr Mould said. A big problem for the Fed chief, however, is that Mr Trump has painted him as an economic threat, and few people have come to the central banker's support. Populists side with the president, while Democrats and progressives think the Fed is just out to protect Wall Street and don't want to be seen as defenders. Karen Petrou, managing partner of Federal Financial Analytics, says Mr Trump has set up Mr Powell for blame if, or when, things go wrong. For all the president's contradictions, he's a master of political reality, she says. ""Mr Trump doesn't care what rates are. He cares about who voters think is to blame for slower growth and market turmoil, and he is determined to be sure it isn't him,"" she said. ""What's an astute politician to do? Find a fall guy distrusted by Republicans, Democrats, independents, populists, and progressives."" Some experts think it's time Mr Powell gave a more forceful response to pressure coming from the White House. Central bankers have emerged from the shadows since the global financial crisis, to be seen as economic saviours with a more powerful public voice. Joseph Song, senior economist at Bank of America, thinks Mr Powell and other Fed policymakers will at the very least defend the Fed's independence. ""They are going to try to hammer home that message again and again, and make sure that they preserve their independence,"" he told the BBC. But the Fed's task is pretty straightforward (if difficult): keep the labour market strong without causing inflation. It means the central bank alone cannot deliver what Mr Trump ultimately wants - sustained economic growth and financial stability - and Mr Powell should perhaps stand up and say so, says Mohamed El-Erian, former head of bond trading giant Pimco. But, as Mr El-Erian wrote this week in an article for Bloomberg, any push back against the president ""risks fuelling immediate market instability and aggravating White House anger"". Perhaps it would be better to say nothing at all, he ponders. ""No wonder a growing number of observers wonder whether central banks should revisit the mantra that more communication and policy transparency are always better - a traditional wisdom that led Powell to increase the frequency of press conferences,"" he said. But after all the expectation, if the Fed chief does opt for diplomacy and prudence, it could end up making Jackson Hole something an anti-climax."
Government Securities Yield,Debt fears over India borrowing move,2024-09-14,2019-07-17,By Vivek Kaul,https://www.bbc.com/news/world-asia-india-48960315,"While presenting her maiden annual budget on 5 July, India's first full-time female finance minister, Nirmala Sitharaman, indicated that her government was planning to borrow more money from abroad. The reason, she said, was that the ratio of India's sovereign external debt to gross domestic product (GDP) is among the lowest in the world - less than 5%. Like most countries, India runs a fiscal deficit, which means that it spends more than it earns, and has to borrow money to make up for the difference.  In 2019-20, the government is expected to run a fiscal deficit of about $103bn (£82bn), or about 3.3% of GDP.  Typically, the government would have borrowed domestically. The problem is that the federal government is not the only one borrowing money.  India's state governments also run their own fiscal deficits and need to borrow money in order to make up for the difference. Then there are state-owned companies which also borrow heavily. Meanwhile, the household savings - bank deposits, insurance funds, mutual funds, currency - which finance these borrowings have been declining over the years.  This has led to a situation where interest rates remain high, despite inflation coming down and the central bank cutting its repo rate three times this year. (The repo rate is the interest rate at which the central bank lends to commercial banks). All the borrowing by the government and its companies - which amounts to 8.5% of GDP - has meant there is less money for private companies to borrow.  Finance Secretary Subhash Chandra Garg has indicated the central government will borrow $10bn from overseas during this financial year. The theory is that by borrowing abroad, the government won't be putting pressure on Indian savings, like it has in recent years.   And there will be less crowding out of private companies looking to borrow and, in the process, slightly lower interest rates.  This is important because private investment in India has been down in the dumps for the last few years.  The major reason is that many private companies went on a borrowing binge between 2004 and 2011, and have since found it difficult to repay the loans, primarily to India's state-owned banks. Banks, in turn, don't want to lend to companies. Many economists and bureaucrats believe that high interest rates are also holding private investment back.  But the government can borrow money and lower interest rates another way too.  It just needs to expand the limits it has set on foreign investors investing in India's debt market - government or corporate bonds, for example.  Allowing more foreign money here will mean less pressure on India's domestic savings. That will lead to lower interest rates, without having to borrow money from abroad.   And instead of repaying the loan in dollars or any other foreign currency, the government will have to repay the loan in rupees, which as we shall see, makes immense sense. Currency risk Borrowing in dollars is expected to be cheaper, and hence, bring down the interest that the government pays on its debt.  But this comes with a corollary.  Assuming the borrowing is in US dollars, the rupee is likely to depreciate against the dollar in the long-term given that India's inflation is significantly higher than that of the US. Then the lower interest rate cost will be more than made up for by the government needing more rupees to buy dollars to repay the loan as well as pay interest on it. So, not everyone is happy with the decision of the government to borrow abroad.  There are also other negatives that come attached with any country borrowing abroad. First and foremost, it will lead to the rupee appreciating against the dollar, at least in the short-run.  When the bonds are sold and the dollars (or any other foreign currency for that matter) are brought back to India, they will have to be converted into rupees.  This will push up the demand for rupees and eventually lead to the rupee appreciating in value against the dollar. In the short-term, an appreciating rupee will hurt India's exports, which are struggling already.  It will also make imports cheaper and hurt domestic producers competing against them.  In the recent past, India has gone back to a policy of protectionism. Hence, there is a lack of policy consistency here as far as the government is concerned.  And some economists are also worried about the currency risk that accompanies any foreign borrowing. When a government borrows in the domestic currency - like the Indian government borrowing in rupees - it always has the option of printing currency and repaying the debt - or what economists call inflating the debt away.  That option doesn't exist when the borrowing is not in the domestic currency. India's central bank cannot create dollars out of thin air. It can only print rupees.  As former finance minister Arun Jaitley wrote in an official paper on government debt last year, ""Public debt is predominantly of domestic origin and denominated in domestic currency, insulating the debt portfolio from currency risk."" In fact, many countries have faced financial crises in the past because of their inability to repay money borrowed in a foreign currency. Latin American countries like Argentina, Brazil and Mexico are a good example; and something similar also played out in Indonesia and Thailand in the late 1990s.  This possibility has some economists worried.  But currency risk becomes a worry only when the foreign borrowings of the government reach a certain size.  Foreign borrowing of $10bn shouldn't lead to any worries on the currency risk front, especially since India's foreign exchange reserves, as of June 2019, stood at $428bn. Having said that, the government shouldn't get used to the idea of borrowing from abroad.  History shows that it's easy for governments to get addicted to foreign debt, which seems cheaper in the short-term. Given that we live in an era of easy money, if the Indian government wants to borrow, money will be easily available to it. This could cause a few problems.  One, it will increase the currency risk.  And two, given the fact that Indian economic statistics have been questioned in the recent past, any international crisis can have a disproportionate impact on India, even if the international borrowings are not huge. Vivek Kaul is an economist and the author of the Easy Money trilogy"
Government Securities Yield,Zoom sees sales boom amid pandemic,2024-09-14,2020-06-02,By Natalie Sherman,https://www.bbc.com/news/business-52884782,"When it comes to its growth rate, video conference company Zoom has lived up to its name. Use of the firm's software jumped 30-fold in April, as the coronavirus pandemic forced millions to work, learn and socialise remotely. At its peak, the firm counted more than 300 million daily participants in virtual meetings, while paying customers have more than tripled. The dramatic uptake has the potential to change the firm's path. Zoom said it expects sales as high as $1.8bn (£1.4bn) this year - roughly double what it forecast in March. ""It's a huge opportunity,"" chief executive Eric Yuan told investors on Tuesday. Mr Yuan didn't intend to create Zoom for the masses. A Chinese-born software engineer, Mr Yuan started the company in 2011, after years rising through the ranks at WebEx, one of the first US video conference companies, which was purchased by Cisco in 2007 for $3.2bn. At the time, he faced doubts from many investors, who did not see the need for another option in a market already dominated by big players such as Microsoft and Cisco. But Mr Yuan - who has credited his interest in video conferencing to the long distances he had to travel to meet up with his now-wife in their youth - was frustrated at Cisco and believed there was demand in the business world for software that would work on mobile phones and be easier to use. When the firm sold its first shares to the public last year, it was valued at $15.9bn. That shot to more than $58bn on Tuesday. ""What Zoom has done is kind of democratised video conferencing for all kinds of businesses and made it very simple for everyone from yoga instructors through to board room executives to deploy video,"" says Alex Smith, senior director at Canalys. When the lockdowns started, Zoom lifted the limits for the free version of its software in China and for educators in many countries, including the UK, helping to drive its popularity. But the firm's bread and butter customers are corporate clients, who pay for subscriptions and enhanced features. Zoom said on Tuesday that sales jumped 169% year-on-year in the three months to 30 April to $328.2m, as it added more than 180,000 customers with more than 10 employees since January - far more than it had expected. It also turned a profit of $27m in the quarter - more than it made in all of the prior financial year. The massive uptake has also strained the firm, forcing it to invest to expand capacity to meet the needs of new users, many of whom are not paying customers. Its reputation also took a hit, as the new attention prompted hackers to hijack meetings and exposed a host of security flaws, revealing that the firm had sent user data to Facebook, had wrongly claimed the app had end-to-end encryption, and was allowing meeting hosts to track attendees. It has also faced political scrutiny for its ties to China - where it has more than 700 staff, including most of its product development team - which have prompted warnings that it is not fit for government use.  In April, Mr Yuan, who is a US citizen, apologised for the security lapses and the firm started rolling out a number of changes intended to fix the problems. Zoom has also announced a number of new appointments familiar with Washington politics, including H R McMaster, a retired Army general and former national security adviser to Donald Trump.  ""Navigating this process has been a humbling learning experience,"" Mr Yuan said on an investor call on Tuesday. Analysts said they expected the company would overcome these reputational blows. ""It's had that mishap and the fact that its name is still very much used as verbatim with video technology still gives it a lot of momentum and opportunity to continue,"" Mr Smith said. Analysts say they expect Zoom to maintain its focus on business customers, since that's how it makes money. But the pandemic is likely to create more challenges for Zoom in that market, as increased demand for remote work prompts competitors such as Microsoft and Cisco to pour resources into the field. ""The stakes are higher and the competition's getting tougher, so we'll see,"" says Ryan Koontz, managing director at Rosenblatt Securities. ""They were on a very strong trajectory before... and happened to be in the right place at the right time as the whole world decided we needed to communicate well on video,"" he says. ""They have this amazing brand... now they have to leverage that brand and figure out which markets they're going to go after."""
Government Securities Yield,Nvidia must halt China AI chip sales 'immediately',2024-09-14,2023-10-25,By Peter Hoskins,https://www.bbc.com/news/business-67213134,"Tech giant Nvidia says the US has told it to stop shipping some of its advanced artificial intelligence chips to China immediately.  The restrictions were supposed to be introduced 30 days from 17 October. That was when President Joe Biden's administration announced measures to block countries, including China, Iran and Russia, from buying high-end AI chips designed by Nvidia and others. Nvidia did not say why the timeline had been moved forward. In a statement to the US Securities and Exchange Commission (SEC), Nvidia said the US government said these curbs were ""effective immediately"", but added that ""given the strength of demand for the Company's products worldwide, the Company does not anticipate that the accelerated timing of the licensing requirements will have a near-term meaningful impact on its financial results"".  The new restrictions bar exports of Nvidia's advanced AI chips, which had been designed for the Chinese market to comply with earlier export regulations. The acceleration of the introduction of the US curbs is the latest move in the ongoing technology dispute between Washington and Beijing. Chinese authorities have yet to publicly comment on Nvidia's announcement, but it hit back at the Biden administration's decision to impose new restrictions on advanced chip exports when it was announced last week. The country's foreign ministry said the curbs ""violate the principles of the market economy and fair competition"". The move was seen as an attempt to close loopholes that became apparent after an initial wave of chip controls last October. At the time, the US said the measures were designed to prevent China from receiving cutting-edge technologies that it could use to strengthen its military, especially in the field of AI. Soaring demand for Nvidia's AI chips has pushed up its share price more than threefold, making it one of the most valuable companies in the world. In May the firm joined technology giants Apple, Amazon, Alphabet and Microsoft in the elite club of companies with stock market valuations of more than $1 trillion (£822bn). California-based Nvidia has come to dominate the market for chips used in AI systems. Chip giant Advanced Micro Devices (AMD), which also supplies AI chips to China, has not made any announcement about the accelerated export curbs. It did not immediately respond to a BBC request for comment. The US Department of Commerce declined to comment on Nvidia's statement when contacted by the BBC."
