Keyword,Title,Scrapping Date,Article Date,Author,Link,Content
investors sentiments,SA rift over finance minister sacking,2024-09-15,2017-03-30,BBC News,https://www.bbc.com/news/world-africa-39451040,"This video can not be played South Africa's night of the long knives South Africa's Deputy President Cyril Ramaphosa has described the sacking of Finance Minister Pravin Gordhan as ""totally unacceptable"".  His late night dismissal on Thursday led to a 5% plunge in the value of the currency, the rand. Mr Gordhan was seen as a bulwark against corruption in an administration that is facing growing criticism. He was one of several victims as President Jacob Zuma conducted a major overhaul of his cabinet. Mr Zuma said the midnight reshuffle was about a ""radical socio-economic transformation"". Mr Ramaphosa told public broadcaster SABC that he would not resign in response to the sacking but continue to ""serve the people"". Africa Live: Updates on this and other stories Fallout from South Africa's ministerial 'massacre' Mr Gordhan remained defiant in the wake of his sacking Pravin Gordhan was seen by many as a safe pair of hands when it came to managing the economy. He was keen to keep a tight rein on spending and resisted calls from the president to increase government expenditure. This was Mr Gordhan's second stint as finance minister after first serving from 2009 to 2014. He was reappointed in 2015 to replace little-known David van Rooyen. Mr Van Rooyen's selection was controversial and he was in place for less than a week. It is unclear why Mr Gordhan was sacked but local media are pointing to an alleged intelligence report which accuses him of working with foreigners to undermine Mr Zuma's administration.  In a spirited farewell press conference at the treasury's office in Pretoria, Mr Gordhan defended his economic record, and dismissed speculation that he had recently held meetings in London aimed at undermining the president. Referral to his dismissal and that of his deputy Mcebisi Jonas he said: ""Our souls are not for sale."" Mr Gordhan and Mr Zuma did not see eye to eye on government spending, the BBC's Milton Nkosi reports, and that led to a rift between them. Ultimately, though, this is being seen as a political issue with the president rewarding loyalists. Earlier this week, the president recalled his finance minister from planned events in the UK. Last October, Mr Gordhan was charged with fraud, but the charges were later dropped. He has described the allegations as politically motivated. Cyril Ramaphosa, Jacob Zuma and Pravin Gordhan pictured just last month on budget day Comments by the Deputy President Cyril Ramaphosa that Mr Gordhan's sacking was ""totally unacceptable"" captures the overwhelming sentiment of some top leaders in the ruling African National Congress (ANC).  ANC chief whip Jackson Mthembu said Mr Gordhan and his deputy Mcebisi Jonas had integrity and were incorruptible. The Anglican Archbishop of Cape Town, Thabo Makgoba, has said the cabinet sackings ""constitute an assault on the poor of South Africa"".   ANC Youth League leader Collen Maine has however praised the cabinet changes calling the new Finance Minister Malusi Gigaba ""experienced and intelligent"". Demonstrators came out in the capital, Pretoria, in response to the news of Pravin Gordhan's sacking The rand is experiencing a setback just when it had started to recover from the political uncertainty and international volatility that plagued it in the past year.  The bond markets, this is where government debt is sold and the values are directly linked to the prospects of the economy have also reacted negatively. For foreign investors that is a boon, but for South African taxpayers subsidising the state it does not represent value for money.   Ultimately ordinary people will feel the pressure of these political moves, a weaker currency means the cost of basic imports such as fuel and some foods will go up.  A country whose reputation is dented, may ultimately lose face with international ratings agencies and finally be downgraded to ""junk status"" when the economic assessments are done again in June.   Apart from the nine ministers who have been affected by the changes Mr Zuma also appointed 10 deputy ministers.  Sfiso Buthelezi will become Deputy Finance Minister, replacing Mcebisi Jonas. ""I have directed the new ministers and deputy ministers to work tirelessly with their colleagues... to ensure that the promise of a better life for the poor and the working class becomes a reality,"" President Zuma's said in a statement. Fallout from South Africa's ministerial 'massacre' South Africa's night of the long knives. Video, 00:01:36South Africa's night of the long knives S Africa drops finance minister charges South African finance minister summoned ANC loses power in Johannesburg Is South Africa's ANC tearing itself apart? Video, 00:02:58Is South Africa's ANC tearing itself apart? South Africa country profile"
investors sentiments,Why Spotify's big bet on Meghan fell flat,2024-09-15,2023-06-17,Natalie Sherman,https://www.bbc.com/news/business-65936228,"When Spotify signed the Duke and Duchess of Sussex with an exclusive deal reportedly worth about $20m (£15.6m) in 2020, the royal couple were taking their first steps into the commercial world and podcasts were positively booming.  How times have changed. These days, Prince Harry and Meghan's brand has waned in the eyes of some and Spotify is reducing its reliance on the big celebrity signings and expensive original content that have weighed on its bottom line. Meghan's podcast became one of the most high-profile casualties this week when Spotify and the duke and duchess's Archewell Audio announced they would be parting ways in a mutual decision. It came after Spotify's deal with Barack and Michelle Obama's production company ended last year. Spotify has let go hundreds of staff since that time, hitting the expansive podcasting division, a hotchpotch of podcasting companies it spent more than $400m acquiring just a few years ago. On a conference call with financial analysts earlier this year, Spotify chief executive Daniel Ek conceded the firm had made some mistakes during the more than $1bn spending spree that followed its 2019 push to establish itself as a key player in the industry. ""You're right in calling out the overpaying and overinvesting,"" he said. ""We're going to be very diligent in how we invest in future content deals,"" he added. ""And the ones that aren't performing, obviously, we won't renew.  ""And the ones that are performing, we will obviously look at those on a case-by-case basis on the relative value."" Spotify clearly still has the stomach for some expensive partnerships. Last year, it resisted calls to cut ties with its controversial star Joe Rogan, who reportedly received $200m in 2020 for giving the streamer exclusive listening rights. But Mr Rogan's show offers several multi-hour episodes each week, which reportedly command an average audience of 11 million people.  Meghan by contrast delivered just 12 episodes of her Archetypes podcast last year. The joint statement announcing the split said the Sussexes and Spotify were ""proud"" of the material they made together.  And a string of accolades showed why. Archetypes' debut last year hit the top of Spotify's charts in six markets, including the US and UK. The show, in which Meghan interviewed fellow celebrities such as Serena Williams, Mariah Carey and Mindy Kaling, also won a People's Choice Award. But crisis communications guru Mark Borkowski says the show may not have been compelling enough when Spotify reviewed the numbers.   ""It's always about the content.... clearly there hasn't been a big enough audience for it,"" he says. ""If you can't deliver your fee, no one's going to pay it."" Mr Borkowski says there is little doubt that the duke and duchess still have value as a media brand. But it may not be what it once was.  Polling for Newsweek earlier this year suggested the couple's popularity in the US suffered following the publicity blitz surrounding their Netflix documentary series and the publication of Harry's memoir, Spare. ""The more Prince Harry and Meghan say, the less Americans like them,"" was Newsweek's headline. Mr Borkowski says the pair, who stepped back as working royals in 2020, will have to ""think hard"" about what they can offer in whatever they do next. ""It's a thread that's been pulled out of the brand,"" he says of the Spotify break-up. ""If they want to stop it unravelling they've really got to think hard. The biggest question is are they going to learn from this setback or are they going to ignore it as just a blip."" A spokesperson for the Hollywood talent agency now representing the duchess told the Wall Street Journal this week: ""Meghan is continuing to develop more content for the Archetypes audience on another platform."" Max Willens, senior analyst at Insider Intelligence, says Spotify is not the only tech giant that spent heavily in recent years to sign talent who failed to live up to the promise implied by the money they commanded.  Those heady days ended last year, as economic sentiment soured and share prices sank.  But shares in Spotify, which continues to add users and has seen its catalogue of podcasts jump to more than five million, are up nearly 90% this year, as investors welcome Mr Ek's promises to stay focused on ""efficiency"".  In announcing the ""next phase"" for its podcasting business this month, the company signalled it would embrace lower-cost, third party creators, while pushing investment towards ""always on"" programming.  ""The platforms that have gotten into [podcasting] had to take some time to figure out what constituted a good investment,"" Mr Willens says. He calls the decision by Spotify and the duke and duchess to part ways an ""understandable and natural part of that that process"".  ""Those were big, big deals designed to generate buzz and grab headlines and they accomplished that. Whether they made good long-term economic sense is a different question."""
investors sentiments,Sunny weather sees people splash out on new clothes,2024-09-15,2023-06-23,Lucy Hooker,https://www.bbc.com/news/business-65995685,"Shoppers have been splashing out on new outfits and other items for enjoying the summer weather, boosting sales overall, latest retail figures show. After the sun came out in the second half of May, sales volumes rose by a stronger than expected 0.3%, the Office for National Statistics (ONS) said. Online retailers and garden centres did particularly well, the ONS said. Fuel sales also rose compared to April, but people bought less food as prices continued to rise. ""Retail sales grew a little in May, with online shops doing particularly well selling outdoor goods and summer clothes, as the sun began to shine,"" Heather Bovill, senior statistician at the ONS said. ""Garden centres and DIY stores also saw growth, as the good weather encouraged people to start home and garden improvements."" Food sales fell 0.5% in May. As well as price pressures, that could be due to the extra bank holiday last month, the ONS said, as more people ordered takeaways or went to the pub. Overall consumers are still buying slightly less than they were before the pandemic. But because prices have risen, they are spending significantly more in total. Prices are still rising, although inflation - the rate at which they are going up - has eased from over 10% at the start of the year to 8.7% in May. On Thursday, the Bank of England put interest rates up by half a percentage point to 5% in an attempt to dampen demand and bring down prices. Interest rates have been rising since December 2021 but that does not yet seem to be having a big impact on consumer spending. ""Retail sales in the UK were stronger than expected which may partly justify the jumbo-sized interest rate increase from the Bank of England,"" said Neil Birrell, chief investment officer at Premier Miton Investors.  ""It's hard to believe that tighter policy won't start having a significant impact sooner rather than later, meaning the consumer will react accordingly."" The online and High Street chocolate chain, Hotel Chocolat, issued a profit warning on Friday saying it expected to make a loss this year and lower than expected profits in 2024. The firm blamed ""ongoing weakness in consumer sentiment and continuing inflationary pressures"" for the shift."
investors sentiments,Tesla profits slump by more than a half,2024-09-15,2024-04-23,BBC News,https://www.bbc.com/news/articles/c72pvz18x4lo,"Tesla has announced its profits fell sharply in the first three months of the year to $1.13bn (£910m), compared with $2.51bn in 2023. It caps a difficult period for the electric vehicle (EV) maker, which - faced with falling sales - has announced  thousands of job cuts. Boss Elon Musk remains bullish about its prospects, telling investors the launch of new models would be brought forward. Its share price has risen but analysts say it continues to face significant challenges, including from lower-cost rivals. The company has suffered from falling demand and competition from cheaper Chinese imports which has led its stock price to collapse by 43% over 2024.   Figures for the first quarter of 2024 revealed revenues of $21.3bn, down on analysts' predictions of just over $22bn.  But the decision by Tesla to bring forward the launch of new models from the second half of 2025 boosted its shares by nearly 12.5% in after-hours trading.  It did not reveal pricing details for the new vehicles.  However Mr Musk made clear he also grander ambitions, touting Tesla's AI credentials and plans for self-driving vehicles - even going as far as to say considering it to be just a car company was the ""wrong framework."" ""If somebody doesn't believe Tesla is going to solve autonomy I think they should not be an investor,"" he said. Such sentiments have been questioned by analysts though, with Deutsche Bank saying driverless cars face ""technological, regulatory and operational challenges."" Some investors have called for the company to instead focus on releasing a lower price, mass-market EV. However, Tesla has already been on a charm offensive, trying to win over new customers by dropping its prices in a series of markets in the face of falling sales.  It also said its situation was not unique.  ""Global EV sales continue to be under pressure as many carmakers prioritize hybrids over EVs,"" it said.  Despite plans to bring forward new models originally planned for next year the firm is cutting its workforce.  Tesla said it would lose 3,332 jobs in California and 2,688 positions in Texas, starting mid-June.  The cuts in Texas represent 12% of Tesla's total workforce of almost 23,000 in the area where its gigafactory and headquarters are located. However, Mr Musk sought to downplay the move.  ""Tesla has now created over 30,000 manufacturing jobs in California!"" he said in a post on his social media platform X, formerly Twitter, on Tuesday.  Another 285 jobs will be lost in New York.  Tesla's total workforce stood at more than 140,000 late last year, up from around 100,000 at the end of 2021, according to the company's filings with US regulators.  The car firm is also facing other issues, with a struggle over Mr Musk's compensation still raging on. On Wednesday, Tesla asked shareholders to vote for a proposal to accept Mr Musk's compensation package - once valued at $56bn - which had been rejected by a Delaware judge. The judge found Tesla's directors had breached their fiduciary duty to the firm by awarding Mr Musk the pay-out. Due to the fall in Tesla's stock value, the compensation package is now estimated to be around $10bn less - but still greater than the GDP of many countries. In addition, Tesla wants its shareholders to agree to the firm being moved from Delaware to Texas - which Mr Musk called for after the judge rejected his payday."
investors sentiments,Indian boss sparks debate over quitting etiquette,2024-09-15,2022-09-08,BBC News,https://www.bbc.com/news/world-asia-india-62830406,"An Indian start-up co-founder's tweet has sparked a debate on what courtesies potential employers and employees may - or may not - owe each other. Prashant Pitti, co-founder of online travel firm EaseMyTrip, shared a screenshot of a message he said was sent by a candidate on the day they were supposed to join.  In it, the person says they decided not to join because of another job offer. Mr Pitti tweeted that this was a ""hugely prevalent"" problem. Social media discussions on work culture have become common in India, where a number of vocal young professionals have launched or joined start-ups over the past few years. Recently, the CEO of Bombay Shaving Company was criticised for suggesting that new recruits at any job should work 18 hours a day. In Mr Pitti's case, the reaction was mixed. Companies, he said, waste a lot of time and resources when a candidate drops out at the last minute. The sentiment evoked both criticism and support from people, including other start-up founders. Some Twitter users supported the candidate, comparing the situation with companies laying off employees or rescinding job offers - they argued that if one could be justified, so could the other. In a follow-up tweet, Mr Pitti addressed the first situation of employers firing people, calling it a ""false equivalence"".  A ""real equaliser"", he said, would be if companies refused to let candidates join at the last minute after sending them an offer letter. ""Would this be acceptable? Big NO,"" he wrote. Many blamed the long notice periods - sometimes up to three months or more - at companies that allowed candidates to ""shop around"" for better offers. The tweet also generated discussion about what companies could do to prevent this from happening.  Some suggested giving higher salaries or fixing joining dates from two weeks of when a candidate signed an offer letter. Others suggested implementing a ""break-up fee"" on the lines of the penalties usually set for mergers and acquisitions. Mr Pitti also received support from Ashneer Grover, a high-profile entrepreneur, who said that India's ""broken and expensive"" legal system meant that there was ""no value of contract"". It was best, Mr Grover added, for potential employers to tone down expectations."
investors sentiments,TikTok founder defends potential Microsoft sale,2024-09-15,2020-08-04,BBC News,https://www.bbc.com/news/business-53654703,"The Chinese head of TikTok has defended plans to sell its US operations, describing a deal as the only way to prevent the app from being banned in the US. In a letter to Chinese staff, Zhang Yiming said the critics do not see the ""full context"". The letter comes as US President Donald Trump has threatened to bar the social media company. Chinese state media have said such pressure amounts to ""theft"". On social media, Zhang Yiming, founder of TikTok's Chinese parent company ByteDance, has also been described as a ""traitor"". In the letter to staff, which was shared by the company, he acknowledged the criticism, but said ""many people misunderstand the current, complex situation"".  He reminded staff of the firm's global ambitions and noted a rise in anti-Chinese sentiment around the world, including in the US and India. ""As a company, we have to abide by the laws of the markets where we operate,"" he said. ""It feels like the goal was not necessarily a forced sale, but given the current macro situation, a ban or even more."" The Trump administration has threatened to ban TikTok, saying the data it collects from its users - including an estimated 100 million in the US - is at risk of exploitation by the Chinese government. Beijing and TikTok deny those claims, which the US has made against other Chinese tech firms. But a sale to a US company is seen as a way to alleviate such concerns.  On Sunday, Microsoft confirmed it was in discussions with ByteDance over buying TikTok's operations in the US, Canada, Australia, and New Zealand - countries that make up four of the Five Eyes intelligence alliance. On Tuesday, it was reported that Apple is also interested. When reports of talks between ByteDance - which has received backing from US investors -  and Microsoft surfaced on Friday, Mr Trump said he opposed the deal.  But he later appeared to okay a potential sale, saying the government - which would review any takeover by a US company for national security risks - should receive a ""substantial"" cut of any purchase price. Mr Trump has threatened to ban the app on 15 September if there is no deal. ""The United States should get a very large percentage of that price, because we're making it possible,"" Mr Trump said.  Such a demand is highly unorthodox.  Nicholas Klein, a lawyer at DLA Piper, said generally ""the government doesn't have the authority to take a cut of a private deal through"" the Committee on Foreign Investment in the United States, which is the inter-agency committee that reviews some foreign investments in the US. Charlotte Jee, a reporter at MIT Technology Review, a magazine owned by Massachusetts Institute of Technology, said Mr Trump's comments were ""pretty astonishing"". Speaking to the BBC's Today programme, she said: ""I hate to say this but it is kind of almost Mafia-like behaviour - threatening a ban which pushes down the price then saying 'oh we should get a cut of that deal afterwards to say thank you for what we've done there'. ""It is extraordinary behaviour as well because last week we had lawmakers in the US trying to look at whether tech companies are too big and now we've got Trump trying to make one of them even bigger so it is a really, really bizarre situation to be in.""  By Dearbail Jordan, business correspondent  Former FBI director James Comey once said that dealing with Donald Trump gave him ""flashbacks to my earlier career as a prosecutor against the Mob"". The US president has certainly made TikTok an offer it can't refuse.  If the video app doesn't break away from its Chinese owner, ByteDance, and sell its US operation to Microsoft, Mr Trump will simply ban it - putting TikTok's access to its 80 million active American users in jeopardy.  Mr Trump has already flexed his muscles against other Chinese firms, such as Huawei. But what makes the situation with TikTok unprecedented is the demand for a cut of the sale price. The US Treasury has not explained how this extraordinary demand for a cut of a private transaction would work. Mr Trump reckons the government should get a big slice of the pie because ""we're making it possible"".  However, the deal wouldn't be happening in the first place but for his administration's claim that the likes of TikTok are feeding users' data directly to the Chinese Communist Party. Beneath the president's bombast, perhaps this is simply payback for the US and its companies, some of whom claim China has stolen intellectual property from them. Perhaps Mr Trump is just doing outwardly what some governments have been doing for years. But one thing is certain, Mr Trump's demand for payment has muddied the waters in an already fraught situation. "
