Keyword,Title,Scrapping Date,Article Date,Author,Link,Content
Government Securities Yield,British tech tycoon: I only got justice because I'm rich,2024-09-14,2024-08-01,Tom Gerken & Tom Singleton,https://www.bbc.com/news/articles/c4ng14j5vqpo,"The British businessman Mike Lynch, who this June was acquitted in the US of a multi-billion pound fraud, has said he believes he was only able to clear his name because of his huge wealth. Mr Lynch, 59, was facing two decades in jail if had been convicted of the 17 charges he faced, relating to the sale of his tech company, Autonomy, to US firm Hewlett-Packard. He told the the PM programme, on BBC Radio 4, that though convinced of his innocence throughout, he was only able to prove it in a US court because he was rich enough to pay the enormous legal fees involved. ""You shouldn't need to have funds to protect yourself as a British citizen"", he said.  ""The reason I'm sitting here, let's be honest, is not only because I was innocent... but because I had enough money not to be swept away by a process that's set up to sweep you away."" He said most people, even they sold all their assets, would run out of funds in a matter of months, a situation that he said ""has to change."" Mr Lynch co-founded Autonomy in Cambridge in 1996. The software company expanded rapidly, becoming one of the UK's leading tech firms. Its success led to Mr Lynch once being dubbed ""Britain's Bill Gates."" In 2011, hardware giant Hewlett-Packard bought the firm for $11bn (£8.6bn) - a deal Mr Lynch made £500m from. The acquisition soon unravelled though as questions were asked about the enormous price tag. Just a year later, HP wrote down the value of Autonomy - which it said Mr Lynch had exaggerated - by $8.8bn. Years of legal battles followed then, in 2018, US prosecutors brought charges against Mr Lynch. They accused him of inflating the value of the firm by using backdated agreements to mislead about the company's sales, said he had concealed the firm's loss-making business reselling hardware, and also accused him of intimidating or paying off people who raised concerns. They sought to try him in the US - a move Mr Lynch, who lives in Suffolk, resisted. But he was eventually extradited to the US in 2022 to face trial - a process culminated in June this year with Mr Lynch's acquittal. He testified in court that he was not involved in the transactions being described while his legal team argued HP had failed to properly vet the deal. Another former finance executive at Autonomy, Stephen Chamberlain, was also  found not guilty. Mr Lynch said the moment he awaited his verdict was ""indescribable"" and like standing ""between two universes"". ""Until you hear the words, you can't call it"", he explained. But now that he has been acquitted, he has criticised the government for allowing his extradition in the first place under a treaty which critics - such as Mr Lynch - say makes it far too easy for British people to be tried in the US. ""The British government needs to defend its citizens,"" he said. ""Is it right to be sending someone to another country, especially one which has the justice system issues of the US? ""A US prosecutor has far more control over you than your local bobby in the British system."" The charges Mr Lynch was cleared of are not the only legal proceedings arising out of the sale of Autonomy. In 2019, Autonomy's former chief financial officer Sushovan Hussain was jailed for five years and fined millions of dollars on 16 counts of fraud, securities fraud and other charges. In 2022, HP won a civil fraud case against Mr Lynch and Hussain heard by London's High Court.  It is now seeking a reported $4bn. Mr Lynch blamed that on the judge in the case being presented with untested evidence from the US. He says now though he wants to refocus on his career in tech - saying his recent experiences have given him an interest in how AI can be used in the legal field as well as to help with with hearing loss. ""I want to get back to what I love doing, which is innovating"", he said."
Government Securities Yield,British tech tycoon cleared in US fraud trial,2024-09-14,2024-06-06,Natalie Sherman,https://www.bbc.com/news/articles/cneel8ed2vvo,"British tech tycoon Mike Lynch has been cleared of fraud charges he faced in the US over the $11bn (£8.6bn) sale of his software firm to Hewlett-Packard in 2011. A jury in San Francisco found him not guilty on all counts in a stunning victory for Mr Lynch, who had been accused of inflating the value of Autonomy, his company, ahead of its sale. Mr Lynch, who faced more than 20 years in prison if convicted, had denied the charges and took the stand to defend himself. In his testimony, he maintained he had focused on technology not accounting, distancing himself from other executives, including the company's former chief financial officer who was already successfully prosecuted for fraud. ""I am elated with today’s verdict and grateful to the jury for their attention to the facts over the last 10 weeks,"" Mr Lynch said in a statement.   ""I am looking forward to returning to the UK and getting back to what I love most: my family and innovating in my field."" University of Cambridge graduate Mr Lynch co-founded Autonomy in 1996 out of a specialist software research group called Cambridge Neurodynamics. He led it as it grew to be one of the UK's biggest companies, winning him comparisons to Microsoft's Bill Gates and Apple's Steve Jobs.  The company, known for software that could extract useful information from ""unstructured"" sources such as phone calls, emails or video, was ultimately sold to Hewlett-Packard (HP) in 2011 in a deal that ranked as the largest-ever takeover of a British technology business at the time. Mr Lynch made £500m from the sale. Just a year later, HP wrote down the value of Autonomy by $8.8bn. Years of legal battles followed.  The company's chief financial officer, Sushovan Hussain, was found guilty of fraud in 2018 and later sentenced to five years in prison.  US prosecutors brought charges against Mr Lynch in 2018, accusing him of inflating the value of the firm using backdated agreements to mislead about the company's sales; concealing the firm's loss-making business reselling hardware and intimidating or paying off people who raised concerns. Mr Lynch, who lives in Suffolk, was eventually extradited after a UK judge ruled in favour of HP in a similar civil fraud case in 2022. HP is seeking a reported $4bn in that case. Mr Lynch, a former UK government adviser who sat on the boards of the BBC and the British Library, had faced house arrest in the US while preparing for the trial which began in San Francisco in March.  Prosecutors had called dozens of witnesses to the stand, including the former head of HP Leo Apotheker, who was fired shortly after the purchase was announced. But the arguments fell flat. Mr Lynch's team pushed the argument that HP had failed to properly vet the deal and mismanaged the takeover, while he testified he was uninvolved with the transactions being described. Judge Charles Breyer had already dismissed one count of securities fraud during the trial for lack of evidence.  Abraham Simmons, a spokesman for the US Attorney's Office, said: ""We acknowledge and respect the verdict.  ""We would like to thank the jury for its attentiveness to the evidence the government presented in this case."" As well as Mr Lynch, another former finance executive at Autonomy, Stephen Chamberlain, was also on trial. He was found not guilty. Lawyers for Mr Lynch, Christopher Morvillo and Brian Heberlig, said in a statement that they were thrilled by the outcome, saying it reflected a ""rejection of the government's profound overreach in this case"".  ""This verdict closes the book on a relentless 13-year effort to pin HP's well-documented ineptitude on Dr Lynch,"" they said. ""Thankfully, the truth has finally prevailed."""
Government Securities Yield,US pushes ahead with new rules for Chinese firms,2024-09-14,2020-12-03,BBC News,https://www.bbc.com/news/business-55169476,"The US House of Representatives has passed a law to kick Chinese companies off US stock exchanges if they do not comply with its auditing rules.  The act would also require companies to disclose whether they are owned or controlled by a foreign government. The Holding Foreign Companies Accountable Act still needs the US president’s approval.  The move coincides with a wider push to ramp up pressure on China in the final months of the Trump presidency.  In addition to the act, the US government on Wednesday moved to ban cotton imports from a company it says uses the forced labour of detained Uighur Muslims.  The US also took action against Chinese-manufactured twist ties last week, taking the rare step of imposing tariffs to counter the effects of what the US claims is Chinese currency manipulation.  China too has increased pressure, introducing export control laws earlier this week.   This was widely seen as a response to US export controls on microchips that many Chinese tech companies rely on.   The act will have little effect over the short term, as foreign companies are only banned if they fail to comply with audits for three years in a row. The American Securities Association welcomed the bill’s passage, but urged the government to act more swiftly by delisting non-compliant companies by the middle of next year.  The legislation applies to publicly-listed companies from any country, but its sponsors intended for it to target Chinese companies. “US policy is letting China flout rules that American companies play by, and it’s dangerous. Today, the House joined the Senate in rejecting a toxic status quo,” said Republican Senator John Kennedy, who is one of the bill’s authors.  The US-China Economic and Security Review Commission - which was created by Congress to track possible security threats from China - said that as of October there were 217 Chinese companies listed on these US exchanges. A number of US-listed Chinese firms, including Alibaba and KFC China operator Yum China, have recently carried out secondary listings in Hong Kong. The Trump administration also banned cotton imports from a Chinese state-owned enterprise it said has used the forced labour of detained Uighur Muslims in Xinjiang province. The Xinjiang Production and Construction Corps (XPCC) is a quasi-military organisation that reportedly accounts for nearly a fifth of Xinjiang’s GDP.   It is also one of China’s largest cotton producers.  US Customs and Border Protection (CBP) personnel have been ordered to detain shipments containing cotton and cotton products originating from XPCC. “China’s systemic abuse of forced labour in the Xinjiang Region should disturb every American business and consumer,” said CBP Acting Commissioner Mark A. Morgan in a statement.  Beijing has faced international condemnation for its network of detention centres in Xinjiang which mostly house Muslim minorities. China has rejected the criticism, saying its aim is to tackle poverty and religious extremism in Xinjiang."
Government Securities Yield,Boxing gym teaches men to avoid toxic masculinity,2024-09-14,2023-07-18,By Liz Clements,https://www.bbc.com/news/uk-wales-66222043,"""I always viewed men as the alphas in relationships, it was more, 'I'll take care of everything, you guys just look pretty… not in a disrespectful way'."" Farrell Rafferty's views on how a man is supposed to act and his attitude towards women have evolved a lot. He has taken part in helping shape a campaign that encourages young men to learn about gender-based violence. The Welsh government said it hopes its ""Sound"" campaign can make Wales the ""safest place in Europe for women"". Farrell is part of St Joseph's Boxing Gym, and was one of a group of young men who discussed topics like toxic masculinity, coercive control and behaviours that can lead to violence against women to help shape the campaign. The 25-year-old amateur boxer said he ""definitely viewed women in a different way"" until growing up and then he ""realised that was wrong"". He believes calling friends out on problematic behaviour is vital. ""I have a pretty influential friendship group, where if one of us are doing something wrong, we will get pulled up on it,"" he said. ""A lot of men, I think they're scared of pulling their friends up on things, 'cos they think they're going to lose that friendship. But if you are a true friend, a real friend, you'd know when you're doing wrong."" Mr Rafferty said going to St Joseph's boxing gym and speaking with other men is so important. ""It's not just about punching people in the face,"" he said. ""We are going through difficulties in our life and we know we can always talk to each other. It encourages men to talk more."" Patrick Bilongo believes the media, musicians and rappers have a lot to answer for when it comes to influencing men's behaviour. The 20-year-old said TV taught him ""you're not supposed to cry, you're not supposed to show emotions"". He said now he had learned it was actually ""completely the opposite, and all right to do so"". The amateur boxer said some rappers' behaviour was not a realistic representation of ""what real life is like."" There was an incident a few weeks ago when he was with someone who wolf-whistled a woman. ""I let my friend know, that's a human being, that's not a dog or a cat that you can just whistle at. Show more respect,"" he said. He wants to encourage other men to ""be more human"", and to remind their friends to treat people with respect. ""It's something you need to repeat all the time so their mentality will change,"" he said. Mr Bilongo said before the campaign, he did not know about behaviours like lovebombing (showering someone with intense displays of affection to lure them into or keep them in a relationship) or coercive control. The campaign will target young men with informative content on social media, podcasts, TV and streaming channels. Rhian Bowen-Davies, an independent consultant in the field of violence against women, said: ""It's a really good first step in terms of the prevention, early intervention and that societal wide condemnation of violence against women"". She said ""men need to understand the role that they play"" in stopping and calling out problematic behaviours which can ""end up in the situation where violence against women is prevalent"".  She called the campaign being ""co-produced with young men"" exciting. ""It's got the potential to reach audiences that other campaigns haven't done because of the platforms it's going to use and the messages it's sending,"" she said. ""It makes me feel that we have an opportunity that we can feel safer. If I was to go through life and learned what I've learned and experience what I've experienced, and I don't pass that on, what was I here for?"" Zhivago Greaux has been a boxing coach for about eight years, and is proactive in his approach toward shaping young men in the gym. ""People look at it and think I'm a boxing coach but you're really trying to shape them into good people,"" he said. ""You pass on your life experiences. Even though you're doing it through a boxing coach lens... you still instil different disciplines into these young kids. He said even before the campaign, he talked ""a lot about toxic masculinity."" ""I like to have an open gym and conversation, I want to open their minds,"" said the Newport coach. He said sharing his own insecurities and feelings encouraged young men to open up too. ""Currently, I feel we don't have safe spaces for men to talk. I think what we need to do, and what I've tried to do here myself is create an environment that allows men to talk. I encourage it,"" the 38-year-old said. He believes with the rise of misogyny, and figures like the social media influencer Andrew Tate on social media, it is a very ""scary space we're in at the moment"". ""The influence I see he's had on some of the younger kids… that's scary. Scary for me as a man, as a person, as a human - let alone the further impact that could have on women,"" he said. Mr Zhivago believes he is now ""trying to fight that battle to say 'let's actually be open, let's talk about our feelings, emotions etc, and understand what a male role model really is.'"" Social Justice Minister Jane Hutt said the campaign was ""really important as misogyny, sexism, violence against women - and domestic abuse, it's in the news every day and people talk about it as an epidemic."" ""It is sad to say in this day and age that younger men still don't recognise that actually women, young women and women of all age groups are still subject to unacceptable levels of violence and sexual harassment,"" Ms Hutt said."
Government Securities Yield,Keeping your bond portfolio safe,2024-09-14,2014-11-03,Constance Gustke,https://www.bbc.com/worklife/article/20131017-keeping-your-bond-portfolio-safe,"The United States narrowly avoided defaulting on its debt — this time — with its last-minute deal to raise the debt limit. That means Treasuries, the most widely held securities in the world, are still a safe haven. It had appeared touch-and-go for a short time, however. Amid the political wrangling in Washington DC, investors had avoided buying short-term Treasuries and yields spiked as the very real risk of default grew. With another debt ceiling battle likely early next year, the message for investors is clear: bond diversification isn’t just a good idea, it’s necessary. BBC Capital spoke with four experts to find out what you need to know to keep your bond portfolio safe from future debt limit battles — and more. Edited excerpts follow with Mark Zandi, chief economist at Moody’s Analytics; Samuel Rines, an economist at Chilton Capital Management; Guy LeBas, chief fixed-income strategist at Janney Montgomery Scott; and Matt King, chief investment officer at Bell Investment Advisors. Q: If Congress hadn’t raised the debt ceiling, would financial Armageddon have followed?  Zandi: On October 17, the (US) government wouldn’t have actually defaulted on its debt. Thursday is the day the government was shut off from borrowing more money. Instead, the Treasury would be forced to draw on the cash that it already has on hand. By early November, government coffers would be running dry, though. True Treasury default would occur on November 15, when a big payment is due.   Besides that, investor confidence would rapidly erode. If investors didn’t get paid for their Treasury holdings, they would sue the government. Also, investors would demand higher interest rates on Treasuries to compensate for higher default risk, triggering inflation. Short-term investors, rather than ones holding long-term Treasury bonds, would be very worried about getting their money back as the government began defaulting on payments. At some point, we would have a TARP moment. [In 2008 Congress tried to unfreeze the money markets by passing the Troubled Asset Relief Program (TARP). That money bought up mortgage-backed securities from financial institutions. It did not pass in Congress on the first vote and stocks fell nearly 9% that day.]  Investors would head to the door. This scenario makes the probability of default unimaginable. Q: Treasuries are also the glue that holds the financial system together, right?  Rines: Yes. Almost all debt is priced off of Treasuries.  So there would be no risk-free assets for investors. Treasuries are also widely help by European banks, which have shifted into safer US and European bonds. So any default would have ripples worldwide, including to banks. LeBas:  Default threat has already affected the repurchase agreement market, which is essentially a secured loan that uses Treasuries as collateral. In theory, smaller banks could fail as defaults piled up. Also, many US bonds use Treasury yields as a benchmark.  So, Treasuries have their tentacles in every corner of the financial market. Q: How would money market funds, held by large numbers of investors, have been affected, since they hold a lot of Treasuries? In 2008, one money market wrote off bad debt and ended up breaking the buck, triggering investor panic. Rines: some major financial firms like Fidelity have avoided buying short-term Treasuries. Financial firms have developed a capital preservation mentality, since they know what can happen during a financial crisis. LeBas: Yes, many money markets have been preparing for the past week by hording cash and protecting themselves.  They’ve been doing a good job getting ready for this Congressional showdown. Only minimal amounts of money have flowed out of money markets, which means that investors had not panicked.   Q:  Congress has essentially just kicked the debt ceiling can down the road. How can investors protect themselves during future Congressional standoffs? Zandi: there’s really nowhere to hide if the government defaults. Everything would get crushed. However, long-term Treasuries, which have much longer maturities [usually 10 to 30 years] than T-bills, may do better than anything else. However, if you’re holding emerging market bonds, they’ll go down like everything else. Rines: International bonds funds are a good way to diversify. There is a lot of government paper in Germany and the UK to buy, and these governments don’t have this same dysfunction. Cash is also a good go-to place if it looks like there will be a default. LeBas: Investors should always have about 10% of their portfolio in overseas bonds, especially sovereign ones, which are issued by governments, and high-quality corporate bond offerings. King: Nervous investors learned some valuable lessons during the 2011 government debt-ceiling crisis. They wanted to go into cash. However, the investors who did were later left on the sidelines when the markets recovered. It was a painful lesson. So don’t let political risk deter you from your financial plans. Sit tight and wait it out. Investors should have a diversified fixed-income portfolio. Foreign bond exposure helps you hedge your currency risk. When parking money, look at high-yield savings accounts, which offer higher yields than money markets and no risk. Follow BBC Capital on Twitter @BBC_Capital or follow us and join the conversation about this or any other Capital story on Facebook: BBC Capital on Facebook."
Government Securities Yield,Morning business round-up,2024-09-14,2011-11-09,BBC News,https://www.bbc.com/news/business-15656642,"What made the business news in Asia and Europe this morning? Here's our daily business round-up: Italy's bond yields continued to soar on Wednesday, with the yield on 10-year bonds rising well above 7% - a rate which many analysts deem to be unsustainable. The rise comes a day after Italian Prime Minister Silvio Berlusconi said he would resign once budget reforms are passed.  The yield was pushed up as a clearing house asked for a larger deposit to trade Italian bonds - to cover the increased risk of non-payment. Investors increasingly fear that Italy could become the next victim of the debt crisis. The head of the International Monetary Fund, Christine Lagarde, has warned that the global economy is at risk of being plunged into a ""lost decade"". Ms Lagarde said the ongoing debt crisis in Europe had resulted in an uncertain outlook for the global economy. The IMF chief added that while efforts to solve the crisis were heading in the right direction, more needed to be done to restore confidence. China's inflation rate fell for a third straight month in October, as the government continues to try to cool economic growth.  Consumer prices rose 5.5% in October compared with the same month a year earlier, the National Bureau of Statistics said. That is down from 6.1% in September, and a three-year high of 6.5% in July.  The government has identified inflation as one of the main threats to the country's economic stability. Global bank HSBC has reported shrinking underlying profits and warned of a ""very challenging"" outlook. Its headline profit before tax was actually up 66% to $5.2bn (£3.2bn) in the third quarter of the year, mainly thanks to a revaluation of its own debts, the value of which has fallen in volatile markets. But underlying profits fell 36% because of weak business, as well as bad debts in the US. Anglo-French electrical goods retailer Kesa has announced plans to sell off its troubled UK-based Comet stores to a private equity firm for just £2. This video can not be played Biz Heads The buyer is a group of companies under the name ""Hailey"" advised by retailer turnaround specialists OpCapita. Shares in Olympus have plunged yet again as uncertainty looms over the camera maker's future. Shares fell 20% in Tokyo on Wednesday, after shedding 30% in the previous session. On Tuesday, Olympus launched an inquiry after admitting it had hidden losses on its securities investments for decades. The latest edition of Business Daily considers how you can get a job when unemployment is rising. It also reports from shanty towns in Spain where the unemployed gather.  Market data"
