Title,Scrapping Date,Article Date,Author,Link,Content
Ekonom: Defisit APBN 2025 Makin Lebar Bikin Ruang Fiskal Tambah Sulit,2024-09-24T16:47:11.875Z,19 August 2024 17:06 WIB,Annasa Rizki Kamalina,https://search.bisnis.com/link?url=https%3A%2F%2Fekonomi.bisnis.com%2Fread%2F20240819%2F10%2F1792233%2Fekonom-defisit-apbn-2025-makin-lebar-bikin-ruang-fiskal-tambah-sulit,"Bisnis.com, JAKARTA — Peneliti Senior Departemen Ekonomi Centre for Strategic and International Studies (CSIS) Deni Friawan melihat semakin menggunungnya utang berdampak pada ruang fiskal yang semakin sempit. 
Bagaimana tidak, penarikan utang bahkan dapat dikatakan ‘gali lubang tutup lubang’ karena dilakukan untuk membayar bunga utang. 
""Karena defisit yang selalu ada dan kondisi seperti itu, rasio utang dan besaran utang kita terhadap PDB semakin membesar. Hal ini terus terang saja akan semakin menyulitkan ruang fiskal bagi pemerintahan berikutnya,"" jelasnya dalam acara Media Briefing CSIS, Senin (19/8/2024). 
Sebagaimana rencana pembayaran utang jatuh tempo tahun depan yang senilai Rp800,33 triliun dan ditambahkan dengan pembayaran bunga utang senilai Rp552,9 triliun. Artinya Rp1.353,23 triliun belanja APBN adalah untuk bayar utang. 
                            
                                
                                    
                                        
                                            
                                                
                                                
                                                    
                                                        googletag.cmd.push(function() { googletag.display(""div-gpt-ad-parallax""); });
                                                    
                                                
                                                
                                            
                                        
                                    
                                
                            
                            
Melihat dari rencana belanja dalam APBN 2025 senilai Rp3.613,1 triliun, alhasil sekitar 37,45% APBN justru digunakan untuk melaksanakan kewajiban utang. 
Di sisi lain, defisit APBN tahun ini direcanakan semakin lebar ke angka 2,53% atau setara Rp616 triliun. Baca JugaBelanja APBN di Papua Barat Rp3,2 Triliun per Semester I/2024Daftar Saham yang Diuntungkan dan Tertekan dengan Kebijakan Anggaran APBN 2025Bankir Buka Suara soal Bisnis Tahun Depan usai Pembacaan Asumsi Makro RAPBN 2025
Untuk membiayainya, pemerintah merencanakan penarikan utang pada 2025 di angka Rp775,9 triliun yang akan dipenuhi melalui penarikan pinjaman seinlai Rp133,3 triliun dan penerbitan surat berharga negara (SBN) senilai Rp642,6 triliun.
""Jadi perbedaan utang yang baru masuk kita dengan utang yang kita bayarkan bunga dan pokoknya itu makin mengecil,"" tuturnya. 
Deni menyoroti, dalam 3 tahun ke depan, pemerintah setiap tahunnya memiliki kebutuhan sekitar Rp800 triliun untuk membayar utang jatuh tempo. 
Pasalnya, profil jatuh tempo utang dalam tiga tahun ke depan akan mencapai puncaknya imbas dari penarikan utang yang lebih dari Rp1.000 triliun pada saat terjadi Covid-19. 
Dampak dari pembayaran utang yang melonjak ini, ruang fiskal untuk Prabowo menjalankan janji-janji politiknya semakin sempit. 
Nyatanya, sisa APBN untuk mendanai program-program tersebut hanya sekitar Rp2.259,87 triliun. 

                
    Cek Berita dan Artikel yang lain di Google
            News dan WA Channel"
Target Defisit RAPBN 2025 Bawa Sinyal Positif Buat Stabilitas Fiskal,2024-09-24T16:47:12.280Z,17 August 2024 05:35 WIB,Erta Darwati,https://search.bisnis.com/link?url=https%3A%2F%2Fmarket.bisnis.com%2Fread%2F20240817%2F7%2F1791695%2Ftarget-defisit-rapbn-2025-bawa-sinyal-positif-buat-stabilitas-fiskal,"Bisnis.com, JAKARTA - Presiden Joko Widodo (Jokowi) yang mematok defisit Rancangan Anggaran Pendapatan dan Belanja Negara (RAPBN) 2025 sebesar Rp616,2 triliun atau 2,53% terhadap Produk Domestik Bruto (PDB) dinilai sebagai sinyal positif terhadap stabilitas fiskal.
Ekonom Bahana TCW Investment Management Emil Muhammad menilai Rancangan Anggaran Pendapatan dan Belanja Negara (RAPBN) 2025 akan tetap menjaga pengelolaan fiskal.
""Dengan target defisit anggaran yang ditetapkan pada 2,53% untuk tahun 2025, yang berada di batas bawah rentang 2,45-2,82% yang direncanakan dalam KEM PPKF, dan proyeksi defisit yang menurun dari 2,7% pada akhir 2024, hal ini dapat dilihat sebagai sinyal positif terhadap stabilitas fiskal,"" kata Emil dalam keterangannya, Jumat (16/8/2024).
Dia menegaskan bahwa perkembangan tersebut berpotensi meningkatkan optimisme pelaku pasar terhadap aset keuangan domestik, khususnya Surat Berharga Negara (SBN).
                            
                                
                                    
                                        
                                            
                                                
                                                
                                                    
                                                        googletag.cmd.push(function() { googletag.display(""div-gpt-ad-parallax""); });
                                                    
                                                
                                                
                                            
                                        
                                    
                                
                            
                            
Selain itu, dia menilai prospek pasar SBN masih baik di sisa tahun ini, kendati penguatan telah terjadi dalam sebulan terakhir. Hal tersebut dapat meredakan kekhawatiran pelaku pasar SBN yang semula memperkirakan pelebaran defisit.
Dia mengungkap dampaknya terhadap pergerakan imbal hasil SBN 10 tahun. Menurutnya risiko suplai memang masih membayangi akibat penerbitan utang yang dianggarkan sebesar Rp775,9 triliun, yang sebagian ditujukan untuk menggantikan SBN yang jatuh tempo di tahun depan.Baca JugaAsumsi Makro 2025, Ini Dampaknya ke Emiten Infrastruktur dan KesehatanJokowi Pasang Target Ekonomi Prabowo 5,2%, Simak Asumsi Makro 2025Rencana Batas Defisit APBN 3% Dihapus, Faisal Basri: Siap-Siap Stabilitas Makro Goyang
Namun, dia menjelaskan bahwa dampak dari peningkatan suplai dapat diminimalisir seiring meningkatnya minat pelaku pasar terhadap SBN menjelang pemotongan suku bunga The Fed dan Bank Indonesia.
""Kami masih menjaga optimisme pada SBN. Di tengah siklus penurunan suku bunga global yang baru dimulai, kami masih menilai SBN dapat menawarkan peluang return yang baik bagi investor. Volatilitas global yang mulai menurun juga dapat memberikan rasa aman lebih pada investor,"" ucapnya.
Menurutnya, investor dapat mencermati sentimen terkait prospek pemotongan suku bunga The Fed yang masih berfluktuatif bergantung pada rilis data ekonomi Amerika Serikat (AS) setiap pekannya.


                    
                
    Cek Berita dan Artikel yang lain di Google
            News dan WA Channel"
S&P: Investor Was-Was Defisit APBN Pemerintahan Prabowo Bakal Tembus 3%,2024-09-24T16:47:12.648Z,31 July 2024 17:55 WIB,Annasa Rizki Kamalina,https://search.bisnis.com/link?url=https%3A%2F%2Fekonomi.bisnis.com%2Fread%2F20240731%2F10%2F1787064%2Fsp-investor-was-was-defisit-apbn-pemerintahan-prabowo-bakal-tembus-3,"Bisnis.com, JAKARTA – Lembaga pemeringkat kredit S&P mengungkapkan bahwa investor was-was akibat rencana fiskal pemerintahan baru, utamanya soal rasio utang pemerintah dan defisit fiskal, karena menimbulkan ketidakpastian kebijakan. 
Dalam laporan S&P terbaru yang terbit 30 Juli 2024, tertulis bahwa pemerintah yang akan datang telah mengisyaratkan bahwa mereka berniat untuk meningkatkan belanja publik, dengan pendanaan yang berasal dari peningkatan utang pemerintah.
“Para investor cenderung berfokus pada apakah pemerintah yang akan datang akan terus mematuhi batasan hukum pada defisit fiskal,” tulis S&P, dikutip Rabu (31/7/2024). 
Sebagaimana pemberitaan Bisnis sebelumnya, bahwa presiden terpilih Prabowo Subianto berencana menigkatkan rasio utang pemerintah ke level 50% atau masih di bawah batas aman 60% dari PDB sesuai dengan Undang-Undang Keuangan Negara. 
                            
                                
                                    
                                        
                                            
                                                
                                                
                                                    
                                                        googletag.cmd.push(function() { googletag.display(""div-gpt-ad-parallax""); });
                                                    
                                                
                                                
                                            
                                        
                                    
                                
                            
                            
Lebih lanjut, S&P menyoroti bahwa kebijakan ini dapat ditafsirkan bahwa pemerintah akan menjalankan defisit tahunan di atas batas legal 3% dari PDB. Padahal, kebijakan ini sudah dipertahankan dalam 20 tahun terakhir, kecuali selama Pandemi Covid-19. 
S&P pun melihat pada dasarnya pemerintahan yang akan menggantikan Jokowi ini telah meyadari risiko akan kenaikan defisit maupun rasio utang. Mereka telah menekankan bahwa rasio utang 50% tetap berada dalam batas hukum saat ini. Baca JugaS&P Pertahankan Peringkat Kredit Indonesia BBB Outlook StabilChatib Basri Singgung Dampak Rencana Defisit Fiskal Era Prabowo ke Stabilitas RupiahPengusaha Usul Prabowo Relaksasi Batas Maksimal Defisit Fiskal 5%
Pemerintahan yang akan datang juga mengindikasikan bahwa peningkatan utang tergantung pada kemampuan pemerintah baru untuk meningkatkan pendapatan dan bahwa rasio utang akan sedikit berubah pada tahun fiskal berikutnya. 
Meski pihak presiden terpilih telah menyangkal rencana Prabowo untuk mengubah undang-undang dan mengizinkan defisit fiskal yang lebih besar, investor masih was-was akan kebijakan pemerintah Indonesia. 
“Terlepas dari jaminan-jaminan ini, ketidakpastian kebijakan kemungkinan akan tetap ada sampai pemerintahan berikutnya mengumumkan rencananya secara rinci,” lanjut S&P. 
Lebih jauh lagi, S&P bahkan menyampaikan adanya potensi menurunkan peringkat kredit Indonesia apabila utang pemerintah secara umum meningkat pada tingkat tahunan lebih dari 3% dari PDB secara terus-menerus. 
Alasan lainnya, apabila pembayaran bunga pemerintah secara umum melampaui 15% dari pendapatan secara berkelanjutan atau terjadi perlambatan struktural pada penerimaan ekspor. 
Meski demikian, S&P memperkirakan defisit anggaran dalam tiga tahun ke depan akan lebih tinggi dibandingkan defisit anggaran pada 2022-2024.
“Mengingat rencana pengeluarannya, pemerintah baru kemungkinan akan menargetkan kekurangan anggaran yang mendekati batas legal 3% dari PDB,” lanjut S&P. 
Per 30 Juli 2024, S&P mempertahankan peringkat kredit Indonesia atau Sovereign Credit Rating (SCR) pada BBB atau satu tingkat di atas investment grade dengan outlook stabil. 

                
    Cek Berita dan Artikel yang lain di Google
            News dan WA Channel"
Chatib Basri Singgung Dampak Rencana Defisit Fiskal Era Prabowo ke Stabilitas Rupiah,2024-09-24T16:47:13.009Z,16 July 2024 20:05 WIB,Maria Elena,https://search.bisnis.com/link?url=https%3A%2F%2Fekonomi.bisnis.com%2Fread%2F20240716%2F9%2F1782791%2Fchatib-basri-singgung-dampak-rencana-defisit-fiskal-era-prabowo-ke-stabilitas-rupiah,"Bisnis.com, JAKARTA – Ekonom Senior sekaligus mantan Menteri Keuangan (periode 2013-2014) Chatib Basri menyampaikan bahwa tren penguatan nilai tukar rupiah pada pekan lalu utamanya dipengaruhi oleh faktor eksternal.
Dia menjelaskan, kondisi ini seiring dengan adanya ekspektasi pasar terhadap penurunan suku bunga bank sentral Amerika Serikat (AS), Fed Funds Rate/FFR), dalam beberapa bulan ke depan.
“Sehingga ini yang menjelaskan mengapa exchange rate kita mengalami penguatan beberapa ratus basis poin beberapa waktu terakhir,” katanya dalam acara Market Outlook 2024, Selasa (16/7/2024).
Selain itu, Chatib mengatakan bahwa pernyataan pemerintah dan tim sinkronisasi pemerintahan presiden terpilih Prabowo Subianto terkait keberlanjutan fiskal turut mempengaruhi penguatan rupiah.
                            
                                
                                    
                                        
                                            
                                                
                                                
                                                    
                                                        googletag.cmd.push(function() { googletag.display(""div-gpt-ad-parallax""); });
                                                    
                                                
                                                
                                            
                                        
                                    
                                
                            
                            
Pernyataan tersebut berasal dari Menteri Koordinator Bidang Perekonomian, Menteri Keuangan Sri Mulyani Indrawati, dan Tim Sinkronisasi Pemerintahan, bahwa defisit APBN pada 2025 akan djaga di bawah level 3% dari PDB.
“Statement ini memberi comfort kepada market bahwa desain dari kebijakan fiskal itu akan tetap dijaga. Itu yang kemudian juga memberikan rasa yang cukup nyaman bahwa defisitnya bisa dijaga,” jelasnya.Baca JugaJelang RDG Bank Indonesia, Pengusaha di Apindo Minta Dua Hal Terkait RupiahPertumbuhan Ekonomi China Melambat, Ini Risikonya bagi Ekonomi RI dan RupiahNilai Tukar Rupiah Ditutup Melemah ke Rp16.179 per Dolar AS, Selasa 16 Juli 2024
Bisnis mencatat, nilai tukar rupiah pada Selasa (16/7/2024) ditutup pada level Rp16.199 per dolar AS. Nilai tukar tersebut turun 0,18% atau sebesar 29 poin.
Sebagaimana diketahui, kabar rasio utang terhadap PDB dalam APBN pemerintahan mendatang sempat menjadi sorotan dan kekhawatiran bagi investor, sehingga turut memicu pelemahan rupiah.
Pada kesempatan sebelumnya, Sri Mulyani menyampaikan bahwa presiden terpilih Prabowo telah berkomitmen menjaga defisit APBN 2025 di bawah 3% dari PDB.
“Kami sudah menyampaikan juga kepada presiden terpilih Bapak Prabowo dan beliau juga memberikan keyakinan arahan bahwa beliau commit defisit di bawah 3%,” katanya.
Adapun, DPR RI dan pemerintah telah menyetujui defisit pada tahun depan akan berada pada rentang 2,29% hingga 2,82% dari PDB atau di bawah 3%. 

                
    Cek Berita dan Artikel yang lain di Google
            News dan WA Channel"
"Ekonom: Prabowo Bisa Hapus Defisit Fiskal 3%, Asal...",2024-09-24T16:47:13.387Z,11 July 2024 13:31 WIB,Annasa Rizki Kamalina,https://search.bisnis.com/link?url=https%3A%2F%2Fekonomi.bisnis.com%2Fread%2F20240711%2F9%2F1781329%2Fekonom-prabowo-bisa-hapus-defisit-fiskal-3-asal,"Bisnis.com, JAKARTA – Presiden dan Wakil Presiden terpilih Prabowo Subianto dan Gibran Rakabuming, dikabarkan mulai mengkaji rencana revisi Undang-Undang (UU) Keuangan Negara terkait penghapusan batas defisit fiskal 3% dan utang pemerintah 60% dari produk domestik bruto (PDB). 
Rencana penghapusan batas defisit tersebut sebagai upaya untuk mencari kelonggaran yang lebih luas lagi untuk melakukan belanja.  
Direktur Eksekutif Segara Research Institute Piter Abdullah menuturkan bukan hal yang tidak mungkin Indonesia menghapus batas defisit APBN 3% dari PDB dengan merevisi UU tersebut. 
Menurutnya, pemerintah terlalu berhati-hati dalam mengatur keuangan negara dengan adanya double cover (defisit 3% dan utang pemerintah maksimal 60%). Indonesia cukup hanya dengan batas maksimal utang pemerintah di angka 60% dari PDB.  
                            
                                
                                    
                                        
                                            
                                                
                                                
                                                    
                                                        googletag.cmd.push(function() { googletag.display(""div-gpt-ad-parallax""); });
                                                    
                                                
                                                
                                            
                                        
                                    
                                
                            
                            
“Hati-hati itu harus, tetapi terlalu berhati-hati nggak bagus karena mengorbankan pertumbuhan ekonomi. Ketentuan 60% kita pertahankan, itu enggak boleh dilanggar, tetapi 3% longgarkan,” ujarnya kepada Bisnis, Rabu (10/6/2024).  
Piter berpendapat bahwa pemerintah perlu keleluasaan fiskal tanpa adanya batas defisit APBN, untuk mengejar pertumbuhan ekonomi lebih dari 5%. Selama ini, lanjutnya, dorongan fiskal lemah akibat kebijakan tersebut. 




Baca Juga :  Ekonom Khawatir Rasio Utang Tembus 60% PDB jika Batas Defisit APBN 3% Dihapus 




Tidak dapat dipungkiri, Indonesia membutuhkan cara untuk keluar dari middle income trap (MIT) menuju negara maju, sebagaimana cita-cita Indonesia Emas 2045.  
Untuk dapat meraih target tersebut, Piter melihat Indonesia membutuhkan uang yang lebih banyak untuk berhasil membentuk bonus demografi, bukan bencana demografi. 
""Ini yang harus dilakukan Prabowo. Untuk itu, harus membuka yang jadi kendala selama ini, kita kan kurang uang dan investasi. Perlu dorongan fiskal yang jauh lebih besar,” tuturnya.  
Meski demikian, langkah yang diambil bukan semata-mata langsung melonggarkan batas defisit yang telah tercanang dalam UU sejak 2003.  
Piter menegaskan bahwa relaksasi defisit patut memastikan belanja yang dikeluarkan efektif dan efisien, sehingga berdampak besar terhadap pertumbuhan ekonomi. Jika gagal, Indonesia harus menghadapi risiko utang yang menggunung.  
“Risikonya defisit kita melebar utang nambah dan pertumbuhan nggak tercapai. Jadi bisa [dilonggarkan] dengan syarat, 3% harus kita dorong agar fokus ke pertumbuhan dan syarat pengawasan yang lebih baik,” lanjutnya. 

                
    Cek Berita dan Artikel yang lain di Google
            News dan WA Channel"
Bank Dunia Ramal Defisit RI Tak Akan Lampaui 3% Meski Ada Program Makan Bergizi Gratis,2024-09-24T16:47:13.729Z,26 June 2024 12:49 WIB,Annasa Rizki Kamalina,https://search.bisnis.com/link?url=https%3A%2F%2Fekonomi.bisnis.com%2Fread%2F20240626%2F9%2F1777164%2Fbank-dunia-ramal-defisit-ri-tak-akan-lampaui-3-meski-ada-program-makan-bergizi-gratis,"Bisnis.com, JAKARTA – Bank Dunia atau World Bank memprediksikan defisit fiskal Indonesia tidak akan lebih dari 3% dalam lima tahun ke depan, sekalipun program makan bergizi gratis terlaksana secara langsung maupun bertahap pada pemerintahan presiden dan wakil presiden terpilih Prabowo-Gibran. 
Dalam laporan terbaru Bank Dunia Indonesia Economic Prospect edisi Juni 2024, kondisi fiskal diproyeksikan akan melonggar ke depannya karena pemerintah meningkatkan belanja sosial dan investasi publik, masih dalam batas defisit anggaran sebesar 3%. 
Bank Dunia meyakini dalam jangka menengah, defisit diproyeksikan akan stabil pada kisaran 2,5% dari produk domestik bruto (PDB).  
“Hal ini mengikuti peningkatan bertahap dalam pengeluaran untuk mengakomodasi program-program pemerintahan yang akan datang, termasuk yang terkait dengan investasi publik dan infrastruktur,” tulis Bank Dunia, dikutip Rabu (26/6/2024). 
                            
                                
                                    
                                        
                                            
                                                
                                                
                                                    
                                                        googletag.cmd.push(function() { googletag.display(""div-gpt-ad-parallax""); });
                                                    
                                                
                                                
                                            
                                        
                                    
                                
                            
                            
Pada dasarnya, Bank Dunia menilai sederet belanja sosial yang direncanakan dalam program ekonomi lima tahun mendatang memiliki potensi untuk meningkatkan pembentukan sumber daya manusia dalam kerangka fiskal yang berkelanjutan. 
Program populis yang merupakan inti dari kampanye pemilihan presiden menunjukkan peningkatan belanja sosial, termasuk melalui program-program yang sudah ada dan program-program baru. Baca JugaMakan Bergizi Gratis Rp71 Triliun, Indef: Beban APBN Makin Berat!Terungkap! Ini Warga Prioritas yang Terima Makan Bergizi Gratis PrabowoIni Proyeksi Bank Dunia soal Pertumbuhan Ekonomi RI hingga 2026
Utamanya, program makan bergizi gratis (MBG) atau yang Bank Dunia sebut sebagai makanan sekolah alias school meals.
Menurut perhitungan Bank Dunia, jika dilaksanakan secara penuh dan simultan, diperkirakan biaya dari program-program tersebut dapat mencapai 3% dari PDB pada tahun pertama (2025) dan sekitar 2% dari PDB setelahnya. 
“Implementasi bertahap ditambah dengan reformasi perpajakan, yang dapat menghasilkan pendapatan tambahan tahunan sebesar 1%-1,5% dari PDB, akan membantu pemerintah mematuhi aturan fiskalnya,” tulis Bank Dunia. 
Aturan fiskal tersebut telah membantu membangun kerangka kerja kebijakan makroekonomi yang transparan dan kredibel. Hal ini memungkinkan bagi Indonesia untuk berhasil menarik investasi, mendorong pertumbuhan, dan mengatasi guncangan eksternal.
Rencana Program Makan Bergizi Gratis (MBG) 
Laporan Bank Dunia tersebut meluncur bersamaan, secara terpisah, saat Menteri Keuangan Sri Mulyani Indrawati dan Menteri Koordinator bidang Perekonomian Airlangga Hartarto melaksanakan konferensi pers bersama Tim Gugus Sinkronisasi Prabowo-Gibran di Kantor Pusat Direktorat Jenderal Pajak, Senin (24/6/2024). 
Sri Mulyani mengungkapkan program milik Prabowo-Gibran berupa makan bergizi gratis akan dilaksanakan secara bertahap, sesuai dengan hasil rapatnya bersama Prabowo pada pekan lalu. 
“Bapak Prabowo telah menyampaikan beliau telah menyetujui program makanan bergizi gratis dilaksanakan secara bertahap,” ujarnya dalam konferensi pers. 
Mantan Direktur Pelaksana Bank Dunia (2010-2016) tersebut menyampaikan program dengan alokasi anggaran sekitar Rp71 triliun tersebut telah direcanakan masuk dalam Rancangan Anggaran Pendapatan dan Belanja Negara (RAPBN) 2025. 
Nantinya, tim Prabowo-Gibran yang dipimpin oleh Wakil Ketua DPR Sufmi Dasco, akan menyusun secara detail program makan bergizi gratis. 
Lebih lanjut, Bendahara Negara juga menuturkan bahwa presiden terpilih Prabowo Subianto telah berkomitmen untuk menjaga defisit Anggaran Pendapatan dan Belanja Negara (APBN) 2025 di bawah 3% dari PDB.
“Kami sudah menyampaikan juga kepada presiden terpilih Bapak Prabowo dan beliau juga memberikan keyakinan arahan bahwa beliau commit defisit di bawah 3%,” tuturnya.   
Angka tersebut sebagaimana postur APBN 2025 yang telah disepakati dalam Panja A Badan Anggaran (Banggar) DPR pekan lalu, yakni defisit tahun depan akan berada pada rentang 2,29% hingga 2,82% dari PDB atau di bawah 3%. 

                
    Cek Berita dan Artikel yang lain di Google
            News dan WA Channel"
