Title,Scrapping Date,Article Date,Author,Link,Content
Top 5 News Bisnisindonesia.id: Properti Bandung Mahal Hingga Kabar GOTO TikTok,2024-09-25T04:29:29.418Z,26 January 2024 08:00 WIB,Rinaldi Mohammad Azka,https://search.bisnis.com/link?url=https%3A%2F%2Fekonomi.bisnis.com%2Fread%2F20240126%2F9%2F1735659%2Ftop-5-news-bisnisindonesiaid-properti-bandung-mahal-hingga-kabar-goto-tiktok,"Bisnis, JAKARTA – Bandung tampil sebagai kota dengan pertumbuhan tercepat untuk popularitas bulanan sektor perumahan.Merujuk Flash Report Rumah123, di kawasan Jabodetabek dan Bandung, pertumbuhan popularitas tahunan masih dipimpin kota-kota di Jakarta dan sekitarnya, yaitu Jakarta Selatan 1,6%, Jakarta Utara 1,4%, Tangerang 0,6%, Tangerang Selatan 0,5%, dan Bogor 0,2%.
Namun jika menilik pertumbuhan popularitas bulanan, Bandung menjadi kota dengan pertumbuhan tercepat, yakni mencapai 1% disusul Bekasi 0,5%, Depok 0,4%, dan Jakarta Timur 0,3%.
Untuk diketahui, sepanjang tahun 2023, tren harga rumah di Indonesia mengalami kenaikan sebesar 2,9% (year-on-year/YoY). Di kawasan Jabodetabek dan Bandung, Bogor mengalami kenaikan tahunan tertinggi sebesar 3,8 persen, disusul Bekasi 3,3%, Tangerang 2,8%, Depok 2,4%, Jakarta 2%, dan Bandung 0,9%.
Di sisi lain, penjualan mobil sport utility vehicle (SUV) berpenggerak 4x4 sepanjang tahun lalu sangat bergairah di saat pasar otomotif secara nasional melemah.
                            
                                
                                    
                                        
                                            
                                                
                                                
                                                    
                                                        googletag.cmd.push(function() { googletag.display(""div-gpt-ad-parallax""); });
                                                    
                                                
                                                
                                            
                                        
                                    
                                
                            
                            
Gabungan Industri Kendaraan Bermotor Indonesia (Gaikindo) melaporkan, penjualan mobil SUV berpenggerak semua roda (all-wheel drive) pada 2023 melejit 37% dibandingkan dengan tahun sebelumnya 7.898 unit menjadi 10.837 unit.
Padahal, pasar otomotif secara nasional justru mengalami sedikit perlambatan. Pada 2023, penjualan mobil pada 2023 susut 1,5% dibandingkan dengan tahun sebelumnya 1.013.582 unit menjadi hanya 998.059 unit.
Pasar mobil petualang sejati terbagi dalam tiga segmen, yakni SUV 4x4 kecil bermesin kurang dari 1.500cc, segmen SUV 4x4 medium bermesin 1.501-3.000 cc, dan SUV 4x4 besar yang dilengkapi mesin lebih dari 3.000 cc.
Dua petikan berita tersebut merupakan bagian dari berita pilihan Bisnisindonesia.id yang disajikan secara analitik dan mendalam. Berikut sejumlah berita pilihan dari meja redaksi.
1. Melesatnya Harga Hunian di Bandung Terdampak Kereta Cepat Whoosh
Associate VP Marketing 99 Group Indonesia Firman Pamungkas Putra mengatakan permintaan akan hunian jual dan sewa di Bandung telah mengalami tren peningkatan sejak awal tahun 2023, terutama pada bulan Mei hingga bulan Agustus 2023 dengan permintaan bulanan tertinggi tercatat di bulan Mei 2023 dimana pertumbuhan minat hunian sewa mencapai 84,4% dan hunian jual 29,2%.
“Secara tahunan, sejak Desember 2022 hingga Desember 2023 pertumbuhan permintaan akan hunian sewa mencapai 68,6% dan hunian jual sebesar 37,1%,” ujarnya dalam laporan, Kamis (25/1/2024).
Kecenderungan peminat hunian di Bandung masih didominasi kalangan yang berasal maupun yang beraktivitas di kota Bandung itu sendiri, yakni mencapai 42,3 persen, disusul peminat dari Jakarta 25,5%, Kuta 6,3%, dan Surabaya 2,6%.
Salah satu faktor yang cukup signifikan menarik peminat dari Jakarta ditopang kehadiran Kereta Cepat Jakarta-Bandung (KCJB) yang memangkas perjalanan antar-kota tersebut menjadi sekitar 45 menit.
Pada bulan Oktober saat KCJB resmi beroperasi, Rumah123 mencatat adanya peningkatan permintaan di Bandung untuk hunian jual sebesar 18,6% dan hunian sewa sebesar 4,6%. Hal ini mengindikasikan keberadaan KCJB memberikan pengaruh terhadap permintaan hunian di area kota Bandung dan sekitarnya.
2. CEO GOTO Beri Kabar Terbaru Akuisisi Tokopedia Oleh TikTok
Chief Executive Officer (CEO) PT GoTo Gojek Tokopedia Tbk. (GOTO) Patrick Walujo menyampaikan kabar terbaru mengenai akuisisi saham Tokopedia oleh TikTok.
Patrick menuturkan akuisisi saham Tokopedia oleh TikTok hingga saat ini masih berjalan lancar dan tidak menemui kendala yang berarti. Dia berharap akuisisi ini dapat selesai tepat waktu, yakni di akhir kuartal I/2024.
""Semuanya masih oke, mudah-mudahan selesai kuartal I/2024. Mohon didoakan ya, supaya makin banyak promonya Tokopedia,"" kata Patrick ditemui Bisnis usai DealStreetAsia Indonesia PE-VC Summit 2024, di Jakarta, Kamis (25/1/2024).
Sebagaimana diketahui, pengambilalihan saham Tokopedia oleh TikTok dapat diakhiri dengan penjanjian tertulis antara GOTO dan TikTok oleh TikTok atau GOTO, jika penyelesaian belum terjadi pada 31 Maret 2024.
GOTO sebelumnya juga menjelaskan Tokopedia telah setuju untuk menerbitkan saham baru dan TikTok atau anak usaha yang ditunjuk setuju untuk mengambilbagian atas sejumlah 38,19 juta (38.198.745) saham baru Tokopedia atau mewakili 75,01% dari seluruh modal ditempatkan dan disetor penuh Tokopedia.
Dalam transaksi pengambilalihan saham ini, TikTok harus membayarkan sebesar US$840 juta atau setara Rp13,188 triliun kepada Tokopedia untuk dapat mengambilbagian atas saham baru tersebut.
3. Kelam Dibalik Gegap Gembita Investasi dan Hilirisasi
Menteri Investasi Bahlil Lahadalia tampak semringah saat memaparkan realisasi investasi 2023 yang berhasil memenuhi ekspektasi Presiden Joko Widodo, yakni mencapai Rp1.418,9 triliun.
Tidak hanya nilai investasi 2023 yang tumbuh 17,5% (year-on-year/YoY), angan-angan hilirisasi pun terealisasikan melalui berbagai kesepakatan. Realisasi investasi hilirisasi secara keseluruhan mencapai Rp375,4 triliun atau setara 26,5% dari total investasi tahun lalu.
Sepanjang 2023, investasi smelter tercatat mencapai Rp216,68 triliun, dengan 63% di antaranya atau Rp136,6 triliun merupakan investasi smelter nikel. Bahlil langsung memberi catatan, bahwa hilirisasi yang digenjot ke depannya bukan hanya nikel.
""Jadi, sekali lagi bahwa yang kita bangun smelter itu bukan hanya nikel, ini buktinya. Memang ke depan kita perlu dorong di sektor perikanan dan pertanian, kehutanan lebih masif lagi,"" ujar Bahlil, Rabu (24/1/2024).
Bahlil menolak pandangan bahwa hilirisasi hanya menyasar sektor pertambangan. Menurutnya, hilirisasi di pertambangan menjadi pintu masuk untuk berbagai sasaran investasi lainnya.
Pengembangan hilirisasi nikel yang masif turut diikuti oleh realisasi investasi ekosistem kendaraan listrik hingga Rp9,7 triliun sepanjang tahun lalu.
Pemerintah memang berharap hasil olahan nikel di Indonesia dapat diserap oleh industri kendaraan listrik, selain penggunaan utamanya untuk peralatan rumah tangga, alat medis, bahan kosmetik, hingga komponen mesin.
Bahlil menyebut bahwa pada fase awal hilirisasi tembaga dan nikel, niliai ekspor komoditas itu mencapai US$3,3 miliar pada 2017—2018. Setelah pemerintah menghentikan ekspor nikel mentah pada Oktober 2019 dan mengolahnya di dalam negeri, nilai ekspor pun meningkat hingga mencapai US$33 miliar.
4. Prospek Cerah Utang Negara 2024
Pasar obligasi sepanjang 2024 masih berpeluang mengalami peningkatan kinerja seiring dengan potensi penurunan suku bunga acuan oleh bank sentral. Sementara itu, Surat Berharga Negara (SBN) akan memiliki peningkatan daya tarik bagi para investor.Kepala Departemen Riset dan Informasi Pasar PT Penilai Harga Efek Indonesia (PHEI) Roby Rushandie mengatakan saat ini pasar masih akan mencermati kebijakan dovish The Fed. Pasar yang wait and see juga mempertimbangkan Pemilu Indonesia dan Amerika Serikat serta eskalasi konflik Timur Tengah.
“Prospek pasar obligasi tahun ini berpeluang mengalami kenaikan kinerja jika bank sentral menurunkan suku bunga acuan,” kata Roby kepada Bisnis, Kamis (25/1/2024).
Obligasi negara atau SBN juga akan menarik perhatian investor terlebih peringkat surat utang RI diperkirakan masih bertahan seiring dengan stabilnya outlook pertumbuhan ekonomi, dan masih tingginya risiko eksternal yang dapat berpengaruh terhadap kondisi APBN.
Roby menjelaskan SBN dengan tenor pendek menjadi pengaman dari risiko seiring dengan masih tingginya ketidakpastian. Sementara SBN dengan tenor panjang untuk mendapatkan peluang yield tinggi di tengah proyeksi perlambatan ekonomi.
5. Laju Garang Pasar Mobil Petualang
Model-model SUV 4x4 medium masih mendominasi pasar, meski dua segmen lainnya menunjukkan kontribusi yang semakin membesar. Pada 2023, mobil SUV 4x4 medium mendominasi pasar 57%, dan sisanya disumbangkan SUV 4x4 kecil (15%), dan SUV 4x4 besar (29%).
Model SUV 4x4 kecil di antaranya Suzuki Jimny, Audi Q3, dan Kia EV6. Sementara di segmen SUV 4x4 terdapat Mitsubishi Pajero Sport, Nissan Terra, hingga Subaru XV.
Adapun SUV 4x4 yang tergolong besar di antaranya BMW XM, Jeep Gladiator, Mazda CX-60, Mercedes Benz G, hingga Toyota Land Cruiser.
Masuknya model-model terbaru ke pasar menjadi pendorong laju garang pasar mobil petualang. Sepanjang tahun lalu, pasar mobil petualang sejati disemarakkan oleh sedikitnya 41 model, yang mana sebanyak 17 di antaranya merupakan pendatang baru.
Mereka yang menjadi pendatang baru adalah Mercedes Benz GLE, Jeep Wrangler, Isuzu MUX, Mazda CX-5, Subaru Crosstrek, Nissan Terra, Mazda CX-60, dan Mercedes Benz GLS. Lalu ada Subaru WRX, Subaru Outback, Jeep Gladiator, BMW XM, dan Jeep Grand Cherokee.
Mobil berteknologi listrik pun turut menyetrum pasar, mulai dari BMW iX, Mercedes Benz EQS, hingga Kia EV6 dan Kia EV9.


                
    Cek Berita dan Artikel yang lain di Google
            News dan WA Channel"
"Suku Bunga dan Harga BBM Naik, Peluang SBN Ritel Makin Mentereng",2024-09-25T04:29:29.806Z,07 September 2022 17:00 WIB,,https://search.bisnis.com/link?url=https%3A%2F%2Fmarket.bisnis.com%2Fread%2F20220907%2F92%2F1575013%2Fsuku-bunga-dan-harga-bbm-naik-peluang-sbn-ritel-makin-mentereng,"Bisnis.com, JAKARTA – Pasar Surat Berharga Negara (SBN) ritel diprediksi akan tetap menarik hingga akhir tahun ini. Potensi imbal hasil (yield) atau kupon yang naik seiring dengan tren suku bunga akan menjadi katalis utama.Saat ini, pemerintah tengah menawarkan sukuk ritel (SR) seri SR017 dengan tingkat kupon 5,9 persen. Berdasarkan data yang dilansir dari salah satu mitra distribusi daring Rabu (7/9/2022) sekitar pukul 14.00 WIB, total penjualan SR017 telah menyentuh Rp19,91 triliun dari kuota sebanyak Rp22,5 triliun."
"Top 5 News Bisnisindonesia.id: Prospek SBN Ritel, Rekam Jejak Ekonomi Hingga Harga BBM",2024-09-25T04:29:30.155Z,17 August 2022 10:43 WIB,Nurbaiti,https://search.bisnis.com/link?url=https%3A%2F%2Fmarket.bisnis.com%2Fread%2F20220817%2F92%2F1567728%2Ftop-5-news-bisnisindonesiaid-prospek-sbn-ritel-rekam-jejak-ekonomi-hingga-harga-bbm,"Bisnis.com, JAKARTA — Antusiasme investor terhadap seri baru surat berharga negara (SBN) ritel yang bakal segera dirilis, yakni sukuk ritel seri SR017, diyakini bakal tak kalah tingginya dibandingkan dengan seri sebelumnya, apalagi di tengah terbatasnya pilihan instrumen investasi yang stabil saat ini.Menariknya, berbeda dibanding dugaan sejumlah analis, pemerintah justru menawarkan kupon sebesar 5,90 persen per tahun pada instrumen ini, lebih tinggi ketimbang seri SBN ritel yang terbit sebelumnya, yakni SBR011 yang sebesar 5,50 persen.Ini juga bakal menjadi instrumen SBN ritel dengan kupon tertinggi sejak SR013 yang terbit pada akhir September 2020. Seri tersebut mendapatkan kupon 6,05 persen per tahun. Sejak itu, seri SBN ritel lainnya yang terbit setelahnya memiliki kupon di bawah 5,70 persen per tahun. Adapun, SR017 memiliki karakteristik yakni dapat diperdagangkan di pasar sekunder (tradable) setelah holding period selama 3 bulan.Ulasan tentang prospek sukuk ritel seri SR017 yang menawarkan kupon sebesar 5,90 persen per tahun, tertinggi sejak September 2020 menjadi salah satu pilihan Bisnisindonesia.id, selain beragam kabar ekonomi dan bisnis yang dikemas secara mendalam dan analitik tersaji dari meja redaksi Bisnisindonesia.id.
                            
                                
                                    
                                        
                                            
                                                
                                                
                                                    
                                                        googletag.cmd.push(function() { googletag.display(""div-gpt-ad-parallax""); });
                                                    
                                                
                                                
                                            
                                        
                                    
                                
                            
                            Berikut intisari dari top 5 News Bisnisindonesia.id yang menjadi pilihan editor, Rabu (17/8/2022): 1. Mengurai Rekam Jejak Ekonomi Jelang Nota Keuangan RAPBN 2023Pertumbuhan ekonomi domestik yang solid, tren inflasi yang meningkat, keberlanjutan subsidi bahan bakar, tantangan geopolitik dan ketidakpastian ekonomi global, menjadi sejumlah catatan menjelang pembacaan Nota Keuangan RAPBN 2023 oleh Presiden Joko Widodo pada Selasa (16/8/2022).Dalam pidato tentang Rancangan Undang-Undang APBN 2023 beserta nota keuangannya, Presiden Jokowi menyebutkan bahwa Indonesia berhasil mengatasi pandemi dan memulihkan ekonomi dengan cepat.Hal itu tecermin dari pemulihan ekonomi Indonesia yang berada dalam tren yang terus menguat, tumbuh 5,01 persen pada kuartal I/2022 dan menguat signifikan menjadi 5,44 persen kuartal II/2022.Namun, pemerintah mewaspadai adanya tekanan ekonomi dari eksternal. Dana Moneter Internasional  atau International Monetary Fund (IMF) pada tahun ini menurunkan proyeksi ekonomi, dari 3,6 persen menjadi 3,2 persen untuk 2022. 2. Tawarkan Kupon Tinggi, Prospek SBN Ritel SR017 Bakal CerahDirektorat Jenderal Pengelolaan Pembiayaan dan Risiko (DJPPR), Kementerian Keuangan, telah mengumumkan rencana penerbitan SR017. Instrumen ini bakal segera dapat dibeli oleh investor ritel sejak Jumat (19/8/2022) pukul 09.00 WIB mendatang.Periode penawaran akan berlangsung hingga Rabu (14/9/2022) pukul 10.00 WIB. Investor dapat memesan instrumen itu setiap saat secara online selama periode pemasaran tersebut melalui 31 mitra distribusi (midis) yang telah ditunjuk oleh pemerintah.Tahun ini, pemerintah telah menerbitkan empat seri SBN ritel sebelum seri SR017 ini. Ini merupakan seri sukuk ritel kedua yang terbit tahun ini. Sebelumnya, SR016 terbit pada Maret 2022 lalu berhasil terserap Rp18,44 triliun dengan kupon yang diberikan yakni sebesar 4,95 persen per tahun.Dengan demikian, terlihat bahwa kupon yang diberikan pada SR017 ini jauh lebih tinggi ketimbang seri pendahulunya yang sejenis. Lantas, apakah minat investor bakal tinggi pula terhadap instrumen ini? 3. Utang Pemerintah, RAPBN 2023 Butuh Dana Rp598,2 TriliunHingga Juli 2022 utang pemerintah RI tercatat naik menjadi Rp7.163,1 triliun. Dengan begitu, utang pemerintah naik Rp40 triliun dibandingkan periode Juni 2022 sebesar Rp7.123 triliun. Sementara itu, rasio utang terhadap produk domestik bruto (PDB) atau debt to GDP per Juli 2022 mencapai 37,91 persen, turun tipis dibandingkan bulan sebelumnya sebesar 39,56 persen.Pemerintah memproyeksikan defisits anggaran pada RAPBN 2023 sebesar 2,85 persen dari PDB.  Proyeksi tersebut setara dengan Rp598,2 triliun.Defisit anggaran biasanya akan ditutup dengan mencari sumber pembiayaan, baik dalam bentuk pinjaman atau dengan menjual surat utang melalui mekanisme pasar.Terkait dengan surat utang negara, Presiden Jokowi saat menyampaikan pidato nota keuangan, Selasa (16/8/2022) menyebutkan untuk surat utang negara berjangka 10 tahun diberlakukan suku bunga sebesar  7,85 persen.Presiden Jokowi dalam pidatonya menyampaikan bahwa pembiayaan pembangunan akan dicari dari sumber yang  aman dan dikelola dengan hati hati. Pemerintah, lanjut Presiden, berkomitmen untuk menjaga keberlanjutan fiskal.Presiden juga menyebutkan bahwa tingkat rasio utang akan selalu dijaga agar tetap aman. Selain itu, Presiden menyatakan tentang pendalaman pasar keuangan. 4. Menanti Akhir dari Sinyal Kuat Kenaikan Harga BBM SubsidiOpsi menaikkan harga bahan bakar minyak (BBM) jenis Pertalite terus diembuskan, baik dari kalangan pemerintah maupun praktisi ekonomi, sejalan dengan tren konsumsi komoditas subsidi itu yang kian hari makin tidak terkendali.Di sisi lain, keinginan pemerintah agar kuota BBM subsidi tidak jebol demi menjaga postur Anggaran Pendapatan dan Belanja Negara (APBN) tidak makin berat karena subsidi, masih dinilai setengah hati.Hingga kini, pemerintah tak kunjung menerbitkan revisi Peraturan Presiden Nomor 191 Tahun 2014 yang menjadi payung hukum untuk melakukan pembatasan.Kendati Jokowi dalam berbagai kesempatan secara tidak langsung memberikan sinyal kalau APBN tidak akan selamanya kuat menanggung beban subsidi yang kian membengkak seiring dengan lonjakan konsumsi dan harga minyak mentah dunia, nyatanya hingga hari ini pemerintah masih menahan harga Pertalite, Solar, dan LPG 3 kilogram yang sempat diwacanakan pemerintah sejak awal tahun ini. 5. Naskah Lengkap Pidato Presiden Jokowi dalam Sidang Tahunan 2022Presiden Joko Widodo menyampaikan Pidato Kenegaraan dalam rangka Hari Ulang Tahun ke-77 Republik Indonesia di Gedung Nusantara, Jakarta, Selasa (16/8/2022) pagi.Pidato yang disampaikan dalam Sidang Tahunan MPR RI serta Sidang bersama DPR RI dan DPD RI Tahun 2022 itu berisi tentang tantangan dan kesempatan bagi Indonesia untuk dapat menjadi negara yang inklusif, berkeadilan, dan berkelanjutan.Seperti tahun-tahun sebelumnya, Presiden Jokowi juga menggunakan busana khas daerah Nusantara. Tahun ini, Presiden Jokowi mengenakan busana adat dari Provinsi Bangka Belitung, yakni Baju Paksian dengan dominasi warna hijau dan memiliki motif pucuk rebung.


                    
                
    Cek Berita dan Artikel yang lain di Google
            News dan WA Channel"
