Title,Scrapping Date,Article Date,Author,Link,Content
Utang Obligasi Hantui Kinerja PTPP dan WIKA Semester II/2024,2024-08-19T15:41:28.243Z,09 July 2024 16:20 WIB,,https://search.bisnis.com/link?url=https%3A%2F%2Fmarket.bisnis.com%2Fread%2F20240709%2F192%2F1780770%2Futang-obligasi-hantui-kinerja-ptpp-dan-wika-semester-ii2024,"Bisnis.com, JAKARTA – Dua emiten BUMN Karya, PT PP (Persero) Tbk. (PTPP) dan PT Wijaya Karya (Persero) Tbk. (WIKA) bakal menghadapi utang obligasi yang jatuh tempo pada semester II/2024. Strategi pengelolaan kas kini tengah disiapkan keduanya.Berdasarkan data Kustodian Sentral Efek Indonesia (KSEI), PTPP akan menghadapi pembayaran Obligasi Berkelanjutan II PTPP Tahap II Tahun 2019 Seri B senilai Rp250 miliar. Surat utang dengan bunga 8,5% ini jatuh tempo pada 27 November 2024."
Saran untuk Investor Obligasi dari Pelaku Pasar Global,2024-08-19T15:41:28.554Z,18 June 2024 07:16 WIB,Anggara Pernando,https://search.bisnis.com/link?url=https%3A%2F%2Fmarket.bisnis.com%2Fread%2F20240618%2F92%2F1774821%2Fsaran-untuk-investor-obligasi-dari-pelaku-pasar-global,"Bisnis.com, JAKARTA -- Para investor surat utang masih harus menunggu langkah bank sentral Amerika Serikat, The Fed, untuk dapat membalikkan kinerja investasi yang dilakukan dalam surat utang negara berkembang.
Dalam laporan Bloomberg, Selasa (18/6/2024), para investor obligasi pasar negara berkembang mencatatkan kerugian sekitar 1% tahun ini, membalik kondisi keuntungan 6% pada 2023. Sementara itu, para investor yang bertaruh ke dolar Amerika Serikat dalam investasinya telah menghasilkan keuntungan sebesar 2,5% sepanjang tahun berjalan.
""The Fed merupakan hambatan yang signifikan bagi kemajuan di paruh kedua,"" kata Rajeev De Mello, manajer portofolio makro global di GAMA Asset Management SA di Singapura.
Dia menjelaskan semua bank sentral di seluruh dunia, bahkan di luar negara berkembang, berharap bahwa The Fed akan membantu mereka dengan tetap berpegang pada rencana awal penurunan suku bunga.
                            
                                
                                    
                                        
                                            
                                                
                                                
                                                    
                                                        googletag.cmd.push(function() { googletag.display(""div-gpt-ad-parallax""); });
                                                    
                                                
                                                
                                            
                                        
                                    
                                
                            
                            
Meningkatnya tanda-tanda kebijakan hawkish (mendukung kebijakan suku bunga acuan tinggi) oleh The Fed telah memicu aksi jual investor. Ini terlihat pada ETF Obligasi Mata Uang Lokal VanEck JP Morgan EM senilai US$2,7 miliar, ETF terbesar di dunia yang digunakan sebagai indikator melacak utang negara berkembang, telah mengalami arus keluar bersih selama 3 bulan terakhir.
Nilai Muncul Kembali Meski tekanan meningkat, sejumlah investor masih melihat kemungkinan pasar obligasi akan bangkit lagi.Baca JugaHistori Dividen Unilever (UNVR) 5 Tahun Terakhir Jelang RUPS 20 JuniJadwal Cum Dividen 18 Emiten Pekan Ini: Ada ACES, DVLA, Hingga KEENDaftar 10 Tabungan Bank Bebas Biaya Administrasi Bulanan
Investor menyebut telah memperhitungkan risiko penurunan suku bunga The Fed termasuk risiko politik di Meksiko dan Brasil.
“Ini mungkin terlihat lebih menarik dibandingkan beberapa bulan terakhir,” kata Shamaila Khan, kepala pendapatan tetap untuk pasar negara berkembang dan Asia Pasifik di UBS Asset Management di New York.
Menurut Shamaila, pertumbuhan ekonomi domestik memiliki potensi untuk berkinerja cukup baik hingga akhir tahun ini tidak peduli suku bunga The Fed turun satu atau dua kali.
Daniel Wood, fund manager di William Blair menyebut pihaknya belanja surat utang 12%-15% di pasar negara berkembang. ""Dengan batas risiko 1% di setiap pasar, jadi lakukan diversifikasi yang baik di sana,"" katanya.
Dia menjelaskan investasi obligasi yang dilakukan termasuk ke Kenya, Nigeria dan Pakistan. “Sekarang Anda berada di posisi yang tepat di mana Anda menikmati high carry dengan dukungan multilateral yang kuat.”
Meski demikian, tidak semua investor bersikap bullish. Leonard Kwan, fund manager T. Rowe Price, mengatakan investor mungkin harus menunggu beberapa saat hingga obligasi lokal negara berkembang kembali melanjutkan kenaikannya.
“Mungkin terjadi pada akhir tahun ini atau hingga paruh pertama tahun depan,” katanya.



                    
                
    Cek Berita dan Artikel yang lain di Google
            News dan WA Channel"
"Genjot Pertumbuhan di Semester II/2024, INPP Bakal Terbitkan Obligasi Korporasi",2024-08-19T15:41:28.904Z,08 June 2024 17:01 WIB,Dwi Rachmawati,https://search.bisnis.com/link?url=https%3A%2F%2Fmarket.bisnis.com%2Fread%2F20240608%2F92%2F1772350%2Fgenjot-pertumbuhan-di-semester-ii2024-inpp-bakal-terbitkan-obligasi-korporasi,"Bisnis.com, JAKARTA - PT Indonesian Paradise Property Tbk. (INPP) membeberkan rencana aksi strategis korporasi untuk menggenjot pertumbuhan pada semester II/2024.
Rapat Umum Pemegang Saham Tahunan (RUPS) menghasilkan persetujuan bagi INPP untuk menerbitkan obligasi korporasi. Adapun, rencananya obligasi tersebut bakal digunakan untuk proyek komersial, usaha perhotelan, dan inisiatif pengembangan properti.
Presiden Direktur & CEO INPP Anthony P Susilo mengatakan, perseroan optimistis dapat tumbuh lebih pesat dan meraih pendapatan yang signifikan melalui aliran pendapatan berulang. Selain itu, menurut Anthony, aksi korporasi menerbitkan obligasi bakal mendapat respons positif dari publik seiring keberhasilan sebelumnya mempertahankan momentum pertumbuhan melalui kontribusi recurring income.
""INPP berniat untuk mempercepat pertumbuhan dan memberikan nilai tambah bagi pemegang saham melalui aksi-aksi strategis ini,"" ujar Anthony dalam keterangan resmi, dikutip Sabtu (8/6/2024).
                            
                                
                                    
                                        
                                            
                                                
                                                
                                                    
                                                        googletag.cmd.push(function() { googletag.display(""div-gpt-ad-parallax""); });
                                                    
                                                
                                                
                                            
                                        
                                    
                                
                            
                            
Adapun, saat ini status peringkat INPP dari Pefindo yang telah diperbarui pada 7 Juni 2023 yaitu idBBB+ Stable. Peringkat tersebut diraih karena konsistensi INPP memenuhi target pendapatan melalui segmen reccurring income dan non-reccuring income.
Anthony menyebut, INPP mengalokasikan belanja modal hampir Rp1 triliun pada 2024 untuk kebutuhan proyek-proyek yang tengah berjalan dan akan datang.Baca JugaINPP Siapkan Capex Rp1 Triliun Tahun Ini, Minat Bangun Hotel di IKN?Ditopang Bisnis Hotel, Segini Bocoran Kinerja Paradise Indonesia (INPP) 2023Pertaruhan Paradise Indonesia (INPP) di Proyek Apartemen Antasari Place
Lebih lanjut, INPP disebut juga tengah mengembangkan dan menyelesaikan tiga proyek prestisius saat ini, antara lain apartemen Antasari Place di Jakarta, 23 Paskal Shopping Center di Bandung (Extension), dan 23 Semarang Shopping Center. 
""Sejalan dengan visi perusahaan untuk membangun proyek properti ikonik, INPP terus melakukan pengembangan properti mixed-use,"" katanya.
Sebagai informasi, INPP telah resmi dikeluarkan dari Papan Pemantauan Khusus melalui Keputusan Bursa Efek Indonesia (BEI) dalam Pengumuman Bursa No. Peng-CK00009/BEI.PLP/04-2024 ini mulai efektif pada hari Senin, 27 Mei 2024. Dengan dikeluarkannya dari papan pemantauan khusus maka saham INPP akan kembali menjadi penghuni papan pengembangan BEI.
INPP merupakan emiten di sektor properti saat ini memiliki 14 hotel yang tersebar di Jakarta, Bali, Batam, Yogyakarta, dan Makassar. Selain itu, INPP juga memiliki unit bisnis pengoperasian enam pusat perbelanjaan di Jakarta, Bandung dan Bali.


                    
                
    Cek Berita dan Artikel yang lain di Google
            News dan WA Channel"
"Obligasi Korporasi Terbatas, Imbal Hasil Reksa Dana Bisa Turun",2024-08-19T15:41:29.346Z,15 May 2024 06:45 WIB,Artha Adventy,https://search.bisnis.com/link?url=https%3A%2F%2Fmarket.bisnis.com%2Fread%2F20240515%2F92%2F1765455%2Fobligasi-korporasi-terbatas-imbal-hasil-reksa-dana-bisa-turun,"Bisnis.com, JAKARTA - Nilai surat utang atau obligasi korporasi yang jatuh tempo lebih tinggi dari realisasi penggalangan dana akan berimbas pada kinerja reksa dana yang lebih rendah karena meningkatnya harga obligasi dan turunnya imbal hasil yang ditawarkan. 
Berdasarkan data Pefindo, nilai surat utang korporasi yang jatuh tempo pada kuartal II/2024 mencapai Rp34,75 triliun. Di sisi lain, realisasi penggalangan dana hingga kuartal I/2024 mencapai Rp26,35 triliun, lebih rendah dari nilai jatuh tempo pada kuartal I/2024 sebesar Rp30,7 triliun. 
Chief Executive Officer (CEO) Pinnacle Investment Guntur Putra menyebutkan jika nilai surat utang korporasi yang jatuh tempo lebih besar dibandingkan dengan realisasi penggalangan dana maka akan berpotensi ketersediaan obligasi korporasi menjadi lebih terbatas. 
“Ini dapat menyebabkan peningkatan permintaan terhadap obligasi yang tersedia, yang pada gilirannya dapat meningkatkan harga obligasi dan menurunkan imbal hasilnya,” kata Guntur kepada Bisnis, Selasa (14/5/2024). 
                            
                                
                                    
                                        
                                            
                                                
                                                
                                                    
                                                        googletag.cmd.push(function() { googletag.display(""div-gpt-ad-parallax""); });
                                                    
                                                
                                                
                                            
                                        
                                    
                                
                            
                            
Guntur menjelaskan kinerja produk reksa dana berbasis obligasi korporasi mungkin menjadi lebih rendah, terutama jika manajer investasi kesulitan untuk mendapatkan obligasi dengan kualitas yang diinginkan. Risiko likuiditas dan risiko kredit adalah hal yang wajib diperhatikan jika berinvestasi di reksa dana berbasis obligasi korporasi. 
Untuk mengatasi hal tersebut, manajer investasi dapat mengadopsi beberapa strategi. Salah satunya adalah dengan memperluas jangkauan investasi, baik secara geografis maupun sektoral, untuk mencari obligasi korporasi yang sesuai. Baca JugaPotensi Investor Asing Kembali Borong SahamGrup PGN (PGAS) Saka Energi Lunasi Utang Obligasi Dolar ASPeluang Cuan Investasi di Pasar Saham & Obligasi Usai BI Naikkan Suku Bunga Acuan
Selain itu, mereka juga dapat meningkatkan kerjasama dengan perusahaan-perusahaan yang menerbitkan obligasi atau memanfaatkan pasar sekunder untuk memperoleh obligasi yang diinginkan. 
“Kebetulan di Pinnacle kami lebih fokus terhadap pengelolaan RD obligasi pemerintah,” kata dia. 
Perbesar
Beberapa faktor yang menjadi pertimbangan Pinnacle dalam memilih underlying instrumen surat utang korporasi antara lain kualitas kredit emiten, likuiditas pasar, jatuh tempo, tingkat suku bunga yang ditawarkan, serta faktor-faktor ekonomi dan politik yang dapat mempengaruhi kinerja obligasi tersebut.
Terkait proyeksi Kinerja, kata Guntur, secara umum reksa dana berbasis surat utang korporasi biasanya dipengaruhi oleh faktor-faktor seperti bunga yang ditawarkan oleh obligasi, kualitas kredit emiten, dan kondisi pasar secara umum. 
Dalam kondisi pasokan obligasi yang lebih terbatas seperti yang disebutkan sebelumnya, reksa dana berbasis obligasi korporasi mungkin menghadapi tantangan dalam mencapai imbal hasil yang kompetitif dibandingkan dengan produk berbasis Surat Berharga Negara (SBN), yang cenderung lebih likuid dan memiliki risiko kredit yang lebih rendah. 
“Namun, dengan manajemen investasi yang tepat dan pemilihan obligasi yang cermat, reksa dana berbasis surat utang korporasi masih dapat memberikan kinerja yang baik bagi investor,” imbuhnya. 
Senada, Direktur Panin Asset Management Rudiyanto menyebutkan dalam menghadapi situasi terbatasnya obligasi pihaknya aktif memperhatikan penawaran obligasi korporasi dari perusahaan sekuritas dan untuk reksa dana terproteksi. Meski demikian, masih diperlukan fasilitas untuk warehouse karena tanggal penerbitan reksa dana terproteksi belum tentu sama dengan obligasinya. 
Adapun beberapa pertimbangan dalam memilih reksa dana berbasis obligasi korporasi menurut Rudiyanto adalah memastikan peringkat obligasi korporasi minimum investment grade dan memastikan kesehatan keuangan perusahaan seperti rasio hutang masing-masing perusahaan,
“Kemudian laporan keuangan perusahaan yang masih menghasilkan pertumbuhan sales dan laba bersih setiap periode serta Good Corporate Governance,” imbuh Rudiyanto. 


                    
                
    Cek Berita dan Artikel yang lain di Google
            News dan WA Channel"
Top 5 New Bisnisindonesia.id: Saham BUMN Terprospektif hingga Risiko Investasi Obligasi,2024-08-19T15:41:29.717Z,10 January 2024 07:04 WIB,Fatkhul Maskur,https://search.bisnis.com/link?url=https%3A%2F%2Fmarket.bisnis.com%2Fread%2F20240110%2F189%2F1730946%2Ftop-5-new-bisnisindonesiaid-saham-bumn-terprospektif-hingga-risiko-investasi-obligasi,"Bisnis.com, JAKARTA—Saham-saham emiten BUMN terpantau menguat pada awal tahun ini mengungguli kinerja pasar secara rata-rata. Hal ini setidaknya terlihat dari kinerja IDX BUMN20 yang outperform terhadap IHSG. Sentimen pemilu disinyalir bakal menjadi penopang saham-saham BUMN tahun ini.
Berita bertajuk Menjaring Saham BUMN Paling Prospektif di Tahun Pemilu menjadi salah satu berita pilihan editor BisnisIndonesia.id. Selain berita tersebut, sejumlah berita menarik lainnya turut tersaji dari meja redaksi BisnisIndonesia.id.
Berikut ini sorotan utama Bisnisindonesia.id, Selasa (2/1/2024):
1. Menjaring Saham BUMN Paling Prospektif di Tahun Pemilu
                            
                                
                                    
                                        
                                            
                                                
                                                
                                                    
                                                        googletag.cmd.push(function() { googletag.display(""div-gpt-ad-parallax""); });
                                                    
                                                
                                                
                                            
                                        
                                    
                                
                            
                            
Saham-saham emiten BUMN terpantau menguat pada awal tahun ini mengungguli kinerja pasar secara rata-rata. Hal ini setidaknya terlihat dari kinerja IDX BUMN20 yang outperform terhadap IHSG. Sentimen pemilu disinyalir bakal menjadi penopang saham-saham BUMN tahun ini.
Sebagai gambaran, kinerja IDX BUMN20 hingga Senin (8/1/2024) kemarin sudah tumbuh 1,06% dibanding posisi akhir 2023 atau secara year-to-date (YtD). Di sisi lain, pertumbuhan IHSG baru sebesar 0,15% YtD.
Emite-emiten BUMN di indeks ini dengan kinerja cemerlang pada awal tahun ini didominasi oleh perbankan. Di urutan pertama ada PT Bank Syariah Indonesia Tbk. (BRIS) dengan pertumbuhan 12,64% YtD ke level Rp1.960 pada penutupan perdagangan hari ini, Selasa (9/1/2023).
Bank lainnya yakni PT Bank Tabungan Negara (Persero) Tbk. (BBTN) dengan pertumbuhan 6,40% YtD menjadi Rp1.330 dan PT Bank Raya Indonesia Tbk. (AGRO) sebesar 5,81% YtD menjadi Rp328.
2. Gontai Industri Minol Akibat Naik Cukai
Pemerintah menaikkan tarif cukai minumal beralkohol per awal tahun ini. Efeknya tak hanya pada kenaikan harga produk minuman keras itu.
Menteri Keuangan Sri Mulyani Indrawati resmi menaikkan cukai minuman beralkohol per 1 Januari 2024. Hal ini tertuang dalam PMK No.160/2023 tentang tarif Cukai Etil Alkohol, Minuman yang Mengandung Etil Alkohol, dan Konsentrat yang Mengandung Etil Alkohol.
Aturan ini menggantikan PMK No.158/2018 tentang Tarif Cukai Etil Alkohol, Minuman yang Mengandung Etil Alkohol, dan Konsentrat yang Mengandung Etil Alkohol.
Dalam lampirannya, pemerintah menetapkan bahwa tarif cukai MMEA golongan A dengan etil alkohol (EA) sampai dengan 5%, disesuaikan menjadi Rp16.500 per liter, baik untuk MMEA yang diproduksi di dalam maupun luar negeri atau impor.
Lalu, MMEA golongan B yang mengandung etil alkohol lebih dari 5% hingga 20% tarifnya disesuaikan menjadi Rp42.500 per liter untuk yang diproduksi di dalam negeri dan Rp53.000 per liter untuk yang impor.
Sementara, MMEA golongan C dengan kadar etil alkohol 20-55% dikenakan tarif Rp101.000 per liter untuk yang diproduksi di dalam negeri dan Rp152.000 per liter untuk yang impor.
Dibandingkan dengan tarif sebelumnya, kenaikan cukai tertinggi terjadi pada produk minuman alkohol golongan B dalam negeri naik 28,8% dan golongan C dalam negeri naik 26,3%.
3. Ada Peluang Premi Asuransi Umum Dekati Asuransi Jiwa
Dominasi pangsa pasar industri asuransi umum di Indonesia masih belum tergeser. Tiga lini paling jumbo antara lain asuransi harta benda atau properti, asuransi kendaraan bermotor, dan asuransi kredit.
Laporan Indonesia Financial Group (IFG) Progress menyampaikan pangsa pasar indutri asuransi umum di Indonesia masih didominasioleh tiga lini tersebut sepanjang 2022. Berdasarkan Economic Bulletin bertajuk Indonesia’s Insurance Product Snapshot yang dipublikasi pada 29 Desember 2023, pangsa pasar masing-masing ketiga lini usaha tersebut terhadap total industri asuransi umum sebesar 29%, 21%, dan 17%.
“Sehingga ketiga lini usaha tersebut sudah mendominasi hampir 70% industri asuransi umum di Indonesia,” demikian yang dikutip dari laporan IFG Progress, Selasa (9/1/2024).
Sementara itu, untuk klaim industri asuransi umum di Indonesia, kontribusi klaim terbesar juga berasal dari tiga lini usaha, yaitu asuransi kredit, asuransi harta benda, dan asuransi kendaraan bermotor. Masing-masing kontribusi klaim dari ketiga lini usaha trsebut sebesar 28%, 27%, dan 13%.
4. Ekspektasi Ekonomi Konsumen Terkikis Jelang Pemilu
Ekspektasi publik terhadap perekonomian dalam 6 bulan ke depan menyusut seiring dengan sejumlah indikator Indeks Ekspektasi Konsumen (IEK) yang menurun, baik dari sisi sulitnya mencari pekerjaan dan perlambatan dunia usaha.
Hasil survei Bank Indonesia (BI) mencatat, ekspektasi konsumen terhadap kondisi ekonomi 6 bulan ke depan terpantau turun dari November 2023 yang sebesar 134,2 poin menjadi 133,9 pada Desember 2023.
Sejumlah indikator yang berkaitan, seperti Indeks Ekspektasi Ketersediaan Lapangan kerja turun menjadi 129,9 dari 131,4 pada November 2023. Meski demikian, angka ini masih berada dalam zona optimis.
""Konsumen juga memperkirakan ketersediaan lapangan kerja pada 6 bulan mendatang mengalami penurunan,"" tulis BI dalam laporannya, dikutip Selasa (9/1/2024).
5. Menggali Risiko Investasi pada Obligasi
Investasi pada obligasi merupakan pilihan yang umum dalam portofolio keuangan. Namun, artikel ini akan menyoroti secara mendalam risiko yang terkait dengan jenis investasi ini, serta strategi pengelolaan yang dapat membantu investor menghadapi tantangan yang mungkin muncul.
Setidaknya ada 9 jenis risiko, mulai dari risiko tingkat bunga, risiko kredit, risiko likuiditas, risiko inflasi, risiko perubahan hukum dan peraturan, risiko mata uang, risiko reinvestasi, risiko prepayment, hingga risiko suku bunga rendah.
Terkait dengan risiko, maka penting untuk memahami strategi diversifikasi, termasuk alokasi aset yang bijaksana, dapat membantu mengelola risiko investasi pada obligasi. Manajemen risiko yang cermat menjadi kunci kesuksesan.
Dengan pemahaman yang mendalam tentang risiko-risiko ini, investor dapat mengambil keputusan investasi yang lebih terinformasi dan mengembangkan strategi pengelolaan risiko yang efektif untuk meminimalkan dampak negatif pada portofolio mereka.


                    
                
    Cek Berita dan Artikel yang lain di Google
            News dan WA Channel"
"Kinerja Pasar Modal 2023, OJK: IHSG Naik tapi Terjadi Outflow di Obligasi Korporasi",2024-08-19T15:41:30.067Z,09 January 2024 18:50 WIB,Annisa Kurniasari Saumi,https://search.bisnis.com/link?url=https%3A%2F%2Fmarket.bisnis.com%2Fread%2F20240109%2F7%2F1730837%2Fkinerja-pasar-modal-2023-ojk-ihsg-naik-tapi-terjadi-outflow-di-obligasi-korporasi,"Bisnis.com, JAKARTA — Otoritas Jasa Keuangan (OJK) merangkum kinerja dan capaian pasar modal Indonesia di 2023. Sepanjang tahun lalu, OJK mencatat Indeks Harga Saham Gabungan (IHSG) berhasil naik 6,16%, tetapi outflow asing terjadi di obligasi korporasi Rp0,92 triliun.
Kepala Eksekutif Pasar Modal, Keuangan Derivatif dan Bursa Karbon OJK Inarno Djajadi menuturkan selama 2023, kinerja IHSG menjadi yang tertinggi kedua di antara kinerja Bursa Asia Tenggara setelah Vietnam dengan menguat 6,16%. Nilai kapitalisasi pasar tumbuh mencapai Rp11,67 triliun atau 22,9%.
Dari sisi likuiditas transaksi, rata-rata nilai transaksi saham di Desember 2023 meningkat menjadi Rp10,75 triliun per hari, dibandingkan November 2023 yaitu Rp10,54 triliun per hari year to date (YTD).
Dia juga menuturkan capaian kinerja IHSG juga ditopang pertumbuhan jumlah investor pasar modal yang melanjutkan kenaikan double digit sebesar 18,04% menjadi 12,17 juta investor.
                            
                                
                                    
                                        
                                            
                                                
                                                
                                                    
                                                        googletag.cmd.push(function() { googletag.display(""div-gpt-ad-parallax""); });
                                                    
                                                
                                                
                                            
                                        
                                    
                                
                            
                            
""OJK optimistis ruang pertumbuhan industri pasar modal Indonesia masih luas untuk semakin memberikan kontribusi optimal bagi perekonomian nasional,"" tutur Inarno, dalam konferensi pers OJK, Selasa (9/1/2024).
Di pasar Surat Berharga Negara (SBN), selama 2023 yield atau imbal hasil SBN turun rata-rata 29,51 bps di seluruh tenor, dengan investor asing mencatatkan net buy sebesar Rp79,8 triliun year to date (YTD).Baca JugaOJK Beri Denda Miliaran Rupiah ke Pelaku Usaha Pasar Modal yang NakalKapan Transaksi Bitcoin Cs Diawasi OJK? Ini Kisi-kisinyaSempat Disindir Jokowi, OJK Ungkap Fakta Pembelian SBN oleh Bank
Sementara itu, untuk pasar obligasi korporasi, aliran dana keluar atau outflow investor asing sebesar Rp0,92 triliun selama 2023. Selama month to date (mtd) pasar obligasi korporasi per 29 Desember 2023 mencatatkan dana asing atau inflow Rp541,8 miliar.
Di industri pengelolaan investasi, nilai asset under management (AUM) per 29 Desember 2023 sebesar Rp824,73 triliun, dengan nilai aktiva bersih Rp501,46 triliun atau naik sebesar 1,77% mtd. Investor reksa dana membukukan net subscription sebesar Rp6,31 triliun mtd.
Kemudian secara ytd pada 2023, kinerja industri reksa dana relatif stabil dengan nilai aktiva bersih (NAB) turun 0,67%. Namun, masih mencatatkan net subscription Rp8,98 triliun.
Inarno juga menyampaikan penghimpunan dana di pasar modal pda 2023 masih tinggi sebesar Rp255,39 triliun, dengan emiten baru tercatat sebanyak 83 emiten hingga Desember 2023. Penghimpunan dana ini telah melampaui capaian target di 2023 sebesar Rp200 triliun. 


                    
                
    Cek Berita dan Artikel yang lain di Google
            News dan WA Channel"
