Title,Scrapping Date,Article Date,Author,Link,Content,Category
"The Fed turunkan suku bunga, simak seri SUN rekomendasi analis berikut",2024-09-24T16:13:43.098Z,"Kamis, 01 Agustus 2019 / 09:22 WIB",Reporter: Danielisa Putriadita | Editor: Herlina Kartika Dewi,https:////investasi.kontan.co.id/news/the-fed-turunkan-suku-bunga-simak-seri-sun-rekomendasi-analis-berikut,"KONTAN.CO.ID - JAKARTA. Harga Surat Utang Negara (SUN) pada perdagangan Kamis (1/8) berpotensi naik karena didorong penguatan nilai tukar rupiah terhadap dollar AS. I Made Adi Saputra Analis Fixed Income MNC Sekuritas mengatakan rupiah berpotensi menguat terhadap dollar AS karena pelaku pasar optimistis pada beberapa sentimen globlal. Diantaranya, rilis data suku bunga acuan The Fed yang turun sebesar 25 basis poin di level 2%-2,25%. ""Pemangkasan suku bunga tersebut dilakukan dengan mempertimbangkan kekhawatiran perlambatan ekonomi global dan kondisi inflasi Amerika,"" kata Made, dalam riset, Kamis (1/8). Made memproyeksikan penurunan suku bunga tersebut akan berdampak positif bagi harga SUN karena kondisi ini membuat pelaku pasar mencari aset yang lebih berkualitas (flight to quality) dari negara-negara berkembang yang menawarkan tingkat imbal hasil lebih baik, termasuk Indonesia. Di tengah kondisi ini, Made menyarankan investor untuk melakukan strategi trading di tengah pergerakan harga SUN yang berpotensi menguat. Investor juga harus tetap fokus pada pergerakan nilai tukar rupiah. Adapun seri menarik pada kondisi saat ini adalah FR0031, FR0034, FR0053, FR0063, FR0070, FR0056, FR0059, dan FR0071. Cek Berita dan Artikel yang lain di Google News",investasi
"Suku bunga The Fed diramal turun, yield SUN 10 tahun mentok di 7%",2024-09-24T16:13:43.140Z,"Rabu, 31 Juli 2019 / 20:20 WIB",Reporter: Intan Nirmala Sari | Editor: Wahyu T.Rahmawati,https:////investasi.kontan.co.id/news/suku-bunga-the-fed-diramal-turun-yield-sun-10-tahun-mentok-di-7,"KONTAN.CO.ID - JAKARTA. Momentum bank sentral Amerika Serikat (AS) Federal Reserve yang diramal memangkas suku bunga acuannya di akhir Juli 2019, dinilai mampu menggiring investor asing untuk melirik Surat Utang Negara (SUN). Tapi, yield untuk SUN tenor 10 tahun cenderung meningkat. Berdasarkan data Bloomberg di akhir Juli (31/7), imbal hasil SUN seri FR0078 sudah naik menjadi 7,33%. Sementara itu, yield US Treasury turun ke level 2,056% pada Selasa (30/7). Baca Juga: Yield SUN seri FR0078 hanya naik sementara Asal tahu saja, sepanjang 2019, yield untuk SUN seri FR0078 sempat menyentuh level tertingginya pada 22 Mei 2019 yakni di level 8,06%. Adapun level terendah yang pernah dicapai yakni 7,08% pada 16 Juli 2019. Direktur Utama Avrist Asset Management Hanif Mantiq mengatakan, jenis surat utang yang memiliki tenor 10 tahun masih akan cukup menarik. Harapannya, ke depan yield bisa turun di bawah 7,3%. Apalagi, jika The Fed menurunkan suku bunga acuannya, maka investor asing kemungkinan akan membeli SUN untuk mencari imbal hasil lebih tinggi. Hanif optimistis investor asing bakal melanjutkan pembelian SUN karena faktor di dalam negeri sudah cukup stabil, salah satunya kondisi politik. ""Untuk Agustus 2019, tren yield untuk tenor 10 tahun bakal berada di rentang 7% hingga 7,5%,"" kata Hanif kepada Kontan.co.id, Rabu (31/7). Baca Juga: Jelang Rapat The Fed, Lelang SUN Sepi Peminat premium Namun, jika suku bunga The Fed dijaga pada level saat ini, maka diperkirakan investor asing yang membeli SUN bakal berkurang. Sedangkan jika suku bunga The Fed dipangkas Juli 2019, Hanif menilai yield SUN untuk tenor 10 tahun masih sulit menyentuh level di bawah 7%. ""Yield bisa di bawah 7% kalau akhir tahun, karena sudah adjust dengan penurunan suku bunga hingga akhir tahun,"" jelasnya. Untuk tahun ini, Hanif memperkirakan The Fed bakal memangkas suku bunga acuannya sebanyak tiga kali. Adapun spread antara yield SUN dan US Treasury yang masih menarik bagi investor, yakni berada di kisaran 4% hingga 5%. Cek Berita dan Artikel yang lain di Google News",investasi
Harga SUN berpotensi turun jelang pengumuman suku bunga The Fed,2024-09-24T16:13:43.186Z,"Rabu, 31 Juli 2019 / 09:22 WIB",Reporter: Dimas Andi | Editor: Herlina Kartika Dewi,https:////investasi.kontan.co.id/news/harga-sun-berpotensi-turun-jelang-pengumuman-suku-bunga-the-fed,"KONTAN.CO.ID - JAKARTA. Harga Surat Utang Negara (SUN) diperkirakan akan bergerak dengan kecenderungan mengalami penurunan pada perdagangan Rabu (31/7). Namun, potensi penurunan tersebut relatif terbatas di tengah sikap para pelaku pasar yang menahan diri atau wait and see jelang pengumuman suku bunga acuan The Fed pada Rabu (31/7) waktu AS atau Kamis (1/8) dini hari waktu Indonesia. Dengan kondisi demikian, Analis Fixed Income MNC Sekuritas I Made Adi Saputra menyarankan kepada para investor untuk tetap mencermati arah pergerakan harga SUN. “Kami merekomendasikan kepada investor untuk melakukan strategi trading di tengah pergerakan harga SUN yang fluktuaktif,” ungkap dia dalam riset harian yang diterima Kontan.co.id. Sejumlah seri SUN dapat dipertimbangkan oleh para investor pada hari ini. Di antaranya adalah FR0031, FR0034, FR0053, FR0061, FR0063, FR0070, FR0056, FR0059 dan FR0064. Sebelumnya, harga SUN mengalami penurunan pada perdagangan kemarin seiring melemahnya nilai tukar rupiah terhadap dollar AS di tengah penantian rilis suku bunga acuan AS. Harga rata-rata SUN tenor pendek atau satu tahun hingga empat tahun mengalami penurunan terbatas sebanyak 3 basis poin (bps) yang berdampak pada kenaikan imbal hasil rata-rata sebesar 1,1 bps. Harga rata-rata SUN tenor menengah atau lima tahun hingga tujuh tahun mengalami penurunan hingga 10 bps yang mendorong kenaikan imbal hasil rata-rata sebesar 6 bps. Adapun harga SUN tenor panjang atau di atas tujuh tahun mengalami penurunan sekitar 120 bps yang mengakibatkan imbal hasil rata-ratanya naik sebesar 12 bps. Cek Berita dan Artikel yang lain di Google News",investasi
Ekspektasi pemangkasan suku bunga akan memicu penurunan yield SUN berkelanjutan,2024-09-24T16:13:43.837Z,"Kamis, 11 Juli 2019 / 21:04 WIB",Reporter: Dimas Andi | Editor: Yudho Winarto,https:////investasi.kontan.co.id/news/ekspektasi-pemangkasan-suku-bunga-akan-memicu-penurunan-yield-sun-berkelanjutan,"KONTAN.CO.ID - JAKARTA. Ekspektasi penurunan suku bunga acuan oleh Federal Reserve pada akhirnya akan berefek positif bagi pasar obligasi Indonesia. Yield Surat Utang Negara (SUN) pun berpeluang melanjutkan tren penurunan secara berkelanjutan. Sebagai catatan, yield SUN seri acuan 10 tahun per hari ini (11/7) berada di level 7,19%. Head of Economic & Research UOB Indonesia Enrico Tanuwidjaja memproyeksikan, jika Federal Reserve jadi memangkas suku bunga acuan AS hingga 50 bps di sisa tahun ini, yield SUN seri acuan 10 tahun bisa turun maksimal hingga 6,75% pada akhir tahun nanti. Ia mengaku, masih sangat sulit bagi yield SUN berada di bawah level 6,5% seperti yang terjadi di awal tahun 2018 lalu. Ini mengingat kondisi fundamental ekonomi Indonesia sudah mengalami perbedaan yang cukup signifikan. “Defisit transaksi berjalan Indonesia harus ditekan kalau ingin yield SUN turun lebih dalam,” ujarnya, Kamis (11/7). Kendati demikian, hal itu bukan sesuatu yang buruk bagi pasar obligasi Indonesia. Pasalnya, di saat yang sama yield US Treasury juga dipastikan bakal turun ketika The Fed memangkas suku bunga acuan. Belum lagi, tingkat inflasi tahunan Indonesia juga masih stabil di kisaran 3,5%. “Real interest rate Indonesia masih sangat menarik,” ucap Enrico. Berkat keunggulan tersebut, pasar obligasi Indonesia tetap berpotensi dibanjiri permintaan dari investor domestik maupun mancanegara. Sementara itu, Head of Research & Consulting Infovesta Utama Edbert Suryajaya juga memandang, yield SUN 10 tahun Indonesia bakal tetap berada di area 7% sekalipun ekspektasi penurunan suku bunga acuan terus meningkat. Sebab, potensi penurunan suku bunga acuan terjadi di saat kondisi perekonomian global sedang kurang stabil seiring perang dagang yang tak kunjung usai. ""Artinya masih ada ancaman yang bisa mengganggu stabilitas pasar obligasi dalam negeri,"" tuturnya. Walau begitu, Edbert sepakat, adanya ancaman yang bisa membatasi laju penurunan yield SUN tidak akan sampai mengurangi daya tarik pasar obligasi domestik. Apalagi, Indonesia telah mendapat kenaikan peringkat utang dari S&P Global Ratings sehingga kepercayaan dari para investor tetap terjaga. Cek Berita dan Artikel yang lain di Google News",investasi
"The Fed pertahankan suku bunga, harga SUN berpotensi naik",2024-09-24T16:13:43.879Z,"Kamis, 20 Juni 2019 / 09:30 WIB",Reporter: Dimas Andi | Editor: Wahyu T.Rahmawati,https:////investasi.kontan.co.id/news/the-fed-pertahankan-suku-bunga-harga-sun-berpotensi-naik,"KONTAN.CO.ID - JAKARTA. Harga Surat Utang Negara (SUN) diperkirakan akan kembali melanjutkan tren kenaikan pada perdagangan Kamis (20/6). Hal ini seiring dengan hasil FOMC meeting yang menyatakan bahwa Federal Reserve tetap mempertahankan suku bunga acuan AS di level 2,25%-2,50%. Hasil tersebut berdampak pada melemahnya nilai tukar dollar AS terhadap berbagai mata uang utama dunia, sehingga mengakibatkan harga SUN cenderung naik. “Di samping itu, masih tingginya aliran modal asing yang masuk di pasar SUN akan menjadi katalis bagi pergerakan harga SUN hari ini,” ungkap Analis Fixed Income MNC Sekuritas I Made Adi Saputra dalam riset yang diterima Kontan.co.id. Dengan beberapa faktor tadi, Made menyarankan kepada investor untuk tetap mencermati arah pergerakan harga SUN di pasar sekunder. Beberapa seri SUN dinilai masih cukup menarik untuk ditransaksikan di tengah tren kenaikan harga yang terjadi. Seri-seri SUN yang dimaksud antara lain FR0053, FR0061, FR0063, FR0070, FR0056, FR0059, FR0064, FR0071, FR0073 dan FR0058. Sebelumnya, harga SUN mencatatkan kenaikan pada perdagangan Rabu (19/6) lalu. Kenaikan ini didorong oleh penguatan kurs rupiah akibat adanya sentimen domestik dan global. Harga rata-rata SUN tenor pendek atau 1—4 tahun mengalami kenaikan sebesar 9 bps yang mengakibatkan menurunnya imbal hasil rata-rata sekitar 0,5—6 bps. Harga rata-rata SUN tenor menengah atau 5—7 tahun naik sekitar 13—47 bps yang mendorong terjadinya penurunan imbal hasil rata-rata sekitar 3—11 bps. Di sisi lain, harga rata-rata SUN tenor panjang atau di atas 7 tahun bergerak turun sebesar 5 bps yang mengakibatkan penurunan imbal hasil rata-rata sebesar 32 bps. Cek Berita dan Artikel yang lain di Google News",investasi
Sinyal Pemangkasan Suku Bunga The Fed Jadi Angin Segar untuk Pasar SUN,2024-09-24T16:13:44.137Z,,Premium User Only,https:////insight.kontan.co.id/news/sinyal-pemangkasan-suku-bunga-the-fed-jadi-angin-segar-untuk-pasar-sun,Premium Content - Not Scraped,insight
Harga SUN berpotensi naik terbatas jelang pengumuman suku bunga acuan AS,2024-09-24T16:13:44.179Z,"Rabu, 19 Juni 2019 / 09:25 WIB",Reporter: Dimas Andi | Editor: Herlina Kartika Dewi,https:////investasi.kontan.co.id/news/harga-sun-berpotensi-naik-terbatas-jelang-pengumuman-suku-bunga-acuan-as,"KONTAN.CO.ID - JAKARTA. Harga Surat Utang Negara (SUN) diperkirakan akan bergerak dengan kecenderungan naik pada perdagangan Rabu (19/6).  Namun, potensi kenaikan tersebut akan terbatas mengingat para pelaku pasar cenderung menahan diri dan melakukan aksi wait and see jelang pengumuman suku bunga acuan AS oleh The Federal Reserves. Dengan demikian, Analis Fixed Income MNC Sekuritas I Made Adi Saputra menyarankan investor untuk tetap mencermati arah pergerakan harga SUN di pasar sekunder. “Kami merekomendasikan investor untuk melakukan strategi trading dengan fokus kepada pergerakan nilai tukar rupiah,” ungkap dia dalam riset harian yang diterima Kontan.co.id. Beberapa seri SUN cukup menarik untuk dipertimbangkan oleh investor pada hari ini. Di antaranya adalah FR0053, FR0061, FR0043, FR0063, FR0070, FR0077, FR0056, FR0059 dan FR0068. Sebagai informasi, harga SUN bergerak bervariasi dengan kecenderungan naik pada perdagangan Selasa (18/4) lalu. Hal ini dipicu oleh penguatan kurs rupiah di tengah penantian para pelaku pasar terhadap hasil pertemuan FOMC. Harga rata-rata SUN tenor pendek atau 1 tahun—4 tahun mengalami kenaikan sekitar 7,7 bps yang berdampak pada penurunan imbal hasil rata-rata sebesar 6 bps. SUN tenor menengah atau 5 tahun—7 tahun mengalami kenaikan harga rata-rata sebesar 19,2 bps yang mendorong terjadinya penurunan imbal hasil rata-rata berkisar antara 1,3 bps hingga 5 bps. Adapun SUN tenor panjang atau di atas 7 tahun mengalami penurunan harga rata-rata sebesar 29,2 bps yang mengakibatkan kenaikan imbal hasil rata-rata sebesar 91,2 bps. Cek Berita dan Artikel yang lain di Google News",investasi
Harga SUN berpotensi naik setelah suku bunga AS tak berubah,2024-09-24T16:13:44.229Z,"Jumat, 01 Februari 2019 / 10:07 WIB",Reporter: Danielisa Putriadita | Editor: Yudho Winarto,https:////investasi.kontan.co.id/news/harga-sun-berpotensi-naik-setelah-suku-bunga-as-tak-berubah,"KONTAN.CO.ID - JAKARTA. Harga Surat Utang Negara (SUN) pada perdagangan Jumat (1/2), berpotensi naik setelah pengumuman suku bunga acuan AS tetap di level 2,25%-2,50%. I Made Adi Saputra Analis Fixed Income MNC Sekuritas mengamati sepanjang Januari pasar SUN catatkan kinerja positif. Hal ini tercermin dari turunnya tingkat imbal hasil yang didorong oleh masuknya investor asing dari pasar Surat Berharga Negara (SBN). Tentunya investor tertarik masuk ke pasar obligasi domestik karena terjadi penguatan nilai tukar rupiah terhadap dollar AS. ""Penguatan harga SUN pada perdagangan di akhir Januari masih dipengaruhi oleh perubahan nilai tukar mata uang rupiah terhadap dollar AS yang menguat,"" kata Made dalam risetnya hari ini. Menguatnya rupiah didorong oleh pertumbuhan ekonomi pada akhir 2018 yang cukup kuat dibandingkan oleh konsumsi, investasi dan pengeluaran pemerintah. Selain itu, investor asing juga membeli 1,04 miliar saham pada Rabu kemarin. Hal ini merupakan volume pembelian terbesar sejak April 2015. Sementara, faktor eksternal yang mempengaruhi penguatan rupiah dan membuat harga SUN naik adalah berakhirnya FOMC Meeting yang menetapkan suku bunga acuannya tetap berada pada level 2,25% - 2,50%, sama pada periode sebelumnya. Beberapa seri yang kami lihat cukup menarik di tengah kondisi pasar saat ini, yaitu FR0057, FR0068, FR0068, FR0079, FR0053 dan FR0071. Cek Berita dan Artikel yang lain di Google News",investasi
Imbal hasil SUN masih stabil pasca kenaikan bunga acuan BI,2024-09-24T16:13:44.326Z,"Minggu, 18 November 2018 / 19:14 WIB",Reporter: Dimas Andi | Editor: Khomarul Hidayat,https:////investasi.kontan.co.id/news/imbal-hasil-sun-masih-stabil-pasca-kenaikan-bunga-acuan-bi,"KONTAN.CO.ID - JAKARTA. Di atas kertas, kenaikan suku bunga acuan Bank Indonesia (BI) cepat atau lambat akan mempengaruhi kondisi pasar obligasi Indonesia. Namun, selama kurs rupiah bergerak stabil pasca kenaikan tersebut, pasar obligasi dalam negeri kemungkinan juga tetap stabil. Sebagaimana diketahui, BI telah menaikan suku bunga acuan BI-7 Day Repo Rate menjadi 6% pada Kamis (15/11) lalu. Research Analyst Capital Asset Management, Desmon Silitonga mengatakan, kenaikan suku bunga acuan biasanya akan memicu kenaikan yield surat utang negara (SUN) sekaligus menimbulkan penurunan harga instrumen tersebut. Ini dilatarbelakangi oleh makin sempitnya selisih atau spread antara suku bunga acuan dan yield SUN. Namun, kenaikan yield SUN diyakini tidak akan terjadi secara signifikan selama pergerakan rupiah terhadap dollar AS masih stabil. Jika ditelusuri, yield SUN seri acuan 10 tahun berada di level 8,00% pada perdagangan Jumat lalu (16/11). Sehari sebelumnya, ketika kenaikan suku bunga acuan diumumkan, yield SUN berada di level 8,07%. Sementara itu, kurs rupiah di pasar spot juga menguat 0,36% ke level Rp 14.612 per dollar AS pada Jumat lalu. Ekonom PT Pemeringkat Efek Indonesia, Fikri C. Permana melihat, kenaikan suku bunga BI kali ini merupakan cerminan konsistensi BI dalam menjaga pergerakan rupiah dari berbagai tekanan. Ini sejalan dengan kebijakan BI yang berusaha selalu selangkah di depan The Federal Reserves dalam menaikkan suku bunga acuan. Walau bertentangan dengan konsensus para analis, keputusan BI tersebut sejauh ini mendapat respons positif dari para pelaku pasar sehingga rupiah berhasil menguat. “Itu menyebabkan yield SUN bergerak stabil,” imbuh dia. Stabilnya pergerakan rupiah ditambah mulai turunnya yield SUN pasca kenaikan suku bunga acuan akan mendorong kembali dana investor asing ke pasar obligasi Indonesia. Sebab, para investor asing tak lagi mengkhawatirkan sentimen kerugian kurs seperti yang terjadi pada beberapa waktu dahulu. Selain itu, berkaca pada yield SUN terkini, investasi obligasi dinilai sudah mulai kembali menarik bagi para investor domestik. Hal ini didukung pula oleh tingkat inflasi Indonesia yang masih berada di level 3,16% per Oktober 2018. Investor pun bisa mendapat nilai interest rate yang menarik mengingat lebarnya selisih antara yield SUN dan inflasi dalam negeri. “Kondisi sekarang ini bisa dimanfaatkan investor untuk melakukan akumulasi secara berkala,” kata Desmon. Cek Berita dan Artikel yang lain di Google News",investasi
"BNI genjot pendapatan non bunga, termasuk dari penjualan SUN",2024-09-24T16:13:44.500Z,"Kamis, 01 November 2018 / 23:20 WIB",Reporter: Maizal Walfajri | Editor: Khomarul Hidayat,https:////keuangan.kontan.co.id/news/bni-genjot-pendapatan-non-bunga-termasuk-dari-penjualan-sun,"KONTAN.CO.ID - JAKARTA. PT Bank Negara Indonesia Tbk (BNI) menggenjot pendapatan non bunga atau non interest income. Salah satunya melalui penjualan surat utang negara (SUN). General Manager Wealth Management Neny Asriani mengatakan hingga saat ini, pendapatan dari penjualan SUN memberikan kontribusi sekitar 8% hingga 10% dari fee based income penjualan bancassurance dan investasi di BNI. Pendapatan ini lantaran BNI akan mendapatkan pendapatan sekitar 0,35% hingga 0,4% dari total volume penjualan SUN. Terbaru, BNI juga ikut melakukan penjualan SUN terbaru pemerintah yakni sukuk tabungan seri ST002. ""Kami menargetkan penjualan ST 002 sebesar Rp 500 miliar. Strategi pemasaran melalui flier, customer gathering dan SMS blast. Target market kami seluruh nasabah BNI dari semua segmen,"" ujar Neni kepada Kontan.co.id, Kamis (1/11). Selain itu, pemesanan ST002 juga dapat dilakukan melalui mobile banking dan internet banking. Asal tahu saja, hingga September 2018, pendapatan non bunga BNI mencapai Rp 7,6 triliun. Nilai ini tumbuh 6% secara tahunan dari posisi yang sama tahun lalu Rp 7,17 triliun. Cek Berita dan Artikel yang lain di Google News",keuangan
"Suku bunga AS naik, harga SUN berpeluang naik",2024-09-24T16:13:44.547Z,"Kamis, 27 September 2018 / 09:58 WIB",Reporter: Danielisa Putriadita | Editor: Yudho Winarto,https:////investasi.kontan.co.id/news/suku-bunga-as-naik-harga-sun-berpeluang-naik,"KONTAN.CO.ID - JAKARTA. Harga Surat Utang Negara (SUN) pada perdagangan, Kamis (27/9) berpotensi naik seiring dengan penurunan imbal hasil surat utang global serta kebijakan The Fed yang memutuskan untuk menaikkan suku bunga acuan sebesar 25 basis poin. Bank Sentral Amerika diperkirakan masih akan menaikkan suku bunga sebanyak satu kali lagi di tahun ini. Selanjutnya di 2019 kenaikan suku bunga akan terjadi tiga kali lagi dan satu kali lagi di 2020 seiring dengan potensi pertumbuhan ekonomi di masa mendatang. I Made Adi Saputra Analis Fixed Income MNC Sekuritas mengatakan kini pelaku pasar masih akan mencermati keputusan moneter yang akan diambil Bank Indonesia dalam Rapat Dewan Gubernur yang diadakan pada hari ini. Para analis memperkirakan BI akan menaikkan suku bunga acuan sebesar 25-50 bps. Secara teknikal Made menganalisis harga SUN hari ini masih bergerak di tren kenaikan sehingga masih terbuka peluang untuk mengalami kenaikan harga dalam jangka pendek. ""Potensi kenaikan harga tersebut didapati pada keseluruhan tenor SUN,"" kata Made dalam riset hari ini. Made menyarankan investor cermati arah perubahan nilai tukar di mana mata uang dollar AS terlihat akan menguat terhadap mata uang utama dunia setelah masih berpeluangnya The Fed melanjutkan kenaikan suku bunga acuan hingga dua tahun ke depan. Beberapa seri yang Made lihat cukup menarik di tengah kondisi harga Surat Utang Negara yang masih akan bergerak terbatas, yaitu : ORI013, SR009, PBS016, PBS002, FR0031, FR0053, FR0061, FR0043, FR0063, R0070 dan FR0073. Cek Berita dan Artikel yang lain di Google News",investasi
"Suku bunga The Fed naik, yield SUN belum tentu ikut terkerek",2024-09-24T16:13:44.593Z,"Minggu, 23 September 2018 / 18:24 WIB",Reporter: Danielisa Putriadita | Editor: Herlina Kartika Dewi,https:////investasi.kontan.co.id/news/suku-bunga-the-fed-naik-yield-sun-belum-tentu-ikut-terkerek,"KONTAN.CO.ID - JAKARTA. Analis memproyeksikan kenaikan suku bunga The Fed Kamis (27/9) dini hari tidak serta merta membuat yield obligasi pemerintah akan ikut naik. Namun, suku bunga deposito yang saat ini sudah mulai menyaingi imbal hasil obligasi tenor pendek bisa membuat yield obligasi beranjak naik, karena pembeli obligasi berkurang dan beralih ke deposito. Fixed Income Fund Manager Ashmore Asset Management Indonesia Anil Kumar mengatakan yang lebih penting investor perhatikan dari keputusan FOMC pekan depan adalah bukan dari kenaikan suku bunga acuannya yang kali ini, melainkan pergerakan suku bunga The Fed di tahun depan. Jika ke depan arah pergerakan suku bunga The Fed masih cenderung naik, maka akan membawa sentimen negatif bagi pasar obligasi dalam negeri. ""Kenaikan suku bunga The Fed dan BI rate tidak serta merta menaikkan imbal hasil obligasi, selama obligasi ada pembelinya,"" kata Anil. Namun, saat ini Anil melihat imbal hasil obligasi tenor pendek mulai bersaing dengan suku bunga deposito yang cenderung naik karena pengetatan likuiditas. Anil mencatat pertumbuhan pinjaman perbankan di Juli 2018 sebesar 11,2%. Sedangkan pertumbuhan tabungan deposito hanya 6,3%. Maka, perbankan mengalami defisit sekitar 5%. ""Defisit tersebut bermasalah karena saat ini kondisi loan to deposit perbankan tinggi, jadi mau tidak mau tingkat suku bunga deposito harus naik disaat likuiditas perbankan yang ketat,"" kata Anil, Jumat (21/9) Kenaikan suku bunga deposito cenderung naik juga seiring dengan kenaikan suku bunga BI 7 day reverse repo rate (7DRR). Anil mengatakan jika suku bunga deposito naik cukup tinggi maka investor lokal jadi punya alasan untuk pindah dari obligasi jangka pendek ke deposito. ""Suku bunga deposito naik investor lokal tidak mau tambah diinstrumen obligasi bahkan cenderung jual obligasi ketika harga rally,"" kata Anil. Selain itu, pergerakan nilai tukar rupiah terhadap dollar AS juga mempengaruhi pergerakan yield. Kembali lagi, ketika suku bunga The Fed dan BI naik yield belum tentu ikut naik selama obligasi tetap laku. Saat ini mayoritas pembeli obligasi Indonesia dalah investor asing. Salah satu hal yang membuat obligasi menarik bagi investor asing adalah ketika nilai tukar rupiah stabil. Namun, yield obligasi tetap berpotensi naik bila asing tidak masuk ke pasar obligasi karena rupiah yang kembali bergejolak karena keputusan FOMC pekan depan. Anil mengatakan, jika pekan depan suku bunga The Fed naik dan suku bunga BI ikut naik, pergerakan yield akan tergantung dari duluan mana antara kenaikan suku bunga deposito dan masuknya investor asing. ""Suku bunga deposito naik duluan sebelum investor asing masuk maka, imbal hasil harus naik, tetapi kalau kondisi tersebut terjadi bersamaan, imbal hasil bisa stabil, lalu kalau investor asing masuk duluan dari pada kenaikan depositi justru imbal hasil obligasi bisa lebih rendah, kita liat nanti mana duluan yang terjadi,"" kata Anil. Sementara, menurut Anil, kemungkinan suku bunga The Fed dan BI yang tidak berubah sangat kecil. Sehingga, ia memproyeksikan keputusan FOMC pekan depan The Fed akan menaikkan suku bunga acuannya dan BI juga harus ikut naik. Namun, bila pekan depan yang terjadi adalah suku bunga The Fed naik tetapi BI tidak menaikkan suku bunganya maka Anil menilai hal ini akan berdampak buruk bargi pasar keuangan. Bank Indonesia harus siaga menjaga kestabilan ekonomi, karena bila BI tidak seiring dengan kenaikan suku bunga The Fed maka, di ke depannya BI akan menaikkan tingkat suku bunga dengan lebih tinggi lagi. Sedangkan, bila pekan depan suku bunga The Fed tetap dan BI memutuskan untuk menaikkan suku bunga, maka Anil menilai ini baik untuk pasar Indonesia dalam jangka pendek. ""Obligasi bisa rally, positif karena jika pekan depan suku bunga The Fed tetap investor bisa berasumsi The Fed stop kenaikan suku bunga atau tidak percaya akan ada kenaikan inflasi di AS, ini akan sangat baik,"" kata Anil. Anil berharap yield Surat Utang Negara seri acuan tenor 10 tahun di akhir tahun bisa mencapai target di 7,8%. Sementara pergerakan yield SUN sepekan depan ia proyeksikan cenderung turun dan harga obligasi naik karena ketegangan perang dagang mulai mereda dan kenaikan suku bunga The Fed di tahun ini sudah priced in. Cek Berita dan Artikel yang lain di Google News",investasi
