Title,Scrapping Date,Article Date,Author,Link,Content,Category
"Bunga The Fed naik, selisih imbal hasil US Treasury dengan SUN makin lebar",2024-09-24T16:13:44.743Z,"Rabu, 12 September 2018 / 20:38 WIB",Reporter: Dimas Andi | Editor: Khomarul Hidayat,https:////investasi.kontan.co.id/news/bunga-the-fed-naik-selisih-imbal-hasil-us-treasury-dengan-sun-makin-lebar,"KONTAN.CO.ID - JAKARTA. Imbal hasil atau yield Surat Utang Negara (SUN) maupun yield US Treasury masih berpotensi meningkat dalam jangka pendek, sehingga dapat mempengaruhi pergerakan spread atau selisih yield diantara keduanya. Pasalnya, akhir September nanti berlangsung agenda Federal Open Market Committee (FOMC). Hampir dipastikan The Federal Reserves akan menaikan suku bunga acuan AS terlepas adanya kritik dari Presiden AS Donald Trump maupun kekhawatiran investor global terhadap dampak perang dagang. Menurut Research Analyst Capital Asset Management, Desmon Silitonga, jika skenario kenaikan suku bunga acuan AS berjalan lancar, yield US Treasury mesti melakukan penyesuaian sehingga berpeluang besar ikut terkerek. “Mau tidak mau yield SUN juga akan naik agar spread-nya terjaga,” ucapnya, Rabu (12/9). Dia pun memperkirakan, yield US Treasury 10 tahun bisa berpotensi menembus level 3% ketika kenaikan suku bunga acuan AS terwujud. Di sisi lain, yield SUN untuk tenor yang sama berpeluang mencapai level 9%. Sementara itu, Analis Fixed Income MNC Sekuritas, I Made Adi Saputra menilai, stabilitas nilai tukar rupiah menjadi kunci untuk meredam pelebaran spread antara yield SUN dan US Treasury. Meski begitu, potensi penguatan rupiah secara berkelanjutan belum akan terjadi dalam waktu dekat mengingat masih banyaknya sentimen negatif yang berpengaruh pada pergerakan mata uang rupiah. Ditambah lagi, kebijakan menekan defisit transaksi berjalan seperti kenaikan pajak penghasilan (PPh) impor baru diumumkan pekan lalu. “Efek kebijakan tersebut terhadap rupiah baru teruji beberapa bulan ke depan,” tandasnya. Sebagai informasi, yield SUN tenor 10 tahun telah menembus level 8,59% pada perdagangan Rabu (12/9). Di saat yang sama, yield US Treasury tenor 10 tahun bertengger di level 2,96%. Ini berarti spread di antara keduanya sudah mencapai 5,63% atau 563 bps. Cek Berita dan Artikel yang lain di Google News",investasi
Harga SUN berpotensi turun mengantisipasi kenaikan suku bunga AS,2024-09-24T16:13:45.447Z,"Kamis, 30 Agustus 2018 / 09:43 WIB",Reporter: Dimas Andi | Editor: Wahyu T.Rahmawati,https:////investasi.kontan.co.id/news/harga-sun-berpotensi-turun-mengantisipasi-kenaikan-suku-bunga-as,"KONTAN.CO.ID - JAKARTA. Imbal hasil Surat Utang Negara (SUN) diperkirakan akan bergerak naik pada perdagangan Kamis (30/8). Hal ini disebabkan oleh pelemahan rupiah dan kenaikan imbal hasil US Treasury jangka menengah. Ekonom Samuel Sekuritas Indonesia, Ahmad Mikail mengatakan, imbal hasil US Treasury bergerak naik seiring naiknya data pertumbuhan ekonomi AS pada kuartal kedua. Imbal hasil US Treasury jangka menengah (10 tahun) tercatat naik 3 bps ke level 2,88% sedangkan jangka panjang (30 tahun) stabil di level 3,02%. “Ekspektasi investor bahwa Federal Reserve akan menaikan suku bunga acuan AS di bulan September turut mendorong kenaikan imbal hasil US Treasury jangka menengah,” sebutnya dalam riset, hari ini. Pergerakan harga minyak dan gas alam dunia juga mendorong kenaikan imbal hasil US Treasury. Kenaikan ini ditopang oleh jatuhnya persediaan minyak AS pada pekan lalu sebesar 2,6 juta barel. Mikail memproyeksikan imbal hasil SUN akan bergerak naik. Ia memprediksi, imbal hasil SUN seri acuan 10 tahun akan bergerak di kisaran 7,90%-8,00% pada perdagangan hari ini. Adapun seri obligasi negara yang ia rekomendasikan hari ini antara lain FR0061, FR0035, FR0043, FR0063, dan FR0046. Cek Berita dan Artikel yang lain di Google News",investasi
"BI sudah naikkan suku bunga, kenapa minat SUN lebih rendah?",2024-09-24T16:13:45.703Z,"Kamis, 05 Juli 2018 / 18:57 WIB",Reporter: Ghina Ghaliya Quddus | Editor: Khomarul Hidayat,https:////nasional.kontan.co.id/news/bi-sudah-naikkan-suku-bunga-kenapa-minat-sun-lebih-rendah,"KONTAN.CO.ID - JAKARTA. Direktorat Jenderal Pengelolaan Pembiayaan dan Risiko Kementerian Keuangan (Kemkeu) mencatat, dari lelang surat utang negara (SUN), Selasa lalu (3/6), total nominal yang dimenangkan lebih kecil dari lelang sebelumnya. Padahal, Bank Indonesia (BI) pun telah menaikkan suku bunga acuan sebesar 50 bps sepekan sebelumnya. Gubernur BI Perry Warjiyo menyatakan kenaikan suku bunga pada rapat dewan gubernur (RDG) lalu adalah agar yield surat utang menarik. Tujuannya untuk menarik investor masuk. Namun demikian, dalam lelang SUN Selasa lalu, total nominal yang dimenangkan Rp 11,32 triliun dari total penawaran yang masuk sebesar Rp 21,46 triliun. Sementara, dalam lelang sebelumnya, total nominal yang dimenangkan adalah Rp 11,7 triliun dari total penawaran yang masuk sebesar Rp 29,3 triliun. Ekonom Samuel Asset Management Lana Soelistianingsih mengatakan, sepinya minat investor dalam lelang SUN terakhir karena kurang menarik bagi investor. “Mungkin ya, karena selisih antara yield. Bila dengan SUN tenor 10 tahun, selisihnya 2,1%, sementara yield AS tenor 10 tahun 2,85%. Kurang menarik,” ujar Lana kepada KONTAN, Kamis (5/7). Ia mengatakan, lelang SUN yang sepi kemungkinan karena pemerintah yang enggan mengambil yield yang tinggi. Jadi, ada perbedaan antara ekspektasi yield investor dengan pemerintah. Sebelumnya, Perry mengatakan, BI berharap dari hasil lelang SUN bisa membantu menambah suplai dollar AS.. “Dengan adanya lelang, investor asing akan masuk dan akan stabilkan nilai tukar. Ini adalah bentuk kordinasi yang perlu dilakukan,” ujarnya. Namun demikian, BI melihat bahwa investor asing yang masuk belum besar. Dengan demikian, BI masuk ke pasar untuk intervensi valas dan SBN. Cek Berita dan Artikel yang lain di Google News",nasional
"Suku bunga BI naik, harga SUN diperkirakan naik terbatas",2024-09-24T16:13:45.746Z,"Senin, 02 Juli 2018 / 09:31 WIB",Reporter: Danielisa Putriadita | Editor: Sanny Cicilia,https:////investasi.kontan.co.id/news/suku-bunga-bi-naik-harga-sun-diperkirakan-naik-terbatas,"KONTAN.CO.ID - JAKARTA. Harga Surat Utang Negara (SUN) pada perdagangan, Senin (2/7) analis perkirakan cenderung naik meski terbatas. I Made Adi Saputra Analis Fixed Income MNC Sekuritas dalam risetnya hari ini mengatakan, harga SUN akan cenderung bergerak naik di tengah naiknya suku bunga acuan yang lebih besar dari perkiraan pelaku pasar. Sekadar informasi, pekan lalu, BI menaikkan bunga 50 basis poin menjadi 5,25%. Total, selama dua bulan terakhir, BI telah menaikkan bunga 1%. Namun, Made memperkirakan kenaikan harga akan dibatasi oleh surat utang global yang cenderung mengalami kenaikan imbal hasil pada perdagangan di akhir pekan lalu. Made mencatat imbal hasil US Treasury tenor 10 tahun naik 0,02 basis poin menjadi 2,86%. Sementara Gilt tenor 10 tahun juga naik 0,014 basis poin menjadi 1,28%. Sementara, Bund naik 0,012 basis poin menjadi 0,31%. Secara teknikal, Made menganalisis harga SUN untuk keseluruhan tenor pada hari ini masih terlihat dalam tren penurunan harga, di tengah harga SUN yang kembali memasuki area jenuh jual. Made merekomendasikan seri FR0070, FR0040, FR0071, FR0073, FR0058, FR0074, dan FR0065 pada perdagangan hari ini. Cek Berita dan Artikel yang lain di Google News",investasi
Indeks SUN rontok gara-gara adu suku bunga RI dan AS,2024-09-24T16:13:45.943Z,"Senin, 28 Mei 2018 / 08:30 WIB",Reporter: Danielisa Putriadita | Editor: Wahyu T.Rahmawati,https:////investasi.kontan.co.id/news/indeks-sun-rontok-gara-gara-adu-suku-bunga-ri-dan-as,"KONTAN.CO.ID - JAKARTA. Harga surat utang negara masih cenderung turun sepanjang pekan lalu. Tren ini terlihat dari pergerakan indeks SUN yang disusun Perhimpunan Pedagang Surat Utang Negara (Himdasun). Jumat lalu, indeks SUN ditutup di angka 97,12; naik 0,58% ketimbang penutupan sebelumnya. Nah, sehari sebelumnya, indeks ini ditutup di 96,56; level terendah sejak Maret 2016. Penurunan ini terjadi meski lelang SUN yang digelar pekan lalu sukses besar. Dalam lelang tersebut, penawaran investor yang masuk mencapai Rp 31,48 triliun. I Made Adi Saputra, Analis Fixed Income MNC Sekuritas, mengatakan, pasar SUN masih tertekan lantaran rupiah masih cenderung melemah. Hal ini membuat pelaku pasar, terutama asing, menghindari obligasi pemerintah. ""Sentimen utama pasar SUN tetap rupiah yang melemah diikuti aksi jual investor asing,"" kata dia, Jumat (25/5). Direktorat Jenderal Pengelolaan Pembiayaan dan Risiko Kementerian Keuangan mencatat, hingga Kamis (24/5) asing melepas kepemilikan di SUN sekitar Rp 17 triliun. Kini kepemilikan asing di pasar obligasi Indonesia mencapai Rp 829 triliun. Fund Manager Capital Asset Management Desmon Silitonga mengatakan, lelang SUN kemarin ramai karena banyak investor memanfaatkan lelang tersebut untuk mendapatkan SUN di harga rendah. Tapi pelaku pasar juga masih mencermati potensi kenaikan suku bunga AS bulan depan. Ini membuat rupiah tidak stabil dan harga SUN terus tertekan. Semula Desmon memprediksi yield SUN tenor 10 tahun akan berada di level maksimal 7,3%. Namun, level tersebut sudah terlewati. Kamis (24/5) lalu, yield SUN sudah 7,53%. Bank Indonesia juga agresif masuk ke pasar SUN. ""Dampak BI belum terlihat pada penurunan yield, tetapi saya masih optimistis yield turun di bawah 7,5% hingga akhir tahun,"" kata Desmon. Suku bunga BI Namun, Desmon menganalisa, dengan kondisi ekonomi makro Indonesia yang membaik tahun ini, yield obligasi tenor 10 tahun bisa bertengger di 6,5%-6,9%. ""Saat ini investor asing sedang menyesuaikan kembali portofolio mereka sehingga yield bergerak naik,"" terang dia. Desmond menilai, meski yield Indonesia cuma berada di 6,5%-6,9% tahun ini, nilai tersebut masih cukup menarik bagi investor asing. ""Yield kita cukup tinggi dibanding negara tetangga lain, tambah lagi rating Indonesia menarik karena sudah investment grade dan inflasi pun berhasil terjaga,"" kata Desmon. Namun, potensi kenaikan suku bunga BI berpotensi menahan kenaikan harga SUN. Jika BI kembali menaikkan suku bunga, maka kemungkinan yield SUN kembali turun ke bawah 7% bakal sulit terwujud. Saat ini pelaku pasar masih menunggu pergerakan rupiah stabil untuk memperhitungkan proyeksi yield yang baru di akhir tahun. ""Setidaknya rupiah harus stabil dulu dan menunggu faktor eksternal mereda,"" kata Made. Dari sisi domestik, Made menilai saat ini upaya pemerintah menstabilkan rupiah masih terbatas. Meski begitu, Made menilai dengan keluarnya samurai bonds senilai ¥100 miliar, akan jadi katalis positif bagi pasar SUN. Sebab, hal ini akan menambah ketertarikan investor asing masuk. ""Penerbitan samurai bond setidaknya bisa menambah cadangan devisa,"" kata Made. Namun, Made lebih mengharapkan cadangan devisa terkumpul dari kegiatan ekspor, sehingga bisa membuat nilai tukar rupiah menguat secara fundamental. ""Perlu diingat, tambahan cadangan devisa dari surat utang berarti harus bayar kupon dan pokok, yang ujung-ujungnya butuh mata uang lain, baik yen atau dollar AS,"" kata Made. Selain itu, penurunan harga SUN bisa ditahan bila pemerintah bisa memanfaatkan momentum sentimen eksternal. Notulensi rapat FOMC memberi sinyal The Fed tidak akan menaikkan suku bunga secara agresif. Cek Berita dan Artikel yang lain di Google News",investasi
Kenaikan suku bunga dan penguatan rupiah mengerek harga SUN,2024-09-24T16:13:45.985Z,"Jumat, 18 Mei 2018 / 09:37 WIB",Reporter: Danielisa Putriadita | Editor: Wahyu T.Rahmawati,https:////investasi.kontan.co.id/news/kenaikan-suku-bunga-dan-penguatan-rupiah-mengerek-harga-sun,"KONTAN.CO.ID - JAKARTA. Harga Surat Utang Negara pada perdagangan, Jumat (18/5) berpotensi naik. I Made Adi Saputra Analis Fixed Income MNC Sekuritas mengatakan kenaikan harga SUN didorong dari kenaikan suku bunga acuan Indonesia di level 4,5% serta menguatnya nilai tukar rupiah terhadap dollar Amerika Serikat (AS). Namun, Made mengatakan dalam risetnya hari ini harga pada perdagangan hari ini akan dibatasi oleh berlanjutnya kenaikan imbal hasil surat utang global. Tercatat, Kamis (17/5) rupiah ditutup naik 0,28% menjadi Rp 14.058 per dollar AS. Sementara, yield US Treasury juga naik 0,11 basis poin jadi ke level 3,11% untuk tenor 10 tahun. Secara teknikal Made menganalisis harga SUN mulai berubah tren dari turun menjadi naik. Hal ini didukung harga SUN yang berada di area jenuh jual sehingga membuka peluang adanya aksi beli. Made merekomendasikan seri FR0069, FR0073, FR0058, FR0074, FR0068, FR0072, FR0075, dan FR0067 pada perdagangan hari ini. Cek Berita dan Artikel yang lain di Google News",investasi
"Lelang SUN, suku bunga PUAB naik",2024-09-24T16:13:46.034Z,"Rabu, 28 Maret 2018 / 10:40 WIB","Reporter: Galvan Yudistira, Laurensius Marshall Sautlan Sitanggang, Yoliawan H | Editor: Sofyan Hidayat",https:////keuangan.kontan.co.id/news/lelang-sun-suku-bunga-puab-naik,"KONTAN.CO.ID - JAKARTA. Beberapa hari terakhir, suku bunga pasar uang antar bank (PUAB) overnight meningkat seiring dengan meningkatnya kebutuhan likuiditas. Mengutip data Bank Indonesia (BI), Selasa (27/3) suku bunga PUAB overnight naik menjadi 4,06% dari sehari sebelumnya di level 4,02%. Agusman, Kepala Departemen Komunikasi BI menjelaskan, bunga PUAB sedikit naik disebabkan karena kebutuhan perbankan terkait pelaksanaan lelang surat utang negara (SUN) yang berlangsung kemarin (27/3). Dalam lelang kali ini, pemerintah menyerap dana senilai Rp 20,70 triliun dari total penawaran yang masuk sebanyak Rp 35,57 triliun. ""Sehingga ada kebutuhan perbankan dalam menghadapi kontraksi pemerintah dalam pelaksanaan lelang SUN hari ini,"" kata Agusman, Selasa (27/3). Selain itu kenaikan suku bunga pasar uang antar bank overnight juga disebabkan karena penarikan uang kartal yang naik menjelang libur panjang. BI mencatat, kenaikan suku bunga PUAB overnight ini tidak ada kaitannya dengan pelemahan nilai tukar rupiah. Menurut BI, suku bunga antar bank yang mendekati suku bunga acuan 7DRR rate justru hal yang bagus. Ini menunjukkan semakin dalamnya pasar PUAB karena memang seharusnya suku bunga antar bank overnight berada di rentang suku bunga acuan BI. Saat ini suku bunga BI 7-Day RR di level 4,25%. ""Selisih antara 7DRR rate dengan bunga The Federal Reserve juga bukan merupakan faktor yang mempengaruhi likuiditas rupiah,"" kata Agusman. Budi Satria, Direktur BTN berpendapat, kenaikan bunga PUAB overnight bukan karena likuiditas perbankan yang keta. Kenaikan bunga PUAB lebih sebatas respon pasar atas kebijakan ekonomi yang ada saat ini. “Likuiditas masih sangat baik. The Fed sudah menaikan suku bunganya 25 basis poin (bps) jadi bank dan pasar bereaksi dengan menstabilkan situasi,” jelas Budi, Selasa (27/3). Saat suku bunga The Fed naik, maka disparitas rate dalam negeri semakin kecil. Kemudian, jika terlalu kecil, ekspektasi investor akan beda. Sehingga kenaikan bunga PUAB overnight tersebut lebih menstabilkan pasar. Likuiditas masih melimpah, namun karena bunga The Fed naik maka investor banyak memilih untuk menjaga itu. Sebagian perbankan dan pasar sedikit menaikkan agar capital outflow tidak terpengaruh. ""Loan to funding ratio (LFR) BTN saat ini masih aman untuk melakukan penyaluran kredit sesuai dengan target,"" ujar Budi. Berbeda pandangan, SEVP Treasury and Global Services PT Bank Rakyat Indonesia Tbk (BRI) Hexana Tri Sasongko mengatakan, kurs rupiah cukup ketat, sehingga menyebabkan suku bunga di pasar sedikit naik. Cek Berita dan Artikel yang lain di Google News",keuangan
Imbal hasil SUN berpotensi bergerak terbatas setelah bunga The Fed naik,2024-09-24T16:13:46.216Z,"Kamis, 22 Maret 2018 / 20:58 WIB",Reporter: Dimas Andi | Editor: Sanny Cicilia,https:////investasi.kontan.co.id/news/imbal-hasil-sun-berpotensi-bergerak-terbatas-setelah-bunga-the-fed-naik,"KONTAN.CO.ID - JAKARTA. Imbal Hasil Surat Utang Negara (SUN) diperkirakan akan cenderung bergerak terbatas pasca kenaikan suku bunga acuan Amerika Serikat. Hal ini seiring potensi pergerakan imbal hasil US Treasury yang juga cenderung terbatas. Analis Obligasi BNI Sekuritas, Ariawan menyampaikan, secara historis, imbal hasil US Treasury cenderung mengalami kenaikan secara agresif satu atau dua bulan sebelum The Federal Reserve menaikan suku bunga acuan AS. Namun, setelah itu imbal hasil US Treasury perlahan mulai turun walau sifatnya terbatas. “Menjelang akhir 2016, US Treasury terus bergerak naik, padahal Fed Fund Rate baru terwujud di awal 2017,” katanya memberi contoh. Ia pun yakin pola serupa akan kembali terjadi pada tahun ini. Ia pun memperkirakan pada akhir tahun nanti imbal hasil SUN maupun US Treasury masih akan berada di level yang tidak jauh berbeda seperti saat ini. Seperti yang diketahui, imbal hasil SUN pada hari ini (22/3) berada di level 6,789% sedangkan US Treasury berada di level 2,837%. Terlepas dari itu, walau pergerakannya terbatas, Ariawan melihat tren kenaikan US Treasury masih berpotensi terjadi hingga akhir tahun nanti. Sebab, selain disokong oleh ekspektasi kenaikan suku bunga acuan AS, pergerakan imbal hasil US Treasury juga didorong oleh kebijakan pemerintah AS yang banyak menerbitkan surat utang guna menutupi defisit anggaran belanja yang membesar. “Kebijakan balance sheet dari The Fed yang berlangsung sejak tahun lalu juga mempengaruhi pergerakan imbal hasil US Treasury,” tukas Ariawan. Cek Berita dan Artikel yang lain di Google News",investasi
"Tingkat suku bunga global melandai, yield SUN turun",2024-09-24T16:13:46.257Z,"Rabu, 14 Februari 2018 / 09:26 WIB",Reporter: Danielisa Putriadita | Editor: Wahyu T.Rahmawati,https:////investasi.kontan.co.id/news/tingkat-suku-bunga-global-melandai-yield-sun-turun,"KONTAN.CO.ID - JAKARTA. Yield Surat Utang Negara (SUN) pada perdagangan, Rabu (14/2) diperkirakan masih akan turun. Ahmad Mikail Ekonom Samuel Sekuritas Indonesia mengatakan, yield SUN diproyeksikan turun seiring dengan melandainya tingkat suku bunga global dan jelang rilis data inflasi AS hari ini. ""Kemungkinan rendahnya inflasi AS di Januari dibandingkan Desember dan Januari tahun lalu dapat menjadi katalis positif bagi pasar obligasi Indonesia,"" kata Ahmad, dalam risetnya hari ini. Sementara itu, Ahmad memproyeksikan rupiah hari ini masih bergerak mendatar jelang rilis data neraca perdagangan Indonesia yang diprediksikan surplusnya tumbuh terbatas. Ahmad memproyeksikan rupiah hari ini bergerak direntang Rp 13.600 per dollar AS-Rp 13.650 per dollar AS. Sementara, yield seri acuan 10 tahun diprediksikan bergerak direntang 6,35%-6,39%. Ahmad merekomendasikan seri FR0064, FR0074, FR0035, FR0043, FR0063, FR0059, dan FR0075 dalam perdagangan SUN hari ini.  Cek Berita dan Artikel yang lain di Google News",investasi
"Bunga Fed naik, yield SUN 10 tahun bisa 6,80%",2024-09-24T16:13:46.303Z,"Selasa, 12 Desember 2017 / 12:49 WIB",Reporter: Danielisa Putriadita | Editor: Dupla Kartini,https:////investasi.kontan.co.id/news/bunga-fed-naik-yield-sun-10-tahun-bisa-680,"KONTAN.CO.ID - JAKARTA. Yield obligasi domestik diramalkan naik jika Federal Open Market Committee (FOMC) menetapkan kenaikan suku bunga acuan Bank Sentral Amerika Serikat (The Fed) pada rapat Rabu (13/12). Fund Manager Capital Asset Management Desmon Silitonga mengatakan, kenaikan Fed Funds Rate (FFR) bulan ini bisa mendorong kenaikan yield obligasi. ""Setidaknya ke level 6,70%-6,80% untuk obligasi pemerintah tenor 10 tahun,"" kata Desmon, Minggu (10/12). Tercatat yield surat utang negara (SUN) seri acuan tenor 10 tahun per Selasa (12/12) berada di level 6,49%, turun tipis dari sesi sebelumnya 6,50%. Menurut Desmon, kenaikan yield obligasi merupakan momentum yang dipakai investor untuk melakukan aksi profit taking. Jika FFR naik, Desmon memperkirakan rupiah bergerak di kisaran Rp 13.500 hingga Rp 13.580 per dollar AS. ""Range tersebut sepertinya level yang nyaman bagi Indonesia melihat kondisi fundamental kita,"" katanya. Desmon menduga, pemerintah akan menjaga rupiah melalui intervensi Bank Indonesia di pasar valas dan Surat Berharga Negara menggunakan cadangan devisa. ""Dalam dua bulan terakhir cadev cenderung turun,"" imbuhnya. Cek Berita dan Artikel yang lain di Google News",investasi
Penurunan suku bunga menopang harga SUN,2024-09-24T16:13:46.347Z,"Senin, 25 September 2017 / 09:33 WIB",Reporter: Danielisa Putriadita | Editor: Wahyu T.Rahmawati,https:////investasi.kontan.co.id/news/penurunan-suku-bunga-menopang-harga-sun,"KONTAN.CO.ID - Harga surat utang negara (SUN) pada perdagangan Senin (25/9) berpeluang naik. Kenaikan harga SUN didorong sentimen keputusan Bank Indonesia yang kembali menurunkan suku bunga acuan menjadi 4,25%. I Made Adi Saputra Analis Fixed Income MNC Sekuritas mengatakan, harga SUN masih akan mengalami tren kenaikan dalam jangka pendek. Made merekomendasikan seri FR0069, FR0053, FR0070, FR0071, FR0073, FR0065, FR0068, dan FR0075 pada perdagangan hari ini. Sebelumnya, pada perdagangan SUN Jumat (22/9) tercatat imbal hasil surat utang global cenderung turun jelang berakhirnya rapat dewan gubernur (RDG) Bank Indonesia. ""Pelaku pasar juga mencermati hasil RDG bank sentral Amerika Serikat hal ini mendorong penurunan imbal hasil US Treasury,"" kata Made, Senin (25/9) dalam riset. Tercatat pada Jumat (22/9) imbal hasil US Treasury tenor 10 tahun turun 0,025 basis poin (bps) di level 2,253%. Penurunan juga terjadi pada US Treasury tenor 30 tahun sebanyak 0,020 bps jadi di level 2,785%. Cek Berita dan Artikel yang lain di Google News",investasi
Harga SUN terkerek penurunan suku bunga acuan,2024-09-24T16:13:46.391Z,"Kamis, 24 Agustus 2017 / 10:27 WIB",Reporter: Danielisa Putriadita | Editor: Wahyu T.Rahmawati,https:////investasi.kontan.co.id/news/harga-sun-terkerek-penurunan-suku-bunga-acuan,"KONTAN.CO.ID - Harga surat utang negara (SUN) pada perdagangan Kamis (24/8) berpeluang naik lagi untuk jangka pendek. Kemarin, harga SUN naik terdorong keputusan Bank Indonesia menurunkan suku bunga acuan. I Made Adi Saputra, Analis Fixed Income MNC Securities mengatakan, kenaikan harga SUN hari ini masih didorong katalis positif dari penurunan suku bunga acuan Bank Indonesia seven days reverse repo rate ke level 4,5%. ""Penurunan ini juga mendorong pelaku pasar untuk melakukan aksi beli pada perdagangan di pasar sekunder,"" kata Made, Rabu (24/8). Selain itu, harga SUN naik karena didukung imbal hasil US Treasury yang turun di tengah pelaku pasar Amerika Serikat sedang mencermati perkataan Presiden Trump. Tercatat dalam perdagangan Rabu (23/8) US Treasury tenor 10 tahun turun 0,05 basis poin (bps) di level 2,17%. Sedangkan US Treasury tenor 20 tahun juga turun 0,04 bps jadi di level 2,75%. Made menganalisis secara teknikal harga seri SUN tenor pendek masih dalam tren naik. Sedangkan, seri SUN tenor panjang mengalami tren konsolidasi. Namun, kenaikan harga SUN akan dibatasi oleh seri SUN yang telah mendekati area jenuh beli. Pada perdagangan hari ini, Made merekomendasikan seri; FR0069, FR0053, FR0070, FR0071, FR0065, FR0068, ORI013 dan FR0072. Cek Berita dan Artikel yang lain di Google News",investasi
"Bunga turun, SUN tenor pendek berpotensi bullish",2024-09-24T16:13:46.574Z,"Rabu, 23 Agustus 2017 / 10:20 WIB",Reporter: Danielisa Putriadita | Editor: Rizki Caturini,https:////investasi.kontan.co.id/news/bunga-turun-sun-tenor-pendek-berpotensi-bullish,"KONTAN.CO.ID - Harga Surat Utang Negara (SUN) pada perdagangan Rabu (23/8) diperikaran akan naik. I Made Adi Saputra, Analis Fixed Income MNC Securities mengatakan, keputusan dari RDG BI yang memutuskan untuk menurunkan BI-seven days repo rate sebesar 25 basis poin menjadi 4,5% serta positifnya hasil lelang pada perdagangan kemarin mengakibatkan harga SUN hari ini diperkirakan akan mengalami kenaikan. ""Penurunan suku bunga acuan ini diharapkan dapat memperkuat intermediasai perbankan sehingga memperkokoh stabilitas sistem serta mendukung pertumbuhan ekonomi yang lebih tinggi,"" kata Made, Rabu (23/8) dalam risetnya. Secara teknikal, Made menganalisis harga seri SUN tenor pendek masih akan mengalami tren kenaikan. Namun, kenaikan harga SUN akan dibatasi oleh beberapa seri SUN yang telah memasuki area jenuh beli (overbought). Made merekomendasikan seri FR0069, FR0053, FR0061, FR0070, FR0071, FR0065, FR0068, dan ORI013 dalam perdagangan hari ini. Cek Berita dan Artikel yang lain di Google News",investasi
