Title,Scrapping Date,Article Date,Author,Link,Content,Category
"Bunga The Fed Naik, Begini Efeknya Bagi IHSG, Rupiah, dan Yield SUN",2024-09-24T16:13:38.420Z,,Premium User Only,https:////insight.kontan.co.id/news/bunga-the-fed-naik-begini-efeknya-bagi-ihsg-rupiah-dan-yield-sun,Premium Content - Not Scraped,insight
"Antisipasi Bunga Naik, Peserta Lelang SUN Minta Yield Tinggi",2024-09-24T16:13:38.693Z,,Premium User Only,https:////insight.kontan.co.id/news/antisipasi-bunga-naik-peserta-lelang-sun-minta-yield-tinggi,Premium Content - Not Scraped,insight
"Bunga The Fed Ditaksir Naik Lagi, Bagaimana Nasib Kinerja Obligasi (SUN)?",2024-09-24T16:13:39.893Z,,Premium User Only,https:////insight.kontan.co.id/news/bunga-the-fed-ditaksir-naik-lagi-bagaimana-nasib-kinerja-obligasi-sun,Premium Content - Not Scraped,insight
"Efek Bunga The Fed, Peserta Lelang SUN Minta Yield Tinggi",2024-09-24T16:13:40.120Z,,Premium User Only,https:////insight.kontan.co.id/news/efek-bunga-the-fed-peserta-lelang-sun-minta-yield-tinggi,Premium Content - Not Scraped,insight
"Bunga The Fed Naik, Imbal Hasil SUN Tenor 10 Tahun Bisa Melesat Jadi 8%",2024-09-24T16:13:40.339Z,,Premium User Only,https:////insight.kontan.co.id/news/bunga-the-fed-naik-imbal-hasil-sun-tenor-10-tahun-bisa-melesat-jadi-8,Premium Content - Not Scraped,insight
"Tunggu Arah Bunga, Investor Serbu SUN Tenor Pendek",2024-09-24T16:13:41.222Z,,Premium User Only,https:////insight.kontan.co.id/news/tunggu-arah-bunga-investor-serbu-sun-tenor-pendek,Premium Content - Not Scraped,insight
Pasar SUN Mengantisipasi Kenaikan Bunga The Fed Lebih Cepat,2024-09-24T16:13:41.530Z,,Premium User Only,https:////insight.kontan.co.id/news/pasar-sun-mengantisipasi-kenaikan-bunga-the-fed-lebih-cepat,Premium Content - Not Scraped,insight
"Suku bunga turun, begini proyeksi pergerakan yield SUN",2024-09-24T16:13:41.635Z,"Minggu, 21 Februari 2021 / 15:29 WIB",Reporter: Danielisa Putriadita | Editor: Herlina Kartika Dewi,https:////investasi.kontan.co.id/news/suku-bunga-turun-begini-proyeksi-pergerakan-yield-sun,"KONTAN.CO.ID - JAKARTA. Yield Surat Utang Negara (SUN) mulai bergerak naik setelah yield US Treasury menyentuh level tertinggi. Alhasil, dampak penurunan suku bunga BI-7 Day Reverse Repo Rate (BI7DRR) dalam menurunkan yield SUN belum terasa. Berdasarkan Bloomberg, Jumat (19/2), yield US Treasury kembali menyentuh rekor tertinggi sejak Februari 2020 di level 1,34%. Kompak, yield SUN tenor 10 thuan bergerak naik menjadi di level 6,52% dari level 6,2% di Selasa (16/2). Ekonom Samuel Sekuritas Ahmad Mikail Zaini mengatakan yield US Treasury terus naik karena defisit anggaran AS membesar. Defisit tersebut bertambah karena AS berencana mengeluarkan stimulus besar-besaran. Alhasil, potensi penerbitan surat utang AS bertambah sementara permintaan pasar belum seimbang. ""Pertanyaanya siapa yang akan menyerap US Treasury, kepemilikan surat utang AS oleh China menurun, Jepang juga stagnan, sementara The Fed tidak mungkin menyerap semua,"" kata Mikail. Di tengah yeild US Treasury bergerak naik, BI justru menurunkan suku bunga. Mikail mengatakan dampak penurunan suku bunga BI saat yield US Treasury dalam tren naik dapat membuat spread antara yield US Treasury dan yield SUN semakin tipis. Hingga akhirnya mendorong pelaku pasar keluar dari pasar obligasi maupun rupiah (capital outflow). Baca Juga: Era Suku Bunga Rendah, Investasi di Obligasi dan Saham bisa Jadi Pilihan Sayangnya, Mikail memproyeksikan yield US treasury ke depan masih akan naik. ""Jika yield US Treasury naik ke 1,5% maka yield SUN berpotensi naik ke level 6,7%-6,9%,"" kata Mikail. Associate Director Fixed Income Anugerah Sekuritas Ramdhan Ario mengatakan kenaikan yield US Treasury juga dipengaruhi oleh sentimen negatif dari pandemi yang tidak kunjung mereda baik di AS mupun Indonesia. Secara teori Ramdhan mengatakan penurunan suku bunga harusnya bisa membuat yield turun atau harga SUN naik. Namun, di tengah kondisi yang tidak pasti akibat pandemi, ujungnya hanya membuat investor bersikap wait and see. Jika pandemi sudah reda dan tren suku bunga rendah masih dijalankan, Ramdhan memproyeksikan yield SUN tahun ini berpotensi menurun ke bawah 6%. ""Asing berpotensi masuk lagi, likuiditas juga masih baik selama tren suku bunga rendah secara global masih diterapkan,"" kata Ramdhan. Head of Economics Research Pefindo Fikri C Permana menambahkan, di satu sisi melihat yield SUN yang terus naik di atas 6%, seharusnya bisa semakin menarik investor asing untuk masuk. ""Sebenarnya yield di atas 6% sangat prospektif dan menarik apalagi di tengah BI yang percaya diri menurunkan suku bunga acuannya,"" kata Fikri. Suku bunga turun juga menandakan risiko dalam negeri rendah, inflasi pun dapat terjaga di level rendah. Dengan begitu, investor berpotensi dapatkan real interest rate yang lebih tinggi. Faktor yang membuat inflasi diproyeksikan tetap terjaga adalah perbaikan ekonomi yang belum terjadi secepat seperti yang diharapkan.  ""Dengan yield SUN di 6,5% dan inflasi di 2% maka ada spread 450 basis poin ini lebih menarik dibanding yield US treasury, tetapi dengan catatan rupiah tetap bergerak stabil terhadap rupiah,"" kata Fikri.  Cek Berita dan Artikel yang lain di Google News",investasi
Yield SUN masih naik meski ada penurunan suku bunga,2024-09-24T16:13:41.683Z,"Senin, 16 Maret 2020 / 21:15 WIB",Reporter: Hikma Dirgantara | Editor: Wahyu T.Rahmawati,https:////investasi.kontan.co.id/news/yield-sun-masih-naik-meski-ada-penurunan-suku-bunga,"KONTAN.CO.ID - JAKARTA. Imbal hasil atau yield Surat Utang Negara (SUN) Indonesia saat ini tengah berada dalam tren kenaikan. Di sisi lain, The Fed telah memangkas suku bunganya menjadi 0,25%. Menjadikannya rekor terendah sejak krisis finansial yang terjadi pada 2008 silam. Banyak kalangan menilai keputusan The Fed tersebut membuka ruang bagi Bank Indonesia (BI) untuk ikut melakukan pemangkasan suku bunga. Saat ini, suku bunga acuan BI sendiri berada di level 4,75%. Direktur Panin Asset Management (Panin AM) Rudiyanto tak memungkiri secara teori, setiap suku bunga turun maka harga obligasi akan naik. Dengan demikian akan menguntungkan bagi reksadana pendapatan tetap. Tapi untuk saat ini, Rudiyanto melihat hal tersebut tidak terjadi. Baca Juga: Reksadana pendapatan tetap akan diuntungkan pemangkasan suku bunga “Tetapi untuk saat ini fluktuasi jangka pendek akan tetap bisa terjadi meski pemangkasan suku bunga dilakukan. Karena pemangkasan ini imbas dari persebaran wabah corona semakin meluas di luar China termasuk Indonesia,” terang Rudiyanto kepada Kontan.co.id, Senin (16/3). Head of Investment Avrist Asset Management (Avrist AM) Farash Farich juga menyerukan pendapat yang sama. Farash menyebut, The Fed sudah turunkan 150 bps pada tahun ini sementara BI baru 25 bps. Sehingga menurutnya, besar kemungkinan BI akan memangkas suku bunga. “Harga obligasi tidak serta merta naik, justru akan mengikuti tren global yang cenderung risk off. Jadi harga akan turun karena investor keluar dari risky assets termasuk emerging markets bond dan equity,” ujar Farash. Baca Juga: IHSG tumbang sepekan, kinerja reksadana pun ikut jeblok Sementara Fixed Income Portfolio Manager Sucorinvest Asset Management Adi Saputra melihat pemangkasan suku bunga oleh BI memang tidak bisa dihindari. Namun, ia menilai sebaiknya BI tidak meniru langkah The Fed yang memangkas secara sekaligus. Pemangkasan secara berkala menjadi langkah yang lebih tepat. “Kalau dilakukan secara agresif yang dikhawatirkan spread kita jadi tidak terlalu atraktif terhadap US Treasury. Saat ini level 550-650 bps sudah level paling atraktif dan harus dijaga,” kata Adi. Adi melihat situasi saat ini seperti yang terjadi pada 2008 silam. Saat itu, setelah krisis moneter membaik, likuiditas di Amerika Serikat menjadi berlimpah. Sementara yield di AS saat itu rendah dan membuat para investor mengalihkan investasinya ke emerging market, termasuk Indonesia yang punya yield menarik. Baca Juga: The Fed pangkas suku bunga, investor khawatir kemungkinan terburuk terjadi “Kalau tren ini berulang, saat mereda, likuiditas yang ada di market akan dialirkan ke return atraktif yang ada di emerging market. Nah kalau kita bisa menjaga level yield di 500-600 bps, begitu keadaan membalik Indonesia akan dapat inflow besar seperti 2008 silam,” jelas Adi. Cek Berita dan Artikel yang lain di Google News",investasi
"Bunga acuan terpangkas, antusiasme investor di lelang SUN akan meningkat",2024-09-24T16:13:41.844Z,"Jumat, 20 September 2019 / 17:15 WIB",Reporter: Dimas Andi | Editor: Herlina Kartika Dewi,https:////investasi.kontan.co.id/news/bunga-acuan-terpangkas-antusiasme-investor-di-lelang-sun-akan-meningkat,"KONTAN.CO.ID - JAKARTA. Euforia penurunan suku bunga acuan dipercaya masih akan terasa hingga pelaksanaan lelang Surat Utang Negara (SUN) pada Selasa (24/9) mendatang. Minat investor akan meningkat saat lelang nanti. Associate Director Fixed Income Anugerah Sekuritas Indonesia Ramdhan Ario Maruto menilai, pemangkasan suku bunga acuan baik oleh The Federal Reserves maupun Bank Indonesia (BI) sebenarnya sudah diekspektasikan oleh para pelaku pasar. Lebih khusus untuk BI, ruang penurunan suku bunga acuan sangat terbuka seiring besarnya arus modal asing yang masuk ke pasar keuangan Indonesia dalam beberapa bulan terakhir. Alhasil, tinggal masalah waktu saja bagi BI untuk memotong suku bunga acuan. Karena sudah diekspektasikan, kondisi pasar obligasi cenderung stabil. Dalam hal ini, tidak terjadi pergerakan yang signifikan dari yield atau harga SUN di pasar sekunder. Baca Juga: Imbal hasil SN berpotensi turun usai penurunan suku bunga acuan BI Walau begitu, antusiasme investor akan tetap tinggi pada saat lelang SUN nanti. “Biar bagaimanapun, pemangkasan suku bunga acuan selalu menjadi katalis positif bagi pasar obligasi,” ujar dia, Jumat (20/9). Ditambah lagi, ada kemungkinan pemerintah akan meniadakan lelang Surat Berharga Negara (SBN) di pertengahan Desember nanti. Pasalnya, kebijakan front loading pemerintah membuat target penerbitan SBN melalui lelang bisa saja terpenuhi sebelum akhir tahun. “Suplai obligasi di pasar primer mulai terbatas sehingga potensi investor untuk lebih meramaikan lelang sangat terbuka,” imbuhnya. Ramdhan memandang, seiring stabilnya kondisi pasar dan efek penurunan suku bunga acuan, bukan mustahil nilai penawaran yang masuk pada lelang SUN nanti bisa di atas Rp 45 triliun. Baca Juga: Tekanan eksternal turut mengangkat imbal hasil SUN Selain itu, dorongan sentimen positif penurunan suku bunga acuan ditambah tensi perang dagang yang sedang mereda berpotensi membuat penawaran masuk pada lelang SUN nanti tidak hanya terkonsentrasi pada seri-seri tenor pendek saja. Seri-seri tenor panjang atau di atas 10 tahun juga diyakini bakal laris saat lelang nanti. Sebagai catatan, dalam lelang SUN nanti, pemerintah akan menawarkan tujuh seri seperti SPN03191226, SPN12200619, FR0081, FR0082, FR0080, FR0079, dan FR0076. Cek Berita dan Artikel yang lain di Google News",investasi
Yield SUN berpeluang turun menjelang pengumuman suku bunga acuan AS,2024-09-24T16:13:42.075Z,"Rabu, 18 September 2019 / 09:32 WIB",Reporter: Dimas Andi | Editor: Wahyu T.Rahmawati,https:////investasi.kontan.co.id/news/yield-sun-berpeluang-turun-menjelang-pengumuman-suku-bunga-acuan-as,"KONTAN.CO.ID - JAKARTA. Imbal hasil Surat Utang Negara (SUN) diperkirakan bergerak turun pada perdagangan Rabu (18/9). Hal ini seiring ekspektasi penurunan suku bunga acuan Amerika Serikat (AS) yang kian membesar. Sebagai informasi, imbal hasil US Treasury tenor 10 tahun pada Selasa malam turun 2 bps ke level 1,81%. Imbal hasil US Treasury tenor 30 tahun juga turun 2 bps ke level 2,28%. Penurunan ini disebabkan koreksi harga minyak dunia setelah kerusakan fasilitas minyak Saudi Aramco tidak sebesar yang diperkirakan. Baca Juga: Ekonom Standard Chartered dan Samuel Sekuritas prediksi BI pangkas suku bunga Sementara itu, Indonesia Composite Bond Index (ICBI) kemarin mengalami kenaikan 0,06% sehingga sepanjang tahun ini telah mencetak return sebesar 10,55% (ytd). Potensi berlanjutnya tren positif pasar obligasi domestik cukup terbuka. Pasalnya, para investor terus berekspektasi bahwa Federal Reserve akan memotong suku bunga acuan AS nanti malam. Baca Juga: Pergerakan pasar keuangan Indonesia masih bertumpu pada sentimen eksternal ""Para investor juga akan mencermati hasil pidato Gubernur The Fed Jerome Powell untuk melihat arah kebijakan suku bunga acuan AS hingga akhir tahun,"" ungkap Ekonom Samuel Sekuritas Indonesia Ahmad Mikail Zaini dalam riset harian yang diterima Kontan.co.id. Dengan demikian, Mikail memproyeksikan imbal hasil SUN 10 tahun akan bergerak di kisaran 7,15%-7,22% pada hari ini. Adapun seri SUN yang direkomendasikan hari ini antara lain PBS014, PBS022, FR0078, FR0079, FR0081, FR0082, dan FR0080. Cek Berita dan Artikel yang lain di Google News",investasi
"Ekspektasi penurunan suku bunga AS makin gencar, imbal hasil SUN berpotensi turun",2024-09-24T16:13:42.213Z,"Rabu, 04 September 2019 / 09:27 WIB",Reporter: Dimas Andi | Editor: Wahyu T.Rahmawati,https:////investasi.kontan.co.id/news/ekspektasi-penurunan-suku-bunga-as-makin-gencar-imbal-hasil-sun-berpotensi-turun,"KONTAN.CO.ID - JAKARTA. Imbal hasil Surat Utang Negara (SUN) diperkirakan turun pada perdagangan Rabu (4/9). Hal ini didorong oleh turunnya imbal hasil US Treasury seiring melemahnya data ekonomi AS. Sebagai informasi, imbal hasil US Treasury tenor 10 tahun pada Selasa malam lalu turun 4 bps ke level 1,47%, sedangkan imbal hasil US Treasury tenor 30 tahun turun 4 bps ke level 1,96%. Penurunan terebut disebabkan ekspektasi para investor bahwa Federal Reserve akan memotong suku bunga acuan di bulan ini setelah data ISM manufaktur AS mengalami kontraksi. Baca Juga: Bahana TCW menerbitkan efek beragun aset (EBA) kredit pensiunan Ekspektasi penurunan suku bunga acuan AS juga membuat pasar obligasi domestik berpotensi bergerak positif pada hari ini, meski kemarin Indonesia Composite Bond Index (ICBI) turun 0,11%. “Para pelaku pasar juga akan menunggu data PMI China dan Uni Eropa untuk mengetahui arah kebijakan moneter ECB bulan ini,” ungkap Ekonom Samuel Sekuritas Indonesia Ahmad Mikail Zaini dalam riset harian yang diterima Kontan.co.id. Baca Juga: SBR008 Tawarkan Kupon Mini 7,20% premium Dengan demikian, Mikail memproyeksikan imbal hasil SUN tenor 10 tahun akan bergerak turun di kisaran 7,30%--7,36% pada hari ini. Adapun seri SUN yang direkomendasikan pada hari ini antara lain PBS014, PBS022, FR0078, FR0079, FR0081, FR0082, dan FR0080. Cek Berita dan Artikel yang lain di Google News",investasi
"Harga SUN Masih Stagnan Sejak Suku Bunga Dipangkas, Ini Rekomendasi Analis",2024-09-24T16:13:42.444Z,,Premium User Only,https:////insight.kontan.co.id/news/harga-sun-masih-stagnan-sejak-suku-bunga-dipangkas-ini-rekomendasi-analis,Premium Content - Not Scraped,insight
"BI memangkas suku bunga, yield SUN masih stagnan",2024-09-24T16:13:42.486Z,"Selasa, 27 Agustus 2019 / 19:48 WIB",Reporter: Danielisa Putriadita | Editor: Wahyu T.Rahmawati,https:////investasi.kontan.co.id/news/bi-memangkas-suku-bunga-yield-sun-masih-stagnan,"KONTAN.CO.ID - JAKARTA. Penurunan suku bunga acuan Bank Indonesia (BI) 7-Day Reverse Repo Rate (BI7DRRR) nampaknya belum berdampak ke harga Surat Utang Negara (SUN). Sejak, BI menurunkan suku bunga ke 5,5% pada Kamis (22/8), pergerakan yield SUN acuan tenor 10 tahun cenderung stagnan di level 7,2%. Yield tersebut sudah bertengger sejak Rabu (21/8) hingga Selasa (27/8). Para analis mengonfirmasi bahwa penurunan suku bunga memang belum membuat harga SUN naik lebih tinggi. Pasar obligasi domestik masih tertekan sentimen eksternal, yaitu memanasnya perang dagang Amerika Serikat (AS) dan China. Baru-baru ini AS dan China kembali saling melempar tarif impor tambahan. Baca Juga: Tren penguatan obligasi dolar AS masih berlanjut Associate Director Fixed Income Anugerah Sekuritas Indonesia Ramdhan Ario Maruto mengatakan, kondisi tersebut membuat pelaku pasar cenderung wait and see. Hal ini terlihat dari volume perdagangan obligasi di pasar sekunder juga menurun. ""Isu perang dagang membuat asing belum ramai masuk ke pasar obligasi, sementara investor domestik sifatnya juga menunggu arus asing terlebih dahulu,"" kata Ramdhan. Berdasarkan data Direktorat Jenderal Pengelolaan Pembiayaan dan Risiko Kementerian Keuangan, jumlah kepemilikan asing di Surat Berharga Negara (SBN) juga terlihat stagnan di sekitar Rp 1.008 triliun sejak BI menurunkan suku bunga hingga Senin (26/8). Maklum, sentimen eksternal memang menjadi sentimen utama kondisi pasar obligasi domestik. Porsi asing mendominasi dan aktif melakukan transaksi dari pada investor domestik. Baca Juga: Penawaran masuk pada lelang SUN mencapai Rp 29,11 triliun Di pekan depan, Ramdhan memproyeksikan pergerakan yield SUN acuan tenor 10 tahun masih akan bergerak stagnan hingga pengumuman kebijakan moneter Bank Sentral AS (The Fed) terlaksana di September mendatang. Analis PT Capital Asset Management Desmon Silitonga menambahkan, pelaku pasar saat ini belum percaya diri untuk masuk ke emerging market karena The Fed belum solid mengenai arah kebijakan moneternya. Jika di September mendatang The Fed menurunkan suku bunga acuannya, Desmon memproyeksikan pasar obligasi domestik akan rebound dengan cepat. Namun, sebaliknya jika The Fed menahan suku bunga maka pasar obliagsi domestik berpotensi semakin tertekan. Apalagi, dengan nilai tukar rupiah yang masih sangat volatile. Hal tersebut bisa berdampak buruk ke pasar SBN. ""Rupiah kita cukup rentan terbawa pergerakan yuan yang kini tertekan perang dagang AS dan China, rupiah juga bisa makin melemah karena suku bunga BI turun 50 basis poin,"" kata Desmon. Tak heran bila rupiah yang melemah ini bisa membuat harga SUN stagnan meski suku bunga sudah turun. Baca Juga: Minat turun, rata-rata penjualan ST005 per investor makin merata Dalam jangka pendek, Ramdhan merekomendasikan pelaku pasar bisa meminimalkan risiko dengan mengoleksi seri SUN tenor pendek. Namun, bagi investor yang percaya diri bisa tetap mengoleksi SUN tenor panjang. Paling tidak hingga akhir tahun ini, Ramdhan memproyeksikan harga SUN masih berpotensi beri keuntungan dengan yield yang berada di 7% dan posisi nilai tukar rupiah di Rp 14.000 per dolar AS. Desmon pun optimistis tren pelonggaran moneter yang terjadi secara global akan mendorong pasar obligasi ke area positif. Desmon memproyeksikan yield SUN acuan tenor 10 tahun di akhir tahun ini bisa ke level 7% dengan posisi rupiah di Rp 14.100 per dolar AS-Rp 14.200 per dolar AS. ""Saat ini harusnya investor berani ambil seri tenor menengah hingga panjang,"" kata Desmon. Cek Berita dan Artikel yang lain di Google News",investasi
"Pasca BI pangkas bunga acuan, investor asing berpeluang memburu SUN tenor menengah",2024-09-24T16:13:42.724Z,"Minggu, 25 Agustus 2019 / 18:47 WIB",Reporter: Dimas Andi | Editor: Herlina Kartika Dewi,https:////investasi.kontan.co.id/news/pasca-bi-pangkas-bunga-acuan-investor-asing-berpeluang-memburu-sun-tenor-menengah,"KONTAN.CO.ID - JAKARTA. Bank Indonesia (BI) kembali memangkas suku bunga acuan atau BI-7 Day Repo Rate menjadi 5,50% pada Kamis (22/8) lalu. Hasil ini dapat mempengaruhi pilihan seri Surat Utang Negara (SUN) di mata para investor asing. Ekonom PT Pemeringkat Efek Indonesia Fikri C. Permana menilai, ada kemungkinan investor asing akan bergeser mengincar seri-seri bertenor menengah atau 5 tahun—10 tahun usai BI kembali menurunkan suku bunga acuan. Ini mengingat adanya keyakinan dari para investor tersebut bahwa BI masih bersikap dovish terhadap kebijakan suku bunga acuan Indonesia. Keputusan BI yang memotong suku bunga acuan di bulan Agustus sebenarnya agak mengejutkan para pelaku pasar, karena banyak pihak yang sebelumnya memprediksi aksi seperti itu baru dilakukan di bulan September. “Banyak yang melihat BI masih akan lebih akomodatif di tahun ini,” imbuh Fikri, Jumat (23/8) lalu. Associate Director Fixed Income Anugerah Sekuritas Indonesia Ramdhan Ario Maruto menilai, investor asing juga masih mempertimbangkan kondisi pasar secara global. Menurutnya, ketika sentimen perang dagang mereda, investor asing berpeluang menambah kepemilikan pada SUN tenor menengah seperti FR0078 yang notabene menjadi seri benchmark di pasar obligasi Indonesia. Baca Juga: Risiko global meningkat, investor asing cenderung perbanyak SUN tenor pendek Seri seperti ini dipandang paling likuid bagi investor asing, sehingga memudahkan dalam urusan fleksibilitas transaksi. Selain itu, seri FR0078 yang bertenor 10 tahun juga kerap dikomparasikan dengan US Treasury tenor serupa. “Berbekal pasar yang likuid dan spread antar yield yang lebar, bukan tidak mungkin banyak investor asing mengincar seri tenor menengah,” jelas Ramdhan, akhir pekan lalu. Sekadar catatan, berdasarkan data Ditjen Pengelolaan Pembiayaan dan Risiko Kemkeu, dari periode Juni hingga 13 Agustus silam, porsi kepemilikan asing untuk SUN tenor 5—10 tahun stagnan di level 35,4%. Adapun nilai kepemilikan asing di pasar obligasi pemerintah hingga 21 Agustus lalu telah mencapai Rp 1.006,84 triliun. Cek Berita dan Artikel yang lain di Google News",investasi
Harga SUN berpeluang naik jelang pengumuman suku bunga acuan BI,2024-09-24T16:13:42.774Z,"Kamis, 22 Agustus 2019 / 09:25 WIB",Reporter: Dimas Andi | Editor: Herlina Kartika Dewi,https:////investasi.kontan.co.id/news/harga-sun-berpeluang-naik-jelang-pengumuman-suku-bunga-acuan-bi,"KONTAN.CO.ID - JAKARTA. Harga Surat Utang Negara (SUN) diperkirakan akan naik pada perdagangan Kamis (22/8). Hal ini terjadi di tengah penantian para pelaku pasar terhadap rilis kebijakan moneter Bank Indonesia terkait suku bunga acuan. Analis Fixed Income MNC Sekuritas I Made Adi Saputra meyakini, BI akan mempertahankan suku bunga acuan atau BI-7 Day Repo Rate di level 5,75%. Di sisi lain, sebagian besar imbal hasil surat utang global mengalami kenaikan pada perdagangan kemarin. Ambil contoh, imbal hasil US Treasury tenor 10 tahun yang naik ke level 1,586% sedangkan imbal hasil US Treasury tenor 30 tahun naik ke level 2,066%. Baca Juga: Harga SUN berpeluang naik, seri-seri ini bisa jadi opsi bagi investor “Kondisi tersebut kami perkirakan akan menekan harga SUN dengan denominasi mata uang dolar AS,” ungkap Made dalam riset harian yang diterima Kontan.co.id. Dengan demikian, Made menyarankan para investor untuk tetap mencermati pergerakan kurs rupiah seiring masih adanya sentimen perang dagang antara AS-China. Investor juga disarankan melakukan strategi trading dengan memanfaatkan momentum kenaikan harga SUN dengan pilihan pada seri-seri tenor pendek dan menengah. Seri-seri yang dimaksud meliputi FR0031, FR0053, FR0061, FR0056, FR0059, dan FR0064. Sebelumnya, harga SUN naik pada perdagangan kemarin akibat penguatan rupiah serta aksi beli para investor di tengah penantian suku bunga acuan BI. Baca Juga: Tren bunga turun, pamor obligasi dan saham meningkat Harga rata-rata SUN tenor pendek atau satu tahun hingga empat tahun naik sebesar 9 basis poin (bps) yang mengakibatkan penurunan imbal hasil rata-rata sebesar 2 bps. Harga rata-rata SUN tenor menengah atau lima tahun sampai tujuh tahun naik hingga 18,6 bps sehingga imbal hasil rata-ratanya turun sekitar 1 bps—4,6 bps. Adapun harga rata-rata SUN tenor panjang atau di atas tujuh tahun naik sebesar 106 bps sehingga mendorong penurunan imbal hasil rata-rata hingga 10 bps. Cek Berita dan Artikel yang lain di Google News",investasi
"Suku bunga diprediksi tetap, harga SUN diramal turun",2024-09-24T16:13:42.939Z,"Senin, 19 Agustus 2019 / 10:07 WIB",Reporter: Dimas Andi | Editor: Wahyu T.Rahmawati,https:////investasi.kontan.co.id/news/suku-bunga-diprediksi-tetap-harga-sun-diramal-turun,"KONTAN.CO.ID - JAKARTA. Imbal hasil Surat Utang Negara (SUN) diperkirakan akan bergerak naik pada perdagangan Senin (19/8). Hal ini didorong oleh penantian investor terhadap agenda Rapat Dewan Gubernur Bank Indonesia pada 21-22 Agustus nanti. Sebagai informasi, imbal hasil US Treasury tenor 10 tahun naik 7 bps ke level 1,57% pada Jumat (16/8) malam lalu. Di saat yang sama, imbal hasil US Treasury tenor 30 tahun juga naik 7% ke level 2,07%. Baca Juga: Pasar Obligasi Rentan Capital Outflow Jika BI Memangkas Suku Bunga premium “Kembali naiknya imbal hasil US Treasury disebabkan data penjualan ritel AS di bulan Juli yang tumbuh 3,4% (yoy) atau lebih tinggi dari ekspektasi sebesar 3,3% (yoy),” ungkap Ekonom Samuel Sekuritas Indonesia Ahmad Mikail Zaini melalui riset yang diterima Kontan.co.id. Di akhir pekan lalu, Indonesia Composite Bond Index (ICBI) juga mengalami kenaikan 0,65%. Alhasil, secara year to date, ICBI telah membukukan return sebesar 9,13%. Baca Juga: Pasar Obligasi masih labil, BI diyakini pertahankan suku bunga acuan Akan tetapi, ancaman koreksi tengah membayangi pasar obligasi dalam negeri pada hari ini seiring penantian terhadap RDG BI. Para pelaku pasar berekspektasi bahwa BI akan menahan tingkat suku bunga acuan saat RDG nanti. Dengan demikian, Mikail memproyeksikan imbal hasil SUN seri acuan 10 tahun akan bergerak di kisaran 7,30%--7,42% pada perdagangan hari ini. Adapun seri SUN yang direkomendasikan hari ini antara lain PBS014, PBS022, FR0078, FR0079, FR0081, FR0082, dan FR0080. Cek Berita dan Artikel yang lain di Google News",investasi
