Title,Scrapping Date,Article Date,Author,Link,Content,Category
Defisit keseimbangan primer jangan turun cepat,2024-09-24T16:18:46.551Z,"Senin, 18 Desember 2017 / 18:32 WIB",Reporter: Adinda Ade Mustami | Editor: Yudho Winarto,https:////nasional.kontan.co.id/news/defisit-keseimbangan-primer-jangan-turun-cepat,"KONTAN.CO.ID - JAKARTA. Gali Lubang tutup lubang masih dilakukan pemerintah di tahun depan. Artinya, pemerintah masih membayar bunga utang dari penarikan utang yang dilakukan. Hal itu tampak pada keseimbangan primer yang masih mencatatkan defisit. Tahun depan, defisit keseimbangan primer dalam APBN tercatat sebesar Rp 87 triliun. Angka itu lebih rendah dibanding defisit keseimbangan primer dalam APBN-P 2017 yang sebesar Rp 178 triliun. Penurunan defisit keseimbangan primer tersebut sejalan dengan menurunnya target defisit anggaran dari 2,92% dari produk domestik bruto (PDB) dalam APBN-P 2017 menjadi 2,19% dari PDB. Pemerintah memang menargetkan keseimbangan primer semakin berkurang, bahkan seimbang. Namun, Kepala Badan Kebijakan Fiskal (BKF) Kementerian Keuangan Suahasil Nazara mengakui tak ingin hal itu dilakukan dalam waktu yang sangat singkat. ""Kenapa enggak dibuat positif di 2018? Jangan. Terlalu cepat. Nanti defisit ke PDB-nya lebih drop,"" kata Suahasil, Senin (18/12). Sebab, jika defisit anggaran sangat rendah opsinya pemerintah harus mengurangi pengeluaran di saat penerimaan pajak masih rendah seperti saat ini. Jika belanja pemerintah dikurangi , Meski demikian, seiring dengan defisit keseimbangan primer yang menurun pemerintah berharap kredibilitas APBN membaik. Menteri Keuangan Sri Mulyani mengatakan bahwa beban utang pemerintah juga bisa berkurang. Karena bunga utang untuk membayar utang juga akan berkurang. ""Defisit keseimbangan primer di bawah atau hampir separuh tahun ini. Maka APBN Indonesia sehat,"" kata dia. Cek Berita dan Artikel yang lain di Google News",nasional
"Dekat Pilpres, keseimbangan primer sulit surplus",2024-09-24T16:18:46.647Z,"Senin, 12 Juni 2017 / 20:33 WIB",Reporter: Adinda Ade Mustami | Editor: Hendra Gunawan,https:////nasional.kontan.co.id/news/dekat-pilpres-keseimbangan-primer-sulit-surplus,"JAKARTA. Ekonom SKHA Institute for Global Competitiveness Eric Sugandi menilai, keseimbangan primer masih akan sulit mencatat surplus dalam waktu dekat. Sebab, kebijakan fiskal pemerintah masih bersifat ekspansif.  ""Apalagi di tahun 2019 nanti akan ada pemilihan Presiden. Biasanya menjelang Pemilu fiskal lebih ekspansif,"" kata Eric, kepada KONTAN, Minggu (11/6).  Eric juga bilang, pemerintah melihat belum ada kebutuhan untuk melunasi utang dengan cepat. Apalagi, rasio utang pemerintah terhadap PDB saat ini masih berada di batas yang aman.  Dalam rancangan APBN 2018, defisit anggaran diperkirakan sebesar 1,9%-2,3% dari produk domestik bruto (PDB). Sejalan dengan adanya defisit anggaran tersebut, pemerintah memperkirakan defisit keseimbangan primer sebesar 0,4%-0,6% dari PDB. Nilai itu sekitar Rp 50 triliun-Rp 99 triliun.  Angka defisit anggaran dan defisit keseimbangan primer itu hanya sedikit membaik dibanding target dalam APBN 2017 yang masing-masing sebesar 2,41% dari PDB dan Rp 109 triliun.  Padahal, pemerintah memperkirakan keseimbangan primer bisa mencatatkan surplus di tahun 2019 mendatang. Menteri Keuangan sebelumnya Bambang Brodjonegoro pernah mengatakan, keseimbangan primer APBN bisa surplus, asalkan defisit anggaran hanya 1,1% dari PDB. Cek Berita dan Artikel yang lain di Google News",nasional
"Keseimbangan primer bisa mencapai surplus, asal..",2024-09-24T16:18:46.782Z,"Senin, 12 Juni 2017 / 19:25 WIB",Reporter: Adinda Ade Mustami | Editor: Hendra Gunawan,https:////nasional.kontan.co.id/news/keseimbangan-primer-bisa-mencapai-surplus-asal,"JAKARTA. Direktur Jenderal (Dirjen) Anggaran Kementerian Keuangan (Kemkeu) Askolani mengatakan, hasil kajian yang dilakukan oleh pihaknya dalam jangka dua hingga tiga tahun kebelakang, keseimbangan primer bisa mencapai surplus. Hal itu bisa dicapai asal defisit anggaran turun jadi 1,1%-1,2% dari produk domestik bruto (PDB).  Askolani bilang, keseimbangan primer bisa mencapai kondisi netral jika ada lonjakan penerimaan pajak. Menurutnya, kebijakan tentang akses informasi untuk kepentingan perpajakan yang tertuang dalam Peraturan Pemerintah Pengganti Undang-Undang (Perppu) Nomor 1 Tahun 2017 bisa saja meningkatkan penerimaan pajak dan mencapai rasio pajak (tax ratio) yang diinginkan pemerintah.  ""Kedua, kebijakan subsidi agar tepat sasaran, ini bisa mengurangi (defisit). Tetapi itu tergantung evaluasi dan implementasinya,"" kata Askolani, Senin (12/6).  Meski demikian, keseimbangan primer juga tergantung pada arah kebijakan pemerintah di tahun depan. Sementara arah kebijakan di tahun depan, tergantung pada kondisi yang akan dicapai di tahun ini. Cek Berita dan Artikel yang lain di Google News",nasional
SMI: Keseimbangan primer APBN mengkhawatirkan,2024-09-24T16:18:46.944Z,"Rabu, 17 Agustus 2016 / 19:00 WIB",Reporter: Agus Triyono | Editor: Rizki Caturini,https:////nasional.kontan.co.id/news/smi-keseimbangan-primer-apbn-mengkhawatirkan,"JAKARTA. Kondisi keseimbangan primer di dalam APBN sampai saat ini masih mengkhawatirkan. Kondisi ini, bisa dilihat dari defisit yang masih menghantui keseimbangan primer di dalam APBN. Sri Mulyani, Menteri Keuangan menyatakan, hal ini didasar data yang dimilikinya. Sampai saat ini defisit keseimbangan primer masih mencapai Rp 111,4 triliun. Sri mengatakan, defisit tersebut menubjukkan, kondisi APBN sakit dan karena itu pemerintah harus berhati- hati. ""Ini menunjukkan, pemerintah selama ini meminjam bukan untuk investasi, tapi menservice utang, meminjam hanya untuk bayar suku bunga,"" katanya di Jakarta (16/8). Sri mengatakan, agar kondisi tersebut tidak terus terjadi pemerintah akan berbenah. Cek Berita dan Artikel yang lain di Google News",nasional
Pajak jadi kunci surplusnya keseimbangan primer,2024-09-24T16:18:47.108Z,"Minggu, 31 Januari 2016 / 20:22 WIB",Reporter: Adinda Ade Mustami | Editor: Hendra Gunawan,https:////nasional.kontan.co.id/news/pajak-jadi-kunci-surplusnya-keseimbangan-primer,"JAKARTA. Tahun 2015, neraca keseimbangan primer kembali mencatatkan defisit. Dalam realisasi Anggaran Pendapatan dan Belanja Negara Perubahan (APBN-P) 2015 sementara, neraca keseimbangan primer mencatatkan defisit sebesar Rp 136,1 triliun.  Angka itu membengkak 203,8% dari target dalam APBN-P 2015 yang sebesar Rp 66,8 triliun. Defisit tersebut juga lebih lebar dibandingkan dengan tahun 2014 yang sebesar Rp 93,3 triliun atau 87,9% dari target Rp 106 triliun.  Ekonom Samuel Asset Mangement Lana Soelistianingsih mengatakan, kunci utama untuk membuat neraca keseimbangan primer menjadi surplus, yaitu jumlah penerimaan negara harus lebih besar dari jumlah belanja negara ditambah dengan jumlah bunga utang.  Keseimbangan primer adalah total pendapatan negara dikurangi belanja tanpa menghitung pembayaran bunga utang. Jika berada dalam kondisi defisit, berarti pendapatan negara tidak bisa menutupi pengeluaran sehingga membayar bunga utang dengan menggunakan pokok utang baru.  Menurut Lana, dalam hal ini pemerintah hanya bisa mengandalkan penerimaan perpajakan (pajak dan bea cukai). Sebab, penerimaan negara bukan pajak (PNBP) masih menggantungkan nasib pada kondisi global, dimana saat ini harga-harga komoditas masih anjlok.  ""Pemerintah hanya bisa utak-atik strategi penerimaan pajak dan bea cukai misalnya dengan menurunkan tarif pajak agar lebih banyak wajib pajak yang mau membayar pajak,"" kata Lana, Minggu (31/1). Tak hanya tarif, pemerintah juga bisa menyederhanakan administrasi pajak agar wajib pajak tak kesulitan dalam mengisi atau melaporkan SPT.  Sementara itu, pemerintah juga tidak bisa mengurangi belanja mengingat belanja pemerintah menjadi salah satu penggerak ekonomi dalam negeri. Apalagi, pemerintah tengah menggeber pembangunan infrastruktur saat ini.  Di sisi lain, pemerintah juga belum bisa mengurangi utang sejalan dengan rencana pembangunan proyek infrastruktur tersebut. Dengan demikian, secara otomatis bunga utang pemerintah pun akan membesar.  Namun menurut Lana, utang pemerintah akan semakin membesar apabila defisit keseimbangan primer semakin membesar. Sebab, pemerintah akan menutup bunga utang tersebut melalui utang pokok yang baru. Cek Berita dan Artikel yang lain di Google News",nasional
