Title,Scrapping Date,Article Date,Author,Link,Content,Category
"Utang Membengkak, Risiko Gagal Bayar Mengintai Amerika Serikat",2024-09-24T16:03:32.503Z,"Kamis, 16 Februari 2023 / 14:50 WIB",Reporter: Diki Mardiansyah | Editor: Herlina Kartika Dewi,https:////internasional.kontan.co.id/news/utang-membengkak-risiko-gagal-bayar-mengintai-amerika-serikat,"KONTAN.CO.ID - WASHINGTON. Gejolak utang di Amerika Serikat (AS) makin memanas setelah mencapai ambang batas atas plafon pinjaman sebesar US$ 31,4 triliun. Negara berjuluk Paman Sam ini pun akan menghadapi risiko gagal bayar utang sebelum Juli apabila plafon tidak segera dinaikkan. Gagal bayar kemungkinan akan berimbas pada mengurangi 3 juta pekerjaan di AS dan menaikkan biaya KPR tenor 30 tahun. Melansir Reuters pada Kamis (16/2), Kantor Anggaran Kongres (CBO) menyatakan bahwa Departemen Keuangan AS bakal kehabisan kemampuan untuk membayar semua tagihannya antara bulan Juli dan September, kecuali jika batas pinjaman sebesar US$ 31,4 triliun saat ini dinaikkan atau ditangguhkan. Baca Juga: The Fed Akan Lakukan Stress Test Ketahanan Bank Besar Hadapi Krisis Ekonomi Dalam sebuah laporan yang diterbitkan bersamaan dengan prospek anggaran tahunannya, CBO non-partisan memperingatkan bahwa gagal bayar utang federal dapat terjadi sebelum bulan Juli jika pemasukan yang masuk ke Departemen Keuangan pada bulan April melampaui perkiraan. CBO menegaskan belum bisa dipastikan secara pasti tenggat waktu akhir mengenai gagal bayar tersebut. Pemerintah pun mengaku sulit memprediksinya. Hal ini lantaran laju pendapatan yang masih akan masuk, ditambah dengan kinerja ekonomi AS dalam beberapa bulan mendatang. ""Jika batas utang tidak dinaikkan atau ditangguhkan sebelum langkah-langkah luar biasa akan habis antara Juli dan September 2023, pemerintah tidak akan mampu membayar kewajibannya secara penuh,"" kata laporan CBO. Secara terpisah, CBO mengatakan defisit anggaran tahunan AS akan mencapai rata-rata US$2 triliun antara tahun 2024 dan 2033, mendekati rekor era pandemi pada akhir dekade ini. Sementara itu, CBO memperkirakan tingkat pengangguran sebesar 4,7% tahun ini, jauh di atas 3,4% saat ini. Direktur CBO Phillip Swagel mengaitkan kenaikan ini dengan kenaikan suku bunga tinggi yang secara khusus menghantam industri perumahan, ditambah dengan melambatnya investasi bisnis. Analisis ini mencerminkan dampak penuh dari undang-undang pengeluaran baru-baru ini, termasuk investasi dalam energi bersih dan semikonduktor serta pengeluaran militer yang lebih tinggi, bersama dengan biaya perawatan kesehatan, pensiun, dan bunga yang lebih tinggi. Analisis ini mengasumsikan tidak ada perubahan dalam undang-undang perpajakan dan pengeluaran selama satu dekade ke depan. Baca Juga: IMF Menaikkan Estimasi Pertumbuhan Ekonomi Global Tahun Ini Jadi 2,9% ""Dalam jangka panjang, proyeksi kami menunjukkan bahwa perubahan-perubahan dalam kebijakan fiskal harus dilakukan untuk mengatasi kenaikan biaya bunga dan mengurangi konsekuensi-konsekuensi buruk lainnya dari utang yang tinggi dan terus meningkat,"" kata Swagel dalam sebuah pernyataan. Setelah mencapai batas pinjaman US$ 31,4 triliun pada 19 Januari 2023, Menteri Keuangan Janet Yellen mengatakan bahwa Departemen Keuangan dapat mempertahankan pembayaran utang, tunjangan federal, dan melakukan pengeluaran lain setidaknya sampai 5 Juni dengan menggunakan penerimaan kas dan langkah-langkah manajemen kas. Batas pinjaman tersebut juga mendorong Departemen Keuangan AS untuk memulai langkah-langkah yang memungkinkannya melanjutkan pembiayaan kegiatan pemerintah.",internasional
Risiko Gagal Bayar Surat Utang Korporasi Diprediksi Lebih Mini,2024-09-24T16:03:32.731Z,,Premium User Only,https:////insight.kontan.co.id/news/risiko-gagal-bayar-surat-utang-korporasi-diprediksi-lebih-mini,Premium Content - Not Scraped,insight
Badan Anggaran DPR Ingatkan Risiko Utang,2024-09-24T16:03:33.603Z,,Premium User Only,https:////insight.kontan.co.id/news/badan-anggaran-dpr-ingatkan-risiko-utang,Premium Content - Not Scraped,insight
Bank Sentral Korea Perkirakan Risiko Pembayaran Utang Pebisnis Kecil Melonjak di 2023,2024-09-24T16:03:34.444Z,,Premium User Only,https:////insight.kontan.co.id/news/bank-sentral-korea-perkirakan-risiko-pembayaran-utang-pebisnis-kecil-melonjak-di-2023,Premium Content - Not Scraped,insight
Risiko Utang Menghambat Pemulihan Jangka Panjang,2024-09-24T16:03:35.274Z,,Premium User Only,https:////insight.kontan.co.id/news/risiko-utang-menghambat-pemulihan-jangka-panjang,Premium Content - Not Scraped,insight
Peringatan Bank Dunia Soal Risiko Utang Tersembunyi,2024-09-24T16:03:35.477Z,"Senin, 21 Februari 2022 / 05:10 WIB",Reporter: Bidara Pink | Editor: Khomarul Hidayat,https:////newssetup.kontan.co.id/news/peringatan-bank-dunia-soal-risiko-utang-tersembunyi-1,"KONTAN.CO.ID -  JAKARTA. Bank Dunia mewanti-wanti masih ada risiko yang membayangi proses pemulihan ekonomi negara-negara berkembang dari pandemi Covid-19.  Salah satu risiko jangka panjang yang menurut Bank Dunia perlu diwaspadai adalah adanya utang tersembunyi. “Ada risiko yang muncul terkait pemulihan ekonomi dalam jangka panjang, seperti utang tersembunyi dan kewajiban liabilitas yang kemungkinan baru terungkap beberapa waktu kemudian,” tulis Bank Dunia dalam laporan terbarunya, seperti dikutip Minggu (20/2). Sudah menjadi pengetahuan umum, pandemi Covid-19 ini memberikan dampak negatif terhadap negara-negara di dunia. Tak hanya menelan korban jiwa, tetapi juga menyebabkan gonjang-ganjing dari sisi ekonomi. Baca Juga: BI: Perubahan Iklim Berpotensi Ganggu Stabilitas Moneter dan Sistem Keuangan Pemerintah di negara-negara dunia, termasuk negara berkembang sudah menggelontorkan berbagai stimulus untuk mengurangi dampak buruk pandemi Covid-19.  Stimulus ini efektif, tetapi di sisi laini memperburuk kerentanan keuangan yang bahkan sebelumnya sudah ada, karena ada peningkatan utang sektor swasta maupun publik yang signifikan. Utang ini bila tidak ditangani dengan tepat akan menjadi ancaman bagi pemulihan dalam jangka panjang, termasuk adanya utang tersembunyi ini. Ketika dampak langsung dari pandemi kemudian mereda, para pemangku kebijakan akan menghadai tantangan yang sulit, yaitu untuk mencapai keseimbangan antara tetap memberikan dukungan untuk menanggulangi dampak krisis sekaligus membatasi risiko jangka panjang yang mungkin timbul dari respon kebijakan yang sudah digulirkan. Baca Juga: Bank Dunia: Peningkatan Suku Bunga The Fed Jadi Dilema Bank Indonesia Cek Berita dan Artikel yang lain di Google News",newssetup
Bank Dunia: Utang Tersembunyi Jadi Risiko Ekonomi Jangka Panjang,2024-09-24T16:03:35.736Z,"Minggu, 20 Februari 2022 / 15:22 WIB",Reporter: Bidara Pink | Editor: Khomarul Hidayat,https:////nasional.kontan.co.id/news/bank-dunia-utang-tersembunyi-jadi-risiko-ekonomi-jangka-panjang,"KONTAN.CO.ID - JAKARTA. Bank Dunia melihat masih ada risiko yang membayangi proses pemulihan ekonomi negara-negara berkembang dari pandemi Covid-19.  Salah satu risiko jangka panjang yang menurut Bank Dunia perlu diwaspadai adalah adanya utang tersembunyi. “Ada risiko yang muncul terkait pemulihan ekonomi dalam jangka panjang, seperti utang tersembunyi dan kewajiban liabilitas yang kemungkinan baru terungkap beberapa waktu kemudian,” tulis Bank Dunia dalam laporan terbarunya, seperti dikutip Minggu (20/2). Sudah menjadi pengetahuan umum, pandemi Covid-19 ini memberikan dampak negatif terhadap negara-negara di dunia. Tak hanya menelan korban jiwa, tetapi juga menyebabkan gonjang-ganjing dari sisi ekonomi. Baca Juga: BI: Perubahan Iklim Berpotensi Ganggu Stabilitas Moneter dan Sistem Keuangan Pemerintah di negara-negara dunia, termasuk negara berkembang sudah menggelontorkan berbagai stimulus untuk mengurangi dampak buruk pandemi Covid-19.  Stimulus ini efektif, tetapi di sisi laini memperburuk kerentanan keuangan yang bahkan sebelumnya sudah ada, karena ada peningkatan utang sektor swasta maupun publik yang signifikan. Utang ini bila tidak ditangani dengan tepat akan menjadi ancaman bagi pemulihan dalam jangka panjang, termasuk adanya utang tersembunyi ini. Ketika dampak langsung dari pandemi kemudian mereda, para pemangku kebijakan akan menghadai tantangan yang sulit, yaitu untuk mencapai keseimbangan antara tetap memberikan dukungan untuk menanggulangi dampak krisis sekaligus membatasi risiko jangka panjang yang mungkin timbul dari respon kebijakan yang sudah digulirkan. Baca Juga: Bank Dunia: Peningkatan Suku Bunga The Fed Jadi Dilema Bank Indonesia Cek Berita dan Artikel yang lain di Google News",nasional
IMF Beberkan Risiko Pembelian Surat Utang Pemerintah oleh Bank Sentral,2024-09-24T16:03:35.855Z,"Selasa, 11 Januari 2022 / 12:06 WIB",Reporter: Bidara Pink | Editor: Noverius Laoli,https:////nasional.kontan.co.id/news/imf-beberkan-risiko-pembelian-surat-utang-pemerintah-oleh-bank-sentral,"KONTAN.CO.ID -  JAKARTA. Di tengah pandemi Covid-19, bank-bank sentral dunia turut memborong surat utang pemerintah untuk mendanai penanganan pandemi Covid-19, tak terkecuali Bank Indonesia (BI). Dana Moneter Internasional (IMF) memandang langkah pembelian aset ini memang bisa menjadi alat yang efektif karnea membantu mengurangi tekanan pasar keuangan tanpa memicu arus keluar modal atau tekanan lebih pada nilai tukar. Namun, tetap saja, meski pembelian aset ini membantu bank-bank sentral melaksanakan mandatnya, langkah ini tetap mengandung risiko. “Risiko yang muncul terkait dengan isu independensi bank sentral dan juga stabilitas harga,” tulis lembaga tersebut dalam laman resmi IMFBlog, seperti dikutip Selasa (11/1). Baca Juga: Ini Imbauan IMF bagi Negara Berkembang untuk Merespon Kenaikan Bunga di AS IMF menjabarkan lebih lanjut risiko yang muncul dari langkah pembelian aset oleh bank sentral. Pertama, dampak kepada neraca bank sentral itu sendiri. Hal ini terjadi ketika bank sentral membeli surat utang pemerintah atau surat utang korporasi dengan suku bunga rendah. Namun, pada mendekati jatuh tempo, tiba-tiba ada peningkatan drastis suku bunga jatuh tempo. Kondisi tersebut bisa membuat bank sentral merugikan posisi keuangan sendiri. Makanya, IMF mengimbau bank sentral tak terlalu jor-joran dalam membeli aset. Kedua, adanya potensi dominasi fiskal. Dalam hal ini, pemerintah menekan bank sentral untuk memenuhi tujuan pemerintah. Bisa saja dengan langkah ini, pemerintah menjadi terbiasa dengan pembiayaan utang yang murah, sehingga akan meminta bank sentral untuk terus melanjutkan pembelian aset bahkan jika inflasi naik. Baca Juga: IMF: Pandemi Covid-19 torehkan luka dalam bagi prospek perekonomian Imbasnya, kepercayaan pihak lain kepada bank sentral menjadi turun. dalam hal ini, kemampuan bank sentral untuk menjaga inflasi yang stabil dan rendah karena langkah pembelian aset terus menerus bisa memicu periode inflasi yang tinggi dan bergejolak. IMF kemudian memberikan imbauan lebih lanjut. “Prinsip yang kritikal, bank sentral harus memiliki keleluasaan untuk menyesuaikan tingkat kebijakannya, sesuai kebutuhan untuk mencapai tujuan dan tidak menciptakan lambungan inflasi,” tutur mereka.",nasional
Tunas Baru Lampung (TBLA) Dibayang-bayangi Risiko Refinancing Utang Obligasi,2024-09-24T16:03:36.694Z,,Premium User Only,https:////insight.kontan.co.id/news/tunas-baru-lampung-tbla-dibayang-bayangi-risiko-refinancing-utang-obligasi,Premium Content - Not Scraped,insight
"Risiko gagal bayar utang Evergrande merisaukan, ini yang dicari investor",2024-09-24T16:03:36.853Z,"Rabu, 22 September 2021 / 05:45 WIB",Sumber: Reuters | Editor: Noverius Laoli,https:////newssetup.kontan.co.id/news/risiko-gagal-bayar-utang-evergrande-merisaukan-ini-yang-dicari-investor,"KONTAN.CO.ID -  HONG KONG. Risiko gagal bayar China Evergrande Group atas utangnya yang menggunung menekan bursa saham sejumlah negara pada hari Selasa (21/9). Investor tengah mencermati tanda-tanda intervensi Beijing untuk membendung potensi efek domino kebangkrutan perusahaan properti tersebut terhadap ekonomi global. Sejumlah analis memandang kecil ancaman gagal bayar utang Evergrande menjadi seperti momen kasus Lehman Brothers yang menyulut krisis ekonomi global. Kendati analis juga tak menepis adanya kekhawatiran mengenai risiko limpahan dari kehancuran Evergrande, yang dulunya pengembang properti terlaris di China, bakal mengguncang pasar keuangan global. Baca Juga: Evergrande punya utang ke 128 bank, ini bank yang punya eksposure tertinggi Melansir Reuters, untuk meredakan kecemasan investor, Chairman Evergrande, Hui Ka Yuang, mengatakan, dalam surat kepada staf perusahaan bahwa mereka yakin dapat keluar dari momen tergelapnya dan memberikan proyek properti seperti yang dijanjikan. Dalam surat itu, bertepatan dengan festival pertengahan musim gugur China, ketua pengembang properti yang sarat utang, juga mengatakan Evergrande akan memenuhi tanggung jawab kepada pembeli properti, investor, mitra, dan lembaga keuangan. Investor di Evergrande, bagaimanapun, tetap gelisah. Sahamnya dijual kembali pada hari Selasa, turun sebanyak 7%, setelah jatuh 10% pada hari sebelumnya di tengah kekhawatiran utangnya yang sebesar US$ 305 miliar dapat memicu kerugian yang meluas dalam sistem keuangan China jika terjadi keruntuhan. Baca Juga: Krisis Evergrande menyeret harga Bitcoin kian dalam, hampir terlempar dari US$ 40.000 Saham properti lainnya seperti Sunac, pengembang properti No.4 China, dan Greentown China yang didukung negara pada hari Selasa menutup beberapa kerugian besar mereka di sesi sebelumnya.",newssetup
"Kemampuan Mengurangi Utang Terhambat, WIKA Diyakini Tetap Mampu Mengelola Risiko",2024-09-24T16:03:37.680Z,,Premium User Only,https:////insight.kontan.co.id/news/kemampuan-mengurangi-utang-terhambat-wika-diyakini-tetap-mampu-mengelola-risiko,Premium Content - Not Scraped,insight
"Posisi utang naik, ini 4 jurus yang dilakukan pemerintah menjaga target risiko",2024-09-24T16:03:37.789Z,"Selasa, 31 Agustus 2021 / 14:30 WIB",Reporter: Siti Masitoh | Editor: Yudho Winarto,https:////newssetup.kontan.co.id/news/posisi-utang-naik-ini-4-jurus-yang-dilakukan-pemerintah-menjaga-target-risiko,"KONTAN.CO.ID - JAKARTA. Kementerian Keuangan (Kemenkeu) mencatat posisi utang pemerintah pada akhir Juli 2021 berada di angka Rp 6.570,17 triliun, dengan rasio utang pemerintah terhadap Produk Domestik Bruto (PDB) sebesar 40,51%. Posisi utang tersebut mengalami kenaikan sekitar Rp 15,61 triliun dibandingkan dengan posisi utang pada akhir bulan Juni 2021 yang sebesar Rp 6.554,56 triliun. “Kondisi ekonomi Indonesia yang masih berada dalam fase pemulihan akibat perlambatan ekonomi yang terjadi di masa pandemi Covid-19, menyebabkan posisi utang Pemerintah Pusat secara nominal mengalami peningkatan dibandingkan dengan periode yang sama tahun lalu, namun rasio utang terhadap PDB mengalami penurunan dari bulan sebelumnya,” tulis Kemenkeu dalam APBN KITA Edisi Agustus, Selasa (31/8). Baca Juga: Pemerintah dan DPR sepakati asumsi dasar makro ekonomi RAPBN 2022 Pembiayaan utang tersebut digunakan sebagai untuk mendukung kebijakan countercyclical yang dikelola secara prudent, fleksibel dan terukur, terutama untuk menangani Pandemi Covid-19 dan pemulihan ekonomi nasional. Melihat lebih rinci, komposisi utang pemerintah pada Juli 2021 masih didominasi oleh surat berharga negara (SBN) yaitu sebesar Rp 5.727,71 triliun, atau 87,18% terhadap total utang pemerintah. Sementara, utang berbentuk SBN, terdiri atas SBN domestik sebesar Rp 4.437,61 triliun dalam bentuk Surat Utang Negara (SUN) Rp 3.627,99 triliun dan sukuk Rp 809,63 triliun, serta SBN valas Rp 1.290,09 triliun dalam bentuk SUN valas Rp 1.001,58 triliun, dan sukuk valas Rp 288,52 triliun. Utang pemerintah yang berasal dari pinjaman dari dalam negeri tercatat Rp 12,70 triliun dan pinjaman luar negeri sebesar Rp 829,76 triliun. Adapun pinjaman luar negeri terbagi lagi ke dalam tiga kategori, yakni pinjaman bilateral Rp 312,64 triliun, pinjaman multilateral Rp 474,39 triliun dan pinjaman bank komersial Rp 42,73 triliun. Terdapat beberapa langkah yang dilakukan pemerintah dalam memantau dan menjaga target risiko utang agar sesuai dengan indikator risiko yang ditargetkan.",newssetup
Waspada Risiko di Balik Lonjakan Utang Pemerintah,2024-09-24T16:03:38.589Z,,Premium User Only,https:////insight.kontan.co.id/news/waspada-risiko-di-balik-lonjakan-utang-pemerintah,Premium Content - Not Scraped,insight
S&P: Risiko Penurunan Peringkat Utang Bank dan Korporasi Indonesia Terus Berlanjut,2024-09-24T16:03:39.378Z,,Premium User Only,https:////insight.kontan.co.id/news/sp-risiko-penurunan-peringkat-perbankan-dan-korporasi-indones-terus-berlanjut,Premium Content - Not Scraped,insight
Risiko gagal bayar utang masih membayangi emiten sepanjang 2021,2024-09-24T16:03:39.699Z,"Minggu, 16 Mei 2021 / 20:03 WIB",Reporter:  Ika Puspitasari | Editor: Noverius Laoli,https:////investasi.kontan.co.id/news/risiko-gagal-bayar-utang-masih-membayangi-emiten-sepanjang-2021,"KONTAN.CO.ID -  JAKARTA. Sudah lebih dari satu tahun pandemi Covid-19 menekan sejumlah bisnis emiten dalam negeri. Beberapa emiten juga mengalami gagal bayar kewajibannya pada pada paruh pertama tahun ini. Teranyar ada emiten petrokimia PT Tridomain Performance Materials Tbk (TDPM) belum dapat melunasi pokok surat utang jangka menengah atau medium term note (MTN) sebesar Rp 410 miliar yang jatuh tempo pada 27 April 2021 silam. Sebelumnya kasus gagal bayar kewajiban pun menimpa PT Sri Rejeki Isman Tbk (SRIL). Kemudian, pada 12 Februari 2021 yang lalu produsen garmen PT Pan Brothers Tbk (PBRX) juga belum berhasil melunasi utang sindikasi dengan limit US$ 138,5 juta. Head of Investment Research Infovesta Utama Wawan Hendrayana mengatakan, potensi gagal bayar kewajiban masih membayangi emiten pada tahun ini. Menurut Wawan, risiko gagal bayar utang pada tahun ini bisa jauh lebih tinggi ketimbang tahun lalu. Baca Juga: Gagal Bayar MTN Tridomain (TDPM), Bank Maybank Indonesia Angkat Bicara “Karena pada tahun 2020 masih banyak emiten yang paling tidak memiliki cash atau cadangan untuk bertahan. Sedangkan di 2021 sudah setahun lebih, secara bisnis pasti sangat terdampak karena baik dari sisi produksi yang efektivitasnya turun karena sempat ada PSBB,” papar Wawan ketika dihubungi Kontan, Minggu (16/5). Lebih lanjut ia menjelaskan, emiten juga mengalami kenaikan biaya dan harus membayar tunjangan hari raya meskipun kondisi keuangannya kurang baik. Sehingga, secara risiko kredit pada tahun ini meningkat terutama untuk beberapa emiten terutama di bidang jasa dan transportasi. Wawan memandang emiten masih akan menghadapi risiko gagal bayar kewajiban hingga akhir tahun ini. Terlebih, melihat pertumbuhan ekonomi Indonesia di kuartal pertama 2021 yang masih mengalami kontraksi minus 0,74%. Meski demikian, ia berharap kondisi ekonomi akan membaik di kuartal kedua dan ketiga seiring dengan berjalannya program vaksinasi Covid-19. Hanya saja, pertumbuhan ekonomi akan berjalan positif seperti sebelum adanya pandemi kemungkinan baru di kuartal ketiga atau keempat 2021, bahkan di tahun depan. Dengan kondisi ekonomi yang belum sepenuhnya pulih ini, Wawan bilang akan mempengaruhi kondisi keuangan beberapa emiten. Baca Juga: Sebelum Gagal Bayar MTN, Para Petinggi Tridomain Performance Materials (TDPM) Resign Guna mengantisipasi hal ini, Wawan menyarankan emiten untuk terbuka apabila ada potensi untuk mengalami keterlambatan pembayaran kewajiban. “Dan juga emiten bisa melakukan negosiasi dengan regulator juga dengan para krediturnya,” tambah Wawan.",investasi
"Risiko Utang dan Usaha Mengadang Buana Lintas Lautan, Fitch Pangkas Rating BULL",2024-09-24T16:03:40.516Z,,Premium User Only,https:////insight.kontan.co.id/news/risiko-utang-dan-usaha-mengadang-buana-lintas-lautan-fitch-pangkas-rating-bull,Premium Content - Not Scraped,insight
"Risiko likuiditas dan refinancing naik, Fitch turunkan peringkat utang Sritex ke B-",2024-09-24T16:03:40.748Z,"Jumat, 26 Maret 2021 / 13:38 WIB",Reporter: Nur Qolbi | Editor: Anna Suci Perwitasari,https:////investasi.kontan.co.id/news/risiko-likuiditas-dan-refinancing-naik-fitch-turunkan-peringkat-utang-sritex-ke-b,"KONTAN.CO.ID - JAKARTA. Lembaga pemeringkat internasional Fitch Ratings menurunkan Long-Term Issuer Default Rating (IDR) PT Sri Rejeki Isman Tbk (SRIL) menjadi B- dari BB-. Fitch juga menurunkan peringkat surat utang dolar Amerika Serikat (AS) Sritex, baik yang sudah beredar maupun yang berencana diterbitkan menjadi B- dari BB-. Secara bersamaan, Fitch turut memangkas peringkat nasional jangka panjang SRIL menjadi BB(idn) dari A+(idn). Peringkat-peringkat ini berada di Rating Watch Negative (RWN) yang mencerminkan ketidakpastian dalam pelaksanaan rencana pembiayaan kembali (refinancing). Lebih lanjut, Fitch menyatakan, penurunan peringkat ini sejalan dengan meningkatnya risiko likuiditas dan refinancing Sritex. Sebagaimana diketahui, SRIL menghadapi ketidakpastian terkait pengajuan perpanjangan tenor pinjaman sindikasi US$ 350 juta yang bakal jatuh tempo pada Januari 2022. ""Profil kredit Sritex berada di bawah tekanan karena ketidakpastian seiring dengan tertundanya penyelesaian kesepakatan perpanjangan tenor pinjaman sindikasi US$ 350 juta tersebut,"" tulis Fitch dalam laporannya, Jumat (26/3). Sebagai pengingat, sejak November 2020, Sritex mengajukan perpanjangan tenor dua tahun hingga Januari 2024 untuk pinjaman sindikasi ini. Fitch menyampaikan, pihaknya mengetahui bahwa SRIL sudah memperoleh persetujuan dari beberapa pemberi pinjaman sindikasi yang setara US$ 205 juta per 23 Maret 2021. ""Namun keterlambatan penandatanganan tersebut menyebabkan penurunan beberapa poin peringkat karena belum ada kesepakatan final, ditambah sentimen negatif terhadap sektor TPT Indonesia,"" ucap Fitch. Baca Juga: Likuiditas seret, Moody's pangkas rating Sri Rejeki Isman (SRIL) menjadi B3    Fitch menilai, posisi likuiditas Sritex melemah secara signifikan. Pasalnya, selain medium-term note (MTN) US$ 25 juta yang jatuh tempo pada Mei 2021, Sritex juga memiliki jumlah terutang sekitar US$ 175 juta di bawah fasilitas kerja bilateral yang juga berakhir pada tahun 2021. Di sisi lain, Fitch mengestimasikan arus kas bebas Sritex pada tahun ini hanya kurang dari US$ 50 juta. ""Oleh karena itu, akses ke fasilitas bilateral tersebut bersama dengan perpanjangannya adalah kunci untuk mendukung posisi likuiditas perusahaan,"" kata Fitch. Menurut Fitch,  jika perpanjangan tenor ini berhasil disepakati, tekanan likuiditas Sritex untuk saat ini memang aman berkurang. Akan tetapi, utang SRIL, anggota indeks Kompas100 ini, justru akan terkonsentasi pada 2024. Pasalnya pada tahun itu, Sritex juga memiliki obligasi jatuh tempo senilai US$ 155 juta. Kemudian pada tahun 2025, SRIL kembali memiliki obligasi jatuh tempo sebesar US$ 225 juta.  Cek Berita dan Artikel yang lain di Google News",investasi
"Menkeu sebut risiko krisis utang jadi tantangan, ini kata ekonom Bank Permata",2024-09-24T16:03:40.919Z,"Rabu, 17 Maret 2021 / 21:15 WIB",Reporter: Yusuf Imam Santoso | Editor: Tendi Mahadi,https:////newssetup.kontan.co.id/news/menkeu-sebut-risiko-krisis-utang-jadi-tantangan-ini-kata-ekonom-bank-permata,"KONTAN.CO.ID - JAKARTA. Menteri Keuangan (Menkeu) Sri Mulyani Indrawati menyampaikan di tengah pemulihan ekonomi global, ada beberapa risiko yang menjadi sentimen negatif ekonomi dalam negeri, salah satunya risiko utang global. Tak terkecuali, utang pemerintah yang makin menumpuk. Kepala Ekonom Bank Permata Josua Pardede mengatakan meski ada serenteng sentimen negatif ekonomi global, pemulihan ekonomi juga terindikasi. Salah satunya tercermin dari penguatan kinerja bursa saham global sejalan dengan ekspektasi pertumbuhan ekonomi global yang cenderung membaik ditopang oleh program vaksinasi global. Dari sisi risiko peningkatan utang global, Josua mengatakan hal ini tentunya karena dipicu oleh pandemi Covid-19 secara global yang mendorong penurunan penerimaan negara. Baca Juga: Peringati Hari Perawat Nasional, Sri Mulyani ucapkan rasa terima kasih Saat bersamaan, belanja negara cenderung meningkat sebagai upaya untuk membatasi dampak negatif yang ditimbulkan dari pandemi dengan program stimulus fiskal dalam jumlah yang besar. Meskipun terdapat risiko peningkatan utang di negara maju dan berkembang, Josua menilai kondisi fundamental ekonomi Indonesia tetap baik mempertimbangkan rasio utang pemerintah terhadap produk domestik bruto (PDB) pada tahun 2020 masih aman dengan realisasi 38,5%. Angka tersebut lebih rendah dari negara berkembang lainnya misalnya Vietnam (46,6%), Malaysia (67,6%), Thailand (50,4%, dan Filipina (48,9%). Bahkan bagi  negara maju seperti AS sudah mencapai 131,2%, Jepang (266,2%), serta Jerman (73,3%) terhadap PDB negara-negara tersebut. Dengan kondisi utang yang tetap manageable maka ruang fiskal pemerintah Indonesia pun diperkirakan akan lebih lebar dibandingkan dengan negara-negara lain di dunia. Baca Juga: Menkeu: Transformasi digital dapat meningkatkan kepatuhan perdagangan internasional “Hal tersebut berimplikasi bahwa pertumbuhan ekonomi Indonesia untuk mencapai level potensinya cenderung lebih tinggi dibandingkan dengan negara lain,” kata Josua kepada Kontan.co.id, Rabu (16/3). Selain itu, dengan kondisi pengelolaan utang pemerintah Indonesia juga terefleksi dari afirmasi dari lembaga rating internasional yang masih mengafirmasi peringkat utang pemerintah Indonesia masuk golongan Investment Grade.",newssetup
