Title,Scrapping Date,Article Date,Author,Link,Content,Category
"Sri Mulyani sebut risiko krisis utang jadi tantangan, ini kata ekonom",2024-09-24T16:03:41.302Z,"Rabu, 17 Maret 2021 / 15:27 WIB",Reporter: Yusuf Imam Santoso | Editor: Tendi Mahadi,https:////nasional.kontan.co.id/news/sri-mulyani-sebut-risiko-krisis-utang-jadi-tantangan-ini-kata-ekonom,"KONTAN.CO.ID - JAKARTA. Menteri Keuangan (Menkeu) Sri Mulyani Indrawati menyampaikan di tengah pemulihan ekonomi global, ada beberapa risiko yang menjadi sentimen negatif ekonomi dalam negeri, salah satunya risiko utang global. Tak terkecuali, utang pemerintah yang makin menumpuk. Kepala Ekonom Bank Permata Josua Pardede mengatakan meski ada serenteng sentimen negatif ekonomi global, pemulihan ekonomi juga terindikasi. Salah satunya tercermin dari penguatan kinerja bursa saham global sejalan dengan ekspektasi pertumbuhan ekonomi global yang cenderung membaik ditopang oleh program vaksinasi global. Dari sisi risiko peningkatan utang global, Josua mengatakan hal ini tentunya karena dipicu oleh pandemi Covid-19 secara global yang mendorong penurunan penerimaan negara. Baca Juga: Peringati Hari Perawat Nasional, Sri Mulyani ucapkan rasa terima kasih Saat bersamaan, belanja negara cenderung meningkat sebagai upaya untuk membatasi dampak negatif yang ditimbulkan dari pandemi dengan program stimulus fiskal dalam jumlah yang besar. Meskipun terdapat risiko peningkatan utang di negara maju dan berkembang, Josua menilai kondisi fundamental ekonomi Indonesia tetap baik mempertimbangkan rasio utang pemerintah terhadap produk domestik bruto (PDB) pada tahun 2020 masih aman dengan realisasi 38,5%. Angka tersebut lebih rendah dari negara berkembang lainnya misalnya Vietnam (46,6%), Malaysia (67,6%), Thailand (50,4%, dan Filipina (48,9%). Bahkan bagi  negara maju seperti AS sudah mencapai 131,2%, Jepang (266,2%), serta Jerman (73,3%) terhadap PDB negara-negara tersebut. Dengan kondisi utang yang tetap manageable maka ruang fiskal pemerintah Indonesia pun diperkirakan akan lebih lebar dibandingkan dengan negara-negara lain di dunia. Baca Juga: Menkeu: Transformasi digital dapat meningkatkan kepatuhan perdagangan internasional “Hal tersebut berimplikasi bahwa pertumbuhan ekonomi Indonesia untuk mencapai level potensinya cenderung lebih tinggi dibandingkan dengan negara lain,” kata Josua kepada Kontan.co.id, Rabu (16/3). Selain itu, dengan kondisi pengelolaan utang pemerintah Indonesia juga terefleksi dari afirmasi dari lembaga rating internasional yang masih mengafirmasi peringkat utang pemerintah Indonesia masuk golongan Investment Grade.",nasional
"Posisi Kas Lemah, Sritex (SRIL) Menghadapi Risiko Refinancing Utang",2024-09-24T16:03:42.104Z,,Premium User Only,https:////insight.kontan.co.id/news/posisi-kas-lemah-sritex-sril-menghadapi-risiko-refinancing-utang,Premium Content - Not Scraped,insight
Prospek pemulihan ekonomi berpotensi menurunkan risiko gagal bayar surat utang,2024-09-24T16:03:42.986Z,"Selasa, 19 Januari 2021 / 18:21 WIB",Reporter: Danielisa Putriadita | Editor: Wahyu T.Rahmawati,https:////investasi.kontan.co.id/news/prospek-pemulihan-ekonomi-berpotensi-menurunkan-risiko-gagal-bayar-surat-utang,"KONTAN.CO.ID - JAKARTA. Pemeringkat Efek Indonesia (Pefindo) memandang risiko gagal bayar obligasi korporasi di tahun ini dapat lebih terminimalisir dibanding tahun lalu. Pemulihan ekonomi yang terjadi secara bertahap di tahun ini menjadi katalis positif. Dari surat utang yang diperingkat Pefindo sepanjang tahun lalu, tercatat tingkat gagal bayar (default rate) sebesar 0,82%. Angka tersebut meningkat dari default rate tahun 2019 yang sebesar 0,79%. Namun, angka default rate di 2020 masih lebih rendah bila dibanding 2018 yang berada di 0,93%. Head of Division Corporate Rating Pemeringkat Efek Indonesia (Pefindo) Niken Indriarsih mengatakan, prospek pertumbuhan ekonomi yang lebih baik di tahun ini dibanding tahun lalu bisa menjadi katalis positif untuk meminimalisir risiko gagal bayar. ""Ekonomi tahun ini bisa lebih baik, meskipun pandemi masih ada, tetapi masyarakat sudah lakukan penyesuaian walau memang belum kembali seperti sebelum pandemi,"" kata Niken, Selasa (19/1). Baca Juga: BlackRock Institute sebut Indonesia punya outlook investasi prospektif tahun ini Dengan asumsi distribusi vaksin yang berjalan lancar sesuai rencana maka pertumbuhan ekonomi akan lebih baik sehingga risiko gagal bayar bisa diminimalkan. Tapi, Pefindo akan terus memantau karena risiko tidak akan hilang. Head of Economics Research Pefindo Fikri C Permana mengatakan, beberapa sektor yang bisnisnya erat dengan kegiatan banyak orang memang memiliki risiko gagal bayar yang lebih tinggi. Namun, secara umum melihat pertumbuhan ekonomi di kuartal ketiga dan keempat 2020 dan proyeksi keberlanjutan pertumbuhan ekonomi di 2021, faktor ini bisa menurunkan risiko gagal bayar. Baca Juga: Ditopang otomotif, Pefindo proyeksi obligasi perusahaan pembiayaan naik Cek Berita dan Artikel yang lain di Google News",investasi
"Pemulihan ekonomi lambat, risiko gagal bayar surat utang berpotensi meningkat",2024-09-24T16:03:43.108Z,"Senin, 18 Januari 2021 / 22:56 WIB",Reporter: Danielisa Putriadita | Editor: Noverius Laoli,https:////investasi.kontan.co.id/news/pemulihan-ekonomi-lambat-risiko-gagal-bayar-surat-utang-berpotensi-meningkat,"KONTAN.CO.ID - JAKARTA. Risiko gagal bayar obligasi korporasi maupun surat utang jangka menengah atawa medium term notes (MTN) meningkat di tengah ekonomi yang belum pulih sepenuhnya. Sementara, pandemi Covid-19 masih terus meluas. Berdasarkan data Kustodian Sentral Efek Indonesia (KSEI) selama di bulan pertama tahun ini, terdapat empat perusahaan yang menunda pembayAran bunga MTN. Pertama, MTN I Oligo Infrastruktur Indonesia Seri B yang bergerak di sektor infrastruktur. Kedua, MTN Rekapastika Asri I tahun 2019 seri A dan MTN Pasir Berlian I tahun 2016 seri A-C yang bergerak di sektor properti. Terakhir, MTN Maxx Coffee Prima I tahun 2018 seri A-D di sektor horeka. Head of Research & Consulting Service Infovesta Utama Edbert Suryajaya mengatakan ekonomi belum sepenuhnya pulih. Kondisi ini membuat konsumsi masyarakat belum kembali baik seperti sebelum pandemi. Apalagi, pemberlakuan pembatasan kegiatan masyarakat (PPKM) juga menahan konsumsi. Baca Juga: Standard Chartered Bank memprediksi ekonomi global tumbuh 4,8%, Indonesia 6% di 2021 Akibatnya, omset maupun pendapatan penjualan perusahaan berkurang hingga menganggu arus kas (cashflow) dalam membayar pokok utang atau bunganya. Head of Division Corporate Rating Pemeringkat Efek Indonesia (Pefindo) Niken Indriarsih mengatakan secara umum kinerja sektor dari MTN yang gagal bayar tersebut cenderung menurun selama pandemi. ""Social distancing buat sektor bisnis makanan dan minuman terganggu, begitupun sektor propeti yang kondisinya sudah sulit sebelum pandemi,"" kata Niken. Selanjutnya, sektor infrastruktur yang terkait dengan proyek pemeirntah juga kinerjanya terganggu dengan adanya realokasi anggaran dari infrastruktur menjadi untuk penanganan pandemi. Bila pandemi masih berkepanjangan terjadi dan kondisi ekonomi belum pulih sesuai dengan yang diharapkan, maka ke depan arus kas emiten yang mengeluarkan surat utang masih akan terganggu, terutama yang jatuh tempo di tahun ini. Niken memproyeksikan restrukturisasi surat utang dengan perpanjangan jatuh tempo mungkin terjadi dengan mendapat persetujuan dari pemegang MTN. Baca Juga: Pasar membaik, PTPP berani menerbitkan obligasi Sementara itu, Edbert mengatakan jika sebelum pandemi potensi gagal bayar MTN selalu mungkin terjadi, maka tantangan perusahaan untuk menjaga kepercayaan investor jadi semakin tinggi di tengah pandemi yang melambatkan pertumbuhan ekonomi.",investasi
"Risiko Utang Membebani Pengembang Properti, Analis Mengecualikan Tiga Emiten Ini",2024-09-24T16:03:44.022Z,,Premium User Only,https:////insight.kontan.co.id/news/risiko-utang-membebani-pengembang-properti-analis-mengecualikan-tiga-emiten-ini,Premium Content - Not Scraped,insight
Waspada Risiko Utang Emiten Tekstil,2024-09-24T16:03:44.794Z,,Premium User Only,https:////insight.kontan.co.id/news/waspada-risiko-utang-emiten-tekstil,Premium Content - Not Scraped,insight
Indonesia dinilai akan mendulang risiko lebih besar dari monetisasi utang,2024-09-24T16:03:44.928Z,"Kamis, 02 Juli 2020 / 22:19 WIB",Reporter: Bidara Pink | Editor: Yudho Winarto,https:////nasional.kontan.co.id/news/indonesia-dinilai-akan-mendulang-risiko-lebih-besar-dari-monetisasi-utang,"KONTAN.CO.ID - JAKARTA. Bank Indonesia (BI) telah menelurkan banyak kebijakan untuk menghalau dampak negatif virus Covid-19 terhadap perekonomian Indonesia. Salah satunya, BI juga terjun langsung ke pasar perdana untuk membeli Surat Utang Negara (SUN) yang disebut sebagai monetisasi utang. Kabarnya, BI juga akan meneken persetujuan dengan Kementerian Keuangan (Kemenkeu) untuk mendanai tagihan penanganan Covid-19 Indonesia senilai US$ 40 miliar. Sayangnya, langkah yang dilakukan oleh bank sentral tersebut dinilai Chief Strategist of SAV Markets Shyam Devani mampu menimbulkan persepsi buruk investor global terhadap Indonesia. Katanya, investor bisa menganggap kalau BI terlampau jauh dalam bertindak sehingga berisiko mengikis independensi bank sentral. Baca Juga: Jokowi menimbang kembalikan pengawasan bank ke BI, ini tanggapan resmi OJK ""Ini hal yang berisiko. Ini akan membuat investor bertanya-tanya soal kredibilitas Indonesia. Kalau investor sudah tidak percaya dengan BI, maka bisa berpengaruh terhadap volatilitas rupiah, obligasi, juga saham,"" kata Devani seperti dikutip lewat Bloomberg, Kamis (2/7) waktu setempat. Menilik ke nilai tukar rupiah, rupiah tampak terdepresiasi 0,4% ke Rp 14.344 pada Kamis lalu. Selain itu, yield obligasi pemerintah tenor 10 tahun juga terlihat menurun dan bergerak di kisaran 7,24%. Devani pun melihat, kalau nilai tukar rupiah dan obligasi terkoyak, risiko bisa meluas hingga ke pasar saham. Padahal, ekuitas Indonesia sudah mencetak kinerja terburuk di Asia dengan Jakarta Composite Index turun sekitar 22% ytd.",nasional
Ini Empat Risiko Kenaikan Utang Luar Negeri,2024-09-24T16:03:45.174Z,,Premium User Only,https:////insight.kontan.co.id/news/ini-empat-risiko-kenaikan-utang-luar-negeri,Premium Content - Not Scraped,insight
"Risiko default meningkat, investor perlu lebih cermat memilih surat utang",2024-09-24T16:03:45.533Z,"Kamis, 04 Juni 2020 / 20:33 WIB",Reporter: Intan Nirmala Sari | Editor: Wahyu T.Rahmawati,https:////investasi.kontan.co.id/news/risiko-default-meningkat-investor-perlu-lebih-cermat-memilih-surat-utang,"KONTAN.CO.ID - JAKARTA. Diserang dampak persebaran virus corona atau Covid-19, risiko gagal bayar utang perusahaan berpotensi meningkat. Salah satu perusahaan yang menunjukkan gejala tersebut, salah satunya PT IndoSterling Optima Investa. Dalam surat yang dimiliki Kontan, diketahui bahwa PT IndoSterling Optima Investa meminta perpanjangan waktu masa investasi dari nasabahnya. Surat juga dibubuhi tandatangan dari Sean William Henley selaku Direktur PT IndoSterling Optima Investa, yang juga Komisaris dari PT IndoSterling Technomedia Tbk (TECH) yang hari ini (4/6) baru melakukan initial public offering (IPO). Dalam surat tersebut, dijelaskan bahwa surat utang bernama IndoSterling High Yield Promissory Notes (HYPN) meminta perpanjangan masa investasi. Menjanjikan kupon 13% per tahun, nasabah HYPN menempatkan dana selama 12 bulan terhitung sejak awal kuartal II-2019. Baca Juga: IPO IndoSterling Technomedia (TECH) Diwarnai Cerita Gagal Bayar Entitas Berelasinya Head of Investment Research Infovesta Utama Wawan Hendrayana menjelaskan bahwa promissory notes merupakan surat utang piutang biasa yang dikeluarkan oleh suatu perusahaan tanpa ada jaminan khusus. Hanya saja, jenis surat utang ini umumnya menggunakan tenor satu tahun dari waktu penerbitan. ""Risiko default atau credit risk pasti meningkat, dimana penurunan rating surat utang juga kecenderungan turun. Kalau yang betul-betul default, sejauh ini belum ada rasanya,"" ungkap Wawan kepada Kontan.co.id, Kamis (4/6). Baca Juga: Penerbit obligasi korporasi dengan rating investment grade dinilai lebih aman Selain itu, Wawan menilai perusahaan atau emiten yang kinerja operasionalnya terhambat Covid-19 akan paling terdampak atau berisiko mengalami default. Beberapa sektor bisnis seperti sektor perhotelan ataupun pariwisata dinilai memiliki kenaikan risiko. Untuk itu, tips bagi investor yang akan berinvestasi di surat utang dianjurkan untuk lebih mencermati aktivitas bisnis perusahaan tersebut. Selain itu, laporan keuangan perusahaan juga jadi perhatian utama. Meskipun perusahaan berada pada sektor yang berisiko, belum jadi jaminan bakal mengalami default. ""Perlu perhatikan likuiditas masing-masing perusahaan untuk tahu apakah risiko default mereka meningkat atau tidak,"" ungkapnya. Baca Juga: Risiko gagal bayar obligasi korporasi meningkat, begini strategi manajer investasi Di samping itu, Pemeringkat Efek Indonesia (Pefindo) tentunya akan memperbaharui posisi rating jika diketahui ada perusahaan yang kondisi keuangannya terganggu. Sehingga investor harus betul-betul menyaring informasi perusahaan dan waspada akan dampak dari Covid-19. Cek Berita dan Artikel yang lain di Google News",investasi
Simak Daftar Emiten Bebas Risiko Gagal Bayar Utang,2024-09-24T16:03:45.781Z,,Premium User Only,https:////insight.kontan.co.id/news/simak-daftar-emiten-bebas-risiko-gagal-bayar-utang,Premium Content - Not Scraped,insight
Hampir 26% korporasi di Asia Pasifik memiliki risiko tinggi pembayaran utang,2024-09-24T16:03:45.950Z,"Senin, 20 April 2020 / 16:46 WIB",Reporter: Avanty Nurdiana | Editor: Avanty Nurdiana,https:////investasi.kontan.co.id/news/hampir-26-korporasi-di-asia-pasifik-memiliki-risiko-tinggi-pembayaran-utang,"KONTAN.CO.ID - HONG KONG. Moody Investor Service dalam laporan baru menjelaskan, tren kredit korporasi Asia Pasific negatif pada tahun 2020. Ini akibat dari pandemi virus corona yang menimbulkan kerugian ekonomi global, rantai pasokan dan konsumen. Serta pertumbuhan ekonomi juga melambat. ""Ketidakpastian tentang kapan pandemi akan terkendali dan langkahnya pemulihan ekonomi akan membebani pendapatan perusahaan dan kualitas kredit untuk beberapa waktu,"" terang Clara Lau Group Credit Officer and Senior Vice President Moody's seperti dikutip dalam rilis. Kemampuan perusahaan untuk membiayai kembali utang juga menjadi melemah dan leveraged perusahaan cenderung naik jika jatuh tempo utang jatuh pada masa-masa stres seperti saat ini. Sejatinya, pemerintah telah membuat kebijakan moneter yang signifikan dengan memberikan bantuan likuiditas jangka pendek bagi perusahaan yang terkena dampak. Tapi Lau bilang, pemulihan profil kredit akan memerlukan waktu panjang untuk mengontrol gangguan ini. ""Langkah-langkah yang dapat dilakukan perusahaan adalah menjaga likuiditas dan neraca, dan seberapa cepat kegiatan ekonomi akan pulih,"" tambah Lau. Baca Juga: Tanpa Pemangkasan Outlook Oleh S&P, Beban Utang Negara Sudah Berat Moody's menyebut, 26% peringkat portofolio korporasi Asia Pasifik negatif pada akhir kuartal I-2020. Angka ini naik dari 17% pada kuartal IV tahun lalu. Perusahaan otomotif, peritel dan sektor game paling terpukul. Moody's mencatat, lebih dari 50% emiten memiliki peringkat dengan implikasi negatif. Ini artinya peringkat dilakukan dengan pandangan negatif atau sedang ditinjau untuk diturunkan peringkatnya. Tren peringkat portofolio perusahaan di APAC sangat negatif dengan 120 tindakan peringkat negatif dan 5 tindakan positif pada kuartal I-2020. Sebagian besar didorong dampak buruk dari pandemi virus corona pada berbagai sektor. Sehingga menimbulkan risiko pembiayaan kembali perusahaan. Dari 120 tindakan peringkat negatif, seperlima dari sektor transportasi sebanyak 24, diikuti otomotif sebanyak 18, energi 10 dan REIT 10. Cek Berita dan Artikel yang lain di Google News",investasi
Corona Membuat Risiko Utang Emiten Perkebunan Kelapa Sawit (CPO) Naik,2024-09-24T16:03:46.181Z,,Premium User Only,https:////insight.kontan.co.id/news/corona-membuat-risiko-utang-emiten-perkebunan-kelapa-sawit-cpo-naik,Premium Content - Not Scraped,insight
Moody’s ingatkan pemerintah soal risiko pembengkakan bunga utang,2024-09-24T16:03:47.062Z,"Senin, 06 April 2020 / 13:41 WIB",Reporter: Grace Olivia | Editor: Noverius Laoli,https:////nasional.kontan.co.id/news/moodys-ingatkan-pemerintah-soal-risiko-pembengkakan-bunga-utang,"KONTAN.CO.ID - JAKARTA. Di tengah beragam risiko akibat tekanan perekonomian dan pasar keuangan global saat ini, Moody’s Investors Service memperingatkan pemerintah Indonesia soal potensi naiknya beban bunga utang. Apalagi, prospek penerimaan negara tahun ini buruk sehingga kenaikan bunga utang menjadi salah satu sumber tekanan fiskal bagi pemerintah. Baca Juga: Perkara PKPU terus meningkat, praktisi hukum: Pertanda ekonomi memasuki resesi Moody’s mencatat, tingkat yield SUN tenor 10 tahun mengalami kenaikan, yaitu 7,9% pada akhir Maret lalu atau hampir menyamai level pada Oktober 2018 di mana terjadi outflow besar-besaran di pasar keuangan domestik. Naiknya yield SUN juga disertai dengan pelemahan kurs rupiah sehingga kondisi ini menjadi resep bagi melambungnya beban bunga utang pemerintah ke Depan. Terlepas dari sokongan likuiditas yang dikucurkan Bank Indonesia saat ini, kelangkaan dollar AS di dalam negeri berpotensi memaksa BI untuk membiayai obligasi jatuh tempo atau menerbitkan SUN baru dengan tingkat kupon yang tinggi sesuai dengan permintaan pasar. Baca Juga: Hingga Maret, pemerintah tarik utang lewat SBN sebesar Rp 243,8 triliun “Kombinasi pelemahan rupiah dan naiknya yield akan meningkatkan biaya utang dan mengurangi kemampuan membayar utang yang saat ini sudah berada pada level yang lemah,” papar Moody’s. Kondisi penerimaan negara yang lesu pun akan semakin menambah tekanan. Moody’s memperkirakan rasio bunga utang pemerintah akan mencapai 17% dari penerimaan negara pada tahun 2020 atau berlipat ganda dari median 8,4% pada negara berperingkat Baa lainnya.",nasional
"Awas, risiko baru ekonomi global: Ledakan jumlah utang dunia",2024-09-24T16:03:47.337Z,"Selasa, 14 Januari 2020 / 09:24 WIB",Sumber: CNN | Editor: Khomarul Hidayat,https:////internasional.kontan.co.id/news/awas-risiko-baru-ekonomi-global-ledakan-jumlah-utang-dunia,"KONTAN.CO.ID - NEW YORK. Beban utang dunia sangat besar dan memecahkan rekor tertinggi rasio utang terhadap produk domestik bruto (PDB) bahkan sebelum tahun 2019 berakhir. Ledakan utang ini menimbulkan risiko bagi ekonomi global. CNN melaporkan, berdasarkan data Institute of International Finance (IIF), hingga kuartal III 2019 lalu utang global yang terdiri dari pinjaman rumah tangga, pemerintah dan perusahaan, bertambah US$ 9 triliun menjadi hampir US$ 253 triliun. Baca Juga: Global bond perdana milik pemerintah tahun ini dirilis dalam dolar AS dan euro Jumlah itu menempatkan rasio utang terhadap PDB global mencapai 322%, melampaui rasio utang tahun 2016 sebagai level tertinggi. Lebih dari setengah jumlah yang sangat besar ini terakumulasi di negara-negara maju, seperti Amerika Serikat (AS) dan Eropa. Rasio utang PDB AS dan Eropa bahkan sudah mencapai 383%. Ada banyak penyebabnya. Negara-negara maju seperti Selandia Baru, Swiss, dan Norwegia semuanya memiliki tingkat utang rumah tangga yang meningkat, sementara rasio utang pemerintah terhadap PDB di AS dan Australia berada pada titik tertinggi sepanjang masa. Di pasar negara berkembang, tingkat utang lebih rendah, dengan total mencapai US$ 72 triliun. Namun, menurut IIF, tingkat pertumbuhan utang di negara berkembang telah meningkat lebih cepat dalam beberapa tahun terakhir. Baca Juga: Jaga rasio utang tak lebih dari 3% PDB, Luhut: Indonesia selalu b to b dengan China Rasio utang China terhadap PDB, misalnya, mendekati level 310%, tingkat tertinggi di negara berkembang. Investor telah lama mengawasi skeptis terhadap negara yang memiliki leverage tinggi.",internasional
"Dibayangi Risiko Utang, Emiten Batubara Masih Andalkan Pasar Obligasi",2024-09-24T16:03:47.621Z,,Premium User Only,https:////insight.kontan.co.id/news/dibayangi-risiko-utang-emiten-batubara-masih-andalkan-pasar-obligasi,Premium Content - Not Scraped,insight
Waduh! Risiko Pembiayaan Utang Emiten Batubara Meningkat,2024-09-24T16:03:47.896Z,,Premium User Only,https:////insight.kontan.co.id/news/waduh-risiko-pembiayaan-utang-emiten-batubara-meningkat,Premium Content - Not Scraped,insight
Ekonom: Butuh dukungan kebijakan pemerintah untuk antisipasi risiko utang korporasi,2024-09-24T16:03:48.220Z,"Selasa, 01 Oktober 2019 / 21:39 WIB",Reporter: Grace Olivia | Editor: Handoyo .,https:////nasional.kontan.co.id/news/ekonom-butuh-dukungan-kebijakan-pemerintah-untuk-antisipasi-risiko-utang-korporasi,"KONTAN.CO.ID - JAKARTA. Lembaga pemeringkat utang internasional Moody’s Investor Service memperingatkan risiko gagal bayar (default) utang perusahaan-perusahaan di kawasan Asia Pasifik, termasuk Indonesia. Melambatnya pertumbuhan ekonomi global dinilai menjadi sumber risiko bagi kemampuan perusahaan untuk membayar kembali utang yang nominalnya semakin bertambah dari tahun ke tahun. Ekonom Center of Reform on Economics (CORE) Indonesia Yusuf Rendy menyarankan agar perusahaan-perusahaan, terutama non-BUMN, untuk memastikan lindung nilai (hedge fund) terhadap utang-utangnya. Baca Juga: Tekanan risiko utang korporasi meningkat, ekonom ini jelaskan alasannya “Ini untuk melindungi kinerja keuangan perusahaan dari risiko gejolak nilai tukar meskipun tahun depan risiko kurs itu relatif bisa diakomodasi,” tutur Yusuf, Selasa (1/10). Adapun, Yusuf juga berharap otoritas dapat mendorong transmisi kebijakan penurunan suku bunga acuan pada suku bunga kredit riil. Yusuf menilai, sering kali penurunan suku bunga acuan tidak dapat ditransmisi pada suku bunga kredit, padahal hal itu sangat penting untuk memperlonggar likuiditas di dalam negeri dan menyediakan sumber pendanaan bagi perusahaan. Baca Juga: Ekonomi melandai, Menkeu Sri Mulyani sarankan perusahaan meningkatkan efisiensi Strategist Maybank Kim Eng Sekuritas Luthfi Ridho menambahkan, pemerintah juga perlu meneruskan stimulus ekonomi melalui kebijakan fiskal. “Sehingga muncul optimisme terutama dari sisi daya beli masyarakat sehingga masyarakat berkonsumsi, perusahaan pun dapat income,” kata Luthfi, Selasa (1/10). Di tengah peningkatan risiko seperti yang diperingatkan Moody's, Luthfi menilai, Bank Indonesia dan OJK juga perlu meningkatkan pengawasan kepada perbankan Hal ini untuk memastikan otoritas benar-benar siap menanggulangi risiko dan menyiapkan upaya penyelamatan tanpa menimbulkan kegaduhan. Cek Berita dan Artikel yang lain di Google News",nasional
