Title,Scrapping Date,Article Date,Author,Link,Content,Category
"Risiko utang Indonesia meningkat, tapi masih wajar",2024-09-24T16:03:51.331Z,"Kamis, 05 Juli 2018 / 20:15 WIB",Reporter: Ghina Ghaliya Quddus | Editor: Khomarul Hidayat,https:////nasional.kontan.co.id/news/risiko-utang-indonesia-meningkat-tapi-masih-wajar,"KONTAN.CO.ID - JAKARTA. Risiko utang Indonesia masih tinggi. Tercermin dari credit default swap (CDS) yang meningkat seiring laju pelemahan nilai tukar rupiah.CDS menandakan risiko utang Indonesia. Mengutip Bloomberg, per Kamis (5/7), untuk tenor lima tahun, CDS Indonesia berada di 137,706 basis poin (bps). Turun dibandingkan kemarin yang sebesar 138,44 bps. Sementara itu, untuk tenor 10 tahun, CDS Indonesia berada di 216,76 bps. Angka ini naik dibandingkan kemarin yang sebesar 214,28 bps. Bila dilihat setahun terakhir, baik untuk tenor lima tahun maupun 10 tahun, CDS mengalami tren kenaikan. Pada Januari 2018, keduanya mencetak rekor terendah. CDS tenor lima tahun misalnya, sempat menyentuh level terendahnya, yakni 76,00 bps di awal tahun. Sementara, CDS tenor 10 tahun juga berada di level terendahnya, yakni 141 bps. Ekonom Samuel Asset Management Lana Soelistianingsih mengatakan, meski berada dalam tren naik, CDS Indonesia belum mencapai titik tertingginya selama dua tahun. “Memang meningkat dibandingkan awal tahun 2018. Tapi, dua tahun terakhir, untuk tenor lima tahun yang tertingginya adalah 199 bps. Sementara, untuk tenor 10 tahun, tertingginya 262 bps,"" ujarnya. Ia mengatakan, meningkatnya CDS Indonesia adalah hal yang wajar. Mengingat terjadi penguatan dollar Amerika Serikat menyebabkan risiko kredit di negara-negara emerging market yang mengandalkan pendanaan luar negeri cenderung meningkat. “Bukan hanya Indonesia. misalnya India, tren CDS-nya persis sama. Memang ada kenaikan tapi belum risiko banget,” ucapnya. Seiring dengan CDS yang meningkat, Lana mengatakan, investor asing ramai-ramaikeluar dari pasar obligasi Indonesia untuk sementara karena khawatir terhadap risiko kerugian kurs. Cek Berita dan Artikel yang lain di Google News",nasional
"Utang luar negeri swasta lemah, Ekonom: Ada kekhawatiran risiko pelemahan rupiah",2024-09-24T16:03:51.516Z,"Selasa, 15 Mei 2018 / 21:27 WIB",Reporter: Ghina Ghaliya Quddus | Editor: Yudho Winarto,https:////nasional.kontan.co.id/news/utang-luar-negeri-swasta-lemah-ekonom-ada-kekhawatiran-risiko-pelemahan-rupiah,"KONTAN.CO.ID - JAKARTA. Bank Indonesia (BI) mencatat, Utang Luar Negeri (ULN) Indonesia pada triwulan I 2018 tercatat sebesar US$ 358,7 miliar atau tumbuh sebesar 8,7% yoy. Pertumbuhannya tercatat melambat dibandingkan triwulan I 2017 yang sebesar 10,4% yoy. Dalam laporannya, BI menyatakan bahwa perlambatan pertumbuhan ULN tersebut disebabkan oleh ULN sektor pemerintah dan sektor swasta yang tumbuh lebih rendah dibandingkan dengan triwulan sebelumnya. Ekonom Indef Bhima Yudhistira mengatakan, pertumbuhan ULN itu mengalami anomali di mana growth ULN swasta dibanding Februari justru turun -0,45% (mtm). Sementara ULN sektor publiknya terus mengalami kenaikan meskipun hanya sebesar 1,8% (mtm). Kondisi ini, menurutnya, mengindikasikan bahwa sektor swasta memang sedang mengerem ekspansi. “Faktor utamanya karena ada kekhawatiran pelemahan nilai tukar rupiah mengakibatkan resiko gagal bayar naik,” ujarnya kepada Kontan.co.id, Selasa (15/5). Ia melanjutkan, kondisi sektor riil sendiri masih dalam tahap pemulihan yang lambat. Hal ini dibuktikan dari pertumbuhan PDB yang hanya 5,06% dan konsumsi rumah tangga yang sebesar 4,95%. Angka ini di bawah ekspektasi karena stagnan. “Swasta berpikir biaya produksi pasti naik karena kebutuhan bahan baku impor menjadi mahal, daya beli masyarakat masih lambat. Jadi buat apa menambah penerbitan utang valas baru? Lebih baik restrukturisasi utang lama dengan memperpanjang tenor jatuh tempo,” jelasnya. Ekonom Bank Central Asia, David Sumual mengatakan, selain karena risiko dari pelemahan nilai tukar rupiah, ada pula faktor musiman dari turunnya ULN swasta. “Kuartal I biasanya memang cenderung rendah. Hal ini terjadi pasca-harga komoditas turun. Tahun ini di kuartal I memang lemah, investasi juga masih lemah, pertumbuhan kreditnya lemah,” kata dia. Berdasarkan catatan BI, ULN swasta tumbuh melambat terutama dipengaruhi oleh ULN sektor industri pengolahan dan sektor pengadaan listrik, gas, dan uap/air panas (LGA). Secara tahunan, pertumbuhan ULN sektor industri pengolahan dan sektor LGA pada triwulan I 2018 masing-masing tercatat sebesar 4,4% dan 19,3%, lebih rendah dibandingkan dengan pertumbuhan pada triwulan sebelumnya. Sementara itu, pertumbuhan ULN sektor pertambangan meningkat dan pertumbuhan ULN sektor keuangan relatif stabil dibandingkan dengan pertumbuhan triwulan sebelumnya. Pangsa ULN keempat sektor tersebut terhadap total ULN swasta mencapai 72,2%, relatif sama dengan pangsa pada triwulan sebelumnya. Cek Berita dan Artikel yang lain di Google News",nasional
IMF beri peringatan risiko utang ke semua negara,2024-09-24T16:03:51.983Z,"Sabtu, 21 April 2018 / 09:45 WIB","Reporter: Arsy Ani Sucianingsih, Titis Nurdiana | Editor: Barratut Taqiyyah Rafie",https:////nasional.kontan.co.id/news/imf-beri-peringatan-risiko-utang-ke-semua-negara,"KONTAN.CO.ID - WASHINGTON DC. Dana Moneter Internasional (IMF) mengingatkan semua negara agar mewaspadai risiko utang pada tahun ini. Di tengah ketidakpastian global dan perang dagang, peningkatan utang pemerintah dan swasta bisa menghambat laju ekonomi. Meski risiko meningkat, IMF memproyeksikan, perekonomian global tahun ini dan tahun depan bisa tumbuh 3,9%. Angka ini lebih tinggi daripada proyeksi IMF pada Oktober 2017 sebesar 3,7%. Direktur Pelaksana IMF Christine Lagarde menyatakan, momentum pertumbuhan itu terdorong oleh penguatan investasi dan peningkatan transaksi perdagangan dunia. ""Dalam jangka pendek, ekonomi global masih akan terang. Hanya di sisi lain, kami juga melihat ada akumulasi hambatan di masa depan,"" ujar Lagarde kepada jurnalis, termasuk dari KONTAN, di sela-sela Spring Meeting IMF-Bank Dunia, Kamis (19/4). Hambatan itu berasal dari risiko utang. Alarm utang berbunyi seiring penambahan utang dari seluruh negara di dunia. Catatan IMF, utang global saat ini melesat hingga 225% dari pendapatan per kapita global yakni mencapai US$ 164 triliun. Ini merupakan rekor utang baru sejak 2016 lalu. Semakin besar utang, tarif atau bunga utang bertambah, berikutnya volatilitas pasar keuangan juga naik. Kondisi serupa tengah terjadi Indonesia. Utang pemerintah akhir tahun lalu mencapai Rp 3.938 triliun dan berpotensi meningkat menjadi Rp 4.772 triliun di pengujung tahun ini. Jumlah itu bertambah hampir dua kali lipat dibandingkan dengan posisi 2014 lalu yang hanya Rp 2.609 triliun. Salah satu cara mengatasi tantangan tersebut adalah, IMF meminta negara-negara untuk menurunkan defisit anggaran mereka secara gradual. Secara otomatis, langkah ini bisa mengerem utang pemerintah bertambah. Tapi, menurut Scenaider Clasein H. Siahaan, Direktur Strategi dan Portofolio Pembiayaan Kementerian Keuangan, peringatan dari IMF itu cuma berlaku untuk negara dengan excessive borrowing. Yakni, negara dengan rasio utang terhadap produk domestik bruto (PDB) lebih dari 60%. ""Indonesia tidak, karena rasio utang baru 29% dari PDB,"" tegasnya. Cek Berita dan Artikel yang lain di Google News",nasional
Risiko surat utang Indonesia semakin mini,2024-09-24T16:03:52.273Z,"Rabu, 27 Desember 2017 / 21:08 WIB",Reporter: Tane Hadiyantono | Editor: Wahyu T.Rahmawati,https:////investasi.kontan.co.id/news/risiko-surat-utang-indonesia-semakin-mini,"KONTAN.CO.ID - JAKARTA. Kenaikan peringkat utang Indonesia berdampak positif pada credit default swap (CDS) Indonesia. CDS untuk tenor lima tahun memecah rekor terendah di 86,59 pada Rabu (27/12). CDS lima tahun sudah turun fantastis hingga 45,16% secara year to date (ytd). CDS tenor 10 tahun per 26 Desember juga menyentuh level rendah di 155,03 alias turun 31,20% secara ytd. Turunnya CDS ini mengindikasikan risiko gagal bayar surat utang Indonesia menjadi semakin rendah dan menjadi peluang besar bagi investor untuk kembali memarkirkan dananya di Indonesia. CDS yang makin rendah juga memperkecil premium alias spread imbal hasil yang harus diberikan pemerintah dalam penerbitan surat utang. Anil Kumar, Analis Fixed Income Fund Manager Ashmore Asset Management Indonesia melihat, tren penurunan CDS Indonesia ini merespon apresiasi dari Fitch Ratings terhadap Indonesia. Sontak investor asing artinya kembali memburu surat utang Indonesia karena dinilai memiliki potensi risiko rendah. Apalagi berkaca dengan negara tetangga yang memiliki peringkat surat utang yang mirip, yakni Filipina, Anil yakin Indonesia bisa menyentuh level CDS yang lebih rendah lagi. Filipina memiliki peringkat surat utang yang mirip dengan Indonesia, yakni Moody's Investor Service di Baa2 atau satu peringkat di atas investment grade dengan outlook stabil, dan BBB- oleh Fitch Ratings dengan outlook positif. CDS tenor lima tahun Filipina berada di level 59,33. ""Indonesia akan mulai mengejar pelan-pelan, apalagi kuartal empat 2017 akan berakhir. Kalau data bagus dan perekonomian membaik maka kita bisa mendekati CDS Filipina,"" kata Anil saat dihubungi Kontan.co.id, Rabu (27/12). Optimisme ini juga didukung oleh harga komoditas yang semakin stabil, apresiasi peringkat dari Fitch Ratings dan inflasi yang terjaga dan potensi Bank Indonesia bakal mempertahankan suku bunga di level rendah. Melalui empat resep ini, Anil melihat CDS Indonesia pada semester I tahun 2018 seharusnya bisa menyentuh level yang sama dengan Filipina di sekitar 60. Cek Berita dan Artikel yang lain di Google News",investasi
Kemkeu: Risiko fiskal dari utang BUMN masih kecil,2024-09-24T16:03:52.452Z,"Minggu, 08 Oktober 2017 / 11:33 WIB",Reporter: Ghina Ghaliya Quddus | Editor: Rizki Caturini,https:////nasional.kontan.co.id/news/kemkeu-risiko-fiskal-dari-utang-bumn-masih-kecil,"KONTAN.CO.ID - KONTAN. Pemerintah mengklaim penjaminan utang dan pelaksanaan proyek Badan Usaha Milik Negara (BUMN) tidak memberatkan ruang fiskal. Kepala Badan Kebijakan Fiskal (BKF) Kementerian Keuangan (Kemkeu) Suahasil Nazara mengatakan, risiko fiskal dari utang BUMN relatif kecil. Risikonya hanya sekitar maksimum 6% dari PDB. “Hanya sekitar maksimum 6% dari PDB. Kita masih jauh dari situ. Kalau sekitar 6% dan debt to GDP ratio kita sebesar 29% lalu ditambah 6%, hanya sebesar 35%,” kata Suahasil di Kantor Kemkeu, Jumat (6/10). Kemudian, apabila menyesuaikan dengan ketentuan Undang-Undang Keuangan Negara, rasio utang dianggap aman bila di bawah 60% terhadap PDB. “Itu masih jauh dari angka 60%. Nah, dari yang dialokasikan sekitar 6% itu, yang terpakai baru sekitar 1/10 nya saja dari 6%,” ujar dia. Suahasil melanjutkan, yang berkewajiban membayar utang tersebut adalah BUMN meskipun utang tersebut dijamin pemerintah, mengingat kegunaannya adalah untuk membangun proyek pemerintah. Oleh karena itu, peran pemerintah bukan serta merta menjamin utang tersebut untuk semua BUMN. “Untuk penugasan tertentu jaminannya dari pemerintah, seperti PT PLN untuk pemasangan listrik, dari pemerintah. Tapi untuk banyak BUMN sebenarnya hanya karena dimiliki pemerintah. Bukan karena benar-benar dijamin,” jelasnya. Ia mengatakan, dari 245 Proyek Strategis Nasional (PSN) yang ada di Komite Percepatan Penyediaan Infrastruktur Prioritas (KPPIP), masih sangat sedikit yang dijamin pemerintah. Namun demikian, pemerintah akan terus memperhatikan beban penjaminan tersebut agar tidak kian membengkak. ""Dari 245 PSN yang ada di KPPIP, yang sudah jalan baru 20 proyek sampai 30 proyek. Itu masih jauh (nilai penjaminan dari maksimal yang bisa dijamin),"" kata dia. Sebelumnya, Menteri Keuangan Sri Mulyani mengirimkan surat ke Menteri BUMN Rini Soemarno dan Menteri ESDM Ignasius Jonan. Ada beberapa catatan penting, salah satunya sesuai UU Keuangan Negara, Kemkeu berkewajiban mengelola keuangan negara dan APBN (fiskal) secara hati-hati dan berkelanjutan. Itu termasuk melakukan pengawasan dan penilaian potensi risiko fiskal yang berasal dari berbagai sumber kegiatan publik. Kedua, kementerian dan badan usaha yang memiliki tanggung jawab atas pengelolaan potensi risiko keuangan negara dan risiko fiskal, diminta untuk selalu melakukan pengawasan risiko. Juga diminta melakukan langkah-langkah pengelolan dan pencegahan risiko fiskal sesuai tugas dan tanggung jawab masing-masing Kementerian dan Lembaga (Badan Usaha). Cek Berita dan Artikel yang lain di Google News",nasional
Risiko utang Indonesia naik lagi,2024-09-24T16:03:52.675Z,"Senin, 25 September 2017 / 09:29 WIB",Reporter: Choirun Nisa | Editor: Barratut Taqiyyah Rafie,https:////nasional.kontan.co.id/news/risiko-utang-indonesia-naik-lagi,"KONTAN.CO.ID - Walau utang pemerintah terus meningkat dari tahun ke tahun, Kementerian Keuangan (Kemkeu) mengklaim utangnya masih di level sehat. Hanya saja, tidak ada salahnya jika pemerintah tetap waspada, karena sejumlah indikator risiko utang telah naik. Kenaikan risiko utang ini terlihat dari data Direktorat Jenderal Pengelolaan Pembiayaan dan Risiko (DJPR) Kemkeu yang mencatat risiko tingkat bunga naik. Refixing interest rate risk naik menjadi 19% dari sebelumnya 18,7%. Lalu, debt maturity 1 tahun meningkat dari 8,8% menjadi 9,4%. Untuk debt maturity jangka 3 tahun naik dari 23,6% menjadi 23,9%. Debt maturity jangka waktu 5 tahun naik dari 38,9% menjadi 39,2%. Kenaikan risiko ini terjadi seiring dengan kenaikan utang pemerintah yang hingga Agustus 2017 mencapai Rp 3.825,79 triliun. Jumlah itu bertambah Rp 45,81 triliun dibanding bulan sebelumnya. ""Dalam pengelolaan risiko utang, pemerintah senantiasa melakukannya dengan hati-hati dan terukur, termasuk menjaga risiko pembiayaan kembali, risiko tingkat bunga, dan risiko nilai tukar dalam posisi yang terkendali,"" bunyi keterangan tertulis DJPR Kemkeu, akhir pekan lalu. Ekonom Samuel Aset Manajemen Lana Soelistianingsih mengatakan, meski risiko utang masih terhitung aman, namun pemerintah harus mengetatkan pengeluaran tahun depan. ""Untuk debt maturity jatuh tempo satu tahun semakin besar, berarti tahun depan ada banyak utang yang harus dibayarkan. Jika banyak bayar utang, berarti harus diatur defisit anggarannya hingga ke pengeluarannya,"" ujar Lana, Minggu (24/9). Pemerintah juga harus mewaspadai kenaikan pada debt maturity jangka waktu 5 tahun. Sebab bila dibandingkan dengan periode akhir 2016, terjadi penambahan sebesar 3,2%. ""Untuk utang jatuh tempo 5 tahun, sebagian besar pemiliknya adalah asing dan ada potensi asing akan keluar serta isu global tentang potensi suku bunga yang cenderung naik karena The Fed berencana menurunkan neracanya. Jadi, harus dipertimbangkan yang satu ini,"" tandas Lana. Untuk kenaikan interest rate risk, Lana berpendapat masih wajar. Kenaikan ini mengikuti obligasi pemerintah Amerika Serikat yang memiliki rating risk free AAA (triple A) sementara Indonesia baru BBB- (triple B minus) dan suku bunga obligasi di AS saat ini sedang mengalami peningkatan. ""Jika ingin interest rate turun, maka rating utang kita dari S&P dan Fitch Ratings harus naik lagi ke depan,"" katanya. Cek Berita dan Artikel yang lain di Google News",nasional
"Risiko likuiditas naik, bank bersiap memburu utang",2024-09-24T16:03:52.923Z,"Selasa, 06 Juni 2017 / 08:03 WIB",Reporter: Galvan Yudistira | Editor: Barratut Taqiyyah Rafie,https:////keuangan.kontan.co.id/news/risiko-likuiditas-naik-bank-bersiap-memburu-utang,"JAKARTA. Para bankir sudah bersiap menghadapi kenaikan risiko likuiditas yang diprediksi bakal terjadi di semester II-2017 mendatang. Perbankan menyiapkan alternatif pendanaan non dana pihak ketiga (DPK) seperti penerbitan surat utang ataupun instrumen wholesale funding lain. Iman Nugroho Soeko, Direktur Keuangan dan Tresuri Bank Tabungan Negara (BTN) berharap, wholesale funding seperti penerbitan obligasi bakal mencukupi kebutuhan likuiditas BTN. ""Saat ini, porsi wholesale funding BTN sebesar 15% dari total DPK,"" ujar Iman kepada KONTAN, Senin (5/6). Pada semester II nanti, bank berkode saham BBTN ini mengaku masih pada rencana penerbitan obligasi sebesar Rp 3 triliun hingga Rp 5 triliun. Taswin Zakaria, Presiden Direktur Maybank Indonesia juga mengatakan, Maybank masih memiliki instrumen obligasi dan negotiable certificate of deposit (NCD) untuk menambah likuiditas. ""Pelaksanaannya melihat perkembangan biaya dana di pasar dan pertumbuhan kredit,"" ujar Taswin. Senada, Parwati Surjaudaja, Presiden Direktur Bank OCBC NISP bilang, untuk menambah likuiditas pihaknya akan menerbitkan obligasi pada semester II 2017. Ini merupakan bagian dari obligasi berkelanjutan tahap II 2016. Sebagai gambaran, risiko likuiditas di semester II mendatang menjadi salah satu perhatian Otoritas Jasa Keuangan (OJK). Hingga akhir kuartal I 2017, pertumbuhan DPK perbankan memang masih lebih tinggi dibandingkan dari penyaluran kredit. Berdasarkan catatan OJK, pertumbuhan dana pihak ketiga di tiga bulan pertama tahun ini sebesar 9,53% secara tahunan atau year on year (yoy). Sementara, penyaluran kredit hanya tumbuh 8,95% pada kuartal yang sama. OJK meminta perbankan menjaga pertumbuhan DPK hingga akhir tahun untuk mengantisipasi melonjaknya permintaan kredit, terutama di sektor infrastruktur pada semester II-2017. Hingga akhir Maret 2017 lalu, rasio likuiditas industri perbankan masih aman yakni sebesar 89,12%, turun 48 basis poin (bps). Cek Berita dan Artikel yang lain di Google News",keuangan
