Title,Scrapping Date,Article Date,Author,Link,Content
Begini Cara Pemerintah Selesaikan Utang Jatuh Tempo RI Rp800 T di 2025,2024-08-20T05:29:42.857Z,20 August 2024 11:10,"Arrijal Rachman,",https://www.cnbcindonesia.com/news/20240820103426-4-564704/begini-cara-pemerintah-selesaikan-utang-jatuh-tempo-ri-rp800-t-di-2025,"Jakarta, CNBC Indonesia - Pemerintahan Presiden Terpilih Prabowo Subianto akan menarik utang baru senilai Rp 775,86 triliun, sebagaimana tertuang dalam RAPBN 2025. Di sisi lain, ia akan menerapkan strategi refinancing untuk membayar utang jatuh tempo tahun depan yang mencapai Rp 800 triliun.  Direktur Jenderal Pengelolaan Pembiayaan dan Risiko Kementerian Keuangan, Suminto, mengatakan khusus untuk kebijakan refinancing atau rollover terhadap utang jatuh tempo itu akan bisa dilakukan karena stabilitas perekonomian Indonesia yang terus terjaga lima tahun terakhir.   Membuat investor percaya diri untuk refinancing atau reinvestasi utang-utang yang jatuh tempo, termasuk dalam bentuk surat berharga negara (SBN) yang porsinya mayoritas. Suminto pun menekankan, utang jatuh tempo yang senilai Rp 800 triliun itu bukanlah utang yang tak bisa dibayar pemerintah.  ""Dan tentu dengan confidence yang dapat kita build, investor akan refinance, akan reinvestasi, akan investasi kepada kita termasuk dari sisi portfolio atas SBN yang jatuh tempo dan kiranya nominal itu bukan suatu yang membuat kita seolah-olah itu nominal yang sedemikian besar,"" kata Suminto dalam program Special Report CNBC Indonesia, Selasa (20/8/2024)  Mengutip data profil jatuh tempo utang yang tercatat oleh Direktorat Jenderal Pengelolaan Pembiayaan dan Risiko (DJPPR), utang jatuh tempo pada 2024 masih sebesar Rp 434,29 triliun, terdiri dari yang dalam bentuk Surat Berharga Negara (SBN) Rp 371,8 triliun, dan pinjaman Rp 62,49 triliun.  Sedangkan, pada 2025 melonjak menjadi Rp 800,33 triliun, terdiri dari SBN Rp 705,5 triliun dan pinjaman Rp 94,83 triliun. Pada 2026 naik menjadi Rp 803,19 triliun, terbagi menjadi SBN Rp 703 triliun dan pinjaman Rp 100,19 triliun, serta pada 2027 menjadi Rp 802,61 triliun, terdiri dari SBN Rp 695,5 triliun dan pinjaman Rp 107,11 triliun.   Pada 2028, utang jatuh tempo menjadi hanya sebesar Rp 719,81 triliun yang terdiri dari SBN Rp 615,2 triliun dan pinjaman Rp 104,61 triliun, dan pada 2029 kembali turun menjadi Rp 622,3 triliun, terdiri dari utang jatuh tempo dalam bentuk SBN sebesar Rp 526,1 triliun dan pinjaman sebesar Rp 96,2 triliun.  ""Jadi kalau yang refinancing dari SBN yang jatuh tempo, seperti yang saya sampaikan tadi, yang penting adalah kita giving concern memberikan confidence kepada market, kepada investors, bahwa kita betul-betul dapat menjaga perekonomian kita,"" tegasnya.  Sementara itu, terkait penarikan utang atau pembiayaan utang dalam RAPBN 2025 sebesar Rp 775,86 triliun, total yang berasal dari penerbitan Surat Berharga Negara (SBN) secara neto Rp 642,56 triliun, sementara itu yang berasal dari pinjaman secara neto sebesar Rp 133,30 triliun."
"79 Tahun RI: Belum Bisa Merdeka Dari Utang, Justru Makin Menumpuk!",2024-08-20T05:29:43.114Z,18 August 2024 21:30,"Tim Riset,",https://www.cnbcindonesia.com/research/20240818180422-128-564209/79-tahun-ri-belum-bisa-merdeka-dari-utang-justru-makin-menumpuk,"Jakarta, CNBC Indonesia - Masyarakat Indonesia tampaknya tidak tenang melihat utang Indonesia yang menembus Rp8.500 triliun. Ungkapan keluh kesah masyarakat dituangkan di media sosial seperti X maupun Instagram. Ungkapan tersebut bermuara pada ke pertanyaan, kapan Indonesia merdeka dari ngutang? Bagi masyarakat, utang pemerintah sangatlah besar. Per Juli 2024, utang pemerintah kini tembus Rp 8.502,69 triliun, atau naik sekitar Rp 57,82 triliun dalam sebulan. Meskipun begitu, rasio utang terhadap PDB per Juli 2024 hanya mencapai 38,68% atau turun dari per Juni 2024 sebesar 39.13% PDB. Sementara itu menurut catatan Bank Indonesia, utang luar negeri Indonesia mencapai US$408.620 juta atau Rp6.537,92 triliun (kurs=Rp16.000/US$) per Juni 2024. // <![CDATA[!function(){""use strict"";window.addEventListener(""message"",(function(a){if(void 0!==a.data[""datawrapper-height""]){var e=document.querySelectorAll(""iframe"");for(var t in a.data[""datawrapper-height""])for(var r=0;r<e.length;r++)if(e[r].contentWindow===a.source){var i=a.data[""datawrapper-height""][t]+""px"";e[r].style.height=i}}}))}();// ]]> Berdasarkan data Bank Indonesia, berdasarkan sektor ekonomi, utang Indonesia paling besar untuk jasa keuangan dan asuransi dengan nilai US$77.503 juta atau Rp1240,05 triliun. Selanjutnya utang luar negeri Indonesia disalurkan ke sektor manufaktur atau industri pengolahan dengan nilai Rp778,09 triliun. Menurut kelompok peminjam, utang Indonesia dibagi menjadi dua yakni pemerintah & bank sentral lalu swasta. Pinjaman yang berasal dari swasta terdiri dari bank, lembaga keuangan non bank, dan bukan lembaga keuangan. // <![CDATA[!function(){""use strict"";window.addEventListener(""message"",(function(a){if(void 0!==a.data[""datawrapper-height""]){var e=document.querySelectorAll(""iframe"");for(var t in a.data[""datawrapper-height""])for(var r=0;r<e.length;r++)if(e[r].contentWindow===a.source){var i=a.data[""datawrapper-height""][t]+""px"";e[r].style.height=i}}}))}();// ]]> Tujuan penggunaan utang luar negeri swasta banyak digunakan untuk modal kerja dan investasi. Nilai utang untuk modal kerja mencapai US$94.283 juta atau Rp1.508,53 triliun. Sementara untuk investasi senilai US$83.724 miliar atau Rp1.339,58 triliun. // <![CDATA[!function(){""use strict"";window.addEventListener(""message"",(function(a){if(void 0!==a.data[""datawrapper-height""]){var e=document.querySelectorAll(""iframe"");for(var t in a.data[""datawrapper-height""])for(var r=0;r<e.length;r++)if(e[r].contentWindow===a.source){var i=a.data[""datawrapper-height""][t]+""px"";e[r].style.height=i}}}))}();// ]]> Kapan Indonesia Merdeka Hutang? Kalau pertanyaan apakah Indonesia bisa segera bebas hutang, tampaknya jawabannya masih belum bisa. Sebab kondisi Indonesia saat ini yang masih fase mengejar pembangunan. Dikutip dari laman resmi Kementerian Keuangan alasan mengapa negara melakukan utang adalah bertujuan mengejar ketertinggalan infrastruktur dan masalah konektivitas. Masalah infrastruktur dan konektivitas tersebut dianggap jadi penyebab tingginya biaya ekonomi yang harus ditanggung oleh masyarakat. Maka dari itu, pemerintah mengambil kebijakan fiskal ekspansif, belanja lebih besar ketimbang pendapatan untuk mendorong ekonomi untuk mengejar infrastruktur dan peningkatan sumber daya manusia. Saat kebutuhan pemerintah sangat besar, sementara pendapatan tidak mencukupi maka akan menghasilkan gap atau selisih. Hal ini yang kemudian ditutup dengan utang. Pertimbangan menutup defisit dengan utang adalah kebutuhan untuk pembangunan merupakan kebutuhan yang harus segera diwujudkan tanpa penundaan. Pembangunan yang dilakukan oleh pemerintah saat ini dan jangka panjang akan menaikkan jumlah investasi baru dan meningkatkan daya saing serta daya beli. Pada akhirnya, penerimaan pajak di masa yang akan datang dapat digunakan untuk membayar kembali utang yang dikeluarkan saat ini. "
Siap-Siap! Suku Bunga Bakal Membayangi Sentimen Utama Pekan Depan,2024-08-20T05:29:43.294Z,18 August 2024 18:00,"Susi Setiawati,",https://www.cnbcindonesia.com/research/20240818170457-128-564202/siap-siap-suku-bunga-bakal-membayangi-sentimen-utama-pekan-depan,"Jakarta, CNBC Indonesia - Dalam sepekan ini, investor dibuat senang oleh kompaknya pergerakan positif Indeks Harga Saham Gabungan (IHSG) bersama rupiah. Dalam sepekan, tercatat IHSG bergerak positif dengan melesat 2,41% di level 7.432,09 hingga perdagangan Jumat (16/8/2024). // <![CDATA[!function(){""use strict"";window.addEventListener(""message"",(function(a){if(void 0!==a.data[""datawrapper-height""]){var e=document.querySelectorAll(""iframe"");for(var t in a.data[""datawrapper-height""])for(var r=0;r<e.length;r++)if(e[r].contentWindow===a.source){var i=a.data[""datawrapper-height""][t]+""px"";e[r].style.height=i}}}))}();<br />// ]]> Begitu juga dengan pergerakan rupiah terhadap dolar Amerika Serikat (AS) yang menguat 1,48% dalam sepekan di level Rp15.685/US$1 hingga perdagangan Jumat (16/8/2024). // <![CDATA[!function(){""use strict"";window.addEventListener(""message"",(function(a){if(void 0!==a.data[""datawrapper-height""]){var e=document.querySelectorAll(""iframe"");for(var t in a.data[""datawrapper-height""])for(var r=0;r<e.length;r++)if(e[r].contentWindow===a.source){var i=a.data[""datawrapper-height""][t]+""px"";e[r].style.height=i}}}))}();<br />// ]]> Dalam sepekan ini, hasil rapat Rancangan Anggaran Pendapatan dan Belanja Negara (RAPBN) 2025 dan Nota Keuangan menjadi sentimen utama. Presiden Joko Widodo menyampaikan pidato pengantar Rancangan Anggaran Pendapatan dan Belanja Negara (RAPBN) 2025 beserta Nota Keuangannya di hadapan Pimpinan dan Anggota Majelis Permusyawaratan Rakyat (MPR), Dewan Perwakilan Rakyat (DPR), serta Dewan Perwakilan Daerah (DPD) di Gedung Nusantara, Jakarta, pada Jumat, 16 Agustus 2024. Dalam pidatonya, Presiden Jokowi menegaskan pentingnya optimalisasi pendapatan negara, belanja yang berkualitas, serta pembiayaan yang inovatif sebagai fondasi utama RAPBN 2025. Presiden Jokowi juga menjelaskan bahwa optimalisasi rasio perpajakan akan menjadi fokus utama pemerintah untuk memperkuat ruang fiskal. Langkah ini akan dilaksanakan dengan tetap menjaga iklim investasi yang kondusif, keberlanjutan dunia usaha, serta perlindungan terhadap daya beli masyarakat. Presiden mengatakan bahwa belanja negara dalam RAPBN 2025 direncanakan sebesar Rp3.613,1 triliun, yang terdiri dari belanja pemerintah pusat sebesar Rp2.693,2 triliun dan transfer ke daerah sebesar Rp919,9 triliun. Pekan depan, pergerakan IHSG dan rupiah akan kembali volatile, didukung oleh beberapa sentimen penting dalam sepekan ke depan. Indonesia Dari dalam negeri, pada hari Rabu (21/8/2024) terdapat beberapa rilis data ekonomi RI. Pertama, Bank Indonesia (BI) akan melaporkan pertumbuhan kredit perbankan periode Juli 2024. Sebelumnya, BI melaporkan kredit yang disalurkan oleh perbankan tumbuh 12,36% secara tahunan (yoy) per Juni 2024 atau kuartal II tahun ini. Hal ini didukung oleh kondisi likuiditas yang cukup. Berlanjut, BI juga akan memutuskan suku bunga acuan atau BI Rate periode Agustus 2024. Sebelumnya, Rapat Dewan Gubernur (RDG) BI pada 16-17 Juli 2024 memutuskan untuk mempertahankan BI-Rate sebesar 6,25%, suku bunga Deposit Facility sebesar 5,50%, dan suku bunga Lending Facility sebesar 7,00%. Keputusan ini konsisten dengan kebijakan moneter yang pro-stability sebagai langkah pre-emptive dan forward looking untuk memastikan tetap terkendalinya inflasi dalam sasaran 2,5±1% pada 2024 dan 2025. Dan sebelum menutup akhir pekan, pada hari Jumat (23/8/2024), BI akan mengumumkan hasil uang beredar Juli 2024. Sebelumnya, BI mengumumkan likuiditas perekonomian atau uang beredar dalam arti luas (m2) pada Juni 2024 mencapai Rp9.026,2 triliun atau tumbuh sebesar 7,8% (yoy). Pertumbuhan ini lebih tinggi dibandingkan pertumbuhan pada bulan sebelumnya yang sebesar 7,6% (yoy). Tingginya pertumbuhan uang beredar didorong oleh pertumbuhan uang beredar sempit (M1) sebesar 7,0% (yoy) dan uang kuasi sebesar 7,7% (yoy). Amerika Serikat (AS) Dari negeri Paman Sam akan dihiasai oleh pidato dari para pejabat The Federal Reverse (The Fed) dalam sepekan. Dan puncaknya akan ada risalah Rapat Komite Pasar Terbuka Federal (FOMC) pada Kamis (22/8/2024). Risalah tersebut memberikan wawasan terperinci mengenai sikap FOMC terhadap kebijakan moneter, untuk mendapatkan petunjuk mengenai hasil keputusan suku bunga di masa mendatang. Masih dalam hari yang sama, akan terdapat data mingguan klaim pengangguran awal dan berkelanjutan AS. Kemudian, berlanjut akan terdapat data PMI S&P Global AS periode Agustus 2024. Sebelumnya, PMI S&P Global AS direvisi lebih rendah menjadi 54,3 pada Juli 2024, dari estimasi awal 55 dan sedikit menurun dari 54,8 pada Juni. Dan menjelang akhir pekan, pada hari Jumat (23/8/2024), akan terdapat pidato dari Ketua Dewan Gubernur The Fed, Jerome Powell. China Dari negeri tirai bambu, Bank Rakyat China (PBOC) akan mengumumkan suku bunga acuan pinjaman (LPR) satu tahun dan lima tahun pada Selasa (20/8/2024). Sebelumnya, China menurunkan acuan suku bunga pinjaman setelah pemangkasan suku bunga mengejutkan oleh PBOC. Suku bunga acuan pinjaman (LPR) satu tahun diturunkan sebesar 10 basis poin menjadi 3,35% dari 3,45% sebelumnya, sementara LPR lima tahun dikurangi dengan margin yang sama menjadi 3,85% dari 3,95%. Sebagian besar pinjaman baru dan yang beredar di China didasarkan pada LPR satu tahun, sementara suku bunga lima tahun memengaruhi harga hipotek. CNBC Indonesia Research [email protected]"
"Dirgahayu RI ke-79, Inilah Sederet Kontribusi BRI untuk Negeri",2024-08-20T05:29:43.484Z,17 August 2024 10:42,"Elga Nurmutia,",https://www.cnbcindonesia.com/news/20240817103753-4-563974/dirgahayu-ri-ke-79-inilah-sederet-kontribusi-bri-untuk-negeri,"Jakarta, CNBC Indonesia - Memperingati Hari Ulang Tahun (HUT) ke-79 Republik Indonesia, PT Bank Rakyat Indonesia (Persero) Tbk atau BRI terus menunjukkan komitmennya dalam mendukung kemajuan Negeri melalui berbagai inisiatif strategis yang telah memberikan dampak positif bagi rakyat Indonesia. Direktur Utama BRI Sunarso menjelaskan bahwa melalui berbagai programnya BRI terus berkontribusi bagi negeri ini dengan terus membuat economic value serta memberikan social value. ""BRI percaya bahwa setiap langkah yang kita ambil, jika dilakukan bersama-sama, akan membawa dampak besar bagi kemajuan bangsa. BRI akan terus berada di garis terdepan dalam mendukung pemerintah dan masyarakat menuju Indonesia yang lebih sejahtera dan berdaya saing di kancah global,"" ujar Sunarso dalam keterangan resminya, Sabtu (17/8/2024). Asal tahu saja, hingga akhir kuartal II-2024 tercatat ekosistem Ultra Mikro (UMi) BRI Group berhasil menyalurkan pinjaman kepada 36,1 juta debitur dengan portofolio pinjaman yang disalurkan mencapai Rp 622,3 triliun atau tumbuh 7,7% secara year on year. Bila dirinci, dari total Rp 622,3 triliun tersebut Rp 496,2 triliun diantaranya disalurkan melalui kredit mikro BRI, Rp 77 triliun disalurkan oleh Pegadaian dan sisanya senilai Rp 49,2 triliun disalurkan Permodalan Nasional Madani (PNM). Dari sisi simpanan Holding UMi telah berhasil melayani lebih dari 176 juta rekening simpanan. Disamping itu, Holding UMi yang merupakan sinergi antara BRI, Pegadaian, dan PNM juga menjadi salah satu inisiatif penting dalam pembangunan berkelanjutan di Indonesia, khususnya dalam hal menciptakan kesetaraan gender dan pengentasan kemiskinan. Holding UMi sendiri dibentuk untuk memperkuat layanan keuangan kepada pelaku usaha ultra mikro, khususnya di kalangan masyarakat berpenghasilan rendah, termasuk perempuan. Tak hanya itu, BRI juga berhasil menorehkan pencapaian bersejarah, melalui perluasan layanan perbankan hingga pelosok negeri dalam rangka memperkuat inklusi keuangan. Hal ini ditandai dengan jumlah total AgenBRILink yang mencapai 1 juta agen per 25 Juli 2024. Satu juta agen tersebut berhasil mencatat transaksi lebih dari 645 juta kali dengan volume transaksi lebih dari Rp 800 triliun serta menghasilkan fee based income Rp 895,4 miliar, dimana fee yang diperoleh para agen diproyeksikan dapat mencapai 2-3 kali lipat fee yang diterima BRI. Dengan adanya 1 juta AgenBRILink, diharapkan semakin memperluas cakupan layanan keuangan dari kota-kota besar hingga desa-desa terpencil. AgenBRILink tersebut tersebar di lebih dari 61 ribu desa. Jumlah tersebut setidaknya meng-cover lebih dari 80% dari total desa di Indonesia. AgenBRILink sendiri merupakan perluasan layanan perbankan BRI, di mana BRI menjalin kerja sama dengan nasabah sebagai agen yang dapat melayani transaksi perbankan secara real time online. Dengan begitu, selaku Agen BRILink akan mendapatkan keuntungan yang diberikan BRI melalui konsep sharing fee.  Di samping itu, BRI pun terus memperkuat ekosistem super apps BRImo sebagai salah satu strategi transformasi digital-nya untuk memberikan berbagai kemudahan masyarakat dalam bertransaksi. Dalam enam bulan pertama 2024 tercatat BRImo telah digunakan oleh 35,2 juta user dan berhasil mencatatkan 2,01 miliar transaksi finansial dengan volume transaksi mencapai Rp 2.574 triliun atau tumbuh 35,81% yoy. Saat ini, super app BRImo menjadi aplikasi mobile banking dengan rating terbaik dibandingkan aplikasi mobile banking perbankan konvensional lainnya di Indonesia. Data tersebut didapatkan berdasarkan review para pengguna Android (Playstore) yang memberikan rating 4,7 dan pengguna IOS (AppStore) memberikan rating 4,7. Hal tersebut menunjukkan kepuasan nasabah terhadap BRImo. Hingga akhir kuartal II-2024, penyaluran kredit BRI tercatat Rp 1.336,78 triliun atau tumbuh 11,20% year on year (yoy). Segmen UMKM masih mendominasi penyaluran kredit BRI, dengan porsi mencapai 81,96% dari total penyaluran kredit BRI, atau sekitar Rp1.095,64 triliun. Sunarso mengungkapkan bahwa salah satu bentuk komitmen BRI dalam mendukung pertumbuhan ekonomi nasional yakni dengan tetap mendorong penciptaan lapangan pekerjaan khususnya pada segmen UMKM melalui penyaluran kredit yang berkualitas. Tak hanya pembiayaan semata, BRI juga memiliki berbagai program pemberdayaan UMKM, diantaranya adalah pemberdayaan melalui program Klasterku Hidupku dan Desa BRILiaN. Pemberdayaan Klaster Usaha sendiri merupakan pemberdayaan kepada kelompok usaha yang terbentuk berdasarkan kesamaan usaha, dalam satu wilayah sehingga tercipta keakraban dan kebersamaan dalam peningkatan maupun pengembangan usaha para anggotanya. Sebagaimana diketahui, hingga akhir Juli 2024 tercatat BRI telah memiliki 31.488 klaster usaha yang tergabung dalam program Klasterku Hidupku. BRI juga telah menyelenggarakan 2.184 pelatihan dalam program Klasterku Hidupku tersebut. Di sisi lain, ada juga program Desa BRILiaN. Yakni program pemberdayaan desa yang bertujuan menghasilkan role model dalam pengembangan desa yang diinisiasi BRI sebagai bentuk agent of development dalam mengembangkan desa. Hingga akhir Juni 2024 tercatat terdapat 3.602 desa yang telah mendapatkan pemberdayaan Desa BRILiaN.   Program ini diawali sejak tahun 2020 yang tidak lepas dari strategi perseroan untuk lebih dalam mengenal potensi wilayah dan merupakan salah satu bagian dari integrasi aktivitas pemberdayaan dan eksistensi mantri BRI bersama inisiatif-inistiatif lainnya yakni Klaster usaha binaan BRI, pasar.id, serta Hyperlocal Ecosystem yang merupakan suatu bentuk Ekosistem Konsolidasi Mikro. Hingga semester I-2024 BRI telah membukukan portofolio sustainable financing sebesar Rp793,6 triliun, atau sebesar 65.2% dari total pembiayaan dan investasi corporate bond yang dilakukan BRI. Dalam menyalurkan kredit berkelanjutan, BRI tetap berfokus pada penyaluran kredit kepada Kredit KKUB (Kategori Kegiatan Usaha Berkelanjutan) yang mencapai Rp 699,8 triliun pada periode ini, kemudian disusul kredit KUBL (Kegiatan Usaha Berwawasan Lingkungan) sebesar Rp 89,8 triliun, yang terdiri dari penyaluran kredit kepada sektor pengelolaan sumber daya alam hayati dan penggunaan lahan yang berwawasan lingkungan senilai Rp 60,83 triliun, transportasi hijau sebesar Rp 11,47 triliun, energi terbarukan Rp 6,48 triliun, dan sektor KUBL lainnya sebesar Rp 11 triliun. Melihat kuatnya komitmen terhadap sustainable banking, BRI menjadi salah satu First Movers on Sustainable Banking di Indonesia pada 2017. Selanjutnya, pada 2018, BRI menyusun Rencana Aksi Keuangan Berkelanjutan untuk periode 2019 - 2023. Sebagai bentuk penerapan sustainability governance, BRI telah membentuk Komite ESG pada tahun 2021, yang merupakan forum bagi jajaran direksi dalam memonitor dan mengevaluasi implementasi ESG di BRI. Tak hanya itu, BRI juga telah resmi bergabung sebagai anggota di United Nations Global Compact (UNGC) pada 12 Maret 2023. UNGC merupakan lembaga yang mendorong kebijakan dan implementasi keberlanjutan perusahaan, khususnya pada ranah sustainable development goals (SDGs). Tak ketinggalan, sepanjang tahun 2023 lalu BRI berhasil mencatatkan laba bersih senilai Rp 60,4 triliun, atau tumbuh 16,5% yoy. Sebagai bentuk komitmen penciptaan economic value, BRI membagikan dividen sebesar 80% dari total laba bersih atau senilai Rp43,49 triliun kepada pemegang saham baik pemerintah maupun publik. Atas pembagian dividen kepada pemegang saham tersebut, BRI menjadi perusahaan dengan setoran dividen terbesar di tahun 2024. Kementerian BUMN mencatat total dividen BUMN yang disetorkan ke negara mencapai Rp 85,5 triliun, dan sebesar 30% diantaranya atau senilai Rp 25,7 triliun merupakan kontribusi BRI. Sementara itu, dari sisi pembayaran pajak, pada akhir Juli 2024 lalu BRI mendapatkan apresiasi dari Direktorat Jenderal Pajak Kementerian Keuangan RI. BRI menjadi salah satu diantara 20 grup perusahaan di Indonesia yang menjadi penyumbang setoran pajak terbesar sepanjang 2023. Apabila ditarik lebih jauh, terhitung sejak tahun 2019 hingga akhir Kuartal I 2024 BRI telah menyetorkan Rp192,06 triliun kepada kas negara. Apabila dirinci, pada tahun 2019 BRI menyetorkan Rp 26,56 triliun, tahun 2020 menyetorkan Rp 28,38 triliun, tahun 2021 menyetorkan Rp 27,09 triliun, tahun 2022 menyetorkan Rp 34,18 triliun dan tahun 2023 menyetorkan Rp45,34 triliun. Sedangkan untuk tiga bulan pertama di tahun 2024, BRI telah menyetorkan senilai Rp 31,03 triliun ke kas negara. Setoran ini berasal dari pembayaran Pajak Penghasilan, Pajak Pertambahan Nilai & Bea Materai, Pajak Penghasilan Badan, Dividen dan Pajak Daerah. Kinerja BRI yang sehat dan berkelanjutan mendapatkan pengakuan dari dunia internasional. Pada pertengahan Juni 2024 lalu, BRI dinobatkan Forbes Internasional sebagai perusahaan terbesar (peringkat 1) di Indonesia dalam daftar Forbes Global 2000 tahun 2024 dan berada di peringkat 308 diantara 2000 perusahaan publik (dari seluruh industri) terbesar di dunia, mengungguli perusahaan multinasional lain seperti Starbucks, Renault, hingga Uber dan Nissan Motor. Dalam pemeringkatan tersebut BRI menduduki peringkat teratas dari 9 perusahaan asal Indonesia yang masuk dalam daftar Forbes Global 2000 tahun 2024 bersama ribuan perusahaan dunia lain. Secara umum, daftar tersebut berisikan 2 ribu perusahaan publik terbesar di dunia yang disusun berdasarkan penjualan, laba, aset, dan nilai pasar tertinggi dengan keempat variabel yang berbobot sama. Selain Forbes, media ekonomi terkemuka lain, Fortune mengumumkan daftar Fortune Southeast Asia 500 yang menilai 500 perusahaan terbesar di Asia Tenggara berdasarkan revenue, profit dan aset. Pada daftar tersebut, BRI menduduki peringkat pertama untuk industri perbankan dan keuangan di Indonesia dan berada di urutan keempat untuk kategori finansial di Asia Tenggara. Tak berselang lama, pada 10 Juli 2024 BRI menduduki peringkat teratas dari 26 bank Indonesia yang masuk dalam daftar Top 1.000 Banks 2024 rilisan media ekonomi dan keuangan London, The Banker, serta berperingkat 110 secara global. Top 1000 Banks 2024 tersebut berisikan 1.000 bank terbaik di seluruh dunia, dinilai berdasarkan parameter penilaian Tier 1 Capital, Aset, Profit pre tax, Capital Asset Ratio, Return on Capital, dan Return on Asset. Dari sisi kapitalisasi pasar perbankan di dunia, BRI menempati urutan ke-54 dari seluruh bank di dunia dengan market cap sebesar USD 46,43 billion (data per 17 Agustus 2024, companiesmarketcap.com). Peringkat tersebut lebih tinggi dibandingkan bank-bank kelas global seperti Barclays (peringkat 57), QNB/Qatar National Bank (peringkat 64), UOB (peringkat 66), dan Deutsche Bank (peringkat 77). "
"APBN 2025 Tekor Rp616 T, Prabowo Tambal Pakai Instrumen Ini",2024-08-20T05:29:43.719Z,16 August 2024 15:19,"Redaksi,",https://www.cnbcindonesia.com/news/20240816150153-4-563759/apbn-2025-tekor-rp616-t-prabowo-tambal-pakai-instrumen-ini,"Jakarta, CNBC Indonesia -  Presiden Joko Widodo atau Jokowi memaparkan defisit anggaran tahun 2025 direncanakan sebesar 2,53% terhadap PDB atau Rp616,2 triliun. Hal ini terungkap dalam pidato RUU APBN 2025 dan Nota Keuangan di Gedung DPR/MPR, Jumat (16/8/2024). Jokowi mengklaim defisit APBN 2025 yang bakal dijalankan oleh presiden terpilih Prabowo Subianto akan ditopang dengan sumber pembiayaan yang aman. ""Defisit anggaran tahun 2025 direncanakan sebesar 2,53% terhadap PDB atau Rp616,2 triliun yang akan dibiayai dengan memanfaatkan sumber-sumber pembiayaan yang aman dan dikelola secara hati-hati,"" kata Jokowi, Jumat (16/8/2024).   Secara spesifik pemerintah berencana menambal defisit anggaran tersebut lewat penerbitan surat berharga negara (SBN) dan pembiayaan melalaui mekanisme pinjaman. Adapun besaran surat utang (SBN) yang akan diterbitkan untuk menopang belanja pemerintah tahun depan adalah senilai Rp 642,56 triliun. Sementara dari pinjaman sebesar Rp 133,30 triliun. Artinya total pembiayaan utang tahun pertama Prabowo menjabat sebagai presiden mencapai Rp 775,86 triliun. Dari total pinjaman Rp 133,30 triliun yang dianggarkan, hanya sebesar Rp 5,17 triliun ditarik dari dalam negeri. Kemudian, pemerintah akan menarik pinjaman luar negeri Rp 216,50 triliun (bruto) dan menggunakan Rp 88,37 triliun untuk pembayaran cicilan pokok pinjaman sehingga pinjaman luar negeri neto mencapai sebesar Rp 128,13 triliun. Selanjutnya sisa penerbitan SBN dan penarikan pinjaman setelah membiayai defisit akan digunakan untuk pembiayaan investasi, pemberian pinjaman dan pembiayaan lainnya."
