Title,Scrapping Date,Article Date,Author,Link,Content
Makin Numpuk! Utang RI Tembus Rp 8.500 Triliun di Juli 2024,2024-08-20T05:29:43.936Z,16 August 2024 08:25,"Arrijal Rachman,",https://www.cnbcindonesia.com/news/20240816082004-4-563469/makin-numpuk-utang-ri-tembus-rp-8500-triliun-di-juli-2024,"Jakarta, CNBC Indonesia - Utang pemerintahan Presiden Joko Widodo (Jokowi) makin menumpuk. Per Juli 2024, utang pemerintah kini tembus Rp 8.502,69 triliun, atau naik sekitar Rp 57,82 triliun dalam sebulan. Pada Juni 2024, Kementerian Keuangan mencatat, utang pemerintah masih sebesar Rp 8.444,87 triliun. Kenaikan utang tersebut tapi tidak diiringi dengan kenaikan rasio utang terhadap produk domestik bruto (PDB) Indonesia. Sebab,, rasio utang terhadap PDB per Juli 2024 hanya mencapai 38,68% atau turun dari per Juni 2024 sebesar 39.13% PDB. ""Rasio utang per akhir Juli 2024 yang 38,68 persen terhadap PDB, tetap konsisten terjaga di bawah batas aman 60 persen PDB sesuai UU Nomor 17/2003 tentang Keuangan Negara,"" sebagaimana tertulis dalam buku APBN Kinerja dan Fakta edisi Agustus 2024.   Dari total utang per Juli 2024 yang sebesar Rp 8.502,69 triliun, mayoritas berasal dari penerbitan Surat Berharga Negara (SBN) sebesar Rp 7.642,25 triliun. Sisanya dari pinjaman Rp 1.040,44 triliun. Untuk utang yang berasal dari penerbitan SBN terdiri dari SBN Domestik senilai Rp 5.993,14 triliun, dan SBN Valas sebesar Rp 1.468,81 triliun. Sedangkan pinjaman berasal dari pinjaman dalam negeri Rp 39,95 triliun dan pinjaman luar negeri Rp 1.000,49 triliun. Dalam dokumen APBN Kita edisi Agustus 2024 itu disebutkan per akhir Juli 2024, lembaga keuangan memegang sekitar 39,6% kepemilikan SBN domestik, terdiri dari perbankan 20,5% dan perusahaan asuransi dan dana pensiun sebesar 19,1%. ""Bagi lembaga keuangan, SBN berperan penting dalam memenuhi kebutuhan investasi dan pengelolaan likuiditas, serta menjadi salah satu instrumen mitigasi risiko,"" sebagaimana tertera dalam dokumen itu.   Kepemilikan SBN domestik oleh Bank Indonesia sekitar 24,3% yang antara lain digunakan sebagai instrumen pengelolaan moneter. Sementara, asing hanya memiliki SBN domestik sekitar 13,9% termasuk kepemilikan oleh pemerintah dan bank sentral asing. Kepemilikan investor individu di SBN domestik meningkat sejak 2019 yang hanya di bawah 3% menjadi 8,6% per akhir Juni 2024. Sementara, asing hanya memiliki SBN domestik sekitar 14,0 persen termasuk kepemilikan oleh pemerintah dan bank sentral asing. Sejalan dengan upaya pemerintah memperluas basis investor, inklusi keuangan dan peningkatan literasi keuangan masyarakat dari savings society menjadi investment society, kepemilikan investor individu di SBN domestik terus mengalami peningkatan sejak 2019 yang hanya di bawah 3 menjadi 8,7% per akhir Juli 2024. ""Sisa kepemilikan SBN domestik dipegang oleh institusi domestik lainnya untuk memenuhi kebutuhan investasi dan pengelolaan keuangan institusi bersangkutan,"" dikutip dari dokumen APBN Kita. "
"Perhatian, Produksi Pabrik China Melambat & Tak Penuhi Ekspektasi",2024-08-20T05:29:44.131Z,15 August 2024 15:10,"Thea Fathanah Arbar,",https://www.cnbcindonesia.com/news/20240815135001-4-563319/perhatian-produksi-pabrik-china-melambat-tak-penuhi-ekspektasi,"Jakarta, CNBC Indonesia - Pertumbuhan produksi pabrik di China pada Juli melambat dan tidak memenuhi ekspektasi. Situasi ini membuat harapan untuk pemulihan ekonomi yang cepat bagi salah satu negara adidaya tersebut. Hal ini terlihat dari Data Biro Statistik Nasional (NBS) pada Kamis (15/8/2024). Di mana produksi industri tumbuh hanya 5,1% dari tahun sebelumnya, melambat dari laju 5,3% pada Juni dan di bawah ekspektasi jajak pendapat analis Reuters meningkat 5,2%.   Meski begitu, indikator aktivitas bulanan NBS menunjukkan penjualan ritel yang menjadi ukuran konsumsi, naik 2,7% pada Juli. Ini meningkat dari peningkatan 2,0% pada Juni dan mengalahkan ekspektasi untuk pertumbuhan sebesar 2,6%. Angka tersebut menjadi tanda upaya untuk meningkatkan belanja rumah tangga mulai membuahkan hasil.   Sementara itu, investasi aset tetap meningkat 3,6% dalam tujuh bulan pertama tahun 2024 secara tahunan. Walau begitu, angka ini meleset dari ekspektasi kenaikan 3,9% dan juga melambat dari pertumbuhan 3,9% pada periode Januari hingga Juni. Namun, analis memperingatkan bahwa prospek yang lebih luas ""masih sangat menantang"" bagi para pembuat kebijakan di China. Ini menunjukkan bahwa akan lebih banyak langkah stimulus yang diperlukan. ""Data menunjukkan bahwa ekonomi telah mengalami awal yang lemah pada paruh kedua tahun ini, dan diperkirakan kemungkinan mengganti MLF dengan pemotongan RRR akan meningkat, tetapi kunci untuk mempertahankan pertumbuhan ekonomi 5% tetap pada kedatangan belanja fiskal,"" kata ekonom pasar ANZ China Xing Zhaopeng, merujuk pada fasilitas pinjaman jangka menengah dan rasio persyaratan cadangan Bank Rakyat China. Pada Kamis ini, bank sentral China (People's Bank of China/ PBoC) menyuntikkan uang tunai melalui instrumen obligasi jangka pendek dan mengatakan akan melakukan rollover MLF akhir bulan ini. Langkah tersebut dilakukan demi memperluas dukungan likuiditas ke sistem keuangan. Para pemimpin China bulan lalu mengisyaratkan bahwa mereka akan beralih ke buku pedoman baru dan memfokuskan upaya peningkatan pertumbuhan pada konsumen daripada menyalurkan lebih banyak dana ke infrastruktur dan manufaktur. Sejak pemulihan pascapandemi yang gagal terwujud pada tahun 2022, seruan untuk lebih banyak langkah peningkatan pertumbuhan bagi ekonomi senilai US$19 triliun telah menghantui para pejabat China. Meskipun pemerintah masih menargetkan pertumbuhan sekitar 5% tahun ini, para analis menilai semakin besar kemungkinan bahwa pusat produksi dunia tersebut telah memasuki kelesuan ekonomi yang berkepanjangan, mirip dengan Jepang pada tahun 1990-an.  "
"Thailand Panas, PM Srettha Thavisin Diberhentikan karena Langgar Etika",2024-08-20T05:29:44.315Z,14 August 2024 21:40,"sef,",https://www.cnbcindonesia.com/news/20240814174330-4-563099/thailand-panas-pm-srettha-thavisin-diberhentikan-karena-langgar-etika,"Jakarta, CNBC Indonesia - Mahkamah Konstitusi Thailand memberhentikan Perdana Menteri (PM) Srettha Thavisin, Rabu (14/8/2024). Ia disebut melanggar etika dengan mengangkat seorang menteri yang menjalani hukuman penjara, sehingga meningkatkan ancaman pergolakan politik dan goncangan dalam aliansi pemerintahan. Srettha, seorang taipan real estate menjadi PM Thailand keempat dalam 16 tahun yang dicopot dalam putusan pengadilan yang sama. Padahal ia kurang dari setahun menjabat.   Para hakim menilainya gagal menjalankan tugasnya dengan integritas. Ini artinya parlemen harus bersidang untuk memilih PM baru dan membuat prospek ketidakpastian yang lebih besar di negara tersebut. ""Pengadilan telah menemukan 5-4, bahwa terdakwa diberhentikan sebagai perdana menteri karena kurangnya kejujurannya,"" kata para hakim, seraya menambahkan bahwa perilakunya sangat melanggar standar etika dikutip Reuters. Peradilan Thailand memang memainkan peran penting dalam politik Negeri Gajah Putih. Pengadilan yang sama minggu lalu membubarkan Partai Move Forward setelah partai memutuskan mengkampanyekan reformasi undang-undang penghinaan terhadap keluarga kerajaan karena berisiko merusak monarki konstitusional. Putusan tersebut juga datang pada saat ekonomi Thailand belum bangkit. Di mana sejumlah sektor seperti ekspor dan belanja konsumen masih lemah, diikuti utang rumah tangga yang sangat tinggi, dengan lebih dari satu juta usaha kecil tidak dapat mengakses pinjaman.   Pemerintah Thailand memperkirakan pertumbuhan hanya sebesar 2,7% untuk tahun 2024, tertinggal dari negara-negara tetangga. Bursa saham di Thailand juga telah menjadi pasar dengan kinerja terburuk di Asia tahun ini dengan indeks saham utamanya (SETI), turun sekitar 17%. ""Saya sedih harus meninggalkan jabatan sebagai perdana menteri yang terbukti tidak etis,"" kata Srettha kepada wartawan di Gedung Pemerintah. ""Saya melaksanakan tugas saya dengan integritas dan kejujuran,"" klaimnya. Putusan pemberhentian Srettha diyakini dapat mengguncang ""gencatan senjata"" yang rapuh antara tokoh politik besar seperti mantan PM Thaksin Shinawatra dan musuh-musuhnya di kalangan elit konservatif dan militer. Diketahui Thaksin telah kembali dari pengasingan diri selama 15 tahun pada tahun 2023, di mana dirinya lengser dlewat kudeta di 2006. Masalah etika yang dituduhkan ke Srettha terkait penunjukan mantan pengacara Shinawatra Pichit Chuenban. Ia sempat dipenjara karena penghinaan terhadap pengadilan pada tahun 2008 atas dugaan upaya menyuap staf pengadilan, adalah sah. Tuduhan penyuapan tidak pernah terbukti. Pichit mengundurkan diri pada bulan Mei. Wakil perdana menteri Phumtham Wechayachai diperkirakan akan mengambil alih jabatan sebagai PM sementara. Belum diketahui kapan pemilihan PM baru digelar. Menurut beberapa pakar politik, kemungkinan partai Srettha, Pheu Thai masih akan memiliki pengaruh untuk memimpin pemerintahan berikutnya. Dampak pemberhentian hanya akan terasa dalam jangka pendek. ""Koalisi tetap bersatu,"" kata Olarn Thinbangtieo, wakil dekan Fakultas Ilmu Politik dan Hukum Universitas Burapha. ""Mungkin ada beberapa dampak pada kepercayaan, tetapi itu akan terjadi dalam jangka pendek,"" ujarnya. Sejumlah nama bisa dinominasikan sebagai PM baru. Antara lain putri Thaksin yang berusia 37 tahun dan pemimpin partai Paetongtarn Shinawatra, koalisi Pheu Thai. Jika berhasil menjadi PM, dia akan menjadi PM ketiga Thailand setelah Thaksin dan bibinya, Yingluck Shinawatra. Kandidat potensial lainnya termasuk Menteri Dalam Negeri Anutin Charnvirakul, Menteri Energi Pirapan Salirathavibhaga dan mantan kepala militer berpengaruh yang terlibat dalam dua kudeta terakhir, Prawit Wongsuwan. "
"Duka Pekerja RI: 70.000-an Korban PHK, Miskin-Terjerat Judi Online",2024-08-20T05:29:44.532Z,13 August 2024 15:20,"Damiana,",https://www.cnbcindonesia.com/news/20240813143217-4-562693/duka-pekerja-ri-70000-an-korban-phk-miskin-terjerat-judi-online,"Jakarta, CNBC Indonesia - Kementerian Ketenagakerjaan (Kemnaker) mencatat jumlah pekerja yang korban pemutusan hubungan kerja pada periode Januari-Juni 2024 mencapai 32.064 orang. Angka tersebut melonjak 21,4% dari periode sama tahun lalu yang tercatat sebanyak 26.400 orang. Namun, data itu pun diduga lebih kecil dari kondisi sebenarnya. Aktivis Buruh Nasional Mirah Sumirat mengatakan, jumlah buruh di Indonesia terus menurut akibat gelombang PHK massa yang terus berlanjut. Menurutnya, jumlah korban PHK bisa dua kali lipat lebih besar dari data pemerintah yang dirilis Kemnaker tersebut. ""Data yang sesungguhnya bisa 2 kali lebih besar dari jumlah tersebut. Kenapa ada perbedaan data? Karena banyak perusahaan tidak melaporkan jumlah pekerja yang di PHK kepada Dinas Tenaga Kerja setempat. Biasanya sudah ada kesepakatan antara pengusaha dan pekerja di internal, sehingga tidak ada pelaporan ke Dinas Tenaga Kerja,"" katanya dalam keterangan resmi, dikutip Selasa (13/8/2024). ""Dan banyak juga pengusaha yang tidak mendaftarkan pekerjanya ke BPJS Ketenagakerjaan. Hal ini berpengaruh dengan data yang digunakan oleh pihak Kementerian. Karena pihak Kementerian Ketenagakerjaan selalu menggunakan data dari BPJS Ketenagakerjaan berdasarkan klaim dari buruh terhadap Jaminan Hari Tua ( JHT ) yang ada di BPJS Ketenagakerjaan,"" ungkap Mirah. Dia memaparkan, buruh yang jadi korban PHK kini sebagian beralih menjadi pelaku wirausaha skala kecil. Misalnya menjadi pedagang makanan kaki lima. Sebagian lagi, kata dia, beralih menjadi driver online, kerja serabutan, dan pekerjaan informal lainnya. ""Data dari Badan Pusat Statistik (BPS), jumlah pekerja sektor informal di Indonesia bertambah dalam 5 tahun terakhir. Pada Februari 2019 jumlahnya masih 74,09 juta orang (57.27 % dari total penduduk Indonesia yang bekerja). Pada Februari 2024 naik menjadi 84,13 juta orang ( 59.17 % dari total penduduk bekerja),"" paparnya. ""Artinya mereka memiliki pendapatan tidak tetap dan cenderung bertambah miskin, sulit untuk memenuhi kebutuhan hidup layak,"" sebut Mirah yang juga Presiden Women Commitee Asia Pasifik di UNI Apro. UNI Apro adalah federasi pekerja jasa di kawasan Asia Pasifik dari UNI Global Union Asia Pacific Regional Organisation (Apro). Kondisi ini, lanjutnya, menambah beban hidup masyarakat, terutama pekerja atau buruh. Akibatnya, daya beli masyarakat terseret dan melemah. Mirah pun memaparkan sederet permasalahan yang dihadapi pekerja dan masyarakat kelas menengah-bawah di Tanah Air: Pertama, kata dia, kebijakan upah murah sejak tahun 2015 dengan adanya PP no.78/2015 tentang pengupahan. ""Hal ini telah mereduksi fungsi dewan pengupahan dan mereduksi komponen perhitungan upah dalam hal ini menghilangkan Komponen Hidup Layak ( KHL). Lalu disusul dengan di keluarkan UU Omnibus Law Cipta Kerja yang semakin menegaskan PP 78/2015 terkait upah murah,"" tukasnya. ""Kebijakan politik upah murah ini terbukti membuat kesenjangan antara kaya dan miskin semakin melebar, ini bisa berakibat tidak baik untuk kita berbangsa dan beragam,"" ujar Mirah. Kedua, lanjut Mirah, kenaikan harga kebutuhan pangan dan kebutuhan dasar (sembako). Hal ini berdampak signifikan terhadap daya beli masyarakat yang semakin rendah. ""Melambungnya harga pangan dan kebutuhan dasar yang sejak tahun 2021 naik rata -rata sekitar 20%, dan sampai saat ini tetap tidak bisa terkendali,"" sebutnya. Ketiga, tambahnya, munculnya Kebijakan atau regulasi yang dikeluarkan oleh pemerintah yang tidak memihak kepada rakyat/buruh semakin memperburuk kondisi ekonomi buruh dan rakyat. Contohnya, tuturnya,  Peraturan Menteri Perdagangan (Permendag) Nomor 8/2024 tentang Perubahan Ketiga atas Permendag Nomor 36/2023 tentang Kebijakan dan Pengaturan Impor, UU Omnibus Law Cipta Kerja, UU Omnibus Law Kesehatan, UU Omnisbus Law Perbankan, Tambang, Agraria dan sebagainya. ""Kebijakan tersebut dalam proses Pembuatan nya jarang sekali melibatkan publik, stakeholder atau pihak yang terkait sehingga hasilnya tidak berpihak terhadap rakyat,"" kata Mirah. Permasalahan keempat, sebut Mirah, bergesernya Revolusi Industri 4.0 bahkan sudah menjadi 5.0 tanpa diantisipasi oleh pemerintah. Menurutnya, ketika proses peralihan teknologi tidak ada perlindungan bagi buruh dari dampak buruknya terhadap keberlangsungan pekerja, sehingga telah memberikan andil semakin terpuruknya nasib buruh. ""Banyak tenaga manusia diganti dengan mesin (otomatisasi) yang menambah penyebab pekerja kehilangan pekerjaan. Kalaupun ada yang bekerja status mereka bukan sebagai karyawan tetap, tapi sebagai pekerja kontrak, harian lepas. Yang setiap saat bisa di putus kontraknya tanpa mendapat pesangon,"" papar Mirah. Kelima, lanjutnya, terkait kebijakan pajak. ""Keputusan menaikkan pajak kepada seluruh rakyat, di satu sisi pemerintah terlihat tidak ada upaya yang keras untuk menarik pajak dari para wajib pajak yang menunggak pajak. Coba dicek berapa tunggakan pajak dari kelompok orang-orang kaya yang punya wajib pajak kepada negara?"" tukasnya. ""Keputusan menaikkan pajak ini berdampak membuat harga barang ikut naik. Seharusnya pajak diturunkan sehingga bisa membantu menurunkan harga, dan pemerintah mencari sumber dana lain untuk memenuhi kebutuhan belanja negara dan membayar utang pemerintah dan memberantas korupsi,"" ucap Mirah. Biang kerok keenam yang menurut Mirah menekan hidup pekerja dan daya beli warga RI adalah pencabutan subsidi yang menyasar rakyat kecil. Hal ini, ujarnya, makin memperburuk daya beli. ""Perlahan tapi pasti pemerintah mulai menghilangkan subsidi listrik 450 va, rencana pembatasan BBM, dan ada rencana pembatasan pembelian tabung gas melon ukuran 3 kg,"" ujarnya. Dia pun meminta agar subsidi listrik, LPG, BBM untuk buruh dan rakyat kelompok menengah ke bawah agar tetap dipertahankan. Mirah mengatakan, sebagian warga kelas menengah ke bawah sulit untuk menambah penghasilan karena hanya mengandalkan upah yang tidak kunjung memadai untuk hidup layak. Akhirnya mengambil jalan pintas berharap mendapatkan penghasilan tambahan secara instan/cepat dengan cara main judi online, pinjaman online. ""Akibatnya banyak yang terjerat, tidak bisa mengembalikan sehingga banyak kasus bunuh diri akibat judi online dan pinjaman online, produktivitasnya menurun, meningkatnya angka perceraian, dan potensi ekonomi negara yang hilang ratusan triliun rupiah,"" ujar Mirah. ""Permasalahan tersebut jangan dibiarkan berlarut larut, harus segera dicarikan solusinya. Kami berharap di pemerintahan baru, isu pekerja/ buruh dan rakyat bisa diselesaikan untuk mendapatkan kehidupan sejahtera dan layak sesuai dengan amanat Konstitusi UUD 1945 bisa terwujud,"" pungkasnya."
"Di Tengah Ekonomi Lesu, Sri Mulyani Gencar Tarik Utang Baru",2024-08-20T05:29:44.723Z,13 August 2024 14:20,"Arrijal Rachman,",https://www.cnbcindonesia.com/news/20240813121140-4-562636/di-tengah-ekonomi-lesu-sri-mulyani-gencar-tarik-utang-baru,"Jakarta, CNBC Indonesia - Menteri Keuangan Sri Mulyani Indrawati mengakui penarikan utang baru pada saat ini sudah mulai kembali tinggi untuk merespons pelemahan ekonomi, khususnya dari sisi harga-harga komoditas yang mulai melandai. Ia mengatakan, hingga 31 Juli 2024, penarikan pembiayaan utang telah mencapai Rp 266,3 triliun atau 41,1% dari target APBN 2024 sebesar Rp 648,1 triliun. Sementara itu, pertumbuhan penarikan utang baru itu telah mencapai 36,6% dibanding periode yang sama tahun lalu. ""Karena tadi semua komoditas sudah reverse back ke harganya sehingga memang defisitnya diperkirakan pasti lebih tinggi dari 2023. Dan ini sudah mulai terlihat dari pembiayaan kita,"" kata Sri Mulyani saat konferensi pers APBN di Kantor Pusat Kementerian Keuangan, Jakarta, Selasa (31/8/2024).   Sri Mulyani mengatakan, total penarikan pembiayaan utang pada 7 bulan tahun ini berkebalikan dengan tahun lalu. Pada tahun lalu pemerintah mengerem penarikan utang baru untuk pembiayaan anggaran karena harga komoditas menurutnya tengah tinggi sehingga mengerek tinggi setoran pajak. ""Karena tahun lalu dengan penerimaan kita cukup tinggi, karena komoditas boom, kita mengerem pembiayaan utang sangat dalam, makanya tahun lalu pembiayaan mengalami penurunan issuance yang luar biasa harusnya Rp 437,8 triliun, kita hanya keluar Rp 184 triliun SBN issuance,"" ucap Sri Mulyani. Sri Mulyani pun merincikan, untuk pembiayaan utang yang berasal dari penerbitan SBN secara neto per Juli 2024 telah mencapai Rp 253 triliun dari target Rp 666,4 triliun. Total penerbitan SBN itu 38% dari target dengan pertumbuhan mencapai 37,5% dibanding tahun lalu. ""SBN neto kita sudah issuance Rp 253 triliun itu tumbuh 38% dibanding tahun lalu. Ini sebagai bagian dari siklikal waktu ekonomi turun kita menstabilkan dan waktu ekonominya tinggi kita issuance nya lebih kecil, sehingga itu mengurangi ledakan dari sisi boom tahun lalu,"" ujarnya.   Sementara itu, pembiayaan utang yang berasal dari pinjaman telah mencapai Rp 13,3 triliun, jauh lebih tinggi dari desain dalam APBN 2024 yang seharusnya minus Rp 18,4 triliun. Artinya pembiayaan dari pinjaman itu telah mencapai 72,6% dari target dengan pertumbuhan 21,6%. Adapun untuk total pembiayaan nonutang minus Rp 49,3 triliun atau telah tumbuh 39,4% dari target APBN tahun ini yang minus Rp 125,3 triliun, dengan pertumbuhannya sebesar 61,8%. Dengan demikian, total pembiayaan anggaran per Juli 2024 sebesar Rp 217 triliun, sebesar 41,5% dari target Rp 522,8 triliun, dengan pertumbuhan sebesar 31,9% dari periode yang sama tahun lalu sebesar Rp 164,5 triliun. "
"Elon Musk Tak Peduli Nasib Tesla, Lebih Pilih Donald Trump",2024-08-20T05:29:44.957Z,13 August 2024 13:25,"Redaksi,",https://www.cnbcindonesia.com/tech/20240813112524-37-562614/elon-musk-tak-peduli-nasib-tesla-lebih-pilih-donald-trump,"Jakarta, CNBC Indonesia - Elon Musk terang-terangan mendukung Donald Trump dalam pemilu Amerika Serikat (AS) 2024. Hal ini membuat banyak pihak terkejut, sebab Trump selama ini menentang industri mobil listrik (EV) yang didominasi Tesla, perusahaan milik Musk.  Trump juga kerap menyebut isu perubahan iklim sebagai hoaks belaka. Hal ini tak sejalan dengan nilai yang dipegang Tesla, yakni memberikan alternatif kendaraan ramah lingkungan untuk mereduksi dampak perubahan iklim.  Selama ini, Tesla mendapat banyak kemudahan dari pemerintahan Joe Biden. Antara lain pinjaman pemerintah, keringanan pajak, hingga regulasi kendaraan listrik lainnya yang berkontribusi pada pertumbuhan bisnis Tesla.  Pada Februari lalu, Tesla bersama dengan Lembaga Perlindungan Lingkungan AS (EPA), meminta pemerintahan Biden untuk memperketat aturan soal emisi kendaraan di California.  Beberapa bulan sebelumnya, Tesla melobi pemerintah untuk menetapkan regulasi yang melarang produksi mobil bensin baru pada 2035. Banyak yang menentang rencana aturan tersebut, termasuk Trump.  ""Musk cenderung mengatakan dia memusuhi subsidi, padahal Tesla melahapnya seperti Godzilla yang lapar,"" kata Mike Murphy, ahli strategi Partai Republik yang menjalankan EV Politics Project, sebuah kelompok advokasi berbasis di Los Angeles yang mencari dukungan bipartisan untuk kendaraan listrik.  Orang-orang yang akrab dengan manajemen Musk di Tesla mengatakan kepada Reuters bahwa pendekatannya terhadap subsidi bersifat pragmatis, yaitu kesediaan untuk menerima uang publik jika dana tersebut memang ada untuk diambil.  Sikap Musk yang mengabaikan penolakan Partai Republik terhadap industri yang ia rintis, menandakan miliarder tersebut punya ambisi lebih besar di luar bisnisnya, dikutip dari Reuters, Selasa (13/8/2024).  ""Tesla bukan tujuan akhir bagi Musk,"" kata Andrew Ward, profesor di Lehigh University.  Ia mengatakan Musk memiliki banyak lini bisnis lain, mulai dari perusahaan teknologi kecerdasan buatan (AI), eksplorasi luar angkasa, hingga neuroscience.  ""Musk bisa mengorbankan kepentingan jangka pendek Tesla demi mencapai ambisi dan kepentingan pribadinya untuk jangka panjang,"" Ward menambahkan.  Musk dan Tesla tak merespons permintaan komentar dari Tesla. Juru bicara Trump juga tak merespons. Sementara Gedung Putih menolak berkomentar.  Trump dan Musk dulunya tak 'akrab'. Namun, sikap Musk berubah 180 derajat pasca upaya pembunuhan Trump beberapa saat lalu gagal. Musk mengatakan sepenuhnya mendukung Trump dan memberikan bantuan dana US$ 21 juta untuk melawan Demokrat. Beberapa hari setelah mengumbar dukungan untuk Trump, Musk menjawab pertanyaan netizen di X soal pandangan Trump yang menolak industri EV.  ""Semua akan baik-baik saja,"" begitu jawaban Musk.  Selanjutnya, Trump juga mengatakan bahwa ia terpaksa akan mendukung mobil listrik karena Musk mendukungnya. Namun, Trump menegaskan bahwa masyarakat harus tetap diberikan alternatif untuk membeli mobil berbahan bakar bensin.  Apapun tujuan akhir Musk, ia tak bisa menampik besarnya dukungan pemerintah yang dinakhodai rezim Demokrat selama ini bagi Tesla. Fasilitas manufaktur Tesla pertama di Fremont dibangun dengan pinjaman pemerintah melalui Kementerian Energi AS senilai US$ 465 juta. Pinjaman itu dikembalikan tiga tahun kemudia.  Baru-baru ini, Tesla meraup hampir $9 miliar sejak 2018 dengan menjual 'regalutory credit' menurut pengajuan sekuritas. Kredit tersebut diberikan pemerintah federal dan negara bagian kepada perusahaan yang melampaui peraturan emisi yang makin ketat. Kredit itu dapat dijual kepada produsen mobil lain yang tidak mampu mematuhinya.  ""Tak akan ada Tesla tanpa otoritas penegak hukum California,"" kata pemerintah California Gavin Newson dalam konferensi tahun 2022."
