Title,Scrapping Date,Article Date,Author,Link,Content,Category
Pasar sambut positif Sri Mulyani menjadi Menteri Keuangan lagi,2024-08-21T02:09:48.191Z,"Selasa, 29 Oktober 2019 / 12:37 WIB",Sumber: Kompas.com | Editor: Noverius Laoli,https:////nasional.kontan.co.id/news/pasar-sambut-positif-sri-mulyani-menjadi-menteri-keuangan-lagi,"KONTAN.CO.ID - JAKARTA. Presiden Joko Widodo telah mengumumkan susunan Kabinet Indonesia Maju yang akan membantunya selama pemerintahan periode 2019-2024. Sejumlah nama-nama baru muncul memberikan kejutan. Namun, beberapa posisi masih tetap diduduki oleh wajah lama, salah satunya Menteri Keuangan Sri Mulyani Indrawati. Kepala Ekonom DBS Indonesia Masyita Crystallin berdasarkan analisisnya mengatakan, penunjukan kembali Sri Mulyani sangat positif di tengah kondisi global yang masih bergejolak. Baca Juga: Simak tanggapan Kemkeu soal usulan tax amnesty jilid II ""Tantangan global saat ini sangat berat, pertumbuhan ekonomi dunia melemah, belum lagi diwarnai perang dagang dan beberapa isu geopolitik. Penetapan Ibu Sri Mulyani sebagai Menteri Keuangan mendapat reaksi positif dari pasar,"" kata Masyita dalam siaran pers, Selasa (29/10). Sedangkan mengenai kabinet baru secara keseluruhan, Masyita menilai cukup netral terhadap pertumbuhan ekonomi. ""Kabinet ini memiliki kombinasi antara partai dan profesional yang cukup baik,"" ujar dia. Untuk Kementerian Keuangan, Masyita memprediksi Kemenkeu akan melanjutkan manajemen anggaran yang baik dan melanjutkan reformasi fiskal. Menurutnya, manajemen anggaran yang baik sangat penting dalam kondisi yang volatile, karena anggaran pemerintah diperlukan sebagai stimulus di saat ekonomi sedang melemah. Baca Juga: DJBC: Revisi PMK Ekspor Kembali Barang Impor pertimbangkan aspek lingkungan ""Secara bersamaan menjaga defisit agar tetap berada di koridor yang aman. Kebijakan fiskal yang kontra siklus berarti pada saat perekonomian sedang lemah, stimulus fiskal dapat digunakan untuk mengangkat pertumbuhan ekonomi,"" ujar Masyita. Selain itu, Masyita juga menilai reformasi fiskal akan tetap menjadi prioritas. Hal tersebut memang sangat diperlukan untuk Indonesia karena rasio pajak yang masih kurang dari 12 persen di bawah rata-rata negara peers. ""Untuk tumbuh lebih tinggi, Indonesia membutuhkan rasio pajak setidaknya 15 persen,"" pungkas dia. (Fika Nurul Ulya) Baca Juga: Pengusaha sarankan mobil dinas menteri diganti mobil listrik Artikel ini telah tayang di Kompas.com dengan judul ""Riset: Pasar Respon Positif Sri Mulyani Jadi Menkeu Lagi"", Cek Berita dan Artikel yang lain di Google News",nasional
"Sri Mulyani tetap jadi Menteri Keuangan, pasar tunggu pengumuman kabinet lengkap",2024-08-21T02:09:48.350Z,"Selasa, 22 Oktober 2019 / 11:36 WIB",Reporter: Benedicta Prima | Editor: Herlina Kartika Dewi,https:////investasi.kontan.co.id/news/sri-mulyani-tetap-jadi-menteri-keuangan-pasar-tunggu-pengumuman-kabinet-lengkap,"KONTAN.CO.ID - JAKARTA. Sri Mulyani Indrawati menjadi satu-satunya menteri yang secara tegas menyatakan dirinya tetap menduduki kursi menteri Keuangan di periode kedua Presiden Jokowi. Direktur Pilarmas Investindo Maximilianus Nico Demus menilai pernyataan itu menjadi salah satu katalis positif bagi pasar. ""Karena kita semua kenal kapasitas Sri Mulyani, di mana kemampuan dalam mengatur keuangan negara tentu akan menjadi salah satu menteri yang bisa mendukung visi dan misi dari Jokowi,"" jelas Nico kepada Kontan.co.id, Selasa (22/10). Baca Juga: Sri Mulyani kembali ditunjuk jadi Menkeu, rupiah terus menguat ke Rp 14.038 Kendati begitu, pasar tetap menunggu kepastian seluruh racikan kabinet di periode kedua ini. Terutama, pasar setuju apabila kapasitas para tokoh yang terpilih sesuai dengan tugas dan tanggung jawab yang diemban. ""Tentu fokus berikutnya adalah menunggu menteri-menteri selanjutnya, semua menteri memiliki kapasitas yang cukup kuat untuk menggerakkan IHSG,"" ujar dia. Pagi tadi, usai bertemu dengan Jokowi, Sri Mulyani menyatakan dirinya siap menerima tugas dari presiden untuk tetap menjadi Menteri Keuangan. Kepada awak media, alasan utama Sri Mulyani mau mengemban tugas lagi karena Indonesia mesti bersiap menghadapi tekanan perekonomian global. Baca Juga: Sri Mulyani tetap jadi menteri keuangan pada periode kedua Kabinet Jokowi ""Untuk itu, dibutuhkan policy dalam rangka menjaga perekonomian kita dari tantangan pelemahan global. Di sisi lain, di dalam negeri, prioritas kebijakan yang sangat penting, bagi saya merupakan kehormatan untuk bisa melaksanakan tugas kembali sebagai Menteri Keuangan untuk mendorong kualitas Sumber Daya Manusia,"" jelas Sri Mulyani. Usai pengumuman tersebut, IHSG sempat menyentuh level tertinggi hari ini 6.229,39. Kendati begitu, saat ini IHSG bergerak di level 6.191,37 atau melemah 0,12%. Cek Berita dan Artikel yang lain di Google News",investasi
Indonesia raih peringkat pertama sebagai pasar keuangan syariah global,2024-08-21T02:09:48.627Z,"Sabtu, 19 Oktober 2019 / 06:35 WIB",Reporter: Grace Olivia | Editor: Noverius Laoli,https:////nasional.kontan.co.id/news/indonesia-raih-peringkat-pertama-sebagai-pasar-keuangan-syariah-global,"KONTAN.CO.ID -  JAKARTA. Posisi Indonesia di mata dunia naik dalam hal potensi perbankan dan keuangan Islam global.  Berdasarkan Global Islamic Finance Report (GIFR) 2019, Indonesia menempati peringkat nomor satu, naik dari peringkat keenam pada tahun lalu. Indonesia juga berhasil menyalip negara-negara anggota Gulf Cooperation Council (GCC) dan Malaysia yang selalu mendominasi peringkat teratas sejak 2011. Baca Juga: Suku Bunga Turun, Investor Memburu Sukuk Negara “Alhamdulillah, tahun ini Indonesia menempati peringkat teratas dalam hal kepemimpinan dan potensinya dalam perbankan dan keuangan Islam global dengan skor 81,93,” ujar Menteri PPN/Kepala Bappenas Bambang Brodjonegoro dalam keterangannya dari acara Penyerahan GIFR 2019 Award yang bertemakan Fintech, Artificial Intelligence and Innovation in Islamic Finance di Gedung Kementerian PPN/Bappenas, Kamis (17/10). Bambang mengatakan, penghargaan tersebut merupakan bentuk pengakuan terhadap upaya pemerintah, pelaku usaha, akademisi, dan masyarakat dalam merealisasikan MasterplanArsitektur Keuangan Syariah (MAKSI) dan Masterplan Ekonomi Syariah Indonesia (MEKSI) dalam rangka meningkatkan peran keuangan syariah dalam rencana strategis pembangunan ekonomi nasional. Capaian memuaskan perkembangan keuangan syariah Indonesia dinilai dari pertumbuhan institusi keuangan syariah, produk dan layanannya, hingga berkembangnya infrastruktur pendukung keuangan syariah. Berdasarkan data OJK, pada Juni 2019, aset keuangan syariah Indonesia, tidak termasuk saham syariah dan Baitul Malwat Tamwil (BMT), mencapai US$ 94,44 miliar dengan pangsa pasar 8,29%. Total aset perbankan syariah tercatat sebesar Rp 500 triliun atau hampir 6% dari total pangsa pasar keuangan syariah. Baca Juga: Sedikit melambat, BCA perkirakan pertumbuhan kreditnya tahun ini sekitar 9%-10% Bambang menyebut, hal ini menunjukkan pertumbuhan aset, pembiayaan, dan kekuatan deposito perbankan syariah yang menjadi motor penggerak utama keuangan syariah di Indonesia. Selain perbankan syariah, Lembaga Keuangan Non Bank (LKNB) syariah yang mencakup asuransi syariah, pembiayaan syariah, dan institusi lainnya tercatat memiliki nilai Rp 102 triliun.",nasional
"Selamat, Indonesia menempati peringkat pertama pasar keuangan syariah global",2024-08-21T02:09:49.157Z,"Kamis, 17 Oktober 2019 / 18:59 WIB",Reporter: Grace Olivia | Editor: Noverius Laoli,https:////nasional.kontan.co.id/news/selamat-indonesia-menempati-peringkat-pertama-pasar-keuangan-syariah-global,"KONTAN.CO.ID - JAKARTA. Posisi Indonesia di mata dunia naik dalam hal potensi perbankan dan keuangan Islam global.  Berdasarkan Global Islamic Finance Report (GIFR) 2019, Indonesia menempati peringkat nomor satu, naik dari peringkat keenam pada tahun lalu. Indonesia juga berhasil menyalip negara-negara anggota Gulf Cooperation Council (GCC) dan Malaysia yang selalu mendominasi peringkat teratas sejak 2011. Baca Juga: Suku Bunga Turun, Investor Memburu Sukuk Negara “Alhamdulillah, tahun ini Indonesia menempati peringkat teratas dalam hal kepemimpinan dan potensinya dalam perbankan dan keuangan Islam global dengan skor 81,93,” ujar Menteri PPN/Kepala Bappenas Bambang Brodjonegoro dalam keterangannya dari acara Penyerahan GIFR 2019 Award yang bertemakan Fintech, Artificial Intelligence and Innovation in Islamic Finance di Gedung Kementerian PPN/Bappenas, Kamis (17/10). Bambang mengatakan, penghargaan tersebut merupakan bentuk pengakuan terhadap upaya pemerintah, pelaku usaha, akademisi, dan masyarakat dalam merealisasikan MasterplanArsitektur Keuangan Syariah (MAKSI) dan Masterplan Ekonomi Syariah Indonesia (MEKSI) dalam rangka meningkatkan peran keuangan syariah dalam rencana strategis pembangunan ekonomi nasional. Capaian memuaskan perkembangan keuangan syariah Indonesia dinilai dari pertumbuhan institusi keuangan syariah, produk dan layanannya, hingga berkembangnya infrastruktur pendukung keuangan syariah. Berdasarkan data OJK, pada Juni 2019, aset keuangan syariah Indonesia, tidak termasuk saham syariah dan Baitul Malwat Tamwil (BMT), mencapai US$ 94,44 miliar dengan pangsa pasar 8,29%. Total aset perbankan syariah tercatat sebesar Rp 500 triliun atau hampir 6% dari total pangsa pasar keuangan syariah. Baca Juga: Sedikit melambat, BCA perkirakan pertumbuhan kreditnya tahun ini sekitar 9%-10% Bambang menyebut, hal ini menunjukkan pertumbuhan aset, pembiayaan, dan kekuatan deposito perbankan syariah yang menjadi motor penggerak utama keuangan syariah di Indonesia. Selain perbankan syariah, Lembaga Keuangan Non Bank (LKNB) syariah yang mencakup asuransi syariah, pembiayaan syariah, dan institusi lainnya tercatat memiliki nilai Rp 102 triliun.",nasional
"Pasar keuangan tertekan, kinerja reksadana pasar uang masih tumbuh positif",2024-08-21T02:09:49.578Z,"Rabu, 02 Oktober 2019 / 20:03 WIB",Reporter: Dimas Andi | Editor: Khomarul Hidayat,https:////investasi.kontan.co.id/news/pasar-keuangan-tertekan-kinerja-reksadana-pasar-uang-masih-tumbuh-positif,"KONTAN.CO.ID - JAKARTA. Di tengah tekanan pasar keuangan di bulan September 2019 lalu, reksadana pasar uang masih mampu mencatatkan imbal hasil positif. Tercatat, Infovesta Money Market Fund Index 90 yang mencerminkan kinerja rata-rata reksadana pasar uang tumbuh 0,48% (mom) pada bulan lalu. Head of Investment Research Infovesta Utama Wawan Hendrayana menyampaikan, penurunan suku bunga acuan yang terjadi belakangan ini sebenarnya dapat menekan kinerja reksadana pasar uang. Namun, dalam jangka pendek efek penurunan suku bunga acuan belum terlihat mengingat perbankan butuh waktu untuk menyesuaikan tingkat bunga depositonya. Ia pun menilai, keberadaan obligasi bertenor pendek menjadi pemicu stabilnya kinerja reksadana pasar uang untuk saat ini. Baca Juga: Reksadana pendapatan tetap jawara di September Direktur Panin Asset Management Rudiyanto mengamini hal tersebut. Ketika suku bunga acuan turun, harga obligasi dapat merespons lebih cepat sehingga mampu mengalami kenaikan harga. Hal ini yang menjadi penyebab reksadana Panin Dana Likuid mencetak imbal hasil sebesar 0,55% (mom) atau di atas kinerja rata-rata reksadana pasar uang di bulan lalu. Sepanjang tahun ini, performa reksadana tersebut telah tumbuh 4,48% (ytd). Ia menyebut, pihaknya mengkombinasikan deposito berjangka serta obligasi korporasi dan pemerintah tenor di bawah 1 tahun sebagai aset dasar reksadana Panin Dana Likuid. “Kalau terlalu banyak di deposito, potensi pertumbuhan imbal hasilnya lebih terbatas,” ujar Rudiyanto, Rabu (2/10). Khusus untuk obligasi korporasi, pihak Panin AM hanya akan berinvestasi pada obligasi yang memiliki peringkat utang minimal idA. Sementara itu, deposito yang dipilih manajer investasi tersebut minimal berasal dari bank BUKU III. Baca Juga: Pemerintah tetapkan kupon ORI016 sebesar 6,80% “Kalau untuk deposito syariah diperbolehkan dari bank BUKU II karena ketersediannya yang lebih terbatas,” tambah dia. Wawan berpendapat, kinerja reksadana pasar uang masih bisa meningkat di sisa tahun ini terlepas dari adanya penurunan suku bunga acuan lebih lanjut. Tetapi, ia memangkas prediksi kinerja rata-rata reksadana pasar uang di tahun ini dari 5% menjadi 4%--4,5%. “Jumlah ini dihitung setelah pajak dan masih lebih tinggi dari tingkat bunga deposito,” jelas dia, Rabu (2/10). Baca Juga: Reksadana Terproteksi Berbasis Obligasi Masih Menjanjikan Imbal Hasil Besar Cek Berita dan Artikel yang lain di Google News",investasi
"Pasar keuangan berpotensi anjlok akibat demonstrasi, ini langkah Sri Mulyani",2024-08-21T02:09:49.964Z,"Rabu, 25 September 2019 / 17:48 WIB",Reporter: Abdul Basith | Editor: Noverius Laoli,https:////nasional.kontan.co.id/news/pasar-keuangan-berpotensi-anjlok-akibat-demonstrasi-ini-langkah-sri-mulyani,"KONTAN.CO.ID - JAKARTA. Penolakan terhadap revisi Undang-Undang KPK dan RUU KUHP serta sejumlah kebijakan pemerintah dan DPR lainnya, telah menimbulkan demonstrasi berhari-hari di Ibu kota Jakarta. Terkait hal ini, Menteri Keuangan Sri Mulyani Indrawati berjanji pemerintah akan menjaga pondasi ekonomi utnuk menjaga pasar keuangan. Sri Mulyani mengatakan, ia akan melakukan komunikasi ke pelaku usaha. Komunikasi untuk menjelaskan bahwa kondisi Indonesia saat ini masih stabil. Baca Juga: Ogah cabut UU KPK, Menkumham minta demonstran gugat ke MK saja ""Pokoknya kita akan jaga pondasinya aja sehingga kita akan tetap komunikasikan kepada pelaku usaha mengenai Indonesia yg stabil dan tetap terkelola dengan baik,"" ujar Sri Mulyani usai rapat di Kantor Presiden, Rabu (25/9). Hal itu diharapkan dapat menjadi jangkar dalam mengatasi masalah pasar keuangan. Penguatan pondasi dinilai dapat mengatasi sentimen yang sifatnya sementara. Baca Juga: Jokowi kekeh tolak cabut UU KPK meksipun korban mahasiswa mulai berjatuhan Seperti sebelumnya ada aksi demonstrasi yang dinilai berpengaruh pada pasar keuangan. Hingga kondisi ekonomi global yang berdampak pada kondisi domestik. ""Kita mungkin harus melihat dalam konteks yang besar,"" terang Sri Mulyani. Sisi makro ekonomi dinilai lebih banyak mengarahkan sentimen. Selain itu kondisi neraca perusahaan harus tetap kuat sehingga menghilangkan berbagai macam sentimen. Cek Berita dan Artikel yang lain di Google News",nasional
"Djarum, Lippo, Sinar Mas, siapa pemimpin pasar bisnis keuangan di Indonesia?",2024-08-21T02:09:50.329Z,"Senin, 23 September 2019 / 14:50 WIB",Reporter: Ferrika Sari | Editor: Yudho Winarto,https:////keuangan.kontan.co.id/news/djarum-lippo-sinar-mas-siapa-pemimpin-pasar-bisnis-keuangan-di-indonesia,"KONTAN.CO.ID - JAKARTA. Konglomerasi di Indonesia ramai-ramai masuk ke bisnis keuangan. Nama-nama besar seperti Djarum Group, Sinar Mas Group dan Lippo Group bahkan memiliki banyak perusahaan jasa keuangan mulai dari perbankan hingga platform fintech. Sinar Mas Group melalui anak usahanya yang bergerak sektor keuangan, PT Sinar Mas Multiartha Tbk (SMMA) memiliki dua perbankan yaitu PT Bank Sinar Mas Tbk dan PT Simas Money Changer. Tak cukup sampai situ, korporat besar ini mempunyai 10 perusahaan asuransi yang menyebar ke asuransi jiwa, asuransi umum, keagenan asuransi dan reasuransi. Baca Juga: Digital Mediatama Maxima akan IPO pada 21 Oktober mendatang Dari banyak asuransi, PT Asuransi Sinar Mas (ASM) menyumbang pemasukan besar bagi grup. Paruh pertama 2019 saja, asuransi umum ini kantongi pendapatan premi bruto Rp 5,08 triliun naik 51,19% yoy. Sedangkan laba setelah pajak meningkat 33,79% menjadi Rp 178,05 miliar. Menyusul kontribusi Bank Sinar Mas yang mencatatkan pendapatan operasional Rp 1,78 triliun per Juni 2019. Walaupun dari sisi laba bersih justru turun hingga 90,06% menjadi Rp 22,10 miliar karena dipengaruhi kenaikan beban operasional sampai 68,26% di pertengahan tahun 2019. “Dari semuanya, kontribusi terbesar masih dari ASM dan Bank Sinar Mas kalau di Sinar Mas Multiartha,” kata Direktur SMMA Dani Lihardja kepada Kontan.co.id, beberapa waktu lalu. Baca Juga: Formaksi perluas kerjasama dengan RS, peserta BPJS Kesehatan bisa naik kelas gratis Gurita bisnis perusahaan yang didirikan Eka Tjipta Widjaja ini meluas ke multifinance. Ada sebanyak tujuh perusahaan yang didirikan. Namun dalam beberapa tahun terakhir, Sinar Mas gencar memasuki pasar keuangan berbasis digital dengan mengembangkan tiga platform fintech lending, seperti PT Pasar Dana Pinjaman (Danamas), PT Oriente Mas Sejahtera (Finmas) dan PT Dana Pinjaman Inklusif (PinjamanGo). Di bawah SMMA, kata Dani, layanan keuangan Sinar Mas Group sudah lengkap. Untuk menyinergikan seluruh bisnis tersebut pihaknya menghubungkan layanan fintech dengan modal ventura agar nasabah mendapatkan semua layanan yang ada.",keuangan
Pergerakan pasar keuangan Indonesia masih bertumpu pada sentimen eksternal,2024-08-21T02:09:50.544Z,"Selasa, 17 September 2019 / 17:16 WIB",Reporter: Elisabeth Adventa | Editor: Noverius Laoli,https:////nasional.kontan.co.id/news/pergerakan-pasar-keuangan-indonesia-masih-bertumpu-pada-sentimen-eksternal,"KONTAN.CO.ID -  JAKARTA. Danareksa Research Institute (DRI) merilis riset tentang kondisi pasar keuangan dalam negeri. Hasil riset DRI menilai pasar keuangan dalam negeri masih akan digerakkan sentimen eksternal, yakni kecamuk perang dagang Amerika Serikat (AS) dan China, kenaikan harga komoditas safe haven, serta keputusan bank sentral AS (Federal Reserve) soal suku bunga. Head of DRI Moekti Prasetiani memprediksi perang dagang AS - China masih akan terus berlanjut. Sejak awal September lalu, AS menaikkan tarif impor sebanyak 15% untuk barang-barang China dengan total nilai US$ 112 miliar, seperti alas kaki, tekstil dan produk elektronik. Baca Juga: Pembicaraan tingkat deputi perdagangan AS dan China akan digelar Kamis pekan ini Sebagai balasan, China kemudian mengenakan tarif impor 5% - 25% untuk mobil dan suku cadang, kedelai dan lainnya yang masuk dari AS. Dalam keterangan tertulis yang dirilis DRI, Moekti menjelaskan dalam kaitannya selama masa kampanye, Presiden AS, Donald Trump selalu mengedepankan isu nasionalisme. Trump mengungkapkan bahwa China yang membuat ekonomi AS memburuk. Dengan adanya peningkatan tarif impor produk China, maka pendapatan AS dipercaya dapat meningkat. Sehingga kemudian digunakan untuk subsidi petani kedelai dan gandum. Langkah ini diambil sebagai kompensasi atas dihentikannya impor produk pertanian AS ke China. ""Perang dagang AS-China ini menyebabkan melambatnya perekonomian dunia, namun tidak akan menjadikan resesi global, sebagaimana juga diutarakan beberapa ekonom global. Pertumbuhan ekonomi China pada kuartal II tahun 2019 mengalami penurunan dan merupakan yang terendah dalam 27 tahun terakhir,"" jelas Moekti dalam keterangan tertulis, Selasa (17/9). Ia lanjut menjelaskan, stimulus yang diberikan pemerintah China berhasil mempertahankan output retail sales dan investasi. Sementara itu, Consumer (dan Business) Confidence Index di AS yang erat kaitannya dengan saham dan ekonomi mengalami penurunan pada Juli 2019 lalu. Menurut Moekti, di sisi lain, pelaku pasar juga perlu mencermati harga komoditas yang mulai naik. Selain batubara dan tembaga, semua komoditas termasuk emas, minyak sawit (CPO) dan karet sudah mengalami pemulihan sejak Juli 2019. Khususnya emas yang bersama US Treasury (surat utang AS) dan Japan Treasury (surat utang Jepang) yang merupakan instrument safe haven di keuangan global. Baca Juga: Bunga paling tinggi 7%, silakan timbang penawaran bunga deposito bank-bank ini Harga emas dunia saat ini masih berada di rentang perdagangan US$ 1.503 per troy ounce yang terus meningkat di tengah ketidakpastian global. Naiknya harga emas dunia ini pun mendorong harga emas dalam negeri ke level tertinggi, yakni Rp 726.000/gram pada 4 September lalu. Hal ini juga berdampak pada inflasi Agustus 2019 yang dipengaruhi oleh meningkatnya harga emas dan perhiasan.",nasional
Menko Darmin: Program sertifikasi tanah jadi upaya menaikkan minat ke pasar keuangan,2024-08-21T02:09:50.733Z,"Jumat, 23 Agustus 2019 / 11:56 WIB",Reporter: Akhmad Suryahadi | Editor: Wahyu T.Rahmawati,https:////investasi.kontan.co.id/news/menko-darmin-program-sertifikasi-tanah-jadi-upaya-menaikkan-minat-ke-pasar-keuangan,"KONTAN.CO.ID - JAKARTA. Masyarakat Indonesia masih enggan untuk masuk ke sektor keuangan formal. Hal ini disampaikan oleh Menteri Koordinator Perekonomian Darmin Nasution dalam acara Capital Market Summit & Expo 2019, Jumat (23/8). Menurut Darmin, masih diperlukan langkah dan kebijakan untuk meningkatkan dan mendorong masyarakat untuk masuk ke sektor keuangan. ""Agar membuat masyarakat tidak merasa asing terhadap sektor keuangan,"" ujar Darmin. Baca Juga: Jokowi bagikan 2.706 sertifikat tanah di NTT hari ini Darmin berpendapat, program sertifikasi tanah dapat dijadikan salah satu upaya untuk meningkatkan minat masyarakat masuk ke sektor keuangan. Salah satu caranya adalah dengan menjadikan tanah yang telah disertifikasi sebagai agunan. ""Jika aset khususnya tanah sudah disertifikasi, maka dia punya modal untuk masuk ke sektor keuangan formal untuk dijadikan agunan,"" lanjut Darmin. Baca Juga: Duh, Penjualan Sukuk Tabungan ST-005 Kurang Laris Tahun 2018, pemerintah telah menerbitkan 5 juta sertifikat tanah. Untuk tahun ini ada sekitar 7 juta lahan yang menjadi target sertifikasi. Sementara tahun depan diprediksi naik menjadi 9 juta sertifikat lahan. Dengan demikian, program sertifikasi ini dapat sejalan dengan program pemerintah untuk mendorong masyarakat masuk ke sektor keuangan. ""Itulah inklusi keuangan yang sesungguhnya,"" terang Darmin. Baca Juga: AEI dukung peningkatkan stabilitas pasar saham dengan menambah investor domestik Untuk diketahui, tingkat literasi keuangan masyarakat Indonesia masih rendah. Berdasarkan Survei Nasional Literasi Keuangan OJK yang pada tahun 2016, literasi keuangan masyarakat Indonesia baru mencapai 29,7 persen sedangkan inklusi keuangan sebesar 67,8 persen. Cek Berita dan Artikel yang lain di Google News",investasi
Investor reksadana naik berkat penetrasi teknologi di pasar keuangan,2024-08-21T02:09:50.956Z,"Senin, 19 Agustus 2019 / 21:18 WIB",Reporter: Danielisa Putriadita | Editor: Handoyo .,https:////investasi.kontan.co.id/news/investor-reksadana-naik-berkat-penetrasi-teknologi-di-pasar-keuangan,"KONTAN.CO.ID - JAKARTA. Jumlah investor reksadana naik tajam berkat tingginya penetrasi teknologi di pasar keuangan. Otoritas Jasa Keuangan (OJK) mencatat transaksi reksadana melalui online mencapai Rp 5 triliun. Infovesta Utama dalam rilisnya, Senin (19/8) mengatakan kenaikan tersebut didukung oleh tingginya penetrasi teknologi di pasar keuangan dalam negeri. Penetrasi tersebut dibantu dengan keberadaan fintech. Tercatat kini Single Investor Identification (SID) mencapai 1,25 juta orang. Baca Juga: Pacu Produktivitas & Efisiensi, PTPN III Gandeng PNM-IM Terbitkan Sukuk Rp 1 Triliun Infovesta Utama memandang dengan adanya dorongan OJK di industri keuangan bisa memudahkan masyarakat untuk membeli beragam produk reksadana. Hal tersebut juga bisa menjaring investor milenial yang melek terhadap perkembangan teknologi. Infovesta mencatat saat ini terdapat 50 platform online yang telah dikembangkan oleh Manajer Investasi, seperti e-commerece, e-wallet maupun penyelenggaraan fintech lainnya. Baca Juga: Langkah awal menuju kemerdekaan keuangan Cek Berita dan Artikel yang lain di Google News",investasi
China: Pelabelan manipulator mata uang dapat menyebabkan kekacauan di pasar keuangan,2024-08-21T02:09:51.110Z,"Selasa, 06 Agustus 2019 / 22:19 WIB",Reporter: Noverius Laoli | Editor: Noverius Laoli,https:////internasional.kontan.co.id/news/china-pelabelan-manipulator-mata-uang-dapat-menyebabkan-kekacauan-di-pasar-keuangan,"KONTAN.CO.ID - BEIJING. Bank Sentral China merespons cap yang diberikan Washington bahwa Beijing sebagai manipulator mata uang. Bank Sentral China mengatakan keputusan tersebut sangat merusak tatanan keuangan internasional dan menyebabkan kekacauan di pasar keuangan. Keputusan Washington untuk meningkatkan ketegangan mata uang pada hari Senin juga dinilai Beijing akan menghambat pemulihan dan perdagangan global. Baca Juga: Bursa AS rontok, harta miliarder dunia amblas Rp 1.638 triliun dalam sehari Hal itu dikatakan Bank Rakyat China (PBOC) dalam tanggapan resmi pertama negara tersebut terhadap salvo AS terbaru dalam perang perdagangan kedua pihak yang meningkat cepat. ""China belum menggunakan dan tidak akan menggunakan nilai tukar sebagai alat untuk menangani sengketa perdagangan,"" ujar PBOC dalam sebuah pernyataan di situs webnya seperti dilansir Reuters, Selasa (6/8). ""China menyarankan Amerika Serikat untuk mengendalikan kudanya sebelum jatuh ke jurang, dan waspada akan kesalahannya, dan berbalik dari jalan yang salah,"" bunyi pernyataan tersebut. Tudingan AS terhadap Beijing sebagai manipulator mata uang sebagai respons atas penurunan tajam mata uang Yuang dalam sehari pada hari Senin. Baca Juga: Rupiah melemah karena perang mata uang, simak prediksinya untuk besok Penurunan nilai Yuan telah menimbulkan gejolak yang bahkan lebih besar di antara negara perekonomian terbesar dunia tersebut dan menghancurkan harapan yang tersisa untuk melakuakn resolusi cepat dalam perang dagang selama setahun terakhir. Perselisihan dagang ini telah menyebar meluas ke tarif seperti ke teknologi.",internasional
