Title,Scrapping Date,Article Date,Author,Link,Content,Category
Mengulik Aliran Deras Dana di Pasar Keuangan Dalam Negeri,2024-08-21T02:09:29.083Z,,Premium User Only,https:////insight.kontan.co.id/news/mengulik-aliran-deras-dana-di-pasar-keuangan-dalam-negeri,Premium Content - Not Scraped,insight
LPEM FEB UI himbau BI fokus jaga nilai tukar rupiah dan pasar keuangan,2024-08-21T02:09:29.234Z,"Kamis, 22 Juli 2021 / 04:45 WIB",Reporter: Bidara Pink | Editor: Tendi Mahadi,https:////newssetup.kontan.co.id/news/lpem-feb-ui-himbau-bi-fokus-jaga-nilai-tukar-rupiah-dan-pasar-keuangan,"KONTAN.CO.ID - JAKARTA. Lembaga Penyelidikan Ekonomi dan Masyarakat Fakultas Ekonomi dan Bisnis Universitas Indonesia (LPEM FEB UI) menghimbau agar Bank Indonesia (BI) menahan suku bunga acuan di level 3,50% dalam RDG bulan ini. Ekonom Makroekonomi dan Pasar Keuangan LPEM FEB UI Teuku Riefky mengatakan, saat ini BI perlu menjadikan nilai tukar dan stabilitas keuangan menjadi prioritas utama. “Menjaga nilai tukar dan stabilitas keuangan di masa ketidakpastian krisis Covid-19 harus menjadi prioritas utama bank sentral,” ujar Riefky dalam laporannya, Rabu (21/7). Dari sisi pasar keuangan, memang saat ini rupiah relatif bergerak stabil di kisaran Rp 14.500 per dollar Amerika Serikat (AS), meski ada jumlah kasus Covid-19 meningkat dan PPKM Darurat di Jawa dan Bali. Baca Juga: Kredit baru diperkirakan tumbuh lebih tinggi di kuartal III-2021, ini indikasinya Rupiah masih dinilai cukup kuat karena beberapa faktor eksternal, termasuk sikap The Fed untuk kebijakan moneter yang akomodatif meskipun inflasi AS meningkat lebih tinggi dari perkiraan. Namun, The Fed masih mengisyaratkan ini terlalu dini dalam mengganti haluan moneter. Selain itu, untuk mendukung pemulihan ekonomi, bank sentral China mengumumkan akan memangkas rasio cadangan wajib (RRR) sebesar 50bps efektif per 15 Juli 2021. Meski terpantau beberapa investor memindahkan aset mereka dari pasar negara berkembang seperti Indonesia, tetapi masih ada beberapa investor yang masih mau menempatkan aset mereka dalam portofolio yang lebih berisiko, dipicu oleh pengumuman The Fed dan POBC tersebut. Hal ini menghasilkan rupiah masih relatif stabil meski memang ada penurunan arus modal asing bersih yang masuk, yaitu dari US$ 8 juta per pertengahan Juni 2021 menjadi US$ 7,34 juta per pertengahan Juli 2021. Tak hanya itu, kondisi cadangan devisa yang meningkat menjadi US$ 137,1 miliar per Juni 2021 masih sanggup untuk menjaga pergerakan nilai tukar rupiah. Baca Juga: Pola pemulihan ekonomi Indonesia mirip logo Nike, ini kata ekonom Bank Mandiri Hanya saja, BI tak boleh terlena akan hal ini. Karena hingga kini pasar keuangan masih terus mengamati dengan cermat bagaimana varian Delta mendorong kembali krisis Covid-19 di seluruh dunia sambil memantau bagaimana pembuat kebijakan, terutama The Fed akan bereaksi. Riefky kemudian mengatakan, memang saat ini tingkat inflasi masih rendah, dan penurunan suku bunga kebijakan biasanya merupakan alat utama yang diterapkan oleh bank sentral selama periode inflasi rendah. Namun, penurunan kembali suku buga acuan di tengah saat ini akan sia-sia karena sisi penawaran praktis memang masih redup di masa peningkatan kasus harian Covid-19.  Cek Berita dan Artikel yang lain di Google News",newssetup
"Pekan ketiga Juli 2021, aliran modal asing masuk Rp 7,55 triliun ke pasar keuangan",2024-08-21T02:09:29.491Z,"Jumat, 16 Juli 2021 / 14:45 WIB",Reporter: Bidara Pink | Editor: Khomarul Hidayat,https:////nasional.kontan.co.id/news/pekan-ketiga-juli-2021-aliran-modal-asing-masuk-rp-755-triliun-ke-pasar-keuangan,"KONTAN.CO.ID - JAKARTA. Aliran modal asing masuk ke pasar keuangan dalam negeri pada pekan ketiga Juli 2021. Berdasarkan data transaksi Bank Indonesia (BI) periode 12 Juli hingga 15 Juli 2021, nonresiden di pasar keuangan domestik mencatatkan net buy aset portofolio keuangan sebesar Rp 7,55 triliun. “Ini terdiri dari beli neto atau net buy di pasar Surat Berharga Negara (SBN) sebesar Rp 5,73 triliun dan beli neto di pasar saham sebesar Rp 1,82 triliun,” ujar Direktur Eksekutif, Kepala Departemen Komunikasi BI Erwin Haryono, Jumat (16/7). Meski ada aliran masuk modal asing, tetapi premi risiko investasi atau premi credit default swap (CDS) Indonesia tenor 5 tahun naik ke level 77,03 bps per 15 Juli 2021, dari 76,65 bps per 9 Juli 2021. Dengan demikian, berdasarkan data setelmen selama 2021 atau year to date (ytd), nonresiden tercatat beli neto Rp 0,86 triliun.  Cek Berita dan Artikel yang lain di Google News",nasional
Sri Mulyani tegaskan komitmen pemerintah perkuat pasar keuangan syariah,2024-08-21T02:09:29.929Z,"Kamis, 15 Juli 2021 / 20:37 WIB",Reporter: Yusuf Imam Santoso | Editor: Noverius Laoli,https:////nasional.kontan.co.id/news/sri-mulyani-tegaskan-komitmen-pemerintah-perkuat-pasar-keuangan-syariah,"KONTAN.CO.ID -  JAKARTA. Dalam sebuah perekonomian yang terus berkembang, maka peranan sektor keuangan terutama pasar modal menjadi sangat penting. Negara-negara maju memiliki pasar modal, sebuah sektor yang mampu menciptakan kesempatan bagi investor untuk berinvestasi dan sekaligus menyuntikkan modal kepada para pengusaha. Dengan peranan pasar modal yang sedemikian pentingnya dan Indonesia sebagai negara muslim yang sangat besar, maka menciptakan sebuah pasar modal Islam yang kuat menjadi sangat penting. Hal ini disampaikan oleh Menteri Keuangan (Menkeu) Sri Mulyani Indrawati saat menyampaikan pidato pembuka pada acara Konferensi Internasional 2021 ""The Future of Islamic Capital Market: Opportunities, Challenges, and Way Forward”, yang diselenggarakan secara daring, Kamis (15/7). “Tentu dampak pandemi dapat mempengaruhi atau telah mempengaruhi pasar keuangan termasuk pasar keuangan syariah. Oleh karena itu, Indonesia perlu untuk terus memperkuat ketahanan perekonomian dan keuangan termasuk di dalamnya capital market dan Islamic capital market,” jelas Sri Mulyani, Kamis (15/7). Baca Juga: Sistem pajak internasional disepakati, RI bisa pajaki 100 perusahaan multinasional Namun demikian, pada tataran domestik, Indonesia mampu menorehkan beberapa perkembangan penting di sektor ekonomi dan keuangan syariah. Dari sisi aset, sektor keuangan syariah tanah air berhasil tumbuh signifikan dimana total aset keuangan syariah nasional (tidak termasuk kapitalisasi saham syariah) per Maret 2021 mencapai Rp 1.862,77 triliun atau 9,96% dari keseluruhan total aset industri keuangan nasional. Sektor pasar modal syariah yang merupakan bagian penting dari keuangan syariah juga menunjukkan perkembangan yang cukup baik. Data OJK per Juni 2021 menunjukkan bahwa aset saham syariah telah mencapai Rp 3.372,20 triliun atau 47,32% dari total saham di Indeks Harga Saham Gabungan (IHSG) Indonesia. Namun demikian, kapitalisasi aset sukuk korporasi dan reksadana syariah masih tergolong rendah, dimana per 25 Juni 2021 outstanding sukuk korporasi sebesar Rp 32,54 triliun dengan market share 7,44% dan reksadana syariah sebesar Rp 39,75 triliun dengan market share 7,28%. Dengan basis yang masih kecil, Menkeu mengharapkan perkembangan pasar keuangan syariah bisa terus berlanjut. Menurut Sri Mulyani, diperlukan pengembangan pasar modal syariah dengan meningkatkan kedalaman dan likuiditas sektor keuangan syariah. “Dalam konteks ini, Pemerintah bersama OJK dan Bank Indonesia terus bekerja sama dan berkomitmen mengembangkan pasar keuangan syariah dan mengupayakan kebijakan serta regulasi maupun di dalam menciptakan instrumen agar pasar modal syariah dapat tumbuh stabil dan berkelanjutan. Dan tentu ini artinya bisa memberikan ruang berinvestasi yang makin luas bagi masyarakat Indonesia,” tutup Menkeu.  Cek Berita dan Artikel yang lain di Google News",nasional
Diversifikasi aset disarankan di tengah ketidakpastian pasar keuangan,2024-08-21T02:09:30.196Z,,,https:////stocksetup.kontan.co.id/news/diversifikasi-aset-disarankan-di-tengah-ketidakpastian-pasar-keuangan,,stocksetup
Tips mengatur aset di tengah volatilitas pasar keuangan,2024-08-21T02:09:30.639Z,"Kamis, 24 Juni 2021 / 18:57 WIB",Reporter: Achmad Jatnika | Editor: Noverius Laoli,https:////investasi.kontan.co.id/news/tips-mengatur-aset-di-tengah-volatilitas-pasar-keuangan,"KONTAN.CO.ID -   JAKARTA. Di tengah volatilitas pasar yang meningkat karena lonjakan kasus Covid-19 di Indonesia, dan isu tapering dari Amerika Serikat (AS), manajer investasi menyarankan untuk diversifikasi investasi portofolio. Direktur Panin Asset Management Rudiyanto menyarankan agar tetap dapat berinvestasi walaupun kondisi sedang seperti saat ini, tetapi yang perlu diperhatikan adalah melakukan diversifikasi portofolio. Karena menurutnya tidak semua investor memiliki kemampuan yang baik dalam membaca arah pasar dan melakukan market timing. “Kalau misalkan investor yang memiliki market timing yang baik, bisa saja dia itu ibaratnya melakukan perpindahan investasi dengan cepat, kalau tidak ahli, sering juga salah. Jadi, kalau memang dia memiliki kemampuan yang baik, tergantung investor membaca arah pasar,” kata Rudiyanto kepada Kontan, Rabu (23/6). Ia menyarankan untuk membagi porsinya di reksadana pasar uang, campuran, pendapatan tetap, dan saham. Dengan melakukan diversifikasi, walaupun asetnya mengalami penurunan, tetapi porsi menurunnya akan menjadi lebih sedikit. Baca Juga: Nasabah unitlink diwajibkan punya nomor identitas investor “Kadang-kadang antara realita yang terjadi, sama harga saham memang tidak selalu searah, jadi kita mungkin masih bisa mendapatkan kenaikan,” kata Rudiyanto. Walaupun lonjakan kasus Covid-19 menjadi sentimen negatif saat ini, Ia melihat dengan percepatan vaksinasi yang terjadi saat ini akan dapat meredakan kasus yang ada dalam beberapa waktu ke depan. Ia juga melihat India, walaupun kasus di sana cukup parah, tetapi dapat mereda dalam jangka waktu 2-3 bulan. Untuk saat ini, proyeksi Rudiyanto mengenai Indeks Harga Saham Gabungan (IHSG) di angka 6.700-6.800 di akhir tahun masih belum berubah, jadi ini akan menjadi proyeksi positif bagi reksadana saham. Ia memproyeksikan return yang bisa didapatkan oleh reksadana saham di kisaran 10% di akhir tahun. Selain itu ia juga memproyeksikan return reksadana pasar uang 3-3,5%, reksadana reksadana pendapatan tetap 5-7%, dan reksadana campuran 5-10% di akhir tahun.  Cek Berita dan Artikel yang lain di Google News",investasi
Deutsche Bank peringatkan kenaikan inflasi jadi bom waktu di pasar keuangan global,2024-08-21T02:09:31.052Z,"Selasa, 08 Juni 2021 / 14:08 WIB",Sumber: CNBC | Editor: Noverius Laoli,https:////internasional.kontan.co.id/news/deutsche-bank-peringatkan-kenaikan-inflasi-jadi-bom-waktu-di-pasar-keuangan-global,"KONTAN.CO.ID -  JAKARTA. Ekonom Deutsche Bank memperingatkan bahwa inflasi yang menjadi masalah global saat ini berpotensi bertahan lebih lama dan menyulut krisis ekonomi pada tahun-tahun mendatang. Melansir CNBC, Selasa (8/6), dalam perkiraan yang jauh di luar konsensus dari pembuat kebijakan dan Wall Street, Deutsche Bank mengeluarkan peringatan yang mengerikan bahwa berfokus pada stimulus sambil mengabaikan ketakutan inflasi akan terbukti menjadi kesalahan jika tidak dalam waktu dekat pada tahun 2023 dan seterusnya. Analisis ini terutama menunjuk pada Federal Reserve dan kerangka kerja barunya di mana The Fed akan mentolerir inflasi yang lebih tinggi demi pemulihan penuh dan inklusif. Deutsche Bank berpendapat bahwa niat The Fed untuk tidak memperketat kebijakan sampai inflasi menunjukkan kenaikan yang berkelanjutan akan memiliki dampak yang mengerikan. Baca Juga: Terlambat Menutup Posisi, Credit Suisse dan Nomura Menanggung Rugi ""Konsekuensi dari penundaan akan menjadi gangguan yang lebih besar dari aktivitas ekonomi dan keuangan daripada yang akan terjadi ketika Fed akhirnya bertindak,"" kepala ekonom Deutsche, David Folkerts-Landau. “Pada gilirannya, ini dapat menciptakan resesi yang signifikan dan memicu rantai kesulitan keuangan di seluruh dunia, terutama di pasar negara berkembang,” sambungnya. Sebagai bagian dari pendekatannya terhadap inflasi, The Fed tidak akan menaikkan suku bunga atau membatasi program pembelian asetnya sampai The Fed melihat kemajuan lebih lanjut yang substansial menuju tujuan inklusifnya. Beberapa pejabat bank sentral mengatakan mereka tidak mendekati tujuan tersebut. Sementara itu, indikator seperti harga konsumen dan indeks harga pengeluaran konsumsi pribadi jauh di atas sasaran inflasi 2% The Fed. Pembuat kebijakan mengatakan kenaikan inflasi saat ini bersifat sementara dan akan mereda setelah gangguan pasokan dan efek dasar dari bulan-bulan awal krisis pandemi virus corona hilang. ",internasional
"Jaga stabilitas pasar keuangan domestik, ini penjelasan gubernur BI",2024-08-21T02:09:31.282Z,"Selasa, 01 Juni 2021 / 08:35 WIB",Reporter: Bidara Pink | Editor: Noverius Laoli,https:////newssetup.kontan.co.id/news/jaga-stabilitas-pasar-keuangan-domestik-ini-penjelasan-gubernur-bi-1,"KONTAN.CO.ID -   JAKARTA. Kondisi pasar keuangan global menjadi salah satu hal yang menjadi perhatian lebih Bank Indonesia (BI) untuk menjaga stabilitas pasar keuangan domestik. Gubernur BI Perry Warjiyo mengatakan, ketidakpastian di pasar keuangan global di tahun depan masih akan dibayangi oleh inflasi Amerika Serikat (AS) yang meningkat di atas ekspektasi pasar dan berlanjutnya volatilitas imbal hasil US Treasury Bond. “Tahun depan kemungkinan The Fed akan mulai mengubah kebijakan moneter, mengurangi intervensi di likuiditas, dan mulai melakukan pengetatan-pengetatan, bahkan kemungkinan akan menaikkan suku bunga,” jelas Perry dalam Rapat Kerja bersama dengan Badan Anggaran DPR RI, Senin (31/5). Perry kemudian mengatakan, bank sentral akan terus memperkuat kuda-kuda untuk mengantisipasi kemungkinan-kemungkinan tersebut. Baca Juga: BI akan turunkan bunga kartu kredit jadi maksimal 1,75%, begini respons bank Untuk itu, BI akan mengeluarkan jurus untuk memastikan stabilitas di pasar keuangan tetap terjaga yaitu dengan bauran stabilitas moneter. “Karena ini akan berpengaruh pada perkembangan yield SBN kita, maupun nilai tukar rupiah. Makanya, perlu sekali untuk mengantisipasi hal-hal tersebut,” tegasnya. Namun hingga saat ini, Perlu melihat para pelaku pasar masih memperkirakan suku bunga The Fed masih belum akan berubah hingga awal tahun 2022. Perkembangan ini berdampak pada aliran modal global yang kembali masuk ke sebagian negara berkembang dan mendorong penguatan mata uang di berbagai negara tersebut, termasuk Indonesia.  Cek Berita dan Artikel yang lain di Google News",newssetup
"Jaga stabilitas pasar keuangan, ini beberapa hal yang diwaspadai BI",2024-08-21T02:09:31.456Z,"Selasa, 01 Juni 2021 / 04:45 WIB",Reporter: Bidara Pink | Editor: Khomarul Hidayat,https:////newssetup.kontan.co.id/news/jaga-stabilitas-pasar-keuangan-ini-beberapa-hal-yang-diwaspadai-bi-1,"KONTAN.CO.ID -   JAKARTA. Kondisi pasar keuangan global menjadi salah satu hal yang menjadi perhatian lebih Bank Indonesia (BI) untuk menjaga stabilitas pasar keuangan domestik. Gubernur BI Perry Warjiyo mengatakan, ketidakpastian di pasar keuangan global di tahun depan masih akan dibayangi oleh inflasi Amerika Serikat (AS) yang meningkat di atas ekspektasi pasar dan berlanjutnya volatilitas imbal hasil US Treasury Bond. “Tahun depan kemungkinan The Fed akan mulai mengubah kebijakan moneter, mengurangi intervensi di likuiditas, dan mulai melakukan pengetatan-pengetatan, bahkan kemungkinan akan menaikkan suku bunga,” jelas Perry dalam Rapat Kerja bersama dengan Badan Anggaran DPR RI, Senin (31/5). Perry kemudian mengatakan, bank sentral akan terus memperkuat kuda-kuda untuk mengantisipasi kemungkinan-kemungkinan tersebut. Baca Juga: BI akan turunkan bunga kartu kredit jadi maksimal 1,75%, begini respons bank Untuk itu, BI akan mengeluarkan jurus untuk memastikan stabilitas di pasar keuangan tetap terjaga yaitu dengan bauran stabilitas moneter. “Karena ini akan berpengaruh pada perkembangan yield SBN kita, maupun nilai tukar rupiah. Makanya, perlu sekali untuk mengantisipasi hal-hal tersebut,” tegasnya. Namun hingga saat ini, Perlu melihat para pelaku pasar masih memperkirakan suku bunga The Fed masih belum akan berubah hingga awal tahun 2022. Perkembangan ini berdampak pada aliran modal global yang kembali masuk ke sebagian negara berkembang dan mendorong penguatan mata uang di berbagai negara tersebut, termasuk Indonesia.  Cek Berita dan Artikel yang lain di Google News",newssetup
Gubernur BI ungkap hal yang perlu diwaspadai untuk jaga stabilitas pasar keuangan,2024-08-21T02:09:31.656Z,"Senin, 31 Mei 2021 / 15:40 WIB",Reporter: Bidara Pink | Editor: Noverius Laoli,https:////nasional.kontan.co.id/news/gubernur-bi-ungkap-hal-yang-perlu-diwaspadai-untuk-jaga-stabilitas-pasar-keuangan,"KONTAN.CO.ID -  JAKARTA. Kondisi pasar keuangan global menjadi salah satu hal yang menjadi perhatian lebih Bank Indonesia (BI) untuk menjaga stabilitas pasar keuangan domestik. Gubernur BI Perry Warjiyo mengatakan, ketidakpastian di pasar keuangan global di tahun depan masih akan dibayangi oleh inflasi Amerika Serikat (AS) yang meningkat di atas ekspektasi pasar dan berlanjutnya volatilitas imbal hasil US Treasury Bond. “Tahun depan kemungkinan The Fed akan mulai mengubah kebijakan moneter, mengurangi intervensi di likuiditas, dan mulai melakukan pengetatan-pengetatan, bahkan kemungkinan akan menaikkan suku bunga,” jelas Perry dalam Rapat Kerja bersama dengan Badan Anggaran DPR RI, Senin (31/5). Perry kemudian mengatakan, bank sentral akan terus memperkuat kuda-kuda untuk mengantisipasi kemungkinan-kemungkinan tersebut. Baca Juga: BI akan turunkan bunga kartu kredit jadi maksimal 1,75%, begini respons bank Untuk itu, BI akan mengeluarkan jurus untuk memastikan stabilitas di pasar keuangan tetap terjaga yaitu dengan bauran stabilitas moneter. “Karena ini akan berpengaruh pada perkembangan yield SBN kita, maupun nilai tukar rupiah. Makanya, perlu sekali untuk mengantisipasi hal-hal tersebut,” tegasnya. Namun hingga saat ini, Perlu melihat para pelaku pasar masih memperkirakan suku bunga The Fed masih belum akan berubah hingga awal tahun 2022. Perkembangan ini berdampak pada aliran modal global yang kembali masuk ke sebagian negara berkembang dan mendorong penguatan mata uang di berbagai negara tersebut, termasuk Indonesia.  Cek Berita dan Artikel yang lain di Google News",nasional
"Dana asing sebesar Rp 5,1 triliun masuk ke pasar keuangan domestik akhir pekan ini",2024-08-21T02:09:31.898Z,"Senin, 03 Mei 2021 / 06:20 WIB",Reporter: Bidara Pink | Editor: Noverius Laoli,https:////newssetup.kontan.co.id/news/dana-asing-sebesar-rp-51-triliun-masuk-ke-pasar-keuangan-domestik-akhir-pekan-ini,"KONTAN.CO.ID -  JAKARTA. Hingga pekan kelima April 2021, Bank Indoensia (BI) melihat adanya arus modal asing yang masuk ke pasar keuangan domestik. Berdasarkan data transaksi BI periode 26 - 29 April 2021, nonresiden di pasar keuangan domestik beli neto Rp 5,10 triliun. “Terdiri dari beli neto di pasar SBN sebesar Rp 5,86 triliun meski di pasar saham tercatat jual neto Rp 0,76 triliun,” ujar Direktur Eksekutif, Kepala Departemen Komunikasi BI Erwin Haryono dalam keterangannya, Jumat (30/4). Seiring dengan masuknya arus modal asing, premi risiko investasi atau premi credit default swap (CDS) Indonesia 5 tahun turun ke 76,00 bps per 29 April 2021, dari 77,39 bps per 23 April 2021. Dengan demikian, berdasarkan data setelmen selama 2021 (ytd), nonresiden tercatat masih jual neto Rp 2,85 triliun.  Cek Berita dan Artikel yang lain di Google News",newssetup
Chatib Basri ingatkan pasar keuangan Indonesia antisipasi dampak pemulihan ekonomi AS,2024-08-21T02:09:32.298Z,"Senin, 19 April 2021 / 18:08 WIB",Reporter: Bidara Pink | Editor: Noverius Laoli,https:////nasional.kontan.co.id/news/chatib-basri-ingatkan-pasar-keuangan-indonesia-antisipasi-dampak-pemulihan-ekonomi-as,"KONTAN.CO.ID -  JAKARTA. Menteri Keuangan periode 2013 hingga 2014 Chatib Basri kembali mengingatkan pasar keuangan Indonesia untuk siaga dalam mengantisipasi pemulihan ekonomi Amerika Serikat (AS). “Dengan kecepatan ketersediaan vaksin di AS yang seperti ini, pemulihan ekonomi bisa lebih cepat. Pasar keuangan Indoensia harus siap-siap antisipasi,” cuitnya dalam akun Twitter pribadi, @ChatibBasri.   Dengan speed vaccine roll out di US yg spt ini, pemulihan ekonomi bisa lebih cepat. Role fiscal stimulus sbg disaster relief bisa tdk pas, krn ekonomi mulai pulih. Output gap mengecil, resiko inflasi naik. Pasar keuangan di Indonesia hrs siap2 antisipasi https://t.co/PO26b6XajO— M. Chatib Basri (@ChatibBasri) April 18, 2021  Chatib mengatakan, mulai pulihnya ekonomi negeri Paman Sam terlihat dari kesenjangan pengeluaran yang sudah mengecil dan ada risiko peningkatan inflasi. Sehingga, dengan kondisi tersebut, peran stimulus fiskal sebagai penolong sudah tidak pas. Kemudian, mengutip dari The Economist, pemulihan ekonomi di AS terpantau dari pergerakan Indeks Harga Konsumen (IHK) pada bulan Maret 2021 yang lebih tinggi 2,6% yoy dari periode pandemi 2020. Baca Juga: Infovesta Utama prediksi sepekan ini pasar saham dan SBN masih akan fluktuatif Tak hanya itu, peningkatan inflasi ini bahkan merupakan yang tertinggi sejak 2009, atau sejak pemulihan ekonomi dari krisis finansial global. Diprediksi, inflasi AS bisa mencapai 3,5% pada bulan Mei 2021. Bahkan, inflasi diyakini mampu melebihi target sasaran Bank Sentral AS The Federal Reserve (The Fed) yang dipatok 2%. Sayangnya, peningkatan inflasi ini tak melulu pertanda baik. Ada kekhawatiran masalah inflasi yang meroket bisa mengganggu ketika pemulihan ekonomi benar terjadi. Ini bisa menyebabkan adanya tekanan harga yang berkelanjutan. Dengan adanya peningkatan inflasi lebih cepat dari perkiraan ini, bank sentral AS dituntut untuk segera memberikan respons, untuk menurunkan ketidakpastian.  Cek Berita dan Artikel yang lain di Google News",nasional
Chatib Basri: Pasar keuangan Indonesia harus siaga hadapi pemulihan ekonomi AS,2024-08-21T02:09:32.539Z,"Senin, 19 April 2021 / 11:57 WIB",Reporter: Bidara Pink | Editor: Anna Suci Perwitasari,https:////nasional.kontan.co.id/news/chatib-basri-pasar-keuangan-indonesia-harus-siaga-hadapi-pemulihan-ekonomi-as,"KONTAN.CO.ID - JAKARTA. Menteri Keuangan periode 2013 hingga 2014, Chatib Basri, kembali mengingatkan pasar keuangan Indonesia untuk siaga dalam mengantisipasi pemulihan ekonomi Amerika Serikat (AS). “Dengan kecepatan ketersediaan vaksin di AS yang seperti ini, pemulihan ekonomi bisa lebih cepat. Pasar keuangan Indonesia harus siap-siap antisipasi,” cuitnya dalam akun Twitter pribadi, @ChatibBasri.  Dengan speed vaccine roll out di US yg spt ini, pemulihan ekonomi bisa lebih cepat. Role fiscal stimulus sbg disaster relief bisa tdk pas, krn ekonomi mulai pulih. Output gap mengecil, resiko inflasi naik. Pasar keuangan di Indonesia hrs siap2 antisipasi https://t.co/PO26b6XajO — M. Chatib Basri (@ChatibBasri) April 18, 2021  Chatib mengatakan, mulai pulihnya ekonomi Negeri Paman Sam terlihat dari kesenjangan pengeluaran yang sudah mengecil dan ada risiko peningkatan inflasi. Sehingga, dengan kondisi tersebut, peran stimulus fiskal sebagai penolong sudah tidak pas. Kemudian, mengutip dari The Economist, pemulihan ekonomi di AS terpantau dari pergerakan Indeks Harga Konsumen (IHK) pada bulan Maret 2021 yang lebih tinggi 2,6% yoy dari periode pandemi 2020. Tak hanya itu, peningkatan inflasi ini bahkan merupakan yang tertinggi sejak tahun 2009, atau sejak pemulihan ekonomi dari krisis finansial global. Diprediksi, inflasi AS bisa mencapai 3,5% pada bulan Mei 2021. Bahkan, inflasi diyakini mampu melebihi target sasaran Federal Reserve (The Fed) yang dipatok 2%. Baca Juga: Dampak stimulus pemulihan Covid-19 terhadap perubahan iklim dinilai masih minim Sayangnya, peningkatan inflasi ini tak melulu pertanda baik. Ada kekhawatiran masalah inflasi yang meroket bisa mengganggu ketika pemulihan ekonomi benar terjadi. Ini bisa menyebabkan adanya tekanan harga yang berkelanjutan. Dengan adanya peningkatan inflasi lebih cepat dari perkiraan ini, bank sentral AS dituntut untuk segera memberikan respons, untuk menurunkan ketidakpastian.  Cek Berita dan Artikel yang lain di Google News",nasional
