Title,Scrapping Date,Article Date,Author,Link,Content,Category
Pemerintah telah memberikan relaksasi penyaluran pinjaman melalui PT SMI,2024-08-20T04:20:13.884Z,"Selasa, 01 Desember 2020 / 21:39 WIB",Reporter:  Venny Suryanto | Editor: Handoyo .,https:////nasional.kontan.co.id/news/pemerintah-telah-memberikan-relaksasi-penyaluran-pinjaman-melalui-pt-smi,"KONTAN.CO.ID - JAKARTA. Kementerian Keuangan (Kemenkeu) menyebutkan pemerintah telah memberikan relaksasi penyaluran pinjaman melalui PT Sarana Multi Infrastruktur Persero (PT SMI) kepada pemerintah daerah dalam rangka Pemulihan Ekonomi Daerah (PEN). Direktur Jenderal Perimbangan Keuangan Kemenkeu Astera Primanto Bhakti mengatakan dampak pandemi Covid-19 terhadap total pendapatan daerah mencapai 16% PDB. Sementara itu, beban untuk penambahan belanja di daerah-daerah yang terdampak justru meningkat signifikan. Sehingga ini menjadi salah satu pendorong untuk memberikan pinjaman dalam rangka PEN melalui PT SMI bagi daerah yang terdampak. “Tak hanya pinjaman PEN melalui PT SMI saja, Dana Insentif Daerah juga kita tambah Rp 5 triliun kemudian, DAK Fisik yang kita buka kembali dengan besar Rp 8,7 triliun dan hibah pariwisata yang besarnya Rp 3,7 triliun. Ini langkah-langkah pemerintah pusat untuk mendukung pemda,” jelas Prima dalam diskusi via daring, Selasa (1/12). Baca Juga: Pemerintah akan tawarkan PSN di tahun depan, ini respons pengusaha Dirjen Kekayaan Negara, Kementerian Keuangan Isa Rachmatarwata juga mengatakan pinjaman PEN daerah melalui PT SMI telah dialokasikan sebesar Rp 15 triliun. Rinciannya, Rp 10 triliun berasal dari Kementerian Keuangan dan Rp 5 triliun berasal dari PT SMI. Isa mengatakan, sebagai penyalur pinjaman PEN daerah ke pemda, PT SMI juga turut mengikuti prosedur yang telah ditetapkan oleh pemerintah. “Pemerintah telah kerahkan PT SMI untuk memiliki tata kelola yang baik dalam proses penyaluran pinjaman PEN daerah. Dengan demikian kita bisa mengurangi timbulnya penyimpangan dan penyalahgunaan dana tersebut,” tutup Isa.  Cek Berita dan Artikel yang lain di Google News",nasional
"Ubah tenor dan bunga, pemerintah revisi aturan pinjaman PEN bagi pemda",2024-08-20T04:20:14.183Z,"Kamis, 19 November 2020 / 19:30 WIB",Reporter:  Venny Suryanto | Editor: Khomarul Hidayat,https:////nasional.kontan.co.id/news/ubah-tenor-dan-bunga-pemerintah-revisi-aturan-pinjaman-pen-bagi-pemda,"KONTAN.CO.ID - JAKARTA. Kementerian Keuangan telah merevisi Peraturan Menteri Keuangan No. 105/2020 tentang pemberian pinjaman kepada pemerintah daerah (pemda) dalam program pemulihan ekonomi nasional (PEN). Revisi dilakukan melalui PMK No. 179/2020. PMK No. 179/2020 sudah diundangkan pada 12 November 2020 lalu. Dalam perubahan beleid tersebut, peraturan ini mengalami beberapa perubahan yang tercantum pada pasal-pasalnya. Perubahan ini dilakukan untuk mengoptimalkan penggunaan dana pengelolaan pinjaman PEN untuk pemda Beberapa perubahan dari PMK 105/2020 meliputi beberapa hal yakni ketentuan jangka waktu pinjaman, tingkat suku bunga pinjaman, program yang dapat diberikan pinjaman hingga biaya pengelolaan pinjaman per tahun. Baca Juga: Per 12 November 2020, realisasi anggaran PEN sudah mencapai 55,1% Dalam pasal 2 PMK 179/2020, pemerintah mengubah ketentuan jangka waktu pinjaman yang sebelumnya diatur paling lambat 10 tahun sekarang diperpendek menjadi paling lama 8 tahun. Adapun tingkat suku bunga yang sebelumnya ditetapkan 0% per tahun, kini ditetapkan sebesar 0% hanya untuk dana pinjaman yang bersumber dari APBN 2020. Sedangkan untuk dana pinjaman yang bersumber dari APBN Tahun Anggaran 2021 dan tahun-tahun berikutnya, tingkat suku bunga ditetapkan dengan Keputusan Menteri Keuangan. Berdasarkan beleid tersebut, nantinya kepala daerah dapat mengajukan surat permohonan pinjaman PEN daerah kepada Menteri Keuangan melalui Direktur Jenderal Perimbangan Keuangan (DJPK) dengan tembusan kepada Menteri Dalam Negeri dan Direktur Utama PT SMI.  Cek Berita dan Artikel yang lain di Google News",nasional
"Terdampak pandemi, Air New Zealand tarik US$ 72,20 dari fasilitas pinjaman pemerintah",2024-08-20T04:20:14.789Z,"Selasa, 29 September 2020 / 07:40 WIB",Sumber: Reuters | Editor: Anna Suci Perwitasari,https:////internasional.kontan.co.id/news/terdampak-pandemi-air-new-zealand-tarik-us-7220-dari-fasilitas-pinjaman-pemerintah,"KONTAN.CO.ID - SYDNEY. Pandemi virus corona benar-benar memukul industri maskapai global. Sejumlah maskapai global pun kini bergantung pada pinjaman yang diberikan pemerintahnya masing-masing. Terbaru, Air New Zealand Ltd yang akhirnya menarik NZ $ 110 juta setara US$ 72,20 juta dari fasilitas pinjaman yang diberikan pemerintah Selandia Baru sebesar NZ $ 900 juta. Dalam keterangan yang diberikan Selasa (29/9), dana tersebut akan digunakan untuk menopang likuiditas guna membantu mengatasi dampak pandemi virus corona. Maskapai tersebut menegaskan kembali bahwa mereka memperkirakan akan melaporkan kerugian tahunan kedua berturut-turut dalam laporan keuangan yang berakhir pada 30 Juni 2021. Selain itu, maskapai penerbangan ini tidak dapat memberikan panduan pendapatan untuk kinerja di tahun depan. ""Dengan prospek permintaan penumpang di masa depan yang jelas tidak pasti, dan sangat bergantung pada penghapusan pembatasan perjalanan baik di sini di Selandia Baru maupun secara global, kami tahu bahwa Air New Zealand akan terus menjadi bisnis yang lebih kecil untuk beberapa waktu mendatang,"" kata Chairman Therese Walsh pada pertemuan tahunan maskapai di Auckland. Baca Juga: Wall Street melesat di atas 1,5% ditopang reli saham sektor keuangan dan energi Sementara itu, Chief Executive Greg Foran mengatakan, rencana strategis maskapai termasuk menyegarkan program loyalitas dan meningkatkan teknologi dan alat digitalnya. Saat ini, Air New Zealand mengatakan memiliki sekitar NZ $ 1 miliar likuiditas, terdiri dari NZ $ 215 juta kas di tangan dan NZ $ 790 juta yang tersisa dari fasilitas pinjaman pemerintah. Maskapai tersebut memperkirakan akan menghabiskan NZ $ 65 juta hingga NZ $ 85 juta uang tunai sebulan dalam kondisi saat ini. Maskapai penerbangan tersebut pekan lalu mengatakan telah mulai menarik utang pemerintah, yang akan memberinya waktu untuk meninjau struktur modalnya dan menyelesaikan peningkatan modal pada Juni 2021. Sebelumnya, Air New Zealand mengatakan akan memangkas hingga 385 pekerjaan awak kabin karena kurangnya penerbangan internasional jarak jauh, yang akan membuat kehilangan pekerjaan terkait Covid-19 menjadi sekitar 37% dari angkatan kerjanya. Proporsi yang lebih tinggi daripada saingan Qantas Airways Ltd dan Singapore Airlines Ltd. ",internasional
"Pemerintah rencanakan penarikan pinjaman tunai US$ 1,5 miliar pada 2021",2024-08-20T04:20:15.250Z,"Senin, 17 Agustus 2020 / 13:26 WIB",Reporter:  Venny Suryanto | Editor: Khomarul Hidayat,https:////nasional.kontan.co.id/news/pemerintah-rencanakan-penarikan-pinjaman-tunai-us-15-miliar-pada-2021,"KONTAN.CO.ID - JAKARTA. Pemerintah merencanakan penarikan pinjaman tunai dalam mata uang asing pada tahun 2021 sebesar US$ 1,5 miliar atau  setara Rp 21,9 triliun. Penarikan pinjaman di tahun 2021 tersebut direncanakan berupa pinjaman program dengan basis kebijakan yang disepakati antara pemerintah dengan pemberi pinjaman. “Pengadaan pinjaman tunai juga mempertimbangkan kapasitas pemberi pinjaman dari mitra pembangunan multilateral dan bilateral dengan melihat beban biaya dan risiko yang timbul, ketersediaan kebijakan yang menjadi basis pinjaman, dan mata uang yang dibutuhkan dalam rangka pengelolaan kas negara,” demikian dikutip dalam Nota Keuangan dan Rancangan Anggaran Pendapatan dan Belanja Negara (RAPBN) 2021, Senin (17/8). Baca Juga: Defisit anggaran 2021 sebesar 5,5% PDB, bagaimana strategi pembiayaannya? Dengan skema fleksibilitas pembiayaan, pemerintah telah memanfaatkan sumber pembiayaan pinjaman program dengan bunga relatif rendah yang berasal dari lembaga bilateral dan multilateral antara lain Bank Dunia (World Bank), ADB, AFD (Perancis), KfW (Jerman), JICA (Jepang), EDCF (Korea Selatan) dan AIIB. Pinjaman  program yang akan digunakan di tahun 2020  berkisar US$ 7 miliar - US$ 8 miliar. Angka ini meningkat dari target semula dalam APBN 2020 yang sebesar US$ 1,5 miliar. Baca Juga: Masih dalam proses pemulihan, target pertumbuhan penerimaan pajak 2021 hanya 5,8% Cek Berita dan Artikel yang lain di Google News",nasional
"Pemerintah siapkan dua skema baru pemberian pinjaman untuk BUMN, apa saja?",2024-08-20T04:20:15.633Z,"Minggu, 09 Agustus 2020 / 20:21 WIB",Reporter:  Venny Suryanto | Editor: Khomarul Hidayat,https:////nasional.kontan.co.id/news/pemerintah-siapkan-dua-skema-baru-pemberian-pinjaman-untuk-bumn-apa-saja,"KONTAN.CO.ID - JAKARTA. Pemerintah telah merevisi Peraturan Pemerintah (PP) No 23/2020 menjadi PP No 23/2020 tentang Pelaksanaan Program Pemulihan Ekonomi Nasional Dalam Rangka Mendukung Kebijakan Keuangan Negara untuk Penanganan Pandemi Covid-19. Dalam pasal 15 PP 43/2020, pemerintah dapat melakukan investasi dalam rangka pelaksanaan program PEN yang dapat berupa investasi langsung dalam bentuk pemberian pinjaman kepada BUMN, pemberian pinjaman kepada lembaga dan pinjaman PEN daerah. Adapun yang dimaksud pada pemberian pinjaman adalah untuk memberikan dukungan kepada BUMN dan lembaga guna memperkuat dan menumbuhkan kemampuan ekonomi BUMN dan lembaga yang bersangkutan. Dalam aturan tersebut, rupanya pemerintah telah menyiapkan skema baru pemberian pinjaman untuk BUMN. Yustinus Prastowo, Staf Khusus Menteri Keuangan menjelaskan, dalam PP 43/2020 itu nantinya bentuk pinjaman yang diberikan bermacam-macam. Misalnya melalui special mission vehicle (SMV) pemerintah dan mandatory exchangeable bond (MEB) atau penerbitan convertible bond. Baca Juga: Kabar baik bagi wajib pajak badan, diskon tarif PPh 25 ditambah menjadi 50% “Skema pinjamannya bermacam-macam, bisa dilakukan melalui SMV pemerintah dan dengan penerbitan convertible bond,” ujar Yustinus saat dihubungi KONTAN, Minggu (9/8). Ia menjelaskan, skema SMV merupakan salah satu sinergi di sektor penjaminan yang dilakukan untuk membantu pemerintah dalam melaksanakan program pemulihan ekonomi nasional (PEN). Sedangkan MEB sendiri merupakan jenis obligasi yang biasanya disebut juga sebagai obligasi hibrida, karena sewaktu-waktu dapat dikonversikan menjadi saham biasa (common stock) dari perusahaan penerbit obligasi. Sebagai informasi lebih lanjut, pemerintah telah mennyiapkan program PEN guna merespon dampak pelemahan ekonomi yang berlanjut akibat Covid-19. Salah satunya juga untuk pembiayaan korporasi dengan anggaran Rp 53,57 triliun dari total Rp 695,20 triliun untuk PEN. Anggaran APBN untuk pembiayaan korporasi juga telah memiliki porsi masing-masing. Di antaranya yang pertama adalah penempatan dana untuk restrukturisasi padat karya sebesar Rp 3,42 triliun. Lalu untuk penyertaan modal negara (PMN) dengan total Rp 20,50 triliun yang terbagi sebagai berikut PT Hutama Karya Rp 7,5 triliun, PT Bahana Pembinaan Usaha Indonesia (BPUI) Rp 6 triliun, PT Permodalan Nasional Madani (PNM) Rp 1,5 triliun, Indonesia Tourism Development Corporation (ITDC) Rp 0,5 triliun dan PT Perusahaan Pengelolaan Aset (PPA) Rp 5 triliun. Kemudian talangan investasi untuk modal kerja sebesar Rp 29,65 triliun. Baca Juga: Pemerintah kucurkan Rp 27 triliun dari APBN dukungan program PEN daerah 2020 Cek Berita dan Artikel yang lain di Google News",nasional
"Ada dugaan fraud, pinjaman Pemerintah AS ke Kodak US$ 765 juta ditunda",2024-08-20T04:20:15.845Z,"Minggu, 09 Agustus 2020 / 19:38 WIB",Reporter: Anggar Septiadi | Editor: Khomarul Hidayat,https:////internasional.kontan.co.id/news/ada-dugaan-fraud-pinjaman-pemerintah-as-ke-kodak-us-765-juta-ditunda,"KONTAN.CO.ID - NEW YORK. Perjanjian pinjaman Pemerintah Amerika Serikat (AS) kepada Eastman Kodak Co senilai US$ 765 juta untuk memproduksi bahan obat ditangguhkan. US International Development Finance Corp (DFC) menduga Kodak melakukan fraud di bursa saham. Saham Kodak pekan lalu meningkat hingga 1.000% setelah terbitnya pengumuman pinjaman dari pemerintah AS. Beberapa petinggi Kodak tercatat telah menerima opsi sehari sebelumnya. Awal pekan ini, otoritas hukum meminta pemerintah federal untuk menyelidiki transaksi saham Kodak terutama yang dilakukan oleh para petingginya menjelang pengumuman pinjaman. Baca Juga: Trump larang WeChat, kapitalisasi pasar Tencent merosot US$ 46 miliar “Dugaan yang muncul merupakan hal yang serius. Kami tidak akan memproses pencairan pinjaman hingga dugaan ini jelas,” kata DFC seperti dikutip Reuters, Minggu (9/8) Kamis lalu, Presiden Donald Trump mengatakan pihaknya memastikan bakal menggelar investigasi terkait pengumuman pinjaman kepada Kodak. Sementara otoritas hukum menduga adanya insider trading dalam transaksi tersebut. Dalam pernyataan resminya Kodak menyatakan telah membentuk komite independen untuk melkukan audit secara internal. “Audit internal akan dilakukan oleh komite yang dipimpin oleh Ain Strauss hauer & Feld LLP,” tulis Kodak. Baca Juga: Microsoft bakal beli layanan TikTok di AS, Australia, Kanada dan Selandia Baru",internasional
"Pemerintah tarik pinjaman, cadev Indonesia sentuh rekor tertinggi sepanjang sejarah",2024-08-20T04:20:16.022Z,"Sabtu, 08 Agustus 2020 / 16:10 WIB",Reporter: Bidara Pink | Editor: Tendi Mahadi,https:////nasional.kontan.co.id/news/pemerintah-tarik-pinjaman-cadev-indonesia-sentuh-rekor-tertinggi-sepanjang-sejarah-1,"KONTAN.CO.ID - JAKARTA. Cadangan devisa (cadev) Indonesia pada Juli 2020 menembus rekor tertingginya. Bank Indonesia (BI) mencatat, cadev pada akhir Juli 2020 ada di posisi US$ 135,1 miliar atau melampaui rekor tertinggi cadev pada Januari 2018 yang sebesar US$ 131,98 miliar. Menurut Direktur Eksekutif, Kepala Departemen Komunikasi BI Onny Widjanarko, cadev ini juga meningkat dari posisi US$ 131,7 miliar pada akhri Juni 2020 lalu dan dipengaruhi oleh beberapa faktor. Baca Juga: Jelang pengumuman cadangan devisa, IHSG diproyeksikan menguat pada Jumat (7/8) ""Ini didorong oleh penerbitan global bond dan penarikan pinjaman pemerintah,"" tutur Onny dalam keterangan resmi yang diterima Kontan.co.id, Jumat (7/8). Posisi cadev pada akhir bulan lalu setara dengan pembiayaan 9,0 bulan impor atau 8,6 bulan impor dan pembayaran utang luar negeri pemerintah. Ini juga jauh di atas standard kecukupan internasional yang sebesar 3 bulan impor. BI memandang kalau cadev ini memadai, dan mampu mendukung ketahanan sektor eksternal serta menjaga stabilitas makroekonomi dan sistem keuangan. Baca Juga: BI: Defisit transaksi berjalan kuartal II-2020 akan lebih rendah dari 1,5% PDB Ini juga didorong oleh stabilitas dan prospek ekonomi yang terjaga, seiring dengan berbagai respons kebijakan dalam mendorong perekonomian. Cek Berita dan Artikel yang lain di Google News",nasional
