Title,Scrapping Date,Article Date,Author,Link,Content,Category
"Pemerintah Tawarkan Sukuk Wakaf Ritel SWR005 dengan Tingkat Imbalan 6,50%",2024-08-20T04:20:37.062Z,"Minggu, 11 Agustus 2024 / 19:50 WIB",Reporter: Akmalal Hamdhi | Editor: Anna Suci Perwitasari,https:////investasi.kontan.co.id/news/pemerintah-tawarkan-sukuk-wakaf-ritel-swr005-dengan-tingkat-imbalan-650,"KONTAN.CO.ID – JAKARTA Pemerintah resmi membuka masa penawaran Sukuk Wakaf Ritel seri SWR005 kepada wakif individu dan institusi. Bagi masyarakat yang tertarik bisa memulai pemesanan dengan minimum Rp 1 juta dan tanpa maksimum pemesanan. Pemerintah melalui Direktorat Jenderal Pengelolaan Pembiayaan dan Risiko (DJPPR) Kementerian Keuangan mengungkapkan, masa penawaran SWR005 akan berlangsung selama dua bulan, yakni hingga 9 Oktober 2024. Sementara tanggal setelmen atau penerbitannya 16 Oktober 2024. SWR005 memiliki tenor 2 tahun yang akan jatuh tempo 10 Oktober 2026. Penerbitan SWR005 ini menggunakan akad wakalah. Tanpa warkat dan tidak dapat diperdagangkan (non tradable) di pasar sekunder. “Penerbitan Sukuk Wakaf Ritel seri SWR005 merupakan salah satu bentuk komitmen Pemerintah untuk mendukung Gerakan Nasional Wakaf Uang, membantu pengembangan investasi sosial dan pengembangan wakaf produktif di Indonesia,” kata DJPPR dalam keterangannya pada Jumat (9/8). Baca Juga: Dari Potensi Rp 180 Triliun, Wakaf Uang Baru Terkumpul Rp 2,23 Triliun DJPPR menyebutkan, penerbitan SWR005 dikelola berdasarkan prinsip syariah, serta telah mendapatkan pernyataan kesesuaian syariah dari Dewan Syariah Nasional Majelis Ulama Indonesia (DSN-MUI). Melalui Sukuk Wakaf Ritel seri SWR005, Pemerintah bertujuan untuk memfasilitasi para pewakaf uang baik yang bersifat temporer maupun permanen untuk dapat menempatkan dana wakafnya pada instrument yang aman dan produktif. Adapun besaran kupon atau tingkat imbalan SWR005 yakni 6,50% floating with floor yang akan disalurkan untuk program sosial bagi masyarakat. Pembayaran imbalan setiap tanggal 10 setiap bulannya dengan pembayaran pertama pada 10 Desember 2024 (long coupon). Penyaluran imbalan akan dilakukan oleh Nazhir yang ditunjuk oleh Lembaga Keuangan Syariah-Penerima Wakaf Uang (LKSPWU) dan disetujui oleh Badan Wakaf Indonesia (BWI) sebagai regulator dan pengawas Nazhir. Selanjutnya, Nazhir wajib membuat laporan kepada BWI, Kementerian Agama, Kementerian Keuangan, dan wakif (pembeli CWLS) sebagai bentuk transparansi dan akuntabilitas pengelolaan dan penyaluran dana imbalan CWLS. Cara Membeli SWR005 Bagi investor yang berminat melakukan pemesanan pembelian SWR005 secara online dapat melalui 4 (empat) tahap, yaitu (i) registrasi melalui sistem elektronik Midis, (ii) pemesanan melalui sistem elektronik Midis, (iii) pembayaran melalui bank persepsi dengan berbagai saluran pembayaran, (iv) menerima bukti konfirmasi kepemilikan CWLS Ritel. Sementara proses pemesanan pembelian Sukuk Wakaf Ritel seri SWR005 secara offline dapat dilakukan melalui 4 (empat) tahap, yaitu (i) datang langsung ke kantor Midis, (ii) mengisi formular akta ikrar wakaf dan pemesanan, (iii) menyetorkan dana, dan (iv) wakif mendapatkan sertifikat wakaf uang. Adapun untuk pemesanan pembelian SWR005, calon wakif dapat menghubungi 6 (enam) Mitra Distribusi yang telah ditunjuk oleh Pemerintah, yaitu:      Cek Berita dan Artikel yang lain di Google News",investasi
Deposito Lewat Wakaf? Begini Penjelasan OJK,2024-08-20T04:20:37.493Z,"Jumat, 26 Juli 2024 / 13:46 WIB",Reporter: Handoyo | Editor: Handoyo .,https:////nasional.kontan.co.id/news/deposito-lewat-wakaf-begini-penjelasan-ojk,"KONTAN.CO.ID - JAKARTA. Cash Wakaf Linked Deposit (CWLD) merupakan salah satu produk keuangan syariah yang dirancang untuk mengoptimalkan pemanfaatan dana wakaf tunai melalui deposito. CWLD tidak hanya berfungsi sebagai alat investasi, tetapi juga sebagai sarana pemberdayaan masyarakat melalui program sosial yang didanai dari hasil pengelolaan wakaf. Gunawan Setyo Utomo, Analis Eksekutif Direktorat Penyaluran dan Pengembangan Perbankan Syariah Otoritas Jasa Keuangan (OJK), menjelaskan skema pengelolaan dan penyaluran CWLD. Menurutnya, CWLD termasuk dalam kategori wakaf temporer, yang diperbolehkan dan diatur dalam Undang-Undang Nomor 41 Tahun 2004 tentang Wakaf pada Pasal 1 Ayat 1. Baca Juga: Merinding! Berikutb Tawaran Suku Bunga Deposito Bank Raya Terkini ""Undang-Undang Nomor 41 Tahun 2004 tentang Wakaf di Pasal 1 Ayat 1 menyebutkan bahwa wakaf adalah perbuatan hukum wakif untuk memisahkan dan atau menyerahkan sebagian harta benda miliknya untuk dimanfaatkan selamanya, atau untuk jangka waktu tertentu,"" papar Setyo dalam program Ekspose ZaWa (Zakat Wakaf) di kanal YouTube Literasi Zakat Wakaf, Kamis (18/7/2024). Setyo menjelaskan bahwa wakaf uang temporer adalah penyerahan wakaf uang yang dimanfaatkan dalam jangka waktu tertentu. Ia melanjutkan bahwa syarat minimal penyerahan wakaf uang adalah deposito satu tahun dengan jumlah minimal satu juta rupiah. Nazir wajib menyerahkannya ke Lembaga Keuangan Syariah Penerima Wakaf Uang (LKSPWU) sesuai Pasal 48 PP 42 Tahun 2006 tentang pelaksanaan UU Wakaf. Dalam pengelolaan wakaf uang, LKSPWU akan mengelola deposito terlebih dahulu dan hasilnya diberikan kepada mauquf alaih. LKSPWU harus mengetahui jumlah bagi hasil yang kemudian baru bisa disalurkan. ""Syarat dari wakaf uang adalah nominal wakaf tidak boleh berkurang, sehingga nazir perlu menempatkan wakaf ke LKSPWU terlebih dahulu. Bagi hasil yang diperoleh dari penempatan nazir ke LKSPWU nantinya dapat disalurkan ke mauquf alaih,"" jelas Setyo. Baca Juga: Suku Bunga Deposito KB Bank Bikin Sumringah Setyo menegaskan bahwa LKSPWU sebagai pengelola CWLD bertanggung jawab penuh atas pengelolaan dana wakaf. LKSPWU harus memastikan dana tersebut ditempatkan dengan aman, sesuai dengan prinsip syariah, dan diawasi oleh OJK. Terpisah, Kasubdit Inovasi, Edukasi, dan Kerja Sama Zakat dan Wakaf, Muhibudin, menjelaskan bahwa CWLD merupakan inovasi pengelolaan wakaf yang mengintegrasikan prinsip-prinsip syariah dengan mekanisme keuangan modern. Karena prinsip syariah telah terjamin melalui sistem bagi hasil, CWLD dapat dilakukan untuk memperoleh keuntungan dan menyejahterakan masyarakat. ""CWLD memungkinkan dana wakaf yang terkumpul untuk diinvestasikan dalam instrumen keuangan yang sesuai dengan prinsip syariah, sehingga menghasilkan keuntungan yang dapat digunakan untuk tujuan sosial dan kemanusiaan,"" jelas Muhibudin kepada wartawan, Selasa (23/7/2024). Cek Berita dan Artikel yang lain di Google News",nasional
Apa Itu Deposito Lewat Wakaf? Ini Penjelasan OJK,2024-08-20T04:20:37.808Z,"Jumat, 26 Juli 2024 / 04:57 WIB",Reporter: Barratut Taqiyyah Rafie | Editor: Barratut Taqiyyah Rafie,https:////keuangan.kontan.co.id/news/apa-itu-deposito-lewat-wakaf-ini-penjelasan-ojk,"KONTAN.CO.ID - JAKARTA. Istilah Cash Wakaf Linked Deposit (CWLD) masih terdengar awam di telinga masyarakat. Apa itu Cash Wakaf Linked Deposit (CWLD)? Informasi saja, Cash Wakaf Linked Deposit (CWLD)  merupakan salah satu produk keuangan syariah yang dirancang untuk mengoptimalkan pemanfaatan dana wakaf tunai melalui deposito. Mengutip laman Kemenag.go.id, Cash Wakaf Linked Deposit (CWLD) tidak hanya berfungsi sebagai alat investasi, tetapi juga cara untuk memberdayakan masyarakat melalui program sosial yang didanai dari hasil pengelolaan wakaf. Analis Eksekutif Direktorat Penyaluran dan Pengembangan Perbankan Syariah OJK, Gunawan Setyo Utomo, menjelaskan skema pengelolaan dan penyaluran Cash Wakaf Linked Deposit (CWLD). Menurutnya, Cash Wakaf Linked Deposit (CWLD) termasuk dalam kategori wakaf temporer, yang diperbolehkan dan diatur dalam Undang-Undang Nomor 41 Tahun 2004 tentang Wakaf pada Pasal 1 Ayat 1. “Undang-Undang Nomor 41 Tahun 2004 tentang Wakaf di Pasal 1 Ayat 1, definisi wakaf adalah perbuatan hukum wakif untuk memisahkan dan atau menyerahkan sebagian harta benda miliknya untuk dimanfaatkan selamanya, atau untuk jangka waktu tertentu,” papar Setyo dalam program Ekspose ZaWa (Zakat Wakaf) di kanal YouTube Literasi Zakat Wakaf, Kamis (18/7/2024). Baca Juga: Apa Itu Golden Visa yang Baru Saja Diluncurkan Jokowi? Setyo menjelaskan, wakaf uang temporer adalah penyerahan wakaf uang yang dimanfaatkan dalam jangka waktu tertentu. Ia melanjutkan, syarat minimal penyerahan wakaf uang adalah deposito satu tahun dengan jumlah minimal satu juta rupiah. Nazir wajib menyerahkannya ke Lembaga Keuangan Syariah Penerima Wakaf Uang (LKSPWU) sesuai Pasal 48 PP 42 Tahun 2006 tentang pelaksanaan UU Wakaf. Dalam pengelolaan wakaf uang, LKSPWU akan mengelola deposito terlebih dahulu dan hasilnya diberikan kepada mauquf alaih. Sebab, LKSPWU harus mengetahui jumlah bagi hasil yang kemudian baru bisa disalurkan. “Syarat dari wakaf uang adalah nominal wakaf tidak boleh berkurang, sehingga nazir perlu menempatkan wakaf ke LKSPWU terlebih dahulu. Bagi hasil yang diperoleh dari penempatan nazir ke LKSPWU nanti dapat disalurkan ke mauquf alaih,” jelas Setyo. Setyo menegaskan, LKSPWU sebagai pengelola CWLD bertanggung jawab penuh atas pengelolaan dana wakaf. LKSPWU harus memastikan dana tersebut ditempatkan dengan aman, sesuai dengan prinsip syariah, dan diawasi oleh OJK. Baca Juga: Kini NIK Bisa Digunakan untuk 28 Layanan Pajak, Cek Daftarnya Mengutip laman resmi sikapiuangmu.ojk.id, terdapat beberapa keunggulan CWLD bagi Wakif diantaranya sebagai berikut: - Mendapatkan Sertifikat Wakaf Uang, Akta Ikrar Wakaf, dan Bilyet CWLD - Pokok deposito dapat dicairkan setelah periode wakaf berakhir - Ikut berkontribusi pada peningkatan kesejahteraan sosial - Dana dikelola dengan menerapkan prinsip kehati-hatian     Cek Berita dan Artikel yang lain di Google News",keuangan
Kemenag Raih Penghargaan MURI atas Bantuan Terbanyak di Pemberdayaan Zakat&Wakaf 2024,2024-08-20T04:20:38.452Z,22 July 2024,Ignatia Maria Sri Sayekti,https:////pressrelease.kontan.co.id/news/kemenag-raih-penghargaan-muri-atas-bantuan-terbanyak-di-pemberdayaan-zakatwakaf-2024,"KONTAN.CO.ID - Kementerian Agama (Kemenag) menerima penghargaan dari Museum Rekor Dunia Indonesia (MURI) atas Pembagian Santunan kepada Anak Yatim dan Difabel terbanyak dalam acara Kickoff Kolaborasi Program Pemberdayaan Zakat dan Wakaf 2024. Dalam kesempatan ini, tercatat sebanyak dua juta santunan diberikan kepada anak yatim dan difabel secara serentak di seluruh Indonesia. Piagam Rekor MURI diserahkan Direktur Operasional MURI, Yusuf Ngadri kepada Kementerian Agama yang diwakili oleh Direktur Pemberdayaan Zakat dan Wakaf, Waryono Abdul Ghafur, dalam acara “Lebaran Yatim: Berbagi Cinta Berlimpah Berkah” yang berlangsung secara hybrid dan dilaksanakan di Auditorium Kantor Kemenag RI, Jakarta Pusat, Selasa (16/7/2024). Dalam menyalurkan santunan, Kemenag RI melibatkan Kanwil Kemenag se-Indonesia, BAZNAS, LAZ, BSI, serta beberapa bank syariah untuk menyalurkan bantuan kepada yatim dan difabel secara hybrid. Kegiatan ini juga mendapatkan dukungan dari Sinarmas Land, Oxygen.id, dan Harian Kompas. Selain menerima penghargaan, Kementerian Agama melalui Direktorat Pemberdayaan Zakat dan Wakaf juga melakukan peluncuran Kolaborasi Program Pemberdayaan Zakat dan Wakaf tahun 2024. Pada kesempatan tersebut, Wakil Menteri Agama (Wamenag), Saiful Rahmat Dasuki, menyampaikan bahwa program ini meliputi Kampung Zakat, Inkubasi Wakaf Produktif, KUA Pemberdayaan Ekonomi Umat, Kota Wakaf, dan Gerakan Wakaf Uang. ""Kolaborasi ini merupakan wujud komitmen Kemenag untuk memberdayakan zakat dan wakaf bagi kemaslahatan masyarakat. Pemerintah akan terus mendukung dan mengembangkan program-program zakat dan wakaf sebagai bagian dari upaya pengentasan kemiskinan dan pemerataan kesejahteraan,"" ujar Saiful Rahmat Dasuki. Dirjen Bimas Islam, Kamaruddin Amin, menyatakan bahwa Program KUA Pemberdayaan Ekonomi Umat (KUA PEU) telah berjalan sejak 2021 dengan 11 KUA Percontohan Ekonomi Umat. Pada 2024, program ini telah berkembang dengan kolaborasi bersama 39 Lembaga Zakat dan mencapai lebih dari 190 KUA yang berpartisipasi. ""Kami sangat bangga melihat kemajuan program KUA PEU yang telah berkembang pesat. Pada tahun ini, dengan kolaborasi bersama Lembaga Zakat, kami telah mencapai lebih dari 190 KUA yang berpartisipasi,"" ujar Kamaruddin. Selain itu, Kamaruddin juga mengumumkan peluncuran Program Kota Wakaf untuk enam kabupaten/kota: Kabupaten Aceh Tengah, Kabupaten Siak, Kota Padang, Kabupaten Gunungkidul, Kabupaten Wajo, dan Kota Tasikmalaya. ""Program kota wakaf ini diharapkan menjadi program yang menggunakan perspektif ‘bottom-up’ berbasis masyarakat dalam mengembangkan potensi perwakafan guna kesejahteraan masyarakat,"" ungkapnya. Direktur Pemberdayaan Zakat dan Wakaf, Waryono Abdul Ghafur, menegaskan pentingnya sinergi antara pemerintah, masyarakat, serta lembaga zakat dan wakaf dalam mengelola zakat dan wakaf. ""Sinergi merupakan kunci menciptakan kesejahteraan yang merata dan berkelanjutan bagi seluruh umat,"" tambah Waryono. Baca Juga: Sambut Kedatangan Kloter Terakhir Jemaah Haji, Menag Minta Maaf Cek Berita dan Artikel yang lain di Google News",pressrelease
"BSI dan ITB Luncurkan BSI Deposito Wakaf, Targetkan Dana Wakaf Rp 10 Miliar",2024-08-20T04:20:38.494Z,"Kamis, 04 Juli 2024 / 11:08 WIB",Reporter: Nurtiandriyani Simamora | Editor: Herlina Kartika Dewi,https:////keuangan.kontan.co.id/news/bsi-dan-itb-luncurkan-bsi-deposito-wakaf-targetkan-dana-wakaf-rp-10-miliar,"KONTAN.CO.ID - JAKARTA. PT Bank Syariah Indonesia Tbk (BSI), BSI Maslahat, dan Institut Teknologi Bandung (ITB) berkolaborasi meluncurkan BSI Deposito Wakaf dengan seri-04 untuk pembangunan Masjid ITB Cirebon. BSI Deposito Wakaf Seri 04 ini menargetkan pengumpulan dana wakaf sebesar Rp 10 miliar dari potensi alumni ITB sekitar 130.000 alumni, untuk didedikasikan pada proyek pembangunan Masjid ITB Kampus Cirebon. Adapun masa penawaran program dimulai sejak tanggal 2 Juli 2024 sampai dengan 2 Oktober 2024 dengan jangka waktu satu tahun. RCEO BSI Regional Bandung Fitria Ekayani menjelaskan, kolaborasi BSI bersama ITB dan BSI Maslahat ini merupakan salah satu upaya bersama untuk memperkuat ekosistem Wakaf melalui produk wakaf uang temporer sekaligus memfasilitasi calon Wakif (donatur) untuk ikut serta berkontribusi merealisasikan pembangunan Masjid ITB Cirebon dengan model Wakaf Uang secara sementara (satu tahun). Baca Juga: Bank Harus Pertebal Biaya Pengamanan Data “Pembangunan Masjid ITB Cirebon ini diharapkan dapat mendorong kesejahteraan dan peningkatan kualitas hidup bagi masyarakat sekitar dan menjadi peluang meraih pahala yang besar bagi para Wakif yang berkontribusi” ujarnya dalam siaran pers, Kamis (4/7). Ia menambahkan, nasabah yang tertarik untuk membeli produk deposito wakaf tersebut dapat melakukan pembelian di seluruh outlet BSI dengan minimal wakaf hanya 1 juta (maksimal tidak terhingga) dan akan kembali 100% setelah jatuh tempo. Kebijakan Seri Penerbitan produk ini sangat selektif dan tidak sekadar proyek percontohan dari setiap Instansi/lembaga mitra BSI. Setiap seri Penerbitan proyek sosial, instansi/lembaga terkait harus memiliki dampak positif dan komitmen kuat untuk bersama-sama mewujudkan program sosial yang dikehendaki. Cek Berita dan Artikel yang lain di Google News",keuangan
"Buka 4 Program Bantuan Zakat & Wakaf 2024, Kemenag: Pengajuan Mulai 5 - 12 Juni 2024",2024-08-20T04:20:38.771Z,09 June 2024,Ignatia Maria Sri Sayekti,https:////pressrelease.kontan.co.id/news/buka-4-program-bantuan-zakat-wakaf-2024-kemenag-pengajuan-mulai-5-12-juni-2024,"KONTAN.CO.ID - Kementerian Agama (Kemenag) membuka program bantuan Kampung Zakat (KZ), KUA Pemberdayaan Ekonomi Umat (PEU), Inkubasi Wakaf Produktif (IWP), dan Kota Wakaf tahun 2024. Keempat program bantuan tersebut dibuka mulai 5 hingga 12 Juni 2024. Direktur Pemberdayaan Zakat dan Wakaf, Kemenag, Waryono Abdul Ghafur mengatakan, pembukaan program bantuan tersebut bertujuan untuk mempercepat pengembangan zakat dan wakaf di Indonesia. Ia berharap program yang dicanangkan dapat mempercepat pengentasan kemiskinan dan peningkatan kesejahteraan masyarakat. “Pembukaan bantuan Program Kampung Zakat, KUA Pemberdayaan Ekonomi Umat, Inkubasi Wakaf Produktif, dan Kota Wakaf bertujuan untuk mempercepat pengembangan program zakat dan wakaf di Indonesia,” ungkap Waryono pada Sabtu (8/6/2024). Waryono menyebut, bantuan program tersebut merupakan hasil kolaborasi Kemenag dengan sejumlah lembaga zakat dan wakaf serta pemangku kepentingan terkait. Pengajuan program bantuan dapat dilakukan melalui tautan berikut: -    Kampung Zakat: [https://bit.ly/FormulirPendaftaranKZ2024](https://bit.ly/FormulirPendaftaranKZ2024) -    KUA Pemberdayaan Ekonomi Umat: [https://bit.ly/FormulirPendaftaranKJAPEU2024](https://bit.ly/FormulirPendaftaranKJAPEU2024) -    Inkubasi Wakaf Produktif: [https://bit.ly/FormulirPendaftaran/WP2024](https://bit.ly/FormulirPendaftaran/WP2024) -    Kota Wakaf: [https://bit.ly/FormulirPendaftaranKW2024](https://bit.ly/FormulirPendaftaranKW2024) Sementara itu, prosedur pengajuan bantuan dan ketentuan teknis lainnya diatur dalam Pedoman, Petunjuk Teknis, dan Petunjuk Pelaksanaan yang dapat dilihat di [https://bimasislam.kemenag.go.id/post/info-penting/pendaftaran-program-kua-pemberdayaan-ekonomi-umat-tahun-2024](https://bimasislam.kemenag.go.id/post/info-penting/pendaftaran-program-kua-pemberdayaan-ekonomi-umat-tahun-2024). Dikatakan Waryono, proses pengajuan bantuan, seleksi bantuan, penetapan penerima bantuan, dan pencairan bantuan tidak dikenakan biaya apa pun dan tidak ada pungutan dalam bentuk apa pun kepada penerima bantuan. “Tidak ada pungutan apa pun dalam proses pengajuan hingga pencairan bantuan program. Ini murni bantuan,” tegasnya. Untuk informasi lebih lanjut dapat menghubungi PIC program masing-masing: -    Kampung Zakat: Nur Kumala Dewi (0813-8145-1010)
-    KUA Pemberdayaan Ekonomi Umat: Sinta Khairunnisa (0818-0644-4116)
-    Inkubasi Wakaf Produktif: Andayani (0812-9939-3143)
-    Kota Wakaf: Nurmala (0812-8064-3427) Baca Juga: Puncak Haji, Jemaah Dibekali Kerikil Lontar Jumrah dan Snack Berat Sejak dari Arafah Cek Berita dan Artikel yang lain di Google News",pressrelease
Dirjen Bimas Islam Terpilih Jadi Ketua Badan Wakaf Indonesia,2024-08-20T04:20:38.913Z,"Rabu, 22 Mei 2024 / 19:06 WIB",Reporter: Yudho Winarto | Editor: Yudho Winarto,https:////nasional.kontan.co.id/news/dirjen-bimas-islam-terpilih-jadi-ketua-badan-wakaf-indonesia,"KONTAN.CO.ID - JAKARTA. Dirjen Bimas Islam Kementerian Agama (Kemenag) Kamaruddin Amin resmi menjabat sebagai Ketua Badan Wakaf Indonesia (BWI) masa bakti 2024-2027 mulai Senin, 20 Mei 2024. Penetapan tersebut berdasarkan rapat pleno yang digelar di Kantor BWI Pusat, Jakarta Timur, dan tertuang dalam Keputusan Presiden Nomor 32 Tahun 2024 yang ditandatangani Presiden Joko Widodo (Jokowi) pada 8 Mei. Baca Juga: BWI Dorong Wakaf Masuk Dalam Aturan Resmi Pemerintah Kamaruddin mengungkapkan visinya untuk menjadikan BWI sebagai lembaga yang mampu meningkatkan kualitas dan kuantitas perwakafan di Indonesia. Menurutnya, BWI juga dapat mendukung program pembangunan nasional dan pemberdayaan sosial. “Kami punya visi ingin menjadikan BWI sebagai lembaga yang berperan strategis untuk meningkatkan kualitas perwakafan di Indonesia, baik secara kuantitas maupun kualitas,” ujar Kamaruddin dalam keterangan resminya, Selasa (21/5). Dikatakan Kamaruddin, potensi wakaf di Indonesia sangat besar. Karenanya, langkah yang akan diambil adalah memaksimalkan kualitas perwakafan, termasuk wakaf benda tidak bergerak seperti wakaf uang yang telah dirasakan manfaatnya oleh masyarakat. “Untuk memastikan keamanannya, kami menekankan pentingnya sertifikasi wakaf,” tegasnya. Baca Juga: Kemenag Siapkan Ribuan Formasi CPNS Khusus IKN, Cek Cara Buat Akun SSACSN Daftar CPNS Selain itu, Kamaruddin menjelaskan, salah satu tugas penting BWI adalah melakukan pembinaan dan peningkatan kualitas nazir, yang merupakan pengelola wakaf. Nazir, imbuhnya, merupakan bagian penting dari ekosistem perwakafan. Peningkatan kapasitas nazir juga menjadi prioritas agar pengelolaan wakaf dapat dilakukan dengan optimal . “Untuk memaksimalkan potensi wakaf, kita butuh nazir-nazir berkualitas. Ini menjadi salah satu tugas BWI untuk memberi pembinaan dan peningkatan kualitas nazir,” ucapnya. BWI, lanjutnya, akan berkolaborasi dengan seluruh mitra strategis, termasuk kementerian dan lembaga, perbankan, serta ahli-ahli keuangan, untuk memaksimalkan potensi wakaf. Ia berharap, ke depan, wakaf dapat berfungsi meningkatkan kualitas hidup masyarakat dan membantu pemerintah dalam mengentaskan kemiskinan. Baca Juga: Realisasi Wakaf Masih Rendah, Begini Upaya Pemerintah Pihaknya juga berencana melibatkan elemen masyarakat, penyuluh, Ormas Islam, dan penghulu sebagai duta wakaf untuk menyampaikan pentingnya wakaf kepada masyarakat. ""Agar masyarakat, terutama generasi muda Indonesia bisa menjadikan berwakaf sebagai gaya hidup,” tandasnya. Agenda pisah sambut pengurus lama BWI dengan yang baru digelar di Le Meridien Sudirman, Jakarta. Acara pisah sambut itu dilanjutkan dengan Rapat Kerja (Raker) untuk membahas rencana kerja ke depan dan memulai aktivitas resmi pengurus baru. Cek Berita dan Artikel yang lain di Google News",nasional
Asuransi Sinar Mas Salurkan Wakaf Al-Quran di Banda Aceh,2024-08-20T04:20:39.955Z,"Kamis, 04 April 2024 | 12:05 WIB","Andy Dwijayanto, Andy Dwijayanto",https:////momsmoney.kontan.co.id/news/asuransi-sinar-mas-salurkan-wakaf-al-quran-di-banda-aceh,"MOMSMONEY.ID - PT Asuransi Sinar Mas (ASM) dan Asuransi Sinar Mas Unit Usaha Syariah melaksanakan kegiatan corporate social responsibility (CSR) berupa pembagian paket sembako dan wakaf Al-Quran di Banda Aceh dalam rangkaian program Berbagi Berkah Ramadan. Sebanyak 100 paket sembako telah disalurkan kepada masyarakat yang membutuhkan di sekitar kantor cabang ASM Banda Aceh, yang berlokasi di Kantor Keuchik Peunayong, Banda Aceh. Selain itu, Asuransi Sinar Mas Syariah juga melakukan wakaf bagi lima masjid yaitu Masjid Al Muttaqin, Masjid Rahmatullah, Masjid Subulussalam, Masjid Maghfirah, dan Masjid Babu Zamzam. Baca Juga: Sinar Mas Land & PT KAI Percepat Pembangunan Stasiun Jatake di BSD City, Tangerang Masjid Rahmatullah dan Masjid Maghfirah merupakan masjid yang terkena dampak tsunami tahun 2004. ""Kegiatan Berbagi Berkah Ramadan telah menjadi agenda rutin CSR PT Asuransi Sinar Mas,"" kata Dumasi M. Samosir, Direktur PT Asuransi Sinar Mas, dalam  dalam siaran pers, Kamis (4/4). Pada penyelenggaraan tahun sebelumnya, menjangkau tiga lokasi di Jakarta dan tahun ini bertambah lokasi pelaksanaannya di Banda Aceh. Kegiatan ini merupakan wujud nyata dari komitmen Asuransi Sinar Mas dalam berkontribusi positif bagi masyarakat dan lingkungan sekitar. Termasuk menyelaraskannya dengan program pilar usaha Sinar Mas lainnya. ""Contohnya, lewat wakaf Al-Quran yang selama ini rutin digelar oleh Yayasan Muslim Sinar Mas bersama APP Group,"" ujar Dumasi. Baca Juga: Hemat Biaya Operasional, Sinar Mas Land Akan Perkuat Penerapan ESG di Tahun 2024 Dumasi juga menyampaikan komitmen Asuransi Sinar Mas dalam pengembangan asuransi syariah sejak tahun 2004. Sebagai upaya mematuhi regulasi Otoritas Jasa Keuangan (OJK) dalam POJK No 11 tahun 2023 tentang Pemisahan Unit Syariah Perusahaan Asuransi dan Perusahaan Reasuransi, Asuransi Sinar Mas berencana untuk melakukan spin off sebelum Desember 2026. Al-Quran yang diwakafkan dicetak menggunakan bahan kertas hasil produksi dari APP Group. Sejak tahun 2008, APP Group telah mendonasikan lebih dari 1,3 juta mushaf yang melampaui target awal sebanyak 1 juta mushaf. Pendistribusiannya mencakup berbagai wilayah Indonesia, dari Sabang hingga Merauke, termasuk pulau-pulau terluar dan terpencil. Cek Berita dan Artikel yang lain di Google News",momsmoney.id
