Title;Scrapping Date;Article Date;Author;Link;Content
China & Vietnam Teken Kesepakatan Proyek Kereta hingga Ekspor Buaya;2024-08-21T05:13:45.680Z;Rabu, 21 Agu 2024 08:30 WIB;Achmad Dwi Afriyadi - detikFinance;https://finance.detik.com/berita-ekonomi-bisnis/d-7500376/china-vietnam-teken-kesepakatan-proyek-kereta-hingga-ekspor-buaya;"Pemerintah China dan Vietnam menandatangani 14 kesepakatan mencakup proyek jalur kereta lintas batas hingga ekspor buaya. Kesepakatan diteken usai Presiden China Xi Jinping bertemu dengan Presiden Vietnam To Lam di Beijing.
Kunjungan Lam ke Beijing merupakan kunjungan pertama ke luar negeri sejak ia ditunjuk sebagai ketua partai pada awal bulan ini. Hal ini menjadi tanda keinginan untuk memperkuat hubungan seiring dengan pertumbuhan perdagangan dan investasi, meski terkadang terjadi perselisihan mengenai perbatasan di Laut Cina Selatan.
""China selalu menganggap Vietnam sebagai prioritas dalam diplomasi lingkungannya, dan mendukung Vietnam dalam mengikuti kepemimpinan partai, mengambil jalur sosialis yang sesuai dengan kondisi nasionalnya, dan memperdalam tujuan reformasi dan modernisasi sosialis,"" kata Xi dikutip dari CNBC, Rabu (21/8/2024).
Sementara, Lam menggambarkan hubungan bilateral ini sebagai prioritas utama dalam kebijakan luar negeri Vietnam dan menyebut kunjungannya ke China sebagai penegasan Partai Komunis dan pemerintah Vietnam untuk menghargai hubungan dengan China.
Menurut situs pemerintah Vietnam, Lam dalam pertemuan tersebut meminta pinjaman lunak dan teknologi dari China untuk mengembangkan infrastruktur transportasi negaranya dan setuju dengan Xi Jinping untuk meningkatkan hubungan pertahanan dan keamanan.
Keduanya juga sepakat untuk meningkatkan konektivitas jalur kereta api dan jalan antara kedua negara dan Xi berjanji untuk mengimpor lebih banyak produk pertanian Vietnam.
China dan Vietnam menandatangani dokumen mengenai perencanaan dan studi kelayakan untuk rute kereta api standar setelah kesepakatan awal ditandatangani pada bulan Desember saat kunjungan kenegaraan Xi ke Hanoi. Pada Desember, kedua negara akan mengerjakan konektivitas kereta api lintas batas, dan menyebutkan tiga proyek yang mencakup proyek yang menghubungkan pegunungan Lao Cai di barat laut Vietnam ke kota pelabuhan Haiphong dan proyek potensial yang menghubungkan Shenzhen di Tiongkok ke Haiphong.
Para pejabat Vietnam mengatakan jaringan kereta api akan menjadi agenda utama ketika para pemimpin bertemu. Meningkatkan jalur kereta api di Vietnam dapat meningkatkan perdagangan dan investasi, karena semakin banyak produsen China yang memindahkan beberapa operasi berorientasi ekspor ke Vietnam di tengah ketegangan perdagangan antara China dan Amerika Serikat (AS).
Dokumen lain yang ditandatangani mencakup kerja sama antara bank sentral, media, kesehatan, dan karantina, serta pemeriksaan kelapa, buaya, dan durian.
Lihat juga Video: China Bikin Drone Canggih Berbentuk Burung
[Gambas:Video 20detik]"
DPRD Soroti Target Retribusi Tak Realistis dan Defisit APBD-P Bali 2024;2024-08-21T05:13:45.767Z;Selasa, 20 Agu 2024 10:01 WIB;Tim detikBali - detikBali;https://www.detik.com/bali/bisnis/d-7498791/dprd-soroti-target-retribusi-tak-realistis-dan-defisit-apbd-p-bali-2024;"DPRD Bali melontarkan beberapa catatan terkait Anggaran Pendapatan Belanja dan Daerah (APBD) Perubahan 2024. Ada anggaran yang dinilai tak masuk akal, ada pula yang direvisi.
Ragam catatan itu diungkap para wakil rakyat melalui Rapat Paripurna DPRD Bali dengan agenda mendengarkan tanggapan fraksi terhadap APBD Perubahan 2024, Senin (19/8/2024).
Berikut detikBali merangkum beberapa catatan terkait APBD Perubahan 2024 Pemprov Bali:
Ketua Fraksi Gerindra DPRD Bali I Ketut Juliarta mempertanyakan turunnya pendapatan Lain-lain PAD yang Sah sebesar Rp 262 miliar dalam APBD Perubahan 2024. Ia menanyakan kepada Pj Gubernur Bali Sang Made Mahendra Jaya.
""Mohon penjelasan dari Saudara Pj Gubernur kenapa terjadi penurunan yang cukup signifikan dari lain-lain PAD yang sah sebesar Rp 262 miliar lebih atau 41,57 persen dari Rp 632 miliar menjadi Rp 369 miliar,"" kata Juliarta.
Juliarta menyarankan Pemprov Bali menunda anggaran belanja yang tidak mendesak agar tidak memberatkan APBD pada tahun berikutnya. Selain itu, ia juga meminta penjelasan terkait kenaikan belanja hibah dari Rp 989 miliar menjadi Rp 1,1 triliun.
""Apakah sudah termasuk belanja hibah yang difasilitasi dewan sesuai dengan kesepakatan? Mohon penjelasan, Saudara Pj Gubernur,"" tanya politikus asal Klungkung itu.
Ia juga menyoroti rencana pinjaman jangka pendek yang menurutnya akan memberatkan APBD tahun berikutnya. Juliarta menyarankan agar Pemprov Bali menyesuaikan kemampuan keuangan daerah dengan mengurangi dan menunda kegiatan yang tidak wajib.
Fraksi Demokrat DPRD Bali menyarankan agar belanja barang dan jasa serta belanja modal dicoret dari APBD Perubahan 2024.
""Dalam kondisi keuangan daerah seperti sekarang ini, untuk belanja barang dan jasa serta belanja modal, bila tidak mendesak atau bisa ditunda, sebaiknya tidak perlu dianggarkan dalam perubahan APBD TA 2024,"" ujar Nova.
Selain itu, sesuai dengan Undang-Undang Nomor 1 Tahun 2022 tentang Hubungan Keuangan antara Pemerintah Pusat dan Pemerintah Daerah, Demokrat menyarankan agar menyetop sementara belanja yang tidak perlu atau bisa ditunda. Kecuali, belanja rutin dan belanja yang sifatnya wajib.
""Berdasarkan data dan pengalaman tahun-tahun sebelumnya, terkait dengan belanja hibah, untuk ke depan agar disesuaikan dengan kemampuan keuangan daerah dan jangan dipaksakan demi popularitas,"" ungkap anggota Komisi I DPRD Bali itu.
Sewi juga mendorong Pemerintah Provinsi (Pemprov) Bali agar sewa tanah di Nusa Dua dan proyek Pusat Kebudayaan Bali di Klungkung dilanjutkan sampai ada hasil yang nyata. Hal itu bertujuan untuk meningkatkan PAD Pemprov Bali.
Fraksi PDIP menyoroti target pendapatan retribusi pada APBD-P 2024 yang dinilai tak realistis. Pemprov Bali menargetkan retribusi naik dari Rp 59,21 miliar pada APBD Induk menjadi Rp 314,22 miliar pada APBD-P.
PDIP meminta Pemprov Bali mengkaji kembali target itu karena kenaikannya terlalu tinggi. Padahal, hingga Juli 2024, realisasinya baru Rp 11,53 miliar atau 19,48 persen dari target pada APBD Induk.
""Mengingat realisasi sampai dengan 31 Juli 2024 hanya sebesar Rp 11,53 miliar atau 19,48 persen,"" ujar Sari Galung.
Adapun target itu naik 430,67 persen. Nilai ini dinilai terlalu tinggi oleh Fraksi PDIP.
Selain itu, ia juga meminta Penjabat (Pj) Gubernur Bali Sang Made Mahendra Jaya untuk mencermati kembali terhadap upaya untuk menutup defisit dalam pembiayaan anggaran dalam APBD Perubahan 2024. Rencananya, Pemprov Bali akan melakukan pinjaman sebesar Rp 842,85 miliar untuk memenuhi pembiayaan defisit.
""Mengingat ada ketentuan terkait batas maksimal kumulatif defisit APBD, batas maksimal defisit APBD, dan batas maksimal pembiayaan utang daerah,"" jelasnya.
Selain itu, ia menilai jika pinjaman jangka pendek harus ditentukan jangka waktu pelunasannya, yang mana tidak boleh melampaui anggaran yang sedang berjalan.
""Defisit sebesar Rp 929,59 miliar lebih ditambah kebutuhan pendanaan untuk pengeluaran pembiayaan sebesar Rp 255,91 miliar lebih untuk pembayaran angsuran pokok pinjaman sebesar Rp 248,91 miliar,"" beber Sari Galung.
""Dan penyertaan modal pemprov Bali sebesar Rp 7 miliar, sehingga membutuhkan sumber pendanaan dari penerimaan pembiayaan sebesar Rp 1,18 triliun,"" imbuhnya."
PDIP Soroti Target Retribusi Bali di APBD-P Naik Jadi Rp 314 Miliar;2024-08-21T05:13:46.499Z;Senin, 19 Agu 2024 22:22 WIB;Rizki Setyo Samudero - detikBali;https://www.detik.com/bali/berita/d-7498464/pdip-soroti-target-retribusi-bali-di-apbd-p-naik-jadi-rp-314-miliar;"Fraksi PDI Perjuangan (PDIP) Dewan Perwakilan Rakyat Daerah (DPRD) Bali menyoroti kenaikan target pendapatan retribusi daerah di Anggaran Pendapatan dan Belanja Daerah Perubahan (APBD-P) 2024 naik menjadi Rp 314,22 miliar. Hal tersebut disampaikan oleh anggota DPRD Bali dari PDIP, Ni Wayan Sari Galung, saat penyampaian pandangan umum Fraksi PDIP di rapat paripurna DPRD Bali, Senin (19/8/2024).
Galung meminta pemerintah Bali mengkaji kembali target kenaikan pendapatan retribusi daerah di APBD-P 2024. Sebab, target yang dipasang meningkat Rp 255,01 miliar atau 430,67 persen. ""Dibandingkan dengan APBD Induk 2024 sebesar Rp 59,21 miliar lebih, mengingat realisasi sampai dengan 31 Juli 2024 hanya sebesar Rp 11,53 miliar atau 19,48 persen,"" ujar Sari Galung.
Selain itu, ia juga meminta Penjabat (Pj) Gubernur Bali Sang Made Mahendra Jaya untuk mencermati kembali terhadap upaya untuk menutup defisit dalam pembiayaan anggaran dalam APBD Perubahan 2024. Rencananya, Pemprov Bali akan melakukan pinjaman sebesar Rp 842,85 miliar untuk memenuhi pembiayaan defisit.
""Mengingat ada ketentuan terkait batas maksimal kumulatif defisit APBD, batas maksimal defisit APBD, dan batas maksimal pembiayaan utang daerah,"" jelasnya.
Selain itu, ia menilai jika pinjaman jangka pendek harus ditentukan jangka waktu pelunasannya, yang mana tidak boleh melampaui anggaran yang sedang berjalan.
""Defisit sebesar Rp 929,59 miliar lebih ditambah kebutuhan pendanaan untuk pengeluaran pembiayaan sebesar Rp 255,91 miliar lebih untuk pembayaran angsuran pokok pinjaman sebesar Rp 248,91 miliar,"" beber Sari Galung.
""Dan penyertaan modal pemprov Bali sebesar Rp 7 miliar,"" imbuhnya.
Sehingga, membutuhkan sumber pendanaan dari penerimaan pembiayaan sebesar Rp 1,18 triliun.
Kemudian, PDIP juga meminta untuk mengkaji ulang penurunan target pendapatan daerah lain-lain dalam APBD Perubahan 2024.
""Dari sebesar Rp 369,59 miliar atau turun sebesar Rp 262,98 miliar dibandingkan dengan APBD Induk 2024 sebesar Rp 632,57 miliar,"" tandas Sari Galung."
DPRD Bali Pertanyakan PAD yang Sah Turun di APBD Perubahan 2024;2024-08-21T05:13:47.814Z;Senin, 19 Agu 2024 13:36 WIB;Rizki Setyo Samudero - detikBali;https://www.detik.com/bali/berita/d-7497376/dprd-bali-pertanyakan-pad-yang-sah-turun-di-apbd-perubahan-2024;"Fraksi Partai Gerindra Dewan Perwakilan Rakyat Daerah (DPRD) Bali mempertanyakan turunnya pendapatan asli daerah (PAD) lain-lain yang sah sebesar Rp 262 miliar dalam Anggaran Pendapatan dan Belanja Daerah (APBD) Perubahan 2024. Hal itu dilontarkan dewan kepada Penjabat (Pj) Gubernur Bali, Sang Made Mahendra Jaya, saat rapat paripurna DPRD Bali, Senin (19/8/2024).
""Mohon penjelasan dari saudara Pj Gubernur kenapa terjadi penurunan yang cukup signifikan dari lain-lain PAD yang sah sebesar Rp 262 miliar lebih atau 41,57 persen dari Rp 632 miliar menjadi Rp 369 miliar,"" kata Ketua Fraksi Gerindra DPRD Bali, I Ketut Juliarta.
Juliarta menyarankan Pemerintah Provinsi (Pemprov) Bali menunda anggaran belanja yang tidak mendesak agar tidak memberatkan APBD pada tahun berikutnya. Selain itu, ia juga meminta penjelasan terkait kenaikan belanja hibah dari Rp 989 miliar menjadi Rp 1,1 triliun.""Apakah sudah termasuk belanja hibah yang difasilitasi dewan sesuai dengan kesepakatan? Mohon penjelasan saudara Pj Gubernur,"" tanya politikus asal Klungkung itu.
Ia juga menyoroti rencana pinjaman jangka pendek yang menurutnya akan memberatkan APBD tahun berikutnya. Juliarta menyarankan agar Pemprov Bali menyesuaikan kemampuan keuangan daerah dengan mengurangi dan menunda kegiatan yang tidak wajib.
Fraksi Gerindra juga mengusulkan pelaksanaan Perda Pungutan Wisatawan Asing yang melibatkan pihak ketiga agar diberikan insentif. Dengan catatan, dia berujar, penerapannya dikelola lebih profesional dan transparan.""Serta meningkatkan pendapatan daerah guna pencapaian program-program pemerintah provinsi Bali lebih optimal,"" ujar anggota Komisi I DPRD Bali itu.
Juliarta meminta Mahendra agar mengkoordinasikan bantuan kabupaten kepada kabupaten lainnya yang dananya bersumber dari pajak hotel dan restoran. ""Selanjutnya, gubernur membagikan kepada kabupaten yang perlu dibantu dan sebagian menjadi pendapatan provinsi, mengingat provinsi sebagai koordinator pelaksanaan dan pengawasan perda-perda khususnya yang berkaitan dengan pariwisata di Bali,"" ujarnya."
HUT Ke-79 RI, Ini Sederet Kontribusi Besar BRI untuk Indonesia;2024-08-21T05:13:49.102Z;Senin, 19 Agu 2024 08:54 WIB;Erika Dyah - detikFinance;https://finance.detik.com/berita-ekonomi-bisnis/d-7496849/hut-ke-79-ri-ini-sederet-kontribusi-besar-bri-untuk-indonesia;"PT Bank Rakyat Indonesia (Persero) Tbk atau BRI menegaskan komitmennya untuk mendukung kemajuan negeri dan membawa dampak positif bagi rakyat Indonesia. Khususnya dalam memperingati Hari Ulang Tahun (HUT) ke-79 Republik Indonesia.
Direktur Utama BRI Sunarso mengungkapkan BRI memiliki berbagai inisiatif strategis. Melalui berbagai program, pihaknya terus berkontribusi bagi negeri dengan menciptakan economic value serta men-deliver social value.
""BRI percaya bahwa setiap langkah yang kita ambil, jika dilakukan bersama-sama, akan membawa dampak besar bagi kemajuan bangsa. BRI akan terus berada di garis terdepan dalam mendukung pemerintah dan masyarakat menuju Indonesia yang lebih sejahtera dan berdaya saing di kancah global,"" ungkap Sunarso dalam keterangan tertulis, Senin (19/8/2024).
Berikut sederet kontribusi besar BRI untuk negeri:
1. Dorong Ekonomi Kerakyatan Melalui Holding Ultra Mikro dengan 36,1 Juta Nasabah Pinjaman dan 176 Juta Rekening Simpanan
Hingga akhir Triwulan II 2024, tercatat ekosistem Ultra Mikro (UMi) BRI Group berhasil menyalurkan pinjaman kepada 36,1 juta debitur. Diketahui, portofolio pinjaman yang disalurkan telah mencapai Rp 622,3 triliun atau tumbuh 7,7% secara year on year.
Apabila dirinci, dari total Rp 622,3 triliun tersebut, Rp 496,2 triliun di antaranya disalurkan melalui kredit mikro BRI, Rp 77 triliun disalurkan oleh Pegadaian, dan sisanya senilai Rp 49,2 triliun disalurkan Permodalan Nasional Madani (PNM). Dari sisi simpanan, Holding UMi telah melayani lebih dari 176 juta rekening simpanan.
Holding UMi yang merupkan sinergi antara BRI, Pegadaian, dan PNM juga menjadi salah satu inisiatif penting dalam pembangunan berkelanjutan di Indonesia. Khususnya dalam hal menciptakan kesetaraan gender dan pengentasan kemiskinan. Program ini dibentuk untuk memperkuat layanan keuangan kepada pelaku usaha ultra mikro, khususnya di kalangan masyarakat berpenghasilan rendah, termasuk perempuan.
2. Garda Terdepan Dorong Inklusi Keuangan dengan 1 Juta AgenBRILink
BRI berhasil menorehkan pencapaian bersejarah melalui perluasan layanan perbankan hingga pelosok negeri guna memperkuat inklusi keuangan. Hal ini ditandai dengan jumlah total AgenBRILink yang mencapai 1 juta agen per 25 Juli 2024.
Satu juta agen tersebut tercatat melayani transaksi lebih dari 645 juta kali dengan volume transaksi lebih dari Rp 800 triliun, serta menghasilkan fee based income Rp 895,4 miliar. Adapun fee yang diperoleh para agen diproyeksikan dapat mencapai 2-3 kali lipat fee yang diterima BRI.
BRI berharap dengan adanya 1 juta AgenBRILink, cakupan layanan keuangan dari kota-kota besar semakin meluas hingga desa-desa terpencil. Apalagi, AgenBRILink telah tersebar di lebih dari 61 ribu desa. Jumlah tersebut setidaknya meng-cover lebih dari 80% dari total desa di Indonesia.
Untuk diketahui, AgenBRILink merupakan perluasan layanan perbankan BRI yang bekerja sama dengan nasabah sebagai agen. Nasabah dapat melayani transaksi perbankan secara real time online, serta mendapatkan keuntungan selaku Agen BRILink yang diberikan BRI melalui konsep sharing fee.
3. Beri Kemudahan Bertransaksi Masyarakat, Jumlah User BRImo Capai 35,2 Juta
BRI terus memperkuat ekosistem super apps BRImo sebagai salah satu strategi transformasi digitalnya. Hal ini dilakukan untuk mempermudah masyarakat dalam bertransaksi.
Dalam 6 bulan (hingga Juni 2024) tercatat BRImo telah digunakan oleh 35,2 juta user dan berhasil mencatatkan 2,01 miliar transaksi finansial dengan volume transaksi mencapai Rp 2.574 triliun atau tumbuh 35,81% yoy.
Saat ini, super app BRImo menjadi aplikasi mobile banking dengan rating terbaik dibandingkan aplikasi mobile banking perbankan konvensional lainnya di Indonesia. Data tersebut didapatkan berdasarkan review para pengguna Android (Playstore) yang memberikan rating 4,7 dan pengguna IOS (AppStore) memberikan rating 4,7. Hal tersebut menunjukkan kepuasan nasabah terhadap BRImo."
Pemerintahan Prabowo Bakal Utang Rp 775,9 T di 2025 demi Tutup Defisit;2024-08-21T05:13:49.179Z;Senin, 19 Agu 2024 07:33 WIB;Anisa Indraini - detikJatim;https://www.detik.com/jatim/bisnis/d-7496656/pemerintahan-prabowo-bakal-utang-rp-775-9-t-di-2025-demi-tutup-defisit;"Presiden terpilih Prabowo Subianto direncanakan akan menarik utang baru senilai Rp 775,9 triliun pada 2025. Rencana itu tercantum dalam Buku II Nota Keuangan Beserta Rancangan Anggaran Pendapatan dan Belanja Negara (RAPBN) 2025.
""Kebijakan pembiayaan dalam rangka menutup defisit anggaran dilakukan dengan tetap menjaga pembiayaan utang dalam batas yang aman dan manageable serta mengoptimalkan pembiayaan nonutang,"" tulis dokumen itu dilansir dari detikFinance, Minggu (18/7/2024).
Dalam dokumen itu dijelaskan, pembiayaan utang utamanya akan dipenuhi melalui penerbitan Surat Berharga Negara (SBN) neto senilai Rp 642,6 triliun. Kemudian melalui pinjaman neto senilai Rp 133,3 triliun dengan rincian pinjaman dalam negeri Rp 5,2 triliun dan pinjaman luar negeri Rp 128,1 triliun.
""Pengadaan utang diarahkan untuk mendukung program prioritas pemerintah dalam upaya mewujudkan program dan target pembangunan yang disusun dalam APBN,"" jelas dokumen itu.
Total pembiayaan utang tahun depan itu melonjak hingga Rp 222,8 triliun dari outlook pembiayaan utang tahun ini yang sebesar Rp 553,1 triliun. Hal itu untuk menutup defisit APBN 2025 yang direncanakan mencapai Rp 616,2 triliun atau 2,53% terhadap produk domestik bruto (PDB).
Di saat akan menarik utang baru, pemerintah juga harus membayar bunga utang yang direncanakan sebesar Rp 552,85 triliun di 2025. Jumlah itu naik 10,8% dari outlook pembayaran bunga utang pada 2024.
Pertumbuhan pembayaran bunga utang pada 2025 itu lebih rendah dibandingkan pertumbuhan 2024 sebesar 13,4%. Lebih rinci dijelaskan, jumlah itu terdiri dari pembayaran bunga utang dalam negeri sebesar Rp 497,62 triliun dan pembayaran bunga utang luar negeri sebesar Rp 55,23 triliun.
Perhitungan pembayaran bunga utang itu didasarkan pada beberapa asumsi seperti nilai tukar rupiah terhadap mata uang asing terutama dolar Amerika Serikat (US$), yen Jepang (JPY), dan euro (EUR).
Selain itu juga mempertimbangkan tingkat bunga SBN tenor 10 tahun, referensi suku bunga pinjaman serta asumsi spread-nya, diskon penerbitan SBN, serta perkiraan biaya pengadaan utang baru.
""Perhitungan besaran pembayaran bunga utang tahun anggaran 2025 secara garis besar meliputi pembayaran bunga atas outstanding utang yang berasal dari akumulasi utang tahun-tahun sebelumnya; rencana pembiayaan utang tahun anggaran 2024 dan tahun anggaran 2025; dan rencana program pengelolaan portofolio utang (liabilities management),"" bebernya.
Artikel ini sudah tayang di detikFinance. Simak selengkapnya di sini."
Rencana Penarikan Utang Rp 775,9 T di Awal Pemerintahan Prabowo Subianto;2024-08-21T05:13:52.928Z;Senin, 19 Agu 2024 06:00 WIB;Anisa Indraini - detikFinance;https://finance.detik.com/berita-ekonomi-bisnis/d-7496670/rencana-penarikan-utang-rp-775-9-t-di-awal-pemerintahan-prabowo-subianto;"Presiden terpilih Prabowo Subianto bakal menarik utang baru Rp 775,9 triliun pada 2025. Hal itu tercantum dalam Buku II Nota Keuangan Beserta Rancangan Anggaran Pendapatan dan Belanja Negara (RAPBN) 2025.
""Kebijakan pembiayaan dalam rangka menutup defisit anggaran dilakukan dengan tetap menjaga pembiayaan utang dalam batas yang aman dan manageable serta mengoptimalkan pembiayaan nonutang,"" tulis dokumen tersebut, dikutip Minggu (18/7/2024) kemarin.
Berdasarkan dokumen tersebut, pembiayaan utang utamanya akan dipenuhi melalui penerbitan Surat Berharga Negara (SBN) neto senilai Rp 642,6 triliun. Kemudian melalui pinjaman neto senilai Rp 133,3 triliun, dengan rincian pinjaman dalam negeri Rp 5,2 triliun dan pinjaman luar negeri mencapai Rp 128,1 triliun.
""Pengadaan utang diarahkan untuk mendukung program prioritas pemerintah dalam upaya mewujudkan program dan target pembangunan yang disusun dalam APBN,"" jelasnya.
Total pembiayaan utang tahun depan itu melonjak hingga Rp 222,8 triliun dari outlook pembiayaan utang tahun ini yang sebesar Rp 553,1 triliun. Hal itu untuk menutup defisit APBN 2025 yang dirancang mencapai Rp 616,2 triliun atau 2,53% terhadap Produk Domestik Bruto (PDB).
Di saat akan menarik utang baru, pemerintah juga harus membayar bunga utang yang direncakanan Rp 552,85 triliun pada 2025. Jumlah itu naik 10,8% dari outlook pembayaran bunga utang pada 2024.
Pertumbuhan pembayaran bunga utang pada 2025 tersebut lebih rendah jika dibandingkan dengan pertumbuhan 2024 yang sebesar 13,4%. Lebih rinci dijelaskan, jumlah tersebut terdiri dari pembayaran bunga utang dalam negeri sebesar Rp 497,62 triliun dan pembayaran bunga utang luar negeri sebesar Rp 55,23 triliun.
Perhitungan pembayaran bunga utang itu didasarkan pada beberapa asumsi seperti nilai tukar rupiah terhadap mata uang asing terutama dolar Amerika Serikat (AS), yen Jepang (JPY), dan euro (EUR). Serta mempertimbangkan tingkat bunga SBN tenor 10 tahun, referensi suku bunga pinjaman serta asumsi spread-nya, diskon penerbitan SBN, serta perkiraan biaya pengadaan utang baru.
""Perhitungan besaran pembayaran bunga utang tahun anggaran 2025 secara garis besar meliputi pembayaran bunga atas outstanding utang yang berasal dari akumulasi utang tahun-tahun sebelumnya; rencana pembiayaan utang tahun anggaran 2024 dan tahun anggaran 2025; dan rencana program pengelolaan portofolio utang (liabilities management),"" bebernya."
Pemerintahan Prabowo Direncanakan Tarik Utang Rp 775,9 T di 2025;2024-08-21T05:13:54.440Z;Minggu, 18 Agu 2024 22:00 WIB;Anisa Indraini - detikFinance;https://finance.detik.com/berita-ekonomi-bisnis/d-7496512/pemerintahan-prabowo-direncanakan-tarik-utang-rp-775-9-t-di-2025;"Pemerintah di bawah kepemimpinan presiden terpilih Prabowo Subianto direncanakan bakal menarik utang baru senilai Rp 775,9 triliun di 2025. Hal itu tercantum dalam Buku II Nota Keuangan Beserta Rancangan Anggaran Pendapatan dan Belanja Negara (RAPBN) 2025.
""Kebijakan pembiayaan dalam rangka menutup defisit anggaran dilakukan dengan tetap menjaga pembiayaan utang dalam batas yang aman dan manageable serta mengoptimalkan pembiayaan nonutang,"" tulis dokumen tersebut, dikutip Minggu (18/7/2024).
Berdasarkan dokumen tersebut, pembiayaan utang utamanya akan dipenuhi melalui penerbitan Surat Berharga Negara (SBN) neto senilai Rp 642,6 triliun. Kemudian melalui pinjaman neto senilai Rp 133,3 triliun, dengan rincian pinjaman dalam negeri Rp 5,2 triliun dan pinjaman luar negeri mencapai Rp 128,1 triliun.
""Pengadaan utang diarahkan untuk mendukung program prioritas pemerintah dalam upaya mewujudkan program dan target pembangunan yang disusun dalam APBN,"" jelasnya.
Total pembiayaan utang tahun depan itu melonjak hingga Rp 222,8 triliun dari outlook pembiayaan utang tahun ini yang sebesar Rp 553,1 triliun. Hal itu untuk menutup defisit APBN 2025 yang direncanakan mencapai Rp 616,2 triliun atau 2,53% terhadap produk domestik bruto (PDB).
Di saat akan menarik utang baru, pemerintah juga harus membayar bunga utang yang direncanakan sebesar Rp 552,85 triliun di 2025. Jumlah itu naik 10,8% dari outlook pembayaran bunga utang pada 2024.
Pertumbuhan pembayaran bunga utang pada 2025 tersebut lebih rendah jika dibandingkan dengan pertumbuhan 2024 yang sebesar 13,4%. Lebih rinci dijelaskan, jumlah tersebut terdiri dari pembayaran bunga utang dalam negeri sebesar Rp 497,62 triliun dan pembayaran bunga utang luar negeri sebesar Rp 55,23 triliun.
Perhitungan pembayaran bunga utang itu didasarkan pada beberapa asumsi seperti nilai tukar rupiah terhadap mata uang asing terutama dolar Amerika Serikat (US$), yen Jepang (JPY), dan euro (EUR). Serta mempertimbangkan tingkat bunga SBN tenor 10 tahun, referensi suku bunga pinjaman serta asumsi spread-nya, diskon penerbitan SBN, serta perkiraan biaya pengadaan utang baru.
""Perhitungan besaran pembayaran bunga utang tahun anggaran 2025 secara garis besar meliputi pembayaran bunga atas outstanding utang yang berasal dari akumulasi utang tahun-tahun sebelumnya; rencana pembiayaan utang tahun anggaran 2024 dan tahun anggaran 2025; dan rencana program pengelolaan portofolio utang (liabilities management),"" bebernya."
