Title;Scrapping Date;Article Date;Author;Link;Content
HUT RI, Artha Graha Peduli Gelar Upacara di 45 Titik di Indonesia;2024-08-21T05:13:54.669Z;Sabtu, 17 Agu 2024 21:28 WIB;Inkana Izatifiqa R Putri - detikNews;https://news.detik.com/berita/d-7495388/hut-ri-artha-graha-peduli-gelar-upacara-di-45-titik-di-indonesia;"Memperingati Hari Ulang Tahun ke-79 Republik Indonesia, Artha Graha Peduli dan Artha Graha Network menggelar upacara kemerdekaan serentak di 45 titik lokasi yang tersebar di 32 provinsi di Indonesia. Diikuti oleh ribuan peserta, upacara ini di pusatkan di kawasan SCBD, Jakarta pada (Sabtu, 17/8/2024).
Dalam upacara tersebut, Inspektur Upacara Letjen TNI (Purn.) Kiki Syahnakri mengajak untuk mendukung upaya pemerintah dalam melaksanakan pembangunan yang berkelanjutan menuju Nusantara Baru Indonesia Baru.
""Kita harus mewujudkan visi misi Artha Graha Network yaitu menjadi agen-agen pembangunan ekonomi (economic agent development). Langkah ini sebagai bentuk dukungan menuju pembangunan nasional dalam menyongsong Indonesia Emas 2045 mendatang,"" ujarnya dalam keterangan tertulis, Sabtu (17/8/2024).
Lebih lanjut, ia menuturkan pembangunan berkelanjutan adalah pembangunan yang memenuhi kebutuhan saat ini tanpa mengorbankan kemampuan generasi mendatang untuk memenuhi kebutuhan mereka.
""Kita harus bijak dalam memanfaatkan sumber daya alam, menjaga lingkungan, dan memastikan bahwa setiap langkah pembangunan kita memperhitungkan dampak jangka panjangnya. Sektor swasta harus membantu dan berkolaborasi dengan pemerintah untuk menciptakan peluang kerja yang ramah lingkungan, mengembangkan teknologi bersih, dan mendorong inovasi yang berkelanjutan "" imbuhnya.
Ia mengungkapkan pertumbuhan ekonomi harus inklusif, yang artinya harus merata dan dapat dinikmati oleh seluruh lapisan masyarakat. Hal ini dapat diwujudkan melalui berbagai upaya meliputi peningkatan akses pendidikan, layanan kesehatan, dan infrastruktur bagi masyarakat di daerah terpencil dan tertinggal, serta pemberdayaan UMKM sebagai tulang punggung perekonomian nasional, sebagaimana yang telah dilakukan Artha Graha Peduli saat ini.
Dikesempatan yang sama Ketua Umum Artha Graha Peduli Heka Hertanto mengatakan momentum hari kemerdekaan harus dimanfaatkan untuk saling bergotong-royong mewujudkan inovasi dan digitalisasi dalam merealisasikan kemajuan bangsa, mulai dari sektor digitalisasi dan inovasi yang berkelanjutan.
""Digitalisasi sektor ekonomi, seperti e-Commerce dan fintech juga dapat menjadi motor penggerak utama untuk keberlanjutan ekonomi kita. Namun yang tak kalah penting dalam menghadapi masa transisi menuju sistem digital antara lain adanya serangan siber (cyber crime) bahkan yang lebih marak adanya judi online dan pinjaman online. Semua harus diberantas dengan semangat yang sama,"" ucap Heka.
""Khususnya bagi keluarga besar Artha Graha Peduli, kami mengimbau untuk meningkatkan SDM unggul. Mewujudkan masa depan Indonesia yang lebih baik, lebih adil, dan lebih sejahtera. Dirgahayu Indonesia ke 79 Tahun, Nusantara Baru Indonesia Maju,"" pungkas Heka."
BPLDH Dukung Gerakan Lingkungan Melalui Anak Muda dan UMKM;2024-08-21T05:13:55.970Z;Sabtu, 17 Agu 2024 13:49 WIB;Fitrya Anugrah - detikNews;https://news.detik.com/berita/d-7494739/bpldh-dukung-gerakan-lingkungan-melalui-anak-muda-dan-umkm;"Badan Pengelola Lingkungan Hidup Daerah (BPLDH) turut berpartisipasi aktif dalam gelaran Festival LIKE 2024 yang diselenggarakan oleh Kementerian Lingkungan Hidup dan Kehutanan (KLHK) di Jakarta Convention Center. Pada gelaran ini, BPLDH mensosialisasikan mengenai You(th) can CONECTS IT.
Direktur Utama BPLDH Joko Tri Haryanto menjelaskan bahwa program ini merupakan platform konektor anak muda yang hendak membuat gerakan lingkungan. Hal tersebut lantaran Ia melihat banyak anak muda yang membuat gerakan lingkungan, namun masih terpisah-pisah.
Joko menjelaskan BPLDH memiliki kapasitas dan fleksibilitas dalam mengelola sumber pendanaan. Ia menyebut BPLDH telah mengelola pendanaan baik dari internasional maupun domestik. Dana pengelolaan BPLDH ini mencapai hingga Rp 25 T.
""Kami punya kapasitas, punya fleksibilitas, kita bisa mengelola semua sumber pendanaan, baik dari internasional, kita juga bisa mengkonekkan pendanaan domestik baik dari pemerintah maupun non pemerintah. Meskipun kami masih batita, tapi dana pengelolaan kami sudah hampir Rp 25 T,"" jelas Joko.
Lebih lanjut, Joko menyebut BPLDH turut dipercaya oleh presiden sebagai pengelola pariwisata baru di Indonesia. Ia mengaku BPLDH turut berperan memegang berbagai event bergengsi di Tanah Air.
""Kita baru ditunjuk presiden untuk mengelola Indonesia Quality Tourism Fun, itu satu model pengelolaan pariwisata baru di Indonesia. Pendekatanya bisa dari event, mulai event yang sifatnya tahunan seperti Moto Gp, event yg sifatnya nasional kaya Borobudur Marathon Run, kemudian Java Jazz. Itu dananya di BPLDH,"" ujarnya.
Tak hanya itu, dukungan BPLDH dalam memberikan layanan dana masyarakat juga diberikan dalam bentuk dana hibah. Direktur penyaluran dana BPLDH Damayanti Ratu Nanda menjelaskan dana hibah tersebut digunakan khususnya untuk kegiatan peduli lingkungan oleh kelompok tertentu.
""Jadi dananya, dana hibah, yang dapat diakses di layanannya BPLDH. Jadi ada satu layanan hibah untuk kegiatan kampanye pelatihan dan penanaman. Untuk kelompok-kelompok yang sudah terlihat peduli lingkungan, sekolah adiwiyata, pemenang Kalpataru, dan kelompok lingkungan yang sering ke KLHK untuk membicarakan lingkungan,"" ujar Damayanti beberapa waktu lalu.
Lebih lanjut Damayanti turut menjelaskan bentuk dana lainnya yang disediakan oleh BPLDH adalah pinjaman lunak. Dana ini diperuntukkan kepada masyarakat yang memiliki usaha namun membutuhkan dana.
""Jadi buat teman-teman yang sudah berusaha, usaha maggot, usaha bank sampah, ini ada pembiayaan tapi bergulir, pinjaman lunak yang harus dikembalikan,"" ucap Damayanti.
Damayanti menyebut kedua dana tersebut hanya diperuntukkan kepada usaha masyarakat yang bersifat per-orangan ataupun kelompok. Lebih lanjut, Damayanti mengatakan usaha tersebut juga wajib terdaftar pada sistem KLHK.
""UMKM itu bisa, yang tidak bisa itu perusahaan besar, karena maksimum pembiayaan untuk kelompok usaha UMKM maxium Rp 500 juta. Untuk per orangan, tidak lebih dari Rp 50 juta bentuknya pinjaman lunak,"" jelas Damayanti.
""Itu memang kelompok yang di recognize oleh KLHK. Jadi kami hanya memberikan ke kelompok-kelompok yang di recognize oleh KLHK,"" pungkasnya."
