Title,Scrapping Date,Article Date,Author,Link,Content,Category
"Jokowi Minta Lemhannas Lakukan Kajian Mitigasi Krisis Pangan, Energi dan Keuangan",2024-08-21T02:10:41.779Z,"Rabu, 12 Oktober 2022 / 15:08 WIB",Reporter: Ratih Waseso | Editor: Handoyo .,https:////nasional.kontan.co.id/news/jokowi-minta-lemhannas-lakukan-kajian-mitigasi-krisis-pangan-energi-dan-keuangan,"KONTAN.CO.ID - JAKARTA. Presiden Joko Widodo (Jokowi) memberikan arahan kepada peserta program pendidikan reguler angkatan (PPRA) LXIII dan LXIV tahun 2022 di Istana Negara, Jakarta, pada Rabu, 12 Oktober 2022. Lemhanas diminta untuk membuat kajian-kajian yang cepat tentang antisipasi yang dapat dilakukan pemerintah dalam melakukan mitigasi krisis energi, pangan, dan keuangan. Dimana kajian merupakan kombinasi dari kajian makro dan mikro, serta detail dalam pemberian rekomendasi ke depan. “Presiden meminta kajiannya bersifat makro, bersifat mikro dikombinasikan dan juga harus detail dalam merekomendasikan kepada Presiden arah-arah kebijakan ke depan,” kata Gubernur Lembaga Ketahanan Nasional (Lemhannas) RI Andi Widjajanto dalam Kanal YouTube Sekretariat Presiden, Rabu (12/10). Baca Juga: Wapres: Pengembangan dan Penerapan Teknologi Harus Masuk Sampai ke Desa Ia menjelaskan, Presiden mendorong Lemhanas untuk fokus melakukan kajian dalam lima hal seperti konsolidasi demokrasi, transformasi digital, ekonomi hijau, ekonomi biru, dan ibu kota negara (IKN). Untuk konsolidasi demokrasi, Andi menyebut pihaknya menyampaikan hasil kajian secara rutin kepada Presiden. Sayangnya Andi tak dapat menyampaikan substansi detail kajian tersebut. Pasalnya dalam tata kelola organisasi Lemhanas, kajian-kajian yang dilakukan hanya diperuntukkan untuk Presiden. ""Tidak bisa kami buka ke publik tanpa ada arahan Presiden,” ujarnya. Andi menjelaskan, dalam pertemuan tersebut perwakilan PPRA LXIII dan LXIV memaparkan hasil kajian dan rekomendasi yang sudah diseminarkan kepada Presiden Jokowi. Dimana pihaknya memberikan kajian tentang konsolidasi demokrasi bagaimana mereduksi politik identitas, lalu PPRA LXIV memberikan kajian tentang kepemimpinan G20, serta bagaimana memperkuat kolaborasi demi meningkatkan konektivitas dan rantai pasok global. Baca Juga: Ini Arahan Presiden Jokowi kepada Gubenur Lemhanas yang Baru Dalam pertemuan tersebut, Andi menyampaikan presiden juga menjelaskan situasi global yang saat ini dihadapi oleh Indonesia. Diharapkan para peserta PPRA LXIII dan LXIV dapat memperkuat karakter kepemimpinan dalam melaksanakan tugas ke depan. “Presiden memberikan jabaran bagaimana dunia ini sangat sulit, tahun depan mungkin jauh lebih sulit, dunia yang gelap. Sehingga diharapkan PPRA LXIII, LXIV dalam penugasan-penugasan berikutnya itu betul-betul memperkuat karakter kepemimpinannya ke depan,” kata Andi. Cek Berita dan Artikel yang lain di Google News",nasional
Krisis Inggris Meningkatkan Risiko Kekacauan di Pasar Keuangan Global,2024-08-21T02:10:41.873Z,"Selasa, 04 Oktober 2022 / 10:21 WIB",Reporter: Barratut Taqiyyah Rafie | Editor: Barratut Taqiyyah Rafie,https:////newssetup.kontan.co.id/news/krisis-inggris-meningkatkan-risiko-kekacauan-di-pasar-keuangan-global,"KONTAN.CO.ID - LONDON. Penurunan cepat ekonomi Inggris dari posisi stabilitas ke posisi krisis mengancam upaya global untuk mengendalikan inflasi. Kondisi ini meningkatkan risiko kekacauan yang menyebar di pasar keuangan. Mengutip Mint, tingkat volatilitas telah melonjak ke level tertinggi sejak Maret 2020 di seluruh pasar mata uang dan obligasi. Indikator risiko pasar lintas aset global Bank of America juga melonjak ke level yang tidak terlihat sejak awal pandemi. Pejabat pemerintah saat ini di AS memperingatkan tentang potensi limpahan krisis ke pasar keuangan lain. “Ketakutan menular,” kata Ben Kumar, ahli strategi investasi senior di Seven Investment Management LLP. Dia menambahkan, “Volatilitas obligasi yang lebih tinggi di Inggris yang disebabkan oleh likuidasi dana mendorong aksi jual pound karena ketidakstabilan, yang mendorong arus keluar ekuitas Inggris, sehingga mendorong aksi jual paralel di seluruh dunia."" Peristiwa seperti default Rusia pada tahun 1998 dan, baru-baru ini, krisis utang Yunani menunjukkan bagaimana satu negara dapat memicu gejolak keuangan yang lebih luas. Ketakutan kali ini adalah bahwa masalah Inggris menunjukkan seberapa cepat ketegangan antara kebijakan moneter dan fiskal dapat meletus. Bank-bank sentral yang melakukan pertempuran agresif terhadap inflasi membahayakan pemulihan ekonomi yang diperoleh dengan susah payah. Baca Juga: Inggris Dicengkeram oleh Krisis Ekonomi yang Diciptakan Sendiri Pemerintah Inggris dapat mengubah arah, tetapi saat ini tidak menunjukkan kecenderungan untuk merevisi rencana anggarannya setelah paket pemotongan pajak membuat nilai pound jatuh dan mendorong Bank of England untuk melakukan campur tangan di pasar obligasi. Mantan Menteri Keuangan Lawrence Summers menyamakan serangkaian risiko yang dihadapi ekonomi global dengan musim panas sebelum krisis tahun 2007, dengan masalah Inggris saat ini hanya satu contoh potensi kerusakan. Volatilitas mata uang lintas pasar tetap tinggi pada hari Jumat bahkan setelah pound berhasil pulih menyusul janji Bank of England untuk melakukan pembelian obligasi jangka panjang tanpa batas. Selain itu, imbal hasil obligasi AS bertenor sepuluh tahun telah bergerak bersama-sama dengan harga emas Inggris sepanjang minggu. “Volatilitas FX menciptakan volatilitas Treasury yang berkelanjutan, juga membuat pengiriman pesan dan perubahan kebijakan dari bank sentral semakin mudah dipertanyakan oleh pasar,” tulis Michael Purves, pendiri Tallbacken Capital Advisors dalam sebuah catatan. Baca Juga: Paul Volcker, Pembunuh Naga Inflasi dan Inspirator Jerome Powell dalam Kebijakan Fed",newssetup
"Rasa Takut Menular, Krisis Inggris Bisa Menjangkit ke Pasar Keuangan Lain",2024-08-21T02:10:42.063Z,"Selasa, 04 Oktober 2022 / 08:18 WIB",Reporter: Barratut Taqiyyah Rafie | Editor: Barratut Taqiyyah Rafie,https:////internasional.kontan.co.id/news/rasa-takut-menular-krisis-inggris-bisa-menjangkit-ke-pasar-keuangan-lain,"KONTAN.CO.ID - LONDON. Penurunan cepat ekonomi Inggris dari posisi stabilitas ke posisi krisis mengancam upaya global untuk mengendalikan inflasi. Kondisi ini meningkatkan risiko kekacauan yang menyebar di pasar keuangan. Mengutip Mint, tingkat volatilitas telah melonjak ke level tertinggi sejak Maret 2020 di seluruh pasar mata uang dan obligasi. Indikator risiko pasar lintas aset global Bank of America juga melonjak ke level yang tidak terlihat sejak awal pandemi. Pejabat pemerintah saat ini di AS memperingatkan tentang potensi limpahan krisis ke pasar keuangan lain. “Ketakutan menular,” kata Ben Kumar, ahli strategi investasi senior di Seven Investment Management LLP. Dia menambahkan, “Volatilitas obligasi yang lebih tinggi di Inggris yang disebabkan oleh likuidasi dana mendorong aksi jual pound karena ketidakstabilan, yang mendorong arus keluar ekuitas Inggris, sehingga mendorong aksi jual paralel di seluruh dunia."" Peristiwa seperti default Rusia pada tahun 1998 dan, baru-baru ini, krisis utang Yunani menunjukkan bagaimana satu negara dapat memicu gejolak keuangan yang lebih luas. Ketakutan kali ini adalah bahwa masalah Inggris menunjukkan seberapa cepat ketegangan antara kebijakan moneter dan fiskal dapat meletus. Bank-bank sentral yang melakukan pertempuran agresif terhadap inflasi membahayakan pemulihan ekonomi yang diperoleh dengan susah payah. Baca Juga: Inggris Dicengkeram oleh Krisis Ekonomi yang Diciptakan Sendiri Pemerintah Inggris dapat mengubah arah, tetapi saat ini tidak menunjukkan kecenderungan untuk merevisi rencana anggarannya setelah paket pemotongan pajak membuat nilai pound jatuh dan mendorong Bank of England untuk melakukan campur tangan di pasar obligasi. Mantan Menteri Keuangan Lawrence Summers menyamakan serangkaian risiko yang dihadapi ekonomi global dengan musim panas sebelum krisis tahun 2007, dengan masalah Inggris saat ini hanya satu contoh potensi kerusakan. Volatilitas mata uang lintas pasar tetap tinggi pada hari Jumat bahkan setelah pound berhasil pulih menyusul janji Bank of England untuk melakukan pembelian obligasi jangka panjang tanpa batas. Selain itu, imbal hasil obligasi AS bertenor sepuluh tahun telah bergerak bersama-sama dengan harga emas Inggris sepanjang minggu. “Volatilitas FX menciptakan volatilitas Treasury yang berkelanjutan, juga membuat pengiriman pesan dan perubahan kebijakan dari bank sentral semakin mudah dipertanyakan oleh pasar,” tulis Michael Purves, pendiri Tallbacken Capital Advisors dalam sebuah catatan. Baca Juga: Paul Volcker, Pembunuh Naga Inflasi dan Inspirator Jerome Powell dalam Kebijakan Fed",internasional
Menteri Keuangan Pakistan Umumkan Mundur di Tengah Krisis Ekonomi,2024-08-21T02:10:42.461Z,"Senin, 26 September 2022 / 10:58 WIB",Sumber: Reuters | Editor: Prihastomo Wahyu Widodo,https:////internasional.kontan.co.id/news/menteri-keuangan-pakistan-umumkan-mundur-di-tengah-krisis-ekonomi,"KONTAN.CO.ID - LONDON. Menteri Keuangan Pakistan, Miftah Ismail, pada hari Minggu (25/9) mengumumkan akan segera mundur dari jabatannya. Ismail mengambil langkah ini di tengah memburuknya krisis ekonomi akibat banjir besar. Dilansir dari Reuters, Ismail telah menyatakan pengunduran dirinya secara lisan. Ismail yang saat ini berada di London berencana mengajukan permohonan resminya pekan depan. ""Saya telah mengundurkan diri secara lisan sebagai Menteri Keuangan. Saya akan mengajukan pengunduran diri resmi setelah tiba di Pakistan,"" tulis Ismail melalui akun Twitter pribadinya. Ismail dan Perdana Menteri Pakistan, Shehbaz Sharif, saat ini sedang berada di London dan akan kembali ke Pakistan awal pekan ini. Baca Juga: Banjir Terburuk di Pakistan Berdampak ke 33 Juta Penduduk, 1.000 Lebih Tewas Dengan ini, Ismail akan menjadi menteri keuangan kelima yang diganti dalam waktu kurang dari empat tahun. Ekonomi Pakistan yang terus berguncang jadi alasan para menteri mundur dari jabatannya. Ekonomi Pakistan telah mengalami gejolak terus-menerus dalam lima tahun terakhir. Di saat yang sama, defisit transaksi berjalannya telah melebar tajam dan kenaikan inflasi telah memberikan tekanan pada rumah tangga dan bisnis. Krisis ekonomi Pakistan semakin buruk sejak banjir besar melanda akhir bulan lalu. Bencana tersebut menewaskan lebih dari 1.500 orang dan menyebabkan kerusakan yang nilainya ditaksir mencapai US$30 miliar. Banjir telah menghanyutkan jalan, tanaman, infrastruktur dan jembatan. Bencana yang belum pernah terjadi sebelumnya ini telah mempengaruhi 15% dari total populasi Pakistan. Baca Juga: Sepertiga wilayah Pakistan Tenggelam Akibat Banjir Bersejarah Kehancuran itu praktis memperbesar peluang Pakistan untuk gagal membayar utang-utangnya. Ismail pada hari Jumat (23/9) telah meyakinkan kepada para investor bahwa negaranya akan mencari keringanan utang dari kreditur bilateral. Ismail juga menekankan bahwa pemerintah Pakistan tidak akan mencari bantuan dari bank komersial atau kreditur Eurobond. Financial Times melaporkan, sebuah memorandum dari Program Pembangunan Perserikatan Bangsa-Bangsa (UNDP) akan diserahkan kepada pemerintah Pakistan minggu ini. UNDP meminta kreditur Pakistan  harus mempertimbangkan keringanan utang setelah banjir. Memorandum tersebut selanjutnya mengusulkan restrukturisasi atau pertukaran utang, di mana kreditur akan melepaskan beberapa pembayaran sebagai imbalan atas persetujuan Pakistan untuk berinvestasi dalam infrastruktur tahan perubahan iklim.",internasional
Bapak Kiamat Wall Street: Resesi Parah dan Krisis Keuangan Bakal Segera Datang,2024-08-21T02:10:42.689Z,"Rabu, 27 Juli 2022 / 06:22 WIB",Reporter: Barratut Taqiyyah Rafie | Editor: Barratut Taqiyyah Rafie,https:////internasional.kontan.co.id/news/bapak-kiamat-wall-street-resesi-parah-dan-krisis-keuangan-bakal-segera-datang,"KONTAN.CO.ID - Prospek ekonomi global saat ini semakin suram. Sebab, sulit untuk mengetahui kapan inflasi akan mencapai puncaknya, kapan inflasi akan turun, dan sejauh mana Federal Reserve pada akhirnya akan menaikkan suku bunga. Sampai saat ini, juga tidak jelas apakah The Fed, dalam usahanya untuk menjinakkan inflasi, akan menaikkan suku bunga cukup tinggi untuk menyebabkan resesi. The Fed telah menaikkan suku bunga sebesar 150 basis poin sejak Maret. Melansir The Street, bank sentral AS telah mengindikasikan 75 basis poin lagi pada pertemuan 27 Juli. Dan beberapa ahli memperkirakan bahwa total mulai Maret dan seterusnya akan menjadi 350 basis poin pada akhir tahun. Salah satu yang mendorong The Fed untuk mendongkrak suku bunga adalah inflasi yang merajalela, di mana indeks harga konsumen melonjak 9,1% dalam 12 bulan terakhir hingga Juni. Ini merupakan level tertinggi dalam 40 tahun. Baca Juga: IMF Pangkas Proyeksi Pertumbuhan Ekonomi Global Tahun 2022 Jadi 3,2%  Mantan Menteri Keuangan Larry Summers adalah salah satu pakar yang melihat kemungkinan besar terjadinya resesi. Ekonom Harvard mencatat bahwa tidak pernah dalam 65 tahun terakhir inflasi berada di atas 4%, pengangguran di bawah 5% dan ekonomi tidak memasuki resesi dalam dua tahun ke depan. Pengangguran mencapai 3,6% pada bulan Juni. Summers dan sebagian besar ekonom lain yang memperkirakan resesi meyakini, resesi yang dialami Amerika akan ringan. Akan tetapi Nouriel Roubini, kepala eksekutif Roubini Macro Associates, memprediksi sebaliknya. “Ada banyak alasan mengapa kita akan mengalami resesi yang parah dan utang yang parah serta krisis keuangan,” jelas Roubini, yang juga dikenal sebagai Bapak Kiamat kepada Bloomberg pada Selasa (25/7/2022) seperti yang dikutip The Street. Informasi saja, Roubini merupakan salah satu ahli ekonomi yang memperkirakan krisis keuangan 2008-2009. Menurutnya, pendapat yang mengatakan resesi yang dialami AS akan berlangsung pendek dan dangkal benar-benar sebuah delusi. Dalam sebuah artikel baru-baru ini di Project Syndicate, ia membandingkan kesulitan saat ini dengan tahun 1970-an dan 2008. “Krisis berikutnya tidak akan seperti pendahulunya,” tulis Roubini. Baca Juga: Bisa Berdampak ke RI, Ekonom DBS Ungkap Kondisi yang akan Menghantui Perekonomian AS Dia menambahkan, “Pada 1970-an, kita mengalami stagflasi, tetapi tidak ada krisis utang besar-besaran, karena tingkat utang rendah. Setelah 2008, kita mengalami krisis utang, diikuti oleh inflasi atau deflasi yang rendah, karena krisis kredit telah menghasilkan kejutan permintaan yang negatif."" Nah, menurut Roubini, saat ini, ekonomi Amerika menghadapi guncangan pasokan dalam konteks tingkat utang yang jauh lebih tinggi. ""Hal itu menyiratkan bahwa kita sedang menuju kombinasi stagflasi gaya 1970-an dan krisis utang gaya 2008 – yaitu, krisis utang stagflasi,"" kata Roubini. Untuk fiskal 2021, yang berakhir 30 September, defisit anggaran mencapai 12% dari PDB, rasio terburuk kedua (setelah 2020) sejak 1945. ""Adapun saham AS kemungkinan besar, mereka akan jatuh lebih rendah,"" kata Roubini. “Dalam resesi biasa, ekuitas AS dan global cenderung turun sekitar 35%."" ""Tetapi, karena resesi berikutnya akan bersifat stagflasi dan disertai dengan krisis keuangan, jatuhnya pasar ekuitas bisa mendekati 50%,"" lanjutnya. Baca Juga: Suku Bunga The Fed hingga Data Ekonomi Bakal Menyetir Wall Street Sebelumnya pada akhir Juni 2022 lalu, mengutip Bloomberg, Ekonom Nomura Holdings Inc memprediksi, perekonomian AS kemungkinan besar akan jatuh ke dalam jurang resesi ringan pada akhir 2022 karena Federal Reserve menaikkan suku bunga untuk menjinakkan harga. Nomura memperingatkan bahwa kondisi keuangan akan semakin ketat, sentimen konsumen memburuk, distorsi pasokan energi dan makanan memburuk dan prospek pertumbuhan global memburuk. ""Dengan momentum pertumbuhan yang melambat dengan cepat dan Fed berkomitmen untuk memulihkan stabilitas harga, kami percaya resesi ringan yang dimulai pada kuartal keempat 2022 sekarang lebih mungkin terjadi daripada tidak,"" tulis ekonom Nomura Aichi Amemiya dan Robert Dent dalam sebuah catatan Senin. Menurut kedua ekonom Nomura tersebut, kelebihan tabungan dan neraca konsumen akan membantu mengurangi kecepatan kontraksi ekonomi. Namun, mereka mencatat bahwa kebijakan moneter dan fiskal akan dibatasi oleh inflasi yang tinggi.",internasional
"Rupiah Lewat Rp 15.000 Per Dollar AS, Apa Indonesia Krisis? Ini Kata Menteri Keuangan",2024-08-21T02:10:42.912Z,"Kamis, 07 Juli 2022 / 16:24 WIB",Sumber: Kompas.com | Editor: Adi Wikanto,https:////nasional.kontan.co.id/news/rupiah-lewat-rp-15000-per-dollar-as-apa-indonesia-krisis-ini-kata-menteri-keuangan,"KONTAN.CO.ID - Jakarta. Nilai tukar rupiah terhadap dollar Amerika Serikat (AS) melemah belakangan ini hingga melewati Rp 15.000 per dollar AS. Jika nilai tukar rupiah melemah, apakah Indonesia akan krisis? Berdasarkan data di Bank Indonesia, nilai tukar rupiah terhadap dollar AS berada di level 15.030,78 pada Senin (4/7/2022), melemah ke level 15.034,80 untuk Selasa (5/7/2022), dan sedikit melemah menjadi 15.064,95 di Rabu (6/7/2022). Untuk perdagangan hari ini, Kamis 7 Juli 2022, Tradingeconomic mencatat nilai tukar rupiah Rp 14.995 per dollar AS. Menteri Keuangan Sri Mulyani Indrawati menyampaikan penjelasan mengenai kondisi perekonomian Indonesia. Ia mengatakan, beberapa indikator ekonomi terutama dari sisi keuangan yakni nilai tukar rupiah, suku bunga, dan inflasi memang masih dalam keadaan dinamis. Namun, kondisi Indonesia dinilai masih cukup baik, setidaknya tercermin dari neraca transaksi berjalan. ""Beberapa indikator ekonomi, dalam situasi dunia yang seperti sekarang memang masih sangat akan dinamis. Namun Indonesia dari sisi neraca pembayaran, transaksi berjalannya cukup baik,"" ujar Sri Mulyani di Gedung DPR RI, dikutip dari Kompas.com (5/7/2022). Baca Juga: Rupiah Berada di Rp 14.988 Pada Kamis (7/7) Siang Tercatat neraca transaksi yang berjalan pada kuartal satu 2022 mengalami surplus, melanjutkan capaian akhir tahun 2021 yang juga surplus. Hingga akhir Mei 2022 cadangan devisa juga mencapai 135,6 miliar, setara dengan pembiayaan 6 bulan impor dan utang luar negeri pemerintah. Hanya saja, Sri Mulyani menyebut kebijakan Bank Sentral AS yang menaikkan suku bunga acuan dengan agresif, membuat investor lebih tertarik menanamkan dananya di sana. Sehingga, banyak aliran dana keluar (capital outflow) dari negara-negara emerging market, termasuk Indonesia. ""Dalam hal ini capital flow (outflow) barangkali yang terjadi karena dengan interest rate naik di AS, maka kemudian investor mencari aset yang aman atau interest rate-nya lebih tinggi,” jelas dia. Terkait situasi yang terjadi, Sri Mulyani mengaku pemerintah akan terus melihat perkembangan dan indikator ekonomi dalam menyusun kebijakan. Dia memastikan, pemerintah akan terus menjaga stabilitas melalui belanja, penerimaan, dan pembiayaan. ""Umpamanya membantu dari sisi kebijakan mengenai perdagangan, investasi, ekspor-impor, distribusi. Karena itu persoalan yang terjadi dari inflasi sekarang ini, namun jika terdapat masalah sisi demand maka kami akan mengelolanya bersama-sama,” terang Sri Mulyani. Sebelumnya, nilai tukar rupiah sempat melemah hingga menyentuh angka 16.011,90 pada 27 Maret 2020 dan 16.376,68 pada 3 April di tahun yang sama. Ini terjadi di saat-saat awal Indonesia mengonfirmasi temuan kasus infeksi Covid-19. Adapun untuk Kamis (7/7/2022), berdasarkan data Bloomberg, nilai tukar rupiah ada di level 14.999, sedikit menguat dibanding level pada pembukaan pasar hari ini, yakni di 15.022.50. Artikel ini telah tayang di Kompas.com dengan judul ""Rupiah Tembus Rp 15.000 per Dolar AS, Menkeu Jelaskan Kondisi Ekonomi Indonesia "", Penulis : Luthfia Ayu Azanella Editor : Inten Esti Pratiwi Cek Berita dan Artikel yang lain di Google News",nasional
"Pertemuan GCRG Bahas Pemulihan Krisis Pangan, Energi dan Keuangan Global",2024-08-21T02:10:43.149Z,"Minggu, 22 Mei 2022 / 11:57 WIB",Reporter: Dendi Siswanto | Editor: Khomarul Hidayat,https:////nasional.kontan.co.id/news/pertemuan-gcrg-bahas-pemulihan-krisis-pangan-energi-dan-keuangan-global,"KONTAN.CO.ID - JAKARTA. Sekretaris Kementerian Koordinator Bidang Perekonomian Susiwijono Moegiarso, selaku Sherpa GCRG (Global Crisis Response Group), menghadiri pertemuan pertama tingkat Kepala Negara/ Kepala Pemerintahan dari Pertemuan Pertama Champions Group of the GCRG on Food, Energy, and Finance secara virtual pada Jumat lalu (20/5). Susiwijono mewakili Presiden Joko Widodo. Pertemuan ini membahas rekomendasi solusi untuk mengatasi tantangan besar yang saling terkait dalam mewujudkan ketahanan pangan, energi, dan keuangan global, akibat konflik Rusia-Ukraina. Sekretaris Jenderal Perserikatan Bangsa-Bangsa (PBB) Antonio Guterres mengatakan, kompleksitas situasi yang dihadapi saat ini terkait kondisi pangan, energi dan keuangan dunia. “Progres telah dilakukan untuk mengatasi krisis pangan dengan prioritas mengembalikan ekspor bahan pangan dari Ukraina dan Rusia dalam waktu dekat. Berbagai kemungkinan juga telah dikaji untuk solusi mengatas krisis keuangan. PBB juga memerlukan masukan dan dukungan dari negara-negara dunia untuk mengatasi krisis energi,"" kata Sekjen PBB Guterres dalam keterangan resminya, Minggu (22/5). Baca Juga: Jokowi Mendapat Komitmen Investasi US$ 3 Miliar dari Kunjungan ke AS Kanselir Jerman Olaf Scholz pun menyampaikan tiga pandangan utama dalam pertemuan tersebut. Pertama, Jerman telah mengambil peran sebagai salah satu donor terbesar di dunia dengan mengalokasikan € 430 juta untuk mengatasi kebutuhan mendesak dari krisis pangan. Kedua, pada area food security, bersama dengan World Bank, Jerman telah mengusulkan Global Alliance for Food Security untuk meningkatkan ketahanan pangan global. Ketiga, Jerman menyayangkan terdapatnya disinformasi terkait efek dari sanksi ekonomi. Rusia mengklaim penggunaan sanksi merupakan penyebab kenaikan harga dan kekurangan pangan. Sementara faktanya, saat ini 25 juta ton gandum Ukraina tidak dapat diekspor karena blokade Rusia terhadap Pelabuhan Laut Hitam. Kanselir Jerman juga menyerukan penghentian perang. Kemudian Perdana Menteri Bangladesh Sheikh Hasina menegaskan dukungan Bangladesh untuk penghentian perang dan sanksi yang berdampak pada berbagai aspek di banyak negara di dunia. Untuk merespon kondisi saat ini, PM Hasina menyerukan agar solidaritas global dan lembaga pembiayaan internasional diperkuat. Dukungan yang tepat sasaran perlu diberikan kepada negara yang rentan termasuk akses pasar, rantai pasok, logistik global dan akses pembiayaan. Diperlukan pula dukungan teknologi dan penelitian untuk sektor pertanian. Sementara itu, Perdana Menteri Barbados Mia Mottley, menyoroti bahwa kelompok Small State Island Countries mengalami dampak yang luar biasa berat akibat perang Rusia-Ukraina. Permasalahan yang dihadapi antara lain berupa kenaikan harga-harga komoditas dan gangguan rantai suplai, sementara negara-negara ini sulit mengakses fasilitas pinjaman dari lembaga-lembaga keuangan seperti DSSI dan the Common Framework. Dalam merespon beberapa pernyataan dari Champions GCRG tersebut, Sekretaris Jenderal UNCTAD Rebeca Grynspan menyambut baik pertukaran informasi yang dilakukan oleh para Champions dan berharap dapat menyuarakan aspirasi setiap negara yang terdampak krisis. “Kerja sama yang baik diharapkan dapat terjalin dalam mengatasi krisis ini”, ujar Sekjen UNCTAD Grynspan. Usai pertemuan ini, Sekjen PBB akan melakukan pembicaraan tersendiri dengan Presiden Joko Widodo pada Senin (23/5) dan dengan Perdana Menteri Denmark pada 24 Mei 2022. Baca Juga: Presidensi G20-B20 Momen Tingkatkan Kolaborasi Korporasi dengan UMKM Cek Berita dan Artikel yang lain di Google News",nasional
