Title,Scrapping Date,Article Date,Author,Link,Content,Category
Para Ekonom Ingatkan Rencana Keuangan Inggris Pasca Brexit Bisa Picu Krisis Global,2024-08-21T02:10:43.303Z,"Selasa, 17 Mei 2022 / 06:30 WIB",Sumber: Reuters | Editor: Noverius Laoli,https:////newssetup.kontan.co.id/news/para-ekonom-ingatkan-rencana-keuangan-inggris-pasca-brexit-bisa-picu-krisis-global,"KONTAN.CO.ID - LONDON. Lebih dari 50 ekonom pada Senin memperingatkan bahwa rencana Inggris pasca-Brexit untuk meningkatkan daya saing industri keuangannya yang besar berisiko menciptakan jenis masalah yang menyebabkan krisis keuangan global. Inggris yang berusaha menggunakan ""kebebasan Brexit"", meminta regulator untuk membantu Kota London agar tetap menjadi pusat keuangan global setelah negara itu meninggalkan Uni Eropa. Kelompok 58 ekonom, termasuk pemenang Hadiah Nobel dan mantan menteri bisnis Vince Cable, mengatakan menjadikan daya saing sebagai tujuan dapat mengubah regulator menjadi pemandu sorak bagi bank dan menyebabkan pembuatan kebijakan yang buruk. Ini juga meningkatkan risiko merugikan ekonomi riil karena sektor keuangan menyedot talenta yang tidak proporsional, kata mereka dalam surat terbuka kepada Menteri Keuangan Inggris Rishi Sunak. Baca Juga: Panggung Politik Prancis Memanas, Emmanuel Macron Sebut Janji Marine Le Pen Fantasi ""Inggris malah membutuhkan tujuan peraturan yang jelas yang mempromosikan produktivitas, pertumbuhan dan integritas pasar di seluruh ekonomi, dan juga melindungi konsumen dan pembayar pajak, memajukan perang melawan perubahan iklim dan mengatasi uang kotor untuk melindungi keamanan kolektif kita,"" kata surat itu. Menteri jasa keuangan Inggris, John Glen, mengatakan tujuan daya saing baru untuk Bank of England dan Otoritas Perilaku Keuangan akan menjadi tujuan kedua untuk menjaga pasar, konsumen dan perusahaan tetap aman dan sehat. Bank telah berusaha lebih fokus pada daya saing daripada yang diusulkan, tetapi pemerintah telah menghadapi tekanan balik dari BoE yang telah memperingatkan agar tidak kembali ke era ""sentuhan ringan"" yang berakhir dengan pemberi pinjaman yang ditalangi selama krisis keuangan. Miles Celic, kepala eksekutif TheCityUK, sebuah kelompok industri keuangan, membantah ada kontradiksi antara rezim regulasi yang efektif dan tujuan daya saing sekunder yang diusulkan. Baca Juga: Pebisnis Hotel Prediksi Sektor Pariwisata Rebound di Tahun Ini ""Regulator di negara lain, seperti Hong Kong, Australia, dan Singapura, mengelola pertimbangan tujuan kebijakan yang lebih luas seperti daya saing, atau pertumbuhan ekonomi, tanpa merusak penyampaian tujuan kebijakan lain mereka seperti stabilitas keuangan atau perlindungan konsumen,"" kata Celic. Penandatangan surat terbuka itu termasuk Mick McAteer, mantan anggota dewan FCA, dan ekonom pemenang Hadiah Nobel Joseph Stiglitz serta Cable, mantan pemimpin Demokrat Liberal yang berhaluan tengah. Cek Berita dan Artikel yang lain di Google News",newssetup
Rencana Keuangan Inggris Pasca Brexit Bisa Picu Krisis Global,2024-08-21T02:10:43.512Z,"Senin, 16 Mei 2022 / 16:41 WIB",Sumber: Reuters | Editor: Noverius Laoli,https:////internasional.kontan.co.id/news/rencana-keuangan-inggris-pasca-brexit-bisa-picu-krisis-global,"KONTAN.CO.ID - LONDON. Lebih dari 50 ekonom pada Senin memperingatkan bahwa rencana Inggris pasca-Brexit untuk meningkatkan daya saing industri keuangannya yang besar berisiko menciptakan jenis masalah yang menyebabkan krisis keuangan global. Inggris yang berusaha menggunakan ""kebebasan Brexit"", meminta regulator untuk membantu Kota London agar tetap menjadi pusat keuangan global setelah negara itu meninggalkan Uni Eropa. Kelompok 58 ekonom, termasuk pemenang Hadiah Nobel dan mantan menteri bisnis Vince Cable, mengatakan menjadikan daya saing sebagai tujuan dapat mengubah regulator menjadi pemandu sorak bagi bank dan menyebabkan pembuatan kebijakan yang buruk. Ini juga meningkatkan risiko merugikan ekonomi riil karena sektor keuangan menyedot talenta yang tidak proporsional, kata mereka dalam surat terbuka kepada Menteri Keuangan Inggris Rishi Sunak. Baca Juga: Panggung Politik Prancis Memanas, Emmanuel Macron Sebut Janji Marine Le Pen Fantasi ""Inggris malah membutuhkan tujuan peraturan yang jelas yang mempromosikan produktivitas, pertumbuhan dan integritas pasar di seluruh ekonomi, dan juga melindungi konsumen dan pembayar pajak, memajukan perang melawan perubahan iklim dan mengatasi uang kotor untuk melindungi keamanan kolektif kita,"" kata surat itu. Menteri jasa keuangan Inggris, John Glen, mengatakan tujuan daya saing baru untuk Bank of England dan Otoritas Perilaku Keuangan akan menjadi tujuan kedua untuk menjaga pasar, konsumen dan perusahaan tetap aman dan sehat. Bank telah berusaha lebih fokus pada daya saing daripada yang diusulkan, tetapi pemerintah telah menghadapi tekanan balik dari BoE yang telah memperingatkan agar tidak kembali ke era ""sentuhan ringan"" yang berakhir dengan pemberi pinjaman yang ditalangi selama krisis keuangan. Miles Celic, kepala eksekutif TheCityUK, sebuah kelompok industri keuangan, membantah ada kontradiksi antara rezim regulasi yang efektif dan tujuan daya saing sekunder yang diusulkan. Baca Juga: Pebisnis Hotel Prediksi Sektor Pariwisata Rebound di Tahun Ini ""Regulator di negara lain, seperti Hong Kong, Australia, dan Singapura, mengelola pertimbangan tujuan kebijakan yang lebih luas seperti daya saing, atau pertumbuhan ekonomi, tanpa merusak penyampaian tujuan kebijakan lain mereka seperti stabilitas keuangan atau perlindungan konsumen,"" kata Celic. Penandatangan surat terbuka itu termasuk Mick McAteer, mantan anggota dewan FCA, dan ekonom pemenang Hadiah Nobel Joseph Stiglitz serta Cable, mantan pemimpin Demokrat Liberal yang berhaluan tengah.",internasional
"Persaingan Mobil Listrik Ketat, Canoo Inc Mulai Krisis Keuangan",2024-08-21T02:10:43.875Z,"Rabu, 11 Mei 2022 / 09:49 WIB",Reporter: Adrianus Octaviano | Editor: Anna Suci Perwitasari,https:////internasional.kontan.co.id/news/persaingan-mobil-listrik-ketat-canoo-inc-mulai-krisis-keuangan,"KONTAN.CO.ID - JAKARTA. Di tengah persaingan mobil listrik (EV) yang ketat, produsen EV, Canoo Inc memperingatkan pada investor bahwa ada ""keraguan substansial"" tentang kelangsungan usahanya. Meskipun, sedang berusaha mengumpulkan lebih banyak uang Peringatan itu datang ketika perusahaan yang berbasis di Texas itu melaporkan pendapatan kuartal pertama. Di mana, perusahaan mencetak rugi bersih US$ 125,4 juta. Saham Canoo turun sekitar 13% dalam perdagangan setelah jam kerja, menyusul koreksi 5% pada perdagangan siang hari. Krisis keuangan Canoo menyoroti kesulitan yang dihadapi startup EV untuk meningkatkan produksi kendaraan yang mahal dalam menghadapi persaingan mulai dari Tesla Inc hingga pembuat mobil tradisional yang menghabiskan miliaran untuk teknologi dan pabrik baru. Canoo mengatakan, hanya memiliki sisa uang tunai sekitar US$ 105 juta pada akhir Maret, kurang dari US$ 120 juta yang dihabiskan untuk biaya operasional selama tiga bulan pertama tahun ini. Pengeluaran modal selama kuartal pertama mencapai US$ 28,4 juta dengan pendapatan nol dolar, menggarisbawahi kebutuhannya untuk pendanaan tambahan. Baca Juga: Elon Musk: Tesla Buka Kesempatan Akuisisi Perusahaan Pertambangan ""Kami telah menjelaskan filosofi kami untuk meningkatkan modal secara bijaksana dan akan melanjutkan pendekatan disiplin ini,"" kata Ketua dan Chief Executive Officer Canoo Tony Aquila dikutip dari Reuters, Rabu (11/5) Aquila bilang, Canoo memiliki lebih dari US$ 600 juta modal yang dapat diakses untuk mendanai awal produksi kendaraan dan ""pengalaman signifikan meningkatkan modal di pasar yang menantang."" Perusahaan pun telah membangun 39 van Gamma pada 31 Maret dan telah menerima 17.500 pre-order dengan nilai proyeksi US$ 750 juta. Direksi pun menyampaikan  bahwa perusahaan saat ini memproduksi hingga 12 kendaraan per minggu, difokuskan pada pelanggan armada. Pada bulan April, perusahaan juga telah memenangkan kontrak dengan badan antariksa AS untuk membangun kendaraan yang akan mengangkut astronot ke landasan peluncuran untuk misi Artemis NASA yang akan datang ke bulan.",internasional
"Atasi Krisis Keuangan, Sri Lanka Ajukan Utang Tambahan ke China",2024-08-21T02:10:44.387Z,"Selasa, 26 April 2022 / 14:53 WIB",Reporter: Ferrika Sari | Editor: Khomarul Hidayat,https:////internasional.kontan.co.id/news/atasi-krisis-keuangan-sri-lanka-ajukan-utang-tambahan-ke-china,"KONTAN.CO.ID - COLOMBO. Sri Lanka terus berjuang menyelamatkan ekonominya. Sri Lanka kini tengah melakukan penjajakan dengan China untuk menambah utang. Hal ini sebagai upaya negara untuk mengatasi dampak krisis keuangan. Menteri Media Sri Lanka Nalaka Godahewa mengatakan, China telah menyarankan kepada Sri Lanka untuk mengajukan utang kembali. ""Sekarang karena IMF bersedia terlibat dengan Sri Lanka, negara-negara lain sadar bahwa kami mendapat dukungan. Kami telah dijanjikan dukungan dari Bank Dunia dan lembaga lainnya,"" kata Gohahewa seperti dikutip Reuters, Selasa (26/4). Baca Juga: Sri Lanka Krisis, UNDP Minta Pemerintah Sri Lanka Guyur Bansos Menteri Keuangan Sri Lanka Ali Sabry berada di Washington pekan lalu untuk berbicara dengan IMF, Bank Dunia, India, dan lainnya tentang bantuan pembiayaan untuk negara kepulauan itu. Sri Lanka telah menangguhkan pembayaran sebagian dari utang luar negerinya yang sebesar US$ 51 miliar. Ekonomi Sri Lanka terpukul keras pandemi dan pemotongan pajak pemerintah , yang menyebabkan berkurangnya cadangan mata uang asing dan kekurangan bahan bakar, makanan dan obat-obatan yang telah membawa ribuan orang turun ke jalan dalam protes kekerasan secara sporadis. Sebelumnya, pinjaman China kepada Sri Lanka telah mencapai US$ 3,5 miliar dan menjadikannya sebagai kreditur bilateral terbesar. Presiden Sri Lanka Gotabaya Rajapaksa meminta China untuk membantu merestrukturisasi pembayaran utang ketika ia bertemu dengan Menteri Luar Negeri China Wang Yi pada Januari. Baca Juga: Bank Dunia Siapkan Paket Bantuan untuk Sri Lanka, IMF: Pembicaraan Membuahkan Hasil",internasional
"Wall Street Masih Memerah: Dow Jatuh 300 Poin, Krisis Ukraina Memukul Saham Keuangan",2024-08-21T02:10:44.992Z,"Selasa, 01 Maret 2022 / 23:19 WIB",Reporter: Yudho Winarto | Editor: Yudho Winarto,https:////investasi.kontan.co.id/news/wall-street-masih-memerah-dow-jatuh-300-poin-krisis-ukraina-memukul-saham-keuangan,"KONTAN.CO.ID - JAKARTA. Wall Street tergelincir pada perdagangan Selasa (1/3) dengan saham keuangan menanggung beban untuk hari kedua berturut-turut karena krisis Rusia-Ukraina semakin dalam. Sementara lonjakan harga minyak mendorong saham perusahaan energi. Melansir Reuters, pada 10:19 ET, Dow Jones Industrial Average turun 303,82 poin atau 0,90% ke 33.588,78, S&P 500 turun 19,78 poin atau 0,45% pada 4.354,16, dan Nasdaq Composite turun 10,39 poin atau 0,08 % pada 13.741,01. Baca Juga: Simak Rekomendasi Saham-Saham dari Sejumlah Analis untuk Perdagangan Rabu (2/3) Delapan dari 11 sektor utama S&P turun pada awal perdagangan, dengan sektor keuangan turun 2,7% karena imbal hasil US Treasury tenor 10-tahun merosot ke posisi terendah lima minggu di tengah pelarian ke utang safe-haven. Saham Wells Fargo kehilangan 4,5%, sedangkan indeks bank yang lebih luas turun 3,8%. Namun, sektor energi mengungguli dengan kenaikan 1,1% karena minyak melonjak kembali di atas US$100 per barel. Saham Chevron Corp naik 3,2% mencapai rekor tertinggi setelah perusahaan minyak tersebut menaikkan program pembelian kembali sahamnya dan memperkirakan arus kas operasi hingga 2026. Indeks volatilitas CBOE, juga dikenal sebagai pengukur ketakutan Wall Street, terakhir diperdagangkan di 31,41 setelah mencapai level tertinggi sejak 24 Februari di sesi sebelumnya. Kendaraan lapis baja Rusia menyerang ibu kota Ukraina, Kyiv, pada hari keenam serangan. Konflik tersebut telah memicu pembalasan dari Barat. Pasar saham jatuh pada hari Senin setelah beberapa negara mengumumkan sanksi tegas terhadap Moskow atas invasinya ke Ukraina. Baca Juga: Wall Street Tertekan di Perdagangan Terakhir Februari ""Investor tidak menyukai ketidakpastian dan ini adalah tingkat ketidakpastian yang sangat besar untuk pasar keuangan. Pasar menghargai premi risiko yang lebih tinggi pada ekuitas,"" kata Jeff Schulze, analis investasi ClearBridge Investments. ""Mengingat fakta bahwa ekonomi Amerika Serikat (AS) mengalami percepatan, ketidakpastian akan relatif singkat dan tidak akan mengejutkan jika pasar menemukan pijakannya, sekitar beberapa minggu ke depan ketika kejelasan pulih."" Data menunjukkan aktivitas manufaktur AS meningkat lebih dari yang diharapkan pada Februari karena meredanya kasus Covid-19. Meskipun perekrutan di pabrik melambat, berkontribusi untuk menjaga rantai pasokan terganggu dan harga input tetap tinggi. Cek Berita dan Artikel yang lain di Google News",investasi
"Sri Mulyani: Setiap krisis, the real last resort adalah keuangan negara",2024-08-21T02:10:45.248Z,"Minggu, 24 Oktober 2021 / 18:12 WIB",Reporter: Titis Nurdiana | Editor: Titis Nurdiana,https:////nasional.kontan.co.id/news/sri-mulyani-setiap-krisis-the-real-last-resort-adalah-keuangan-negara,"KONTAN.CO.ID -JAKARTA.  Krisis akibat pandemi Covid-19 masih berlangsung. Pemerintah terus berupaya menarik ekonomi Indonesia agar tak terjerambab dalam krisis. Demi menjaga ketahanan ekonomi dari krisis, negara selalu hadir menjadi penyelamat sekaligus penarik ekonomi. “Apapun penyebab krisis, ujungnya sama yakni negara hadir sebagai penyelamat dan penarik ekonomi,” ujar Menteri Keuangan Sri Mulyani Indrawati, dalam acara  Peluncuran Buku 25 Tahun Kontan : Melintasi 3 Krisis Multidimensi, Minggu (24/10). Kata Sri Mulyani, saat krisis terjadi, keuangan negara selalu mengalami beban paling besar, apapun latar belakang pemacu krisis. Pun saat tiga krisis terakhir yang terjadi pada tahun 1997/1988, 2008 dan tahun 2020 sebagai akibat pandemi Covid-19 tahun 2020. ""Kalau Anda lihat, krisisnya beda-beda. Tapi ujungnya semuanya sama, keuangan negara yang mengalami beban paling besar. At the end, itu yang disebut the real last resort, itu selalu keuangan negara,"" kata Sri Mulyani. Baca Juga: Sri Mulyani: Pasca Covid, ancaman krisis berikutnya bisa climate change dan disrupsi Krisis yang terjadi akibat pandemi Covid-19, anggaran negara digelontorkan untuk meningkatkan ragam bantuan sosial (bansos) untuk warga miskin, mengguyur relaksasi pembayaran pajak untuk usaha kecil, menengah, serta mikro. Insentif juga diberikan untuk korporasi. Dari sisi perbankan,  Otoritas Jasa Keuangan (OJK) juga langsung memberikan relaksasi berupa keringanan pembayaran kredit melalui restrukturisasi kredit perbankan. Regulasi OJK ini didasarkan pada praktek regulator di luar negeri agar bank lebih resilient. ""Lagi-lagi keuangan negara. Jadi negara hadir membantu neraca yang berjatuhan (neraca rumah tangga hingga neraca industri) untuk masyarakat yang tidak punya tabungan, kehilangan pekerjaan, kita naikkan bansos besar sekali, terutama kesehatan,"" tutur Sri Mulyani. Tanpa bantuan APBN,  kata Sri Mulyani, warga akan jatuh lebih dalam. Masyarakat tidak lagi memiliki sumber pendapatan ketika kegiatan ekonomi terpaksa berhenti akibat pandemi Covid-19. Ujungnya, perbankan bisa kesulitan. Jika ini terjadi, negara pula yang menanggung beban tersebut. Berbeda dengan dua krisis sebelumnya, Indonesia dan negara-negara lain juga belajar. Adanya reformasi dari krisis sebelumnya, perbankan kini lebih kuat ketika pandemi Covid-19 menghantam yang berujung krisis. Ini ditandai dengan rasio kecukupan modal atau Capital Adequacy Ratio/ yang kuat, mencapai dobel digit.  ""Maka (dalam krisis) yang ketiga ini bank sudah relatif kuat karena belajar dari dua krisis. Bank itu CAR tinggi, prudential regulationnya cukup sangat prudent,"" ujar dia. Menkeu juga menegaskan, pemerintah harus perlu mengejar pendapatan saat negara dan masyarakat dalam kondisi kuat dan sehat. Sebab, keuangan negara harus mampu mengantisipasi setiap ancaman krisis yang bisa saja terjadi. Pandemi bukanlah awal dan akhir dari krisis dunia. Kata Menkeu, masih ada kemungkinan besar krisis-krisis lain datang kembali dalam beberapa tahun ke depan, termasuk perubahan iklim hingga disrupsi digital. ""Saat ekonomi bagus, kita tetap harus akumulasi atau mengisi amunisi, defisit kita turunkan sehingga kita punya yang disebut fiscal space. Begitu terjadi hantaman, fiscal space itu bisa kita pakai dan manfaatkan,"" ujar Ani, panggilan karib Menkeu. Cek Berita dan Artikel yang lain di Google News",nasional
"Sukses melewati tiga kali krisis keuangan, begini strategi MAMI jadi yang terbaik",2024-08-21T02:10:45.534Z,"Selasa, 05 Oktober 2021 / 23:50 WIB",Reporter: Avanty Nurdiana | Editor: Avanty Nurdiana,https:////investasi.kontan.co.id/news/sukses-melewati-tiga-kali-krisis-keuangan-begini-strategi-mami-jadi-yang-terbaik,"KONTAN.CO.ID - JAKARTA. Tidak mudah bagi pengelola dana melewati masa pandemi. Aset investasi yang merosot dan kekhawatiran pemodal akan penempatan investasi membuat pengelola dan seperti manajer investasi harus pandai meyakinkan investor. Integritas menjadi hal penting bagi manajer investasi untuk bisa mendapatkan kepercayaan diri nasabah. Tidak tentang bagaimana Anda mendapatkan hasil investasi yang terbesar. Tapi bagaimana menjaga pengelolaan dana prudent dan bisa menenangkan para investor. Begitu pula yang menurut PT Manulife Aset Manajemen Indonesia paling penting dilakukan. Hal ini terbukti berhasil membuat manajer investasi yang kerap disebut dengan MAMI mampu melewati berbagai tantangan. Pengelola dana yang kini berusia 25 tahun ini, telah melewati berbagai krisis mulai dari krisis keuangan Asia pada tahun 1997. Dan krisis keuangan yang bermula dari subprime mortgage pada tahun 2007-2008 sampai kini krisis karena pandemi Covid-19. Baca Juga: Perjalanan 25 tahun MAMI turut mengembangkan industri reksadana Indonesia Di awal berdiri tahun 1996, MAMI berdiri dengan nama PT Dharmala Aset Manajemen berselang dua tahun manajer investasi harus menghadapi krisis moneter. Nilai tukar rupiah anjlok hingga mencapai Rp 16.800 per dollar AS. Ini menjadi pelemahan terdalam bagi rupiah sepanjang sejarah Indonesia. Pada tahun yang sama yakni 1998, Dharmala Aset Manajemen bertransformasi menjadi PT Dharmala Manulife Aset Manajemen dan kemudian menjadi Manulife Aset Manajemen pada 4 November 1998. Tapi bukan itu yang penting, di tengah krisis terburuk saat itu manajer investasi yang kini berusia 25 tahun ini mampu menilik peluang dengan menerbitkan reksadana perdananya. MAMI meluncurkan reksadana saham Phinisi Dana Saham pada 11 Agustus 1998, terinspirasi dari kapal khas Indonesia yang tahan terjangan ombak. Filosofi tersebut seakan mantra bagi MAMI karena dalam waktu enam tahun sejak peluncuran produk pertama. Dana kelolaan MAMI tumbuh hingga mencapai Rp 12 triliun pada tahun 2004. Hambatan yang dialami oleh dunia investasi tidak berhenti sampai di situ. Krisis ekonomi kembali terjadi lagi. Tahun 2008, krisis global berawal dari subprime mortgage kembali menghempas pasar modal di Indonesia. Indeks Harga Saham Gabungan (IHSG) anjlok hingga 50%. Dana kelolaan reksadana secara industri anjlok menjadi Rp 74,07 triliun dari tahun 2007 sebesar Rp 92,19 triliun. ""Satu yang pasti komitmen MAMI adalah menjaga kepercayaan para sahabat dalam mengelola investasi. Kami tidak pernah memberi janji tapi kami buktikan dengan prestasi,"" kata Presiden Direktur MAMI Afifa. Tak heran saat melewati krisis ekonomi karena pandemi Covid-19, MAMI terbukti mampu bertahan. Di tengah hantaman krisis kesehatan dan ekonomi global di tahun lalu, total dana kelolaan alias aset under management (AUM) meningkat 30% menjadi Rp 97,2 triliun. Baca Juga: MAMI jadi pemilik dana kelolaan reksadana syariah terbesar di Indonesia",investasi
"Bergantung pada Dollar, Rupiah Kerap Terpuruk Saat Krisis Keuangan",2024-08-21T02:10:45.830Z,,Premium User Only,https:////insight.kontan.co.id/news/bergantung-pada-dollar-rupiah-kerap-terpuruk-saat-krisis-keuangan-1,Premium Content - Not Scraped,insight
"Krisis keuangan Evergrande, bagaimana dampaknya ke sektor properti Indonesia?",2024-08-21T02:10:46.145Z,"Selasa, 28 September 2021 / 20:58 WIB",Reporter: Ridwan Nanda Mulyana | Editor: Khomarul Hidayat,https:////industri.kontan.co.id/news/krisis-keuangan-evergrande-bagaimana-dampaknya-ke-sektor-properti-indonesia,"KONTAN.CO.ID - JAKARTA. Beberapa waktu ini dunia dihebohkan dengan krisis yang melilit Evergrande, perusahaan properti raksasa dari China yang memiliki utang fantastis hingga US$ 300 miliar atau sekitar Rp 4.277 triliun. Risiko gagal bayar Evergrande dikhawatirkan mengguncang stabilitas keuangan China maupun global. Di sektor properti, pemerintah China pun telah merumuskan kebijakan ""three red lines (tiga garis merah)"" untuk mengurangi risiko tingkat utang dari sektor ini. Di tengah kondisi krisis Evergrande dan kerawanan industri properti di China, lantas, bagaimana dampaknya terhadap industri properti di Indonesia? Ketua Umum Real Estate Indonesia (REI) Paulus Totok Lusida meyakini, efek langsung terhadap industri properti di Indonesia tidak akan banyak. Totok lebih mewaspadai efek domino dari krisis Evergrande terhadap ekonomi China, bahkan global, yang pada gilirannya bisa berdampak pada ekonomi Indonesia. Jika efek domino terjadi, sektor properti pasti akan turut tertampar. ""Kalau kita bicara pengaruh, pasti ada, tapi semoga tidak banyak dari efek dominonya. Kalau di China krisis ini tidak ditangani dengan tepat, ekonomi terdampak, pembelian barang-barang ekspor dari Indonesia akan berkurang, otomatis mempengaruhi ekonomi Indonesia,"" kata Totok saat dihubungi Kontan.co.id, Selasa (28/9). Baca Juga: Ada potensi gagal bayar Evergrande, begini respons pasar domestik menurut Bahana TCW Namun, dia memperkirakan, efek domino dari Evergrande ini tidak akan sebesar seperti yang terjadi saat krisis Lehman Brothers pada tahun 2008. Selain dari segi nilai utang yang berbeda, bisnis Evergrande yang dominan di sektor properti lebih memiliki aset yang bernilai. Berbeda dengan Lehman Brothers yang hanya bermodalkan surat utang. Selain itu, penanganan krisis di Amerika Serikat (AS) dan China diprediksi tak akan sama. Berbeda dari paham ekonomi pasar bebas ala AS, Totok meyakini kebijakan sosialis dari China akan lebih melakukan proteksi. Menurutnya, kebijakan penyelamatan krisis dari pemerintah China akan menjadi penentu. ""Kalau dulu Lehman Brothers dampaknya besar karena yang dilakukan kan hanya ""kertas"", janji perputaran uang. Beda juga dengan pabrik, selama nggak produksi ya nol. Tapi kalau ini (Evergrande) kan properti, jadi ada aset, punya value yang hampir tidak mengalami penyusutan. Jadi domino effect yang timbul tidak akan sebesar Lehman Brothers. Sekarang gimana cara penanganan oleh pemerintah China,"" kata Totok. Totok juga berpandangan, proyek-proyek properti yang sedang ikut digarap pengembang China, akan terus berlanjut. Berbeda dengan pasar properti di China, Totok menekankan bahwa pangsa pasar properti di Indonesia masih sangat besar. Jika proyek properti terutama perumahan mangkrak, maka itu justru akan semakin membawa dampak negatif bagi likuiditas dan investasi perusahaan. ""Tidak ke arah situ, jadi tetap jalan dong (proyek properti). Indonesia pasarnya masih besar, kalau ditinggalkan dalam kondisi masih membangun, likuiditas dan investasi mereka jadi jelek,"" kata Totok. Baca Juga: Bagini dampak krisis utang Evergrande bagi China, AS, hingga Eropa",industri
"PDB Malaysia terkontraksi 5,6% di 2020, terburuk sejak Krisis Keuangan Asia 1998",2024-08-21T02:10:46.267Z,"Jumat, 12 Februari 2021 / 08:14 WIB",Sumber: The Straits Times | Editor: Barratut Taqiyyah Rafie,https:////internasional.kontan.co.id/news/pdb-malaysia-terkontraksi-56-di-2020-terburuk-sejak-krisis-keuangan-asia-1998,"KONTAN.CO.ID - KUALA LUMPUR. Perekonomian Malaysia semakin menurun pada kuartal keempat tahun 2020. Kondisi tersebut menyebabkan kontraksi yang lebih buruk atas Produk Domestik Bruto (PDB) dari yang semula diproyeksikan oleh pemerintah. Melansir The Straits Times, Kepala Departemen Statistik Malaysia Uzir Mahidin mengatakan pada Kamis (11/2/2021), PDB kuartal keempat Malaysia turun 3,4% - lebih besar dari penurunan 2,7% pada kuartal ketiga. PDB keseluruhan di 2020 menyusut 5,6%, dan menjadi kontraksi terburuk sejak Krisis Keuangan Asia 1998. Kementerian Keuangan Malaysia sebelumnya mengatakan, mereka memperkirakan ekonomi akan menyusut 4,5% pada 2020. Informasi saja, Malaysia mencatat pertumbuhan PDB 4,3% pada 2019. Antara Oktober dan Desember tahun lalu, sebagian besar negara berada di bawah pembatasan pergerakan baru, termasuk pembatasan perjalanan, ketika pemerintah berjuang untuk menangani gelombang ketiga infeksi Covid-19. Baca Juga: Jokowi bakal bertemu PM Malaysia hari ini, apa saja isu yang dibahas? Datuk Seri Uzir mengatakan bahwa sektor konstruksi, pertambangan dan jasa mencatat penurunan terbesar tahun lalu, masing-masing mengalami kontraksi sebesar 19,4%, 10% dan 5,5%. Gubernur Bank Negara Malaysia (BNM), bank sentral Malaysia, Nor Shamsiah Mohd Yunus, pada hari Kamis mengatakan bahwa pasar tenaga kerja diperkirakan akan tetap lemah pada semester pertama 2021 sebelum membaik. Tingkat pengangguran mencapai 4,8% pada akhir tahun 2020 setelah melampaui 5% pada pertengahan tahun, tingkat tertinggi dalam tiga dekade. Baca Juga: Belajar tentang vaksin Covid-19, PM Malaysia Muhyiddin terbang ke Indonesia hari ini Datuk Nor Shamsiah meyakini, ekonomi akan pulih pada 2021 sejalan dengan peluncuran vaksin dan pemulihan ekonomi global, meskipun ia memperingatkan bahwa risiko penurunan akibat situasi Covid-19 tetap ada. Mengutip The Straits Times, BNM diperkirakan akan merilis prospek pertumbuhan ekonomi yang direvisi pada tahun 2021 bulan depan. Proyeksi awal Kementerian Keuangan memperkirakan pertumbuhan tahun ini antara 6,5% hingga 7,5%. ",internasional
