Title,Scrapping Date,Article Date,Author,Link,Content,Category
Tugas baru Bank Indonesia (BI) jadi standby buyer SBN saat krisis keuangan,2024-08-21T02:10:46.482Z,"Kamis, 26 November 2020 / 11:34 WIB",Reporter: Yusuf Imam Santoso | Editor: Noverius Laoli,https:////nasional.kontan.co.id/news/tugas-baru-bank-indonesia-bi-jadi-standby-buyer-sbn-saat-krisis-keuangan,"KONTAN.CO.ID - JAKARTA.Tugas Bank Indonesia (BI) bakal bertambah. Setelah melakukan burden sharing dengan pemerintah yakni membeli Surat Berharga Negara (SBN) untuk pembiayaan dampak pandemi, kali ini bank sentral diposisikan sebagai standby buyer SBN apabila terjadi krisis keuangan. Kebijakan tersebut mengacu pada Rancangan Undang-Undang (RUU) Omnibus Law Sektor Keuangan atau RUU tentang Penanganan Permasalahan Perbankan, Penguatan Koordinasi, dan Penataan Ulang Kewenangan Kelembagaan Sektor Keuangan. Beleid yang didapat Kontan.co.id itu berdalih, dalam rangka pencegahan dan penanganan krisis keuangan, Bank Indonesia berwenang membeli SBN jangka panjang di pasar perdana. Sebab, dengan aturan saat ini BI dapat menolak kebijakan pemerintah. Artinya independensi BI yang diatur oleh Undang-Undang (UU) sebelumnya bakal diputarbalikan. Sebab, UU BI mendefinisikan independensi dalam pelaksanaan tugasnya bebas dari campur tangan pemerintah atau pihak lain. Dus, campur tangan pemerintah atau pihak lain dapat dituntut penjara serta pidana. Baca Juga: Sri Mulyani sebut ada indikasi inflasi jelang akhir tahun 2020 “Dalam rangka pencegahan dan/atau penanganan krisis sistem keuangan sebagaimana diatur UU mengenai pencegahan dan penanganan krisis sistem keuangan, BI juga berwenang termasuk tetapi tidak terbatas pada membeli surat berharga negara di pasar perdana,” sebagaimana Pasal 70 RUU Omnibus Law Sektor Keuangan. Masih dalam rangka pembiayaan krisis keuangan, BI juga berwenang memberikan akses pendanaan kepada korporasi/swasta dengan cara repo SBN yang dimiliki korporasi/swasta melalui perbankan. Selain itu, BI juga diarahkan untuk membeli repo SBN yang dimiliki Lembaga Penjamin Simpanan (LPS) untuk mengantisipasi dan pemenuhan kebutuhan likuiditas dalan penanganan bank bermasalah. “Dalam rangka BI menggunakan kewenangannya untuk membeli SBN di pasar perdana sebagaimana dimaksud, tidak berlaku ketentuan mengenai larangan BI memberi SBN di pasar perdana sebagaimana diatur dalam UU mengenai BI,” jelas Pasal 70 Ayat 3 RUU Omnibus Law Sektor Keuangan. Baca Juga: Rupiah di kurs tengah BI menguat 0,27% ke Rp 14.130 per dolar AS pada Kamis (26/11) Adapun skema dan mekanisme pembelian SBN jangka panjang di pasar perdana oleh BI akan ditetapkan oleh keputusan bersama antara Menteri Keuangan (Menkeu) dan Gubernur Bank Indonesia. Sebagai info, dalam RUU yang didapat Kontan.co.id itu dilatarbelakangi beberapa masalah diterbitkannya beleid tersebut. Pertama, belum optimalnya pelaksanaan peran dan fungsi lembaga sektor keuangan antara lain karena regulatory forbearance dalam mengambil keputusan saat terjadi krisis, utamanya dalam sektor  perbankan.",nasional
"Jaga-jaga ada krisis keuangan, pemerintah sodorkan RUU omnibus law sektor keuangan",2024-08-21T02:10:46.648Z,"Kamis, 26 November 2020 / 05:00 WIB",Reporter: Yusuf Imam Santoso | Editor: Khomarul Hidayat,https:////newssetup.kontan.co.id/news/jaga-jaga-ada-krisis-keuangan-pemerintah-sodorkan-ruu-omnibus-law-sektor-keuangan,"KONTAN.CO.ID - JAKARTA. Krisis ekonomi gara-gara dampak pandemi corona virus disease 2019 (Covid-19) memberi banyak pelajaran bagi Indonesia. Ekonomi yang memburuk  akibat sebaran virus corona ikut menyeret sektor keuangan, bahkan bukan mustahil memacu krisis ekonomi yang lebih dalam. Tak ingin kondisi itu berlangsung di tahun-tahun mendatang, pemerintah menyusun jaring pengaman dengan mengajukan Undang-Undang yang memperkuat stabilitas sistem keuangan. Bersama DPR, pemerintah berupaya memitigasi kemungkinan terjadi krisis keuangan dengan mengajukan Rancangan Undang-Undang (RUU) Omnibus Law Sektor Keuangan atau RUU tentang Penanganan Permasalahan Perbankan, Penguatan Koordinasi, dan Penataan Ulang Kewenangan Kelembagaan Sektor Keuangan. Dalam RUU yang didapat Kontan.co.id  dilatarbelakangi beberapa masalah diterbitkannya beleid tersebut. Pertama, belum optimalnya pelaksanaan peran dan fungsi lembaga sektor keuangan antara lain karena regulatory forbearance dalam mengambil keputusan saat terjadi krisis, utamanya dalam sektor perbankan. Baca Juga: LPS: Tak ada lagi lonjakan pertumbuhan simpanan di atas Rp 5 miliar Sebagai contoh, terkait menyatakan kondisi bank gagal. Kondisi ini menyebabkan langkah penyehatan bank menjadi terhambat, bahkan bukan mustahil terlambat. Hal tersebut disebabkan karena perbedaan pandangan mengenai penyehatan dan resolusi bank antara Otoritas Jasa Keuangan (OJK) dan Lembaga Penjamin Simpanan (LPS) yang justru berpotensi meningkatkan biaya penanganan menjadi lebih besar. Kedua, pengawasan mikroprudensial dan makroprudensial yang masih terpisah, khususnya perbankan mengakibatkan koordinasi antar otoritas menjadi kurang cepat dan efektif. Terlebih apabila tidak diatur dalam suatu dasar hukum yang kuat. Alhasil, pemerintah berencana segera membentuk Forum Pengawasan Perbankan Terpadu untuk penguatan koordinasi antarlembaga yang memiliki kewenangan, pengawasan, dan penyelesaian permasalahan di sektor keuangan, khususnya perbankan. Forum Pengawasan Perbankan Terpadu ini beranggotakan Otoritas Jasa Keuangan (OJK), Bank Indonesia (BI), dan Lembaga Penjamin Simpanan (LPS). “Forum bertugas merumuskan dan menetapkan indikator dan metodologi penilaian kondisi bank dengan menggunakan data dan informasi dalam sistem data dan informasi sektor keuangan terintegrasi dengan pendekatan proyeksi (forward looking),” sebagaimana dikutip dalam Pasal 4 RUU Penanganan Permasalahan Perbankan, Penguatan Koordinasi, dan Penataan Ulang Kewenangan Kelembagaan Sektor Keuangan yang diperoleh Kontan.co.id. Dalam Forum Pengawasan Perbankan Terpadu, Dewan Komisioner OJK merangkap sebagai Kelapa Eksekutif Pengawas Perbankan sebagai koordinator, lalu diikuti satu anggota Dewan Gubernur BI, dan satu anggota Dewan Komisioner LPS, serta sekretaris Komite Stabilitas Sistem Keuangan (KSSK). Pemerintah berharap, dengan kehadiran Forum Pengawasan Perbankan Terpadu nantinya bisa mengantisipasi potensi permasalahan perbankan secara lebih dini dan terkoordinasi. Koordinasi antarlembaga ini diperkuat dengan pembangunan dan pengembangan sistem data dan informasi sektor keuangan yang terintegrasi, sebagai single source of truth di sektor keuangan. Penataan kewenangan lembaga sektor keuangan dirombak besar-besaran. Ada empat kewenangan LPS yang baru. Pertama, LPS diperkuat dengan mandat risk minimizer untuk melakukan penanganan bank lebih dini, dengan melakukan persiapan penanganan permasalahan bank dan penempatan dana. Kedua, memperluas opsi pendanaan LPS dalam penanganan permasalahan bank. LPS berwenang untuk melakukan pengaturan resolution plan dan kebijakan single customer view. Adapun, LPS melaksanakan penjaminan simpanan berdasarkan kelompok nasabah. Ketiga, dalam mengelola kekayaannya, opsi investasi LPS diperluas yakni pada surat berharga yang diterbitkan pemerintah negara asing (hard currency) dengan opsi maksimal 100% dari total kekayaan LPS. Keempat, Ketua Dewan Komisioner LPS menetapkan keputusan akhir apabila musyawarah tidak tercapai mufakat dan bertanggung jawab kepada Presiden. Anggota Dewan Komisioner terdiri dari untur pihak independen atas usul Menteri Keuangan dan unsur ex-officio Kementerian Keuangan (Kemenkeu) yang diangkat oleh Presiden. Baca Juga: Begini strategi bank besar menekan laju NPL di tengah pandemi",newssetup
"Antisipasi krisis keuangan, pemerintah ajukan RUU omnibus law sektor keuangan",2024-08-21T02:10:46.918Z,"Rabu, 25 November 2020 / 20:54 WIB",Reporter: Yusuf Imam Santoso | Editor: Khomarul Hidayat,https:////nasional.kontan.co.id/news/antisipasi-krisis-keuangan-pemerintah-ajukan-ruu-omnibus-law-sektor-keuangan,"KONTAN.CO.ID - JAKARTA. Krisis yang terpacu pandemi corona virus disease 2019 (Covid-19) membuat banyak pelajaran bagi Indonesia. Pemburukan ekonomi akibat sebaran virus corona ikut menyeret sektor keuangan, bahkan bukan mustahil memacu krisis ekonomi yang lebih dalam. Tak ingin kondisi itu berlangsung di tahun-tahun mendatang, pemerintah menyusun jaring pengaman dengan mengajukan Undang-Undang yang memperkuat stabilitas sistem keuangan. Bersama DPR, pemerintah berupaya memitigasi kemungkinan terjadi krisis keuangan dengan mengajukan Rancangan Undang-Undang (RUU) Omnibus Law Sektor Keuangan atau RUU tentang Penanganan Permasalahan Perbankan, Penguatan Koordinasi, dan Penataan Ulang Kewenangan Kelembagaan Sektor Keuangan. Dalam RUU yang didapat Kontan.co.id  dilatarbelakangi beberapa masalah diterbitkannya beleid tersebut. Pertama, belum optimalnya pelaksanaan peran dan fungsi lembaga sektor keuangan antara lain karena regulatory forbearance dalam mengambil keputusan saat terjadi krisis, utamanya dalam sektor perbankan. Baca Juga: LPS: Tak ada lagi lonjakan pertumbuhan simpanan di atas Rp 5 miliar Sebagai contoh, terkait menyatakan kondisi bank gagal. Kondisi ini menyebabkan langkah penyehatan bank menjadi terhambat, bahkan bukan mustahil terlambat. Hal tersebut disebabkan karena perbedaan pandangan mengenai penyehatan dan resolusi bank antara Otoritas Jasa Keuangan (OJK) dan Lembaga Penjamin Simpanan (LPS) yang justru berpotensi meningkatkan biaya penanganan menjadi lebih besar. Kedua, pengawasan mikroprudensial dan makroprudensial yang masih terpisah, khususnya perbankan mengakibatkan koordinasi antar otoritas menjadi kurang cepat dan efektif. Terlebih apabila tidak diatur dalam suatu dasar hukum yang kuat. Alhasil, pemerintah berencana segera membentuk Forum Pengawasan Perbankan Terpadu untuk penguatan koordinasi antarlembaga yang memiliki kewenangan, pengawasan, dan penyelesaian permasalahan di sektor keuangan, khususnya perbankan. Forum Pengawasan Perbankan Terpadu ini beranggotakan Otoritas Jasa Keuangan (OJK), Bank Indonesia (BI), dan Lembaga Penjamin Simpanan (LPS). “Forum bertugas merumuskan dan menetapkan indikator dan metodologi penilaian kondisi bank dengan menggunakan data dan informasi dalam sistem data dan informasi sektor keuangan terintegrasi dengan pendekatan proyeksi (forward looking),” sebagaimana dikutip dalam Pasal 4 RUU Penanganan Permasalahan Perbankan, Penguatan Koordinasi, dan Penataan Ulang Kewenangan Kelembagaan Sektor Keuangan yang diperoleh Kontan.co.id. Dalam Forum Pengawasan Perbankan Terpadu, Dewan Komisioner OJK merangkap sebagai Kelapa Eksekutif Pengawas Perbankan sebagai koordinator, lalu diikuti satu anggota Dewan Gubernur BI, dan satu anggota Dewan Komisioner LPS, serta sekretaris Komite Stabilitas Sistem Keuangan (KSSK). Pemerintah berharap, dengan kehadiran Forum Pengawasan Perbankan Terpadu nantinya bisa mengantisipasi potensi permasalahan perbankan secara lebih dini dan terkoordinasi. Koordinasi antarlembaga ini diperkuat dengan pembangunan dan pengembangan sistem data dan informasi sektor keuangan yang terintegrasi, sebagai single source of truth di sektor keuangan. Penataan kewenangan lembaga sektor keuangan dirombak besar-besaran. Ada empat kewenangan LPS yang baru. Pertama, LPS diperkuat dengan mandat risk minimizer untuk melakukan penanganan bank lebih dini, dengan melakukan persiapan penanganan permasalahan bank dan penempatan dana. Kedua, memperluas opsi pendanaan LPS dalam penanganan permasalahan bank. LPS berwenang untuk melakukan pengaturan resolution plan dan kebijakan single customer view. Adapun, LPS melaksanakan penjaminan simpanan berdasarkan kelompok nasabah. Ketiga, dalam mengelola kekayaannya, opsi investasi LPS diperluas yakni pada surat berharga yang diterbitkan pemerintah negara asing (hard currency) dengan opsi maksimal 100% dari total kekayaan LPS. Keempat, Ketua Dewan Komisioner LPS menetapkan keputusan akhir apabila musyawarah tidak tercapai mufakat dan bertanggung jawab kepada Presiden. Anggota Dewan Komisioner terdiri dari untur pihak independen atas usul Menteri Keuangan dan unsur ex-officio Kementerian Keuangan (Kemenkeu) yang diangkat oleh Presiden. Baca Juga: Begini strategi bank besar menekan laju NPL di tengah pandemi",nasional
"Cuan Gede Saat Krisis Keuangan, Ini Kiat Investasi CEO TOYS Iwan Tjen Saat Pandemi",2024-08-21T02:10:48.216Z,,Premium User Only,https:////insight.kontan.co.id/news/cuan-gede-saat-krisis-keuangan-ini-kiat-investasi-ceo-toys-iwan-tjen-saat-pandemi,Premium Content - Not Scraped,insight
Sibuk Otak-atik Kewenangan OJK-BI demi Antisipasi Ancaman Krisis Keuangan,2024-08-21T02:10:48.440Z,,Premium User Only,https:////insight.kontan.co.id/news/sibuk-otak-atik-kewenangan-ojk-bi-demi-antisipasi-ancaman-krisis-keuangan,Premium Content - Not Scraped,insight
"Sri Mulyani: Saat krisis, kepastian hukum stabilitas sistem keuangan diperlukan",2024-08-21T02:10:48.697Z,"Kamis, 27 Agustus 2020 / 13:38 WIB",Reporter: Yusuf Imam Santoso | Editor: Khomarul Hidayat,https:////nasional.kontan.co.id/news/sri-mulyani-saat-krisis-kepastian-hukum-stabilitas-sistem-keuangan-diperlukan,"KONTAN.CO.ID - JAKARTA. Menteri Keuangan (Menkeu) Sri Mulyani mengatakan, saat krisis ekonomi dan keuangan terjadi, kepastian hukum sangat penting untuk merespon dampak ke depan agar bisa diatasi lebih tepat. Maklum, pandemi corona virus disease 2019 (Covid-19) membuat pemerintah harus melakukan langkah extraordinary. Dari sisi payung hukum, Peraturan Pemerintah Pengganti Undang-Undang (Perppu) dipilih pemerintah untuk merespons cepat agar ekonomi bisa diatasi. Perppu Nomor 1 Tahun 2020 yang telah menjadi Undang-Undang (UU) Nomor 2 Tahun 2020 menjadi landasan kebijakan keuangan negara dan stabilitas sistem keuangan untuk penanganan Covid-19, serta merespons ancaman yang membahayakan. Sri Mulyani menyampaikan, Perppu 1/2020 itu dipersiapkan maraton dan cepat. Pemerintah mencoba mengantisipasi, dampak ekonomi dan stabilitas sistem keuangan yang sebelumnya tidak pernah terjadi. “Termasuk dalam Perppu ini langkah ekonomi perlindungan hukum kepada pemerintah dan lembaga keuangan dalam bidang Komite Stabilitas Sistem Keuangan (SSKK). Pejabat-pejabat (KSSK) ini harus melakukan berbagai tindakan langkah, yang memilki implikasi yang dirasa kahar,” kata Menkeu, Kamis (27/8). Baca Juga: Luhut: Nasib ekonomi Indonesia masih lebih baik dari negara lain Setali tiga uang, pemerintah tengah menyiapkan scara spesifik Perppu terkait reformasi stabilitas sistem keuangan. Sebab, payung hukum saat ini dinilai perlu direvisi karena tidak cukup untuk menangani krisis dan dampaknya saat keadaan darurat seperti saat ini. “Implikasi-implikasi yang menyebabkan dunia usaha dan perbankan, akan dihadapkan pada kondisi ketidak mampuan memenuhi perjanjian kontraknya, dan di sinilah muncul kebituhan untuk bernegosiasi untuk restructuring atau dalam hal ini mungkin akan sangat terjadi perselisihan yang membutuhkan penanganan,” ujar Menkeu. Kamis (27/8), dalam Dialog Internasional; Tantangan dan Peran Peradilan dalam mendukung Pemulihan Ekonomi Pasca Krisis, Sri Mulyani menyampaikan, langkah-langkang pemulihan ekonomi yang telah dan akan ditetapkan pemeirntah, diharapkan bisa berjalan dengan kepastian hukum. “Sehingga bisa efektif dan cepat membantu masyarakat dan dunia usaha agar bisa bertahan dari Covid-19 tapi juga bisa kembali pulih dari kondisi kedaruratan saat ini,” kata Sri Mulyani. Baca Juga: Enam sektor utama penerimaan pajak ini masih tertekan akibat Covid-19, apa saja? Cek Berita dan Artikel yang lain di Google News",nasional
"Tangani Krisis Akibat Pandemi, Pemerintah Siapkan Perpu Stabilitas Sistem Keuangan",2024-08-21T02:10:49.485Z,,Premium User Only,https:////insight.kontan.co.id/news/tangani-krisis-akibat-pandemi-pemerintah-siapkan-perpu-stabilitas-sistem-keuangan,Premium Content - Not Scraped,insight
Beda Krisis Covid-19 dengan Krisis Keuangan Lain,2024-08-21T02:10:49.930Z,"Jumat, 17 April 2020 / 08:00 WIB",Reporter: Harris Hadinata | Editor: Harris Hadinata,https:////kolom.kontan.co.id/news/beda-krisis-covid-19-dengan-krisis-keuangan-lain,"KONTAN.CO.ID - JAKARTA. Hampir semua negara di dunia sedang berperang melawan pandemi Covid-19. Pasar modal juga ikut terpengaruh dan tertekan. Kapan kira-kira pasar modal akan kembali pulih? Apa yang pelaku pasar harus lakukan menghadapi krisis kali ini? Krisis kali ini lebih kompleks dari dua krisis besar sebelumnya, yaitu krisis ekonomi 19981999 dan krisis subprime mortgage Amerika Seritkat (AS) di 2008-2009. Pada krisis ekonomi 1998-1999, krisis berpusat di kawasan Asia. Krisis bermula di Thailand dan menyebar negara lain di Asia, yakni Indonesia, Malaysia dan Korea Selatan. Indonesia juga mengalami pukulan akibat melemahnya kurs. Pelemahan nilai tukar ini memukul sektor rill yang punya utang dalam mata uang asing dan yang mengandalkan bahan baku impor. Akibatnya, kredit macet di sektor perbankan naik. Di sisi lain terjadi gejolak politik di Indonesia dan menambah ketidakpastian ekonomi. Terjadi rush pada perbankan akibat krisis multidimensi ini dan rumor gagal bayar perbankan, yang menyebabkan runtuhnya system keuangan Indonesia. Krisis subprime mortgage berpusat di AS akibat kurang prudent-nya penyaluran kredit perumahan. Periode rendahnya suku bunga untuk mendorong ekonomi dan apresiasi harga rumah mendorong spekulasi di sektor properti. Tapi banyak pemberi kredit perumahan kurang hati-hati, sehingga agunan tidak sesuai nilai fundamental. Selain itu ada berbagai permasalahan, mulai dokumen tidak lengkap hingga rasio debt to income dan payment to income (PTI) yang terlalu tinggi. Terjadilah krisis subprime mortgage, yang dianggap krisis kedua terbesar di dunia setelah krisis 1930. Pada saat krisis terjadi aliran dana keluar dari perekonomian Indonesia yang menimbulkan tekanan pada nilai tukar. Investor asing kembali ke negaranya akibat krisis tersebut. Tetapi setelah The Fed menurunkan suku bunga dan melakukan quantitative easing (QE), pasar saham dunia segera pulih. Indonesia juga hanya terdampak satu tahun. Sesudah itu pasar saham segera pulih karena perekonomian Indonesia tidak terlalu terdampak. Sekarang ada krisis Covid-19. Krisis ini sedikit berbeda. Dunia menghadapi masalah kesehatan, di mana ketakutan dan kekhawatiran akan tertular penyakit dan risiko kematian mempengaruhi kehidupan sehari-hari. Virus korona tipe baru ini punya kecepatan penyebaran tinggi, meskipun di awal tingkat kematian tercatat relatif rendah, cuma sekitar 3,4%. Tetapi ketika penyebarannya tidak terkendali, fasilitas kesehatan pun menjadi tidak mencukupi untuk merawat pasien. Kondisi ini menaikkan angka kematian sampai sekitar 10%. Upaya yang dilakukan adalah memutus rantai penyebaran virus dengan lockdown, social distancing dan physical distancing. Konsekuensinya berbagai aktivitas kehidupan yang mempengaruhi perekonomian melambat, atau bahkan terhenti. Bila sebuah bisnis berhenti, akan muncul masalah. Sebab, masih ada biaya-biaya operasi yang ditanggung seperti biaya sewa, gaji, cicilan utang dan bunga. Beberapa perusahaan sudah melakukan PHK terhadap karyawan akibat turunnya omzet dan atau berhentinya operasi selama pandemi Covid-19. Kita perlu mengapresiasi segala stimulus yang digelontorkan pemerintah, demi membantu dunia usaha dan masyarakat keluar dari masalah. Pemerintah Indonesia juga mengikuti langkah berbagai negara lain, yang mengeluarkan stimulus untuk melawan dampak penyebaran Covid-19. Pemerintah AS merencanakan mengeluarkan dana sampai US$ 2 triliun, ditambah kebijakan pembelian surat berharga oleh The Fed yang mencapai US$ 2,3 triliun. Di Indonesia, kebijakan Otoritas Jasa Keuangan (OJK) mengatur tata cara pengajuan keringanan kredit bank dan pinjaman leasing bagi pihak yang terdampak Covid-19 sangat baik. Ini bisa mengurangi beban UKM dan pekerja informal. Tapi, kebijakan seperti ini hanya mampu mendorong pasar saham naik sesaat dan kemudian melemah kembali. Pelaku pasar terlihat lebih fokus pada kapan pandemi Covid-19 mencapai puncak dan mulai turun. Pasar keuangan akan sangat optimistis ketika jumlah yang sembuh lebih banyak daripada kasus baru. Sekarang, sebesar apapun stimulus, selama roda ekonomi tidak dapat diputar maka tidak akan terjadi pemulihan. Tanda-tanda kasus Covid-19 mencapai puncak mulai terlihat di Eropa, yang merupakan wilayah terbesar terdampak Covid-19. Tetapi sekarang pelaku pasar juga fokus kira-kira sampai kapan virus ini bisa ditanggulangi, atau bahasa sederhananya sampai kapan aktivitas ekonomi bisa normal kembali. Krisis kali ini menjadi kompleks karena semua pihak kesulitan memperkirakan sampai kapan masalah ini akan berakhir. Belajar dari dua krisis di atas, bila krisis tidak merusak fundamental ekonomi, maka pemulihan akan cepat. Tetapi bila pandemi terjadi dalam waktu tiga sampai empat bulan, diperkirakan akan merusak fundamental perekonomian. Artinya, perekonomian akan butuh waktu untuk pulih. Ketika bisnis bermasalah, seperti kehabisan dana segar, terjadi PHK karyawan dan kredit macet, upaya bangkit akan memakan waktu. Pelaku pasar perlu mencermati hal ini dengan memilih saham-saham yang terdampak Covid-19, sehingga harganya saat ini sudah turun cukup signifikan. Tetapi perlu dicari sektor yang cepat pulih kembali ketika pandemi Covid-19 berlalu. Lakukan pembelian saham tersebut dan simpan dalam dua sampai tiga tahun. Tetapi sekarang, yang penting jaga kesehatan, stay at home dan patuhi ketentuan pembatasan sosial berskala besar (PSBB). PSBB diharapkan mampu mempercepat penyelesaian masalah Covid-19, sehingga pasar saham segera bangkit. Cek Berita dan Artikel yang lain di Google News",kolom
WTO ramal: Perdagangan global merosot tajam dibanding krisis keuangan 2008,2024-08-21T02:10:50.322Z,"Rabu, 08 April 2020 / 22:14 WIB",Reporter: SS. Kurniawan | Editor: S.S. Kurniawan,https:////internasional.kontan.co.id/news/wto-ramal-perdagangan-global-merosot-tajam-dibanding-krisis-keuangan-2008,"KONTAN.CO.ID - BRUSSELS. Organisasi Perdagangan Dunia (WTO) meramalkan, perdagangan global akan menyusut lebih tajam tahun ini dibanding krisis keuangan global 2008, sebelum rebound pada 2021 ketika pandemi virus corona mereda. WTO mengatakan, perdagangan global akan merosot pada tahun ini sebesar 13% hingga 32% dari tahun lalu, memberikan jangkauan luas karena begitu banyak dampak ekonomi dari krisis kesehatan yang tidak pasti. ""Angka-angka ini jelek, tidak ada cara untuk mengatasi itu,"" kata Direktur Jenderal WTO Roberto Azevedo dalam sebuah pernyataan, Rabu (8/4), seperti dikutip Reuters. Baca Juga: Gara-gara corona, harga sederet komoditas pangan ini diramal bakal naik ""Tapi, rebound cepat dan kuat adalah mungkin. Keputusan yang diambil sekarang akan menentukan bentuk masa depan dari pemulihan dan prospek pertumbuhan global,"" ujar dia. Menjaga pasar tetap terbuka, menurut Azevedo, akan sangat penting untuk memacu investasi baru. Negara-negara yang bekerjabersama akan melihat pemulihan yang lebih cepat ketimbang masing-masing bertindak sendiri.",internasional
"Cegah AS jatuh ke krisis keuangan, ini langkah habis-habisan The Fed",2024-08-21T02:10:50.740Z,"Senin, 23 Maret 2020 / 21:47 WIB",Sumber: CNN | Editor: Khomarul Hidayat,https:////internasional.kontan.co.id/news/cegah-as-jatuh-ke-krisis-keuangan-ini-langkah-habis-habisan-the-fed,"KONTAN.CO.ID - NEW YORK. Bank sentral Amerika Serikat (AS), The Federal Reserve memberi sinyal akan melakukan apa saja untuk menyelamatkan ekonomi AS dari depresi akibat terkena dampak virus corona. Senin (23/3), The Fed mengumumkan secara besar-besaran mempercepat rencana penyelamatannya dengan mengumumkan pembelian obligasi tanpa batas, tiga fasilitas kredit baru dan program pinjaman Main Street. Baca Juga: Goldman suntikkan US$ 1 miliar ke pasar uangnya setelah penarikan besar-besaran Secara keseluruhan, The Fed menyebutkan, program-program baru akan menyediakan hingga US$ 300 miliar pembiayaan baru untuk ekonomi. The Fed berusaha sekuat tenaga untuk mencegah krisis kesehatan berubah menjadi krisis keuangan. Yang terpenting, The Fed berjanji untuk membeli obligasi ""dalam jumlah yang dibutuhkan"" untuk mendukung pasar, menandakan tidak ada batasan dalam upaya penyelamatannya. Kekhawatiran resesi ekonomi dan krisis likuiditas telah menghancurkan pasar saham selama sebulan terakhir dan menyebabkan sebagian pasar obligasi tidak berfungsi. The Fed menyatakan akan mendukung rumah tangga dan bisnis Amerika, tetapi mengakui ekonomi AS akan menghadapi gangguan parah. ""Pandemi virus corona menyebabkan kesulitan besar di seluruh Amerika Serikat dan di seluruh dunia,"" kata The Fed dalam sebuah pernyataan yang dikutip CNN. Baca Juga: RUU corona AS: Ada bantuan keluarga US$ 3.000 dan tambahan likuiditas US$ 4 triliun",internasional
