Title,Scrapping Date,Article Date,Author,Link,Content,Category
Krisis keuangan Turki meletus!,2024-08-21T02:10:55.714Z,"Sabtu, 11 Agustus 2018 / 10:58 WIB",Reporter: Khomarul Hidayat | Editor: Khomarul Hidayat,https:////investasi.kontan.co.id/news/krisis-keuangan-turki-meletus,"KONTAN.CO.ID - NEW YORK. Turki memasuki krisis keuangan. Jumat (10/8), nilai tukar lira Turki terjun bebas hingga 17% ke level terendah sepanjang masa. Sepanjang tahun ini, kurs lira sudah tersungkur hingga 42% terhadap dollar Amerika Serikat (AS). Efek domino krisis keuangan Turki memicu kecemasan bahwa bakal menular dengan cepat ke pasar keuangan Eropa dan pasar keuangan negara berkembang lainnya. Jumat (10/), efek krisis Turki sudah mulai merembet ke bursa saham dunia. Aksi jual melanda bursa saham global, termasuk di bursa Wall Street. Indeks Dow Jones Industrial Average ditutup turun 0,77% ke level 25.313,14, indeks S&P 500 melorot 0,71% ke 2.833,28 dan indeks Nasdaq Composite turun 0.67% ke 7.839,11. Indeks The MSCI All-Country yang merekam indeks saham di 47 negara turun 1,22% pada penutupan perdagangan akhir pekan ini. Investor beralih dari aset berisiko ke aset safe haven. Tak ayal, sejumlah aset safe haven pun menanjak. Mengutip Reuters, yen Jepang, semisal, mencapai level tertinggi dalam satu bulan yakni menjadi 113,38 per dollar AS. Sementara indeks dollar, yang mengukur kekuatan mata uang dollar AS  terhadap enam mata uang utama dunia, menembus level 96 atau level tertinggi sejak Juli 2017. Bloomberg melaporkan, banyak investor mengatakan negara dengan nilai produk domestik bruto (PDB) seniali US$ 900 miliar itu sudah menuju tebing krisis. Aksi jual melambangkan mosi tidak percaya atas  sistem pemerintahan baru yang memberi wewenang tak tertandingi kepada Presiden Tayyip Erdogan karena telah melumpuhkan birokrasi di negeri tersebut. ""Secara textbook ini adalah krisis mata uang yang berubah menjadi krisis utang dan likuiditas karena kesalahan kebijakan,"" kata Win Thin, ahli strategi di Brown Brothers Harriman & Co. di New York seperti dilansir Bloomberg. Investor  mengatakan bahwa hanya tindakan ekstrem yang bisa membawa Turki kembali terangkat dari jurang krisis. Opsi yang sebelumnya tabu seperti bailout internasional atau kontrol modal, sekarang mulai dibahas di lingkaran keuangan Turki. Di sejumlah bank di Turki, permintaan penarikan mata uang asing telah meroket dan masing-masing bank melaporkan bahwa mereka membutuhkan lebih banyak pasokan uang valas dari kantor pusat. Sabtu ini (11/8), bank-bank di Turki akan mengadakan pertemuan darurat dengan regulator keuangan setelah sistem perbankan mengalami kekacauan lantaran kekurangan pasokan dollar AS. Regulator keuangan Turki pada  Jumat (10/8), sudah meminta bank-bank mempelajari dampak dari bunga dan guncangan nilai tukar lira dan hasilnya akan dibahas pada pertemuan darurat, Sabtu ini. Menurut tiga orang sumber Bloomberg, pertemuan darurat itu juga akan membahas situasi likuiditas di negara tersebut. Para bankir lain yang enggan disebut identitasnya mengonfirmasi  kenaikan permintaan  mata uang asing. Permintaan valas melonjak lantaran publik Turki khawatir dengan penerapan  kontrol modal untuk mencegah krisis. Pemerintah Turki telah berulang kali menyatakan bahwa mereka tidak akan memaksakan kontrol modal. Orang-orang Turki memang memegang sebagian besar tabungan mereka dalam mata uang asing sebagai perlindungan terhadap inflasi Turki yang tak terkendali dan  karena pelemahan mata uang lira. Menurut data terbaru, sekitar setengah dari deposito di sistem perbankan Turki dalam denominasi dollar AS atau euro. Krisis mata uang amat rentan bagi Turki. Sebab tumpukan utang luar negeri korporasi Turki terbilang besar. Pinjaman luar negeri perusahan swasta Turki telah setara sekitar 40% output ekonomi tahunan Turki. Selama setahun terakhir, beberapa konglomerat terbesar dan paling dihormati di negara itu telah meminta restrukturisasi utang miliaran dolar utang luar negeri, dan banyak lagi yang pasti akan mengikuti setelah kurs lira makin terperosok. Lira makin terjun bebas setelah Bank Sentral Turki tidak segera menaikkan suku bunga lantaran Presiden Erdogan tak mau bunga naik. Kini para investor percaya bahwa Bank  Sentral Turki harus mengesampingkan keinginan Erdogan dan mengumumkan peningkatan signifikan ke patokan suku bunga acuan hingga 17,75% untuk menghentikan lira tak makin jatuh bebas. ""Sepertinya ini kecelakaan total, jadi mereka perlu bertindak sekarang. Lira akan terus jatuh jika mereka tidak menaikkan suku hari ini,"" tandas Morten Lund, ahli strategi di Nordea Bank AB Kopenhagen. Senada, Paul Greer, analis Fidelity International di London mengatakan, kenaikan suku bunga agresif oleh bank sentral hingga 1.000 basis poin, akan menjadi ""awal yang baik"" untuk mengendalikan lira Cek Berita dan Artikel yang lain di Google News",investasi
"Kurs lira merosot, krisis keuangan menghantui Turki",2024-08-21T02:10:55.919Z,"Selasa, 07 Agustus 2018 / 21:49 WIB",Reporter: Khomarul Hidayat | Editor: Khomarul Hidayat,https:////investasi.kontan.co.id/news/kurs-lira-merosot-krisis-keuangan-menghantui-turki,"KONTAN.CO.ID - ISTANBUL. Krisis keuangan menghantui Turki. Mata uang Turki, lira terus merosot ke level terendah. Begitu pula harga obligasi jatuh karena kekhawatiran yang meningkat atas perselisihan diplomatik dengan Amerika Serikat (AS). Merosotnya lira makin menyulitkan Bank Sentral Turki untuk kembali menstabilkan mata uang ini. Mengutip Bloomberg, Selasa (7/8), kurs lira melemah 0,5% ke level 5,35 per dollar AS. Sehari sebelumnya, kurs lira sempat merosot hingga 6,7%. Sepanjang tahun ini, nilai tukar lira sudah amblas 29% terhadap dollar AS. Sementara yield atau imbal hasil obligasi Turki tenor 10 tahun melambung di atas 20% ke level tertinggi sepanjang masa yakni sebesar 20,09%. ""Ini akan tetap seperti ini, sampai Bank Sentral Turki berkomitmen tanpa syarat untuk menaikkan suku bunga sampai inflasi berubah. Pasar membutuhkan komitmen keras semacam itu,"" tulis Henrik Gullberg, ahli strategi di Nomura International Plc melalui email seperti dilansir Bloomberg. Sebetulnya  pembuat kebijakan Turki sudah mengubah aturan cadangan untuk meningkatkan likuiditas valuta asing bank. Namun tidak cukup untuk menopang lira. Bank Sentral Turki menurunkan jumlah maksimum pemberian pinjaman dalam mata uang asing sehingga akan ada tambahan cadangan valas yangbparkir di bank sentral. Langkah ini akan memberi mereka tambahan cadangan valas hingga US$ 2,2 miliar. ""Ini adalah perubahan yang bodoh, sementara lira sudah jatuh bebas,"" kata Win Thin, ahli strategi Brown Brothers Harriman di New York. Rontoknya mata uang lira telah kemampuan perusahaan untuk membayar kembali pinjaman mata uang asing mereka, memicu inflasi serta memberikan tekanan pada bank sentral untuk terus menaikkan suku bunga. Bank Sentral Turki dijadwalkan melakukan pertemuan berikutnya untuk menentukan arah suku bunga pada 13 September mendatang. Analis Commerzbank, Lutz Karpowitz mengatakan, perubahan mekanisme cadangan valas hanya akan melemahkan lira. ""Keengganan untuk menaikkan suku adalah sinyal yang dovish  dan kemungkinan akan memicu lebih banyak kerugian bagi lira,"" katanya. Shamaila Khan, Director of Emerging Market Debt AllianceBernstein’s di New York mengatakan, masalah sebenarnya tidak ada tanda-tanda independensi bank sentral atau kebijakan fiskal ketat yang diperlukan untuk menstabilkan lira. ""Pihak berwenang tidak menunjukkan tanda-tanda untuk kembali ke kebijakan yang lebih ortodoks,"" ujarnya. Menurut Khan, yang dibutuhan untuk menguatkan lira adalah independensi Bank Sentral Turki, kebijakan fiskal yang ketat, serta program Dana Moneter Internasional (IMF). Cek Berita dan Artikel yang lain di Google News",investasi
Perang dagang bisa memantik krisis keuangan global,2024-08-21T02:10:56.227Z,"Kamis, 12 Juli 2018 / 15:19 WIB",Reporter: Khomarul Hidayat | Editor: Khomarul Hidayat,https:////investasi.kontan.co.id/news/perang-dagang-bisa-memantik-krisis-keuangan-global,"KONTAN.CO.ID - SINGAPURA. Perang dagang bukan hanya membuat arus perdagangan global tersendat. Efek perang dagang bisa lebih dahsyat lagi yakni memicu krisis finansial. Apalagi, AS berencana menetapkan 10% tarif terhadap barang-barang impor China hingga senilai US$ 200 miliar, setelah awal Juli ini mengenakan tarif impor senilai US$ 34 miliar. Adalah Mark Mobius, seorang investor veteran yang juga bekas Executive Chairman Franklin Templeton Investments, yang meramalkan itu. Ia mengatakan, efek perang dagang dan penguatan kurs dollar AS telah membebani pasar keuangan. Tambah lagi, likuiditas yang lebih ketat karena The Federal Reserve dan Bank Sentral Eropa menormalkan kebijakan moneter dengan menaikkan suku bunga. Kenaikan suku bunga membuat era pendanaan murah berakhir. Nah, akhir dari era bunga murah ini bisa memantik krisis. ""Tidak diragukan lagi, kita akan melihat krisis keuangan cepat atau lambat, karena kita harus ingat kita telah keluar dari era pendanaan murah,""  kata Mobius yang kini mengelola Mobius Capital Partners LLP, dalam sebuah wawancara dengan Bloomberg di Singapura, Rabu (11/7). Menurutnya, akan ada tekanan nyata bagi banyak perusahaan-perusahaan yang selama ini bergantung pada pendanaan murah untuk menjaga kelangsungan bisnisnya. Bukan itu saja, kenaikan suku bunga bisa menjadi kontra-produktif bagi negara-negara dengan jumlah utang yang tinggi. Faktor-faktor itu yang akan membebani pasar finansial, terutama di negara-negara emerging market. Mobius memperkirakan,  indeks MSCI Emerging Markets bakal turun 10% dari level saat ini pada akhir tahun 2018 nanti. Pun mata uang negara berkembang juga berada di bawah tekanan, tercermin dari indeks mata uang MSCI  Emerging Markets yang telah turun sekitar 6% dari level tertinggi tahun ini pada akhir Maret 2018. Itu memaksa bank-bank sentral negara emerging market seperti Turki, Argentina dan Indonesia menaikkan suku untuk menjaga mata uang mereka tak makin jatuh. Cek Berita dan Artikel yang lain di Google News",investasi
"Waspadai efek krisis keuangan Argentina, tapi jangan panik",2024-08-21T02:10:56.520Z,"Jumat, 25 Mei 2018 / 08:14 WIB",Reporter: Dityasa H Forddanta | Editor: Wahyu T.Rahmawati,https:////investasi.kontan.co.id/news/waspadai-efek-krisis-keuangan-argentina-tapi-jangan-panik,"KONTAN.CO.ID - JAKARTA. Krisis keuangan di Argentina memantik kekhawatiran negara emerging market lainnya berpotensi mengalami kondisi serupa. Sebab, aliran dana asing diprediksi masih bakal keluar dari emerging market. The Institute of International Finance (IIF) menyebutkan, kebijakan The Federal Reserves menaikkan suku bunga memberikan tekanan pada negara lain untuk memperketat kebijakan moneter dan mengurangi likuiditas dollar AS. Robin Brooks, Kepala Ekonom IIF, menulis dalam laporannya, krisis di Argentina bisa menjadi indikasi awal hal yang sama terjadi di tempat lain. Nah, banyak pengamat menilai Indonesia juga termasuk salah satu negara yang berpotensi terdampak. Sama seperti Argentina, kurs rupiah tertekan ke level terendah. Rupiah sudah melemah 4.,09% sejak awal tahun. Sekadar informasi, peso Argentina sempat melemah hingga 34,16% sejak awal tahun menjadi US$ 24,98 per dollar AS, Kamis (24/5). Jumat lalu, bank sentral Argentina terpaksa mengerek suku bunga jadi 40% dari 33,25% demi menahan kejatuhan peso, sehari setelah suku bunga dinaikkan dari sebelumnya 30,25%. Seminggu sebelumnya, suku bunga Argentina masih 27,25%. Masih berisiko Pasar menilai kondisi Indonesia mirip, lantaran BI juga mengerek suku bunga jadi 4,5% demi menjaga kurs rupiah. BI juga masih berpotensi menaikkan suku bunga. Kepala Riset BNI Sekuritas Norico Gaman menilai kondisi di Argentina memang bisa terulang di Indonesia. Ini bisa terjadi jika pemerintah tak mampu mengelola perekonomian dan anggaran negara dengan baik. Ia menilai, idealnya defisit neraca berjalan tidak dibiayai oleh utang luar negeri, melainkan dari pendapatan pajak dan investasi asing di sektor riil. ""Ini untuk mengurangi volatilitas pelarian modal asing jangka pendek,"" jelas dia, Kamis (24/5). David Sutyanto, Kepala Riset Ekuator Swarna Sekuritas Indonesia, melihat, pemerintah masih cenderung menitikberatkan kebijakan ekonomi dari sisi moneter ketimbang fiskal. Padahal, tak tercapainya target (shortfall) pajak masih terus saja terjadi. ""Ini perlu diperbaiki,"" imbuh David. Emiten juga tampak menahan ekspansi pada tahun ini. Hal ini terlihat dari berbagai aksi pembagian dividen. Tak sedikit emiten kelas kakap membagi dividen dalam jumlah besar. Ini menjadi sinyal emiten menahan laju ekspansi. Ada unsur ekspansi emiten dalam sebuah pertumbuhan ekonomi. ""Karena kalau memang berekspansi, mereka menahan laba ketimbang membagikan dividen,"" imbuh David. Norico berpendapat, kenaikan IHSG kemarin juga belum cukup kuat mencerminkan fundamental ekonomi Indonesia yang solid. Stabilitas pasar kemungkinan baru terlihat pada semester dua nanti. ""Jadi, IHSG yang naik kencang kemarin lebih karena technical rebound jangka pendek,"" tegas Norico. Cek Berita dan Artikel yang lain di Google News",investasi
Inilah resep penangangan krisis keuangan ala OJK,2024-08-21T02:10:56.719Z,"Rabu, 05 April 2017 / 23:11 WIB",Reporter: Titis Nurdiana | Editor: Titis Nurdiana,https:////keuangan.kontan.co.id/news/inilah-resep-penangangan-krisis-keuangan-ala-ojk,"Otoritas Jasa Keuangan (OJK) mengeluarkan tiga aturan baru. Ini adalah aturan turunan atas Undang Undang Pencegahan dan Penanganan Krisis Sistem Keuangan atau UU PPKSK. Sesuai amanat UU PPKSK, OJK wajib menerbitkan aturan turunan dalam jangka waktu setahun setelah UU PPSKS terbit. Aturan turunan ini nampaknya memberikan kejelasan atas kebijakan penanganan krisis. Muliaman Hadad, Ketua Dewan Komisioner OJK mengatakan, UU PPKSK memberikan landasan hukum bagi OJK dan otoritas lain yakni Bank Indonesia (BI), Lembaga Penjaminan Simpanan (LPS) untuk menangani stabilitas sistem keuangan. Harapannya: keluarnya berbagai aturan tersebut, otoritas yang mengawasi, mengatur industri keuangan bisa bertindak cepat dan tepat sasaran.  Tentu saja, aturan ini tak menjamin industri keuangan terpapar krisis di sistem keuangan. Inilah detail tiga  peraturan OJK (POJK itu) Status pengawasan bank terdiri dari pengawasan normal, intensif, dan khusus. 1.       POJK tentang Penetapan status dan tindak lanjut pengawasan bank umum Kriteria pengawasan bank intensif -          Rasio kecukupan modal atau capital adequacy ratio (CAR) 8% atau lebih besar, tapi masih di bawah ketentuan rasio CAR sesuai profil risiko yang wajib dipenuhi -          Rasio modal inti (tier 1) kurang dari persentase tertentu yang ditetapkan OJK -          Giro Wajib Minimum rupiah sama atau lebih besar dari kewajiban rasio yang harus dipenuhi, tetapi bank itu memiliki permasalahan likuiditas yang mendasar -          Rasio kredit atau pembiayaan bermasalah net lebih dari 5% dari total kredit atau pembiayaan -          Tingkat kesehatan bank dengan peringkat komposit empat atau lima, dan/atau tingkat kesehatan bank peringkat komposit tiga dan peringkat tata kelola dengan peringkat empat atau lima Jangka waktu bank dalam pengawasan intensif paling lama satu tahun dan dapat diperpanjang paling banyak satu kali dengan rentang waktu maksimal satu tahun Kriteria pengawasan bank khusus -          CAR kurang dari 8% -          GWM rupiah kurang dari rasio yang ditetapkan Jangka waktu bank dalam pengawasan khusus paling lama tiga bulan 2.       POJK tentang Bank Perantara Prinsip umum pendirian bank perantara -          Bank perantara hanya dapat didirikan dan melakukan kegiatan usaha setelah mendapat izin dari OJK -          Bank perantara dapat digunakan untuk menerima pengalihan aset dan kewajiban lebih dari satu bank -          Kepemilikan saham pada bank perantara dikecualikan dari ketentuan undang-undang perseroan terbatas dan batas maksimum kepemilikan saham -          Bank Perantara dapat menggunakan infrastruktur dari bank asal -          Bank perantara hanya dapat menerima pengalihan sebagian atau seluruh aset dan kewajiban bank asal yang memiliki kriteria tertentu 3.       POJK tentang rencana Aksi (recovery plan) bagi bank sistemik Pokok-pokok POJK terkait rencana aksi -          Bank sistemik wajib menyampaikan rencana aksi paling lambat 29 Desember 2017 -          Bank sistemik diharuskan untuk memiliki pedoman rencana aksi antara lain memuat serangkaian prosedur, mekanisme dan pihak-pihak yang bertanggung jawab terkait rencana aksi -          Pengaturan mengenai kewajiban pemegang saham pengendali dan pihak lain untuk menambah modal bank sistemik dan mengubah jenis utang atau investasi tertenut menjadi modal bank sistemik bila terjadi permasalahan solvabilitas yang menganggu dan membahayakan. Untuk itu bank sistemik wajib menyampaikan instrumen investasi atau utang yang bisa dikonversi menjadi modal paling lambat 31 Desember 2018  Cek Berita dan Artikel yang lain di Google News",keuangan
Aturan teknis cegah krisis keuangan segera dibuat,2024-08-21T02:10:57.071Z,"Rabu, 22 Februari 2017 / 18:16 WIB",Reporter: Adinda Ade Mustami | Editor: Adi Wikanto,https:////nasional.kontan.co.id/news/aturan-teknis-cegah-krisis-keuangan-segera-dibuat,"JAKARTA. Undang-Undang (UU) Nomor 9 Tahun 2016 Tentang Pencegahan dan Penanganan Krisis Sistem Keuangan (PPKSK) yang disahkan sejak 15 April 2016 dinilai menguntungkan dan menyelamatkan Indonesia dari tantangan global pada tahun lalu. Hal tersebut diungkapkan oleh Gubernur Bank Indonesia (BI) Agus Martowardojo. Agus mengatakan, tahun 2016, Indonesia mendapat sejumlah tantangan besar, khususnya yang datang dari global. Mulai dari keluarnya Inggris dari Uni Eropa, kenaikan suku bunga Bank Sentral AS, dan reaksi ketika terpilihnya Donald Trump sebagai Presiden AS. ""Ekonomi kita terjaga dan salah satu yang menjaga kita adalah UU PPKSK. Dengan adanya UU ini sebetulnya kami bisa lewati periode-periode sulit di 2016,"" ungkap Agus saat rapat kerja di Komisi XI DPR, Rabu (22/2). Lebih lanjut Agus mengatakan, krisis ekonomi bisa datang setiap saat. Beruntungnya lanjut dia, saat ini kondisi stabilitas ekonomi domestik dalam keadaan yang baik. Hal tersebut ditunjukkan oleh capaian pertumbuhan ekonomi tahun lalu yang sebesar 5,02%, inflasi yang rendah sebesar 3,02%, cadangan devisa yang naik menjadi US$ 116 miliar, nilai tukar rupiah yang terapresiasi 2,3%, dan neraca pembayaran Indonesia (NPI) yang mencatat surplus US$ 12 miliar pada tahun lalu. Menteri Keuangan Sri Mulyani Indrawati mengatakan, ada dua beleid yang akan diterbitkan oleh pemerintah untuk menindaklanjuti UU PPKSK. Pertama, Rancangan Peraturan Pemerintah (RPP) mengenai premi restrukturisasi perbankan. Kedua, RPP mengenai penghapusbukuan dan tagihan aset sisa dari restrukturisasi perbankan. Keduanya direncanakan terbit sebelum rapat KSSK berikutnya yaitu April. Tak hanya itu, pihaknya juga akan menerbitkan peraturan menteri keuangan (PMK) yang mengatur mengenai organisasi dan tata kerja. Sementara itu, Otoritas Jasa Keuangan (OJK) juga akan merilis tiga aturan pelaksanaan UU tersebut. Pertama, terkait rencana aksi atau recovery plan yang harus disiapkan setiap bank. Kedua, tentang bank perantara. Ketiga, peraturan tindak pengawasan dan penetapan status bank. Sedangkan Lembaga Penjamin Simpanan (LPS) akan menerbitkan tiga aturan turunan, yaitu terkait dengan penanganan bank sistemik, aturan yang terkait dengan penanganan bank bukan sistemik, dan aturan yang terkait dengan pengelolaan penatausahaan dan pencatatan aset dan kewajiban. Cek Berita dan Artikel yang lain di Google News",nasional
Aturan turunan penanganan krisis keuangan dikaji,2024-08-21T02:10:57.377Z,"Jumat, 03 Februari 2017 / 16:49 WIB",Reporter: Galvan Yudistira | Editor: Sanny Cicilia,https:////nasional.kontan.co.id/news/aturan-turunan-penanganan-krisis-keuangan-dikaji,"JAKARTA. Pemerintah menyiapkan beberapa aturan turunan terkait dengan Undang-Undang Pencegahan dan Penanganan Krisis Sistem Keuangan (UU PPKSK). Nantinya aturan ini akan berupa dua peraturan pemerintah (PP), tiga POJK (peraturan OJK) dan dua peraturan LPS. Dalam konferensi pers rapat Komite Stabilitas Sistem Keuangan (KSSK) Sri Mulyani Menteri Keuangan mengatakan pemerintah sudah menyiapkan dua aturan terkait dengan UU PPKSK. Pertama adalah peraturan pemerintah (PP) terkait dengan premi restrukturisasi sedangkan kedua adalah PP terkait dengan penghapusbukuan dan penghapus tagihan dari premi restrukturisasi perbankan. “Diharapkan bisa selesai sebelum rapat KSSK berikutnya dilakukan, untuk PP mengenai premi restrukturisasi, saat ini ini sudah berbentuk rancangan dan sedang dibahas dengan kementerian dan lembaga lain,” ujar Sri Mulyani, Jumat (3/2). Muliaman Hadad, Ketua Dewan Komisioner OJK mengatakan regulator mikroprudensial ini juga akan mengeluarkan tiga peraturan OJK pendukung UU PPKSK. POJK pertama tentang recovery plan atau rencana aksi. POJK kedua mengenai bridge bank (bank perantara) dan POJK ketiga mengenai aturan tindak lanjut pengawasan atau exit policy. “Ketiga POJK ini diharapkan bisa keluar sebelum April 2017, untuk aturan bank perantara draft-nya usdah selesai,” ujar Muliaman. Halim Alamsyah, Ketua Dewan Komisioner Lembaga Penjamin Simpanan mengatakan terkait dengan UU PPKSK ini LPS sudah menyiapkan dua aturan. Pertama adalah aturan LPS mengenai penanganan kepada bank sistemik dan kedua adalah penanganan kepada bank non sistemik. Cek Berita dan Artikel yang lain di Google News",nasional
Kian kaya seusai terbelit krisis keuangan (2),2024-08-21T02:10:57.562Z,"Senin, 10 Oktober 2016 / 12:34 WIB",Reporter: Dina Farisah | Editor: Tri Adi,https:////internasional.kontan.co.id/news/kian-kaya-seusai-terbelit-krisis-keuangan-2,"Nama Ken Griffin tidak asing di kalangan Wall Street. Dia merupakan pendiri hedge fund ternama Citadel LLC. Griffin memulai kariernya sebagai fund manager Citadel sejak tahun 1990 atau pada usia 22 tahun. Namanya mulai berkibar setelah masuk daftar sebagai investor yang berhasil meraih harta jumbo berkat kepiawaiannya mencetak untung tinggi dari pasar modal. Sempat terjepit pada krisis keuangan 1998 dan 2008, bisnis Citadel justru terus membesar. Cikal bakal gelar miliarder dimulai sejak Kenneth C. Griffin mendirikan perusahaan hedge fund Citadel LLC pada tahun 1990. Nama Griffin terus melambung di kalangan Wall Street seiring kepiawaiannya dalam mengelola investasi. Selama 12 tahun berkecimpung di dunia investasi, pada Juni 2002 nama Griffin masuk dalam jajaran CFO Magazine Global 100 sebagai salah satu orang paling berpengaruh di sektor keuangan. Semenjak saat itu, Griffin kerap menjadi pesohor di berbagai media. Nama Griffin pertama kali muncul mengisi halaman Forbes 400 pada tahun 2003. Kala itu, kekayaan bersih Griffin ditaksir mencapai US$ 650 juta di usianya yang memasuki 34 tahun atau masuk sebagai salah satu orang kaya termuda. Setahun berselang, Fortune menobatkan Griffin sebagai orang terkaya ke-8 di Amerika Serikat (AS) saat masih berusia kurang dari 40 tahun. Sontak, di usia 35 tahun, Griffin menjadi pusat perbincangan di dunia keuangan. Kekayaan Griffin terus membengkak. Dua tahun setelahnya yakni tahun 2006, Griffin kembali menghiasi Forbes 400 dengan kekayaan bersih Griffin senilai US$ 3 miliar. Kekayaannya terus bertumpuk lantaran tangan dinginnya yang ahli mencetak cuan. Tahun 2014, kekayaan Griffin melesat lagi menjadi US$ 5,5 miliar. Citadel LLC yang juga menaungi Citadel Securities dan Citadel Technology terus menyumbang pundi-pundi dollar bagi Griffin. Tahun lalu, Forbes mencatat harta kekayaan bersih Griffin sebesar US$ 7 miliar.",internasional
"Sah, Indonesia punya UU Anti Krisis Keuangan",2024-08-21T02:10:57.785Z,"Kamis, 17 Maret 2016 / 17:44 WIB",Reporter: Asep Munazat Zatnika | Editor: Sanny Cicilia,https:////nasional.kontan.co.id/news/sah-indonesia-punya-uu-anti-krisis-keuangan,"JAKARTA. Rapat paripurna Dewan Perwakilan Rakyat (DPR) akhirnya menyetujui Rancangan Undang-undang tentang Pencegahan dan Penanganan Krisis Sistem Keuangan disahkan menjadi Undang-undang (UU PPKSK). Ketua rapat Taufik Kurniawan memimpin rapat yang mengesahkan beleid ini. Sebelumnya, ketua panitia kerta RUU PPKSK M. Prakosa mengatakan, beleid ini dibentuk untuk melengkapi aturan yang sudah ada, dalam mencegah dan menanangani krisis sistem keuangan. ""Titik berat RUU ini pada pencegahan dan penanganan permasalahan Bank Sistemik,"" kata Prakosa, Kamis (17/3) di Jakarta. Selain itu, ditegaskan, penanganan krisis perbankan tak akan melibatkan uang negara atau Anggaran Pendapatan dan Belanja Negara (APBN). Pembenahan bank bermasalah lewat jalur bail in, bukan bail out. Namun, presiden memiliki hak untuk menentukan adanya krisis dan penggunaan APBN. Menteri Keuangan Bambang Brodjonegoro menyambut baik disahkannya RUU PPKSK ini. Apalagi, pembahasannya memakan waktu cukup alma, sejak delapan tahun lalu. (Cek di sini poin-poin beleid PPKSK) Cek Berita dan Artikel yang lain di Google News",nasional
